rank,full_name,url,description,stars,star_delta_vs_previous_day,forks,fork_delta_vs_previous_day,open_issues,language,topics,created_at,updated_at,pushed_at,archived
272,langbot-app/LangBot,https://github.com/langbot-app/LangBot,"Production-grade platform for building agentic IM bots - 生产级多平台智能机器人开发平台. 提供 Agent、知识库编排、插件系统 / Bots for Discord / Slack / LINE / Telegram / WeChat(企业微信, 企微智能机器人, 公众号) / 飞书 / 钉钉 / QQ / Satori e.g. Integrated with ChatGPT(GPT), DeepSeek, Dify, n8n, Langflow, Coze, Claude, Gemini, MiniMax, Ollama, SiliconFlow, Moonshot, GLM, openclaw / hermes agent",16210,5,1432,1,125,Python,"agent,coze,deepseek,dify,dingtalk,discord,feishu,kook,langbot,lark,line,llm,n8n,ollama,openai,plugins,qq,rag,telegram,wechat",2022-12-07T08:48:02Z,2026-06-04T22:12:28Z,2026-06-04T15:52:46Z,False
273,tradingview/lightweight-charts,https://github.com/tradingview/lightweight-charts,Performant financial charts built with HTML5 canvas,16076,6,2459,0,125,TypeScript,"canvas,charting,charting-library,charts,finance,financial-charting-library,html5-charts,javascript,typescript",2019-05-24T14:41:49Z,2026-06-04T19:49:35Z,2026-06-04T13:22:03Z,False
274,datawhalechina/easy-vibe,https://github.com/datawhalechina/easy-vibe,💻 vibe coding 2026 | Your first modern Coding course for beginners to master step by step.,16031,68,1513,0,14,JavaScript,"agent,ai,coding,course,deepseek,gemini,genai,gpt,llm,low-code,mcp,nextjs,no-code,openai,programming,tutorial,vibe-coding,vibecoding,vscode,workflow",2025-12-28T16:45:28Z,2026-06-04T23:50:58Z,2026-06-03T05:40:18Z,False
275,Tencent/WeKnora,https://github.com/Tencent/WeKnora,"Open-source LLM knowledge platform: turn raw documents into a queryable RAG, an autonomous reasoning agent, and a self-maintaining Wiki.",15990,13,2054,2,225,Go,"agent,agentic,ai,chatbot,embeddings,evaluation,generative-ai,golang,knowledge-base,llm,multi-tenant,multimodel,ollama,openai,question-answering,rag,reranking,semantic-search,vector-search,wiki",2025-07-22T08:01:23Z,2026-06-04T22:09:16Z,2026-06-04T13:43:17Z,False
276,confident-ai/deepeval,https://github.com/confident-ai/deepeval,The LLM Evaluation Framework,15920,4,1491,1,272,Python,"evaluation-framework,evaluation-metrics,llm-evaluation,llm-evaluation-framework,llm-evaluation-metrics,python",2023-08-10T05:35:04Z,2026-06-04T20:15:21Z,2026-06-04T18:37:13Z,False
277,jundot/omlx,https://github.com/jundot/omlx,LLM inference server with continuous batching & SSD caching for Apple Silicon — managed from the macOS menu bar,15911,52,1361,7,482,Python,"apple-silicon,inference-server,llm,macos,mlx,openai-api",2026-02-13T14:13:27Z,2026-06-05T00:13:19Z,2026-06-04T16:31:31Z,False
278,chiphuyen/aie-book,https://github.com/chiphuyen/aie-book,"[WIP] Resources for AI engineers. Also contains supporting materials for the book AI Engineering (Chip Huyen, 2025)",15910,15,2302,1,21,Jupyter Notebook,,2024-12-03T19:43:36Z,2026-06-04T22:50:52Z,2025-02-12T17:48:39Z,False
279,different-ai/openwork,https://github.com/different-ai/openwork,An open-source alternative to Claude Cowork (powered by opencode),15789,14,1567,5,179,TypeScript,,2026-01-14T01:39:31Z,2026-06-05T00:13:46Z,2026-06-04T22:54:27Z,False
280,HKUDS/DeepCode,https://github.com/HKUDS/DeepCode,"""DeepCode: Open Agentic Coding (Paper2Code & Text2Web & Text2Backend)""",15785,0,2091,0,51,Python,"agentic-coding,llm-agent",2025-05-14T05:23:02Z,2026-06-04T08:18:34Z,2026-05-18T03:30:41Z,False
281,getmaxun/maxun,https://github.com/getmaxun/maxun,"🔥 The open-source no-code platform for web scraping, crawling, search and AI data extraction • Turn websites into structured APIs in minutes 🔥 ",15740,2,1304,0,106,TypeScript,"agents,api,automation,browser-automation,crawler,crawling,data-extraction,no-code,nocode,playwright,robotic-process-automation,rpa,scraper,self-hosted,web-scraper,web-scraping,web-search,webscraping",2023-10-23T21:40:19Z,2026-06-04T22:09:28Z,2026-06-04T22:09:31Z,False
282,gastownhall/gastown,https://github.com/gastownhall/gastown,Gas Town - multi-agent workspace manager,15740,16,1466,3,240,Go,,2025-12-16T00:33:33Z,2026-06-04T23:57:22Z,2026-06-04T22:03:39Z,False
283,alshedivat/al-folio,https://github.com/alshedivat/al-folio,"A beautiful, simple, clean, and responsive Jekyll theme for academics",15687,2,13035,0,44,HTML,"academic,academic-website,github-pages,hacktoberfest,jekyll,jekyll-blog,jekyll-theme,personal-website,portfolio-website,theme",2016-05-30T16:32:46Z,2026-06-04T22:33:11Z,2026-06-02T12:43:58Z,False
284,vectorize-io/hindsight,https://github.com/vectorize-io/hindsight,Hindsight: Agent Memory That  Learns,15666,31,889,1,115,Python,"agentic-ai,agents,ai-memory,memory",2025-10-30T11:49:48Z,2026-06-04T23:09:13Z,2026-06-04T20:03:28Z,False
285,googleapis/mcp-toolbox,https://github.com/googleapis/mcp-toolbox,MCP Toolbox for Databases is an open source MCP server for databases.,15481,6,1583,2,222,Go,"agent,agents,ai,bigquery,clickhouse,cockroachdb,database,elasticsearch,firestore,genai,llm,mcp,mongodb,mysql,oracle,postgresql,redis,server,spanner,tidb",2024-06-07T20:52:54Z,2026-06-04T22:16:40Z,2026-06-04T22:06:41Z,False
286,Canner/WrenAI,https://github.com/Canner/WrenAI,"Give AI agents the context to query business data correctly through the open context layer that gives AI agents grounded, governed memory, context, SQL across 20+ data sources, that helps you build agentic GenBI, text-to-sql, dashboards, and agentic analytics.",15431,4,1749,0,324,Python,"agent,anthropic,bigquery,charts,context-engineering,duckdb,genbi,llm,openai,postgresql,rag,sql,sqlai,text-to-chart,text-to-sql,text2sql,vertex",2024-03-13T06:18:20Z,2026-06-04T19:20:26Z,2026-06-04T17:33:58Z,False
287,semgrep/semgrep,https://github.com/semgrep/semgrep,Lightweight static analysis for many languages. Find bug variants with patterns that look like source code.,15388,6,954,-1,875,OCaml,"c,go,java,javascript,python,r2c,ruby,sast,semgrep,static-analysis,static-code-analysis,typescript",2019-12-13T09:29:54Z,2026-06-04T22:21:13Z,2026-06-04T00:33:33Z,False
288,ag-grid/ag-grid,https://github.com/ag-grid/ag-grid,The best JavaScript Data Table for building Enterprise Applications. Supports React / Angular / Vue / Plain JavaScript.,15369,1,2070,0,136,TypeScript,"angular,angular-grid,angular-table,charting,datagrid,datatable,excel,filtering,grid,grouping,javascript-table,pagination,pivoting,react,react-grid,react-table,sorting,table,vue-table,vuejs",2014-12-23T16:20:14Z,2026-06-05T00:16:45Z,2026-06-04T22:55:17Z,False
289,liyupi/ai-guide,https://github.com/liyupi/ai-guide,程序员鱼皮的 AI 资源大全 + Vibe Coding 零基础教程，分享 OpenClaw 保姆级教程、大模型玩法（DeepSeek / GPT / Gemini / Claude）、最新 AI 资讯、Prompt 提示词大全、AI 知识百科（Agent Skills / RAG / MCP / A2A）、AI 编程教程（Harness Engineering）、AI 工具用法（Cursor / Claude Code / TRAE / Codex / Copilot）、AI 开发框架教程（Spring AI / LangChain）、AI 产品变现指南，帮你快速掌握 AI 技术，走在时代前沿。本项目为开源文档，已升级为鱼皮 AI 导航网站,15155,12,1708,0,8,JavaScript,"ai,algorithm,artificial-intelligence,chatgpt,claude,cursor,deep-learning,deepseek,gemini,generative-ai,gpt,llm,mcp,openai,python,rag,vibe-coding,vibecoding,vue,vuepress",2025-02-13T05:47:46Z,2026-06-04T18:05:45Z,2026-06-04T12:40:40Z,False
290,theonedev/onedev,https://github.com/theonedev/onedev,"Git Server with CI/CD, Kanban, and Packages. Seamless integration. Unparalleled experience.",15029,1,955,0,0,Java,"ci-cd,devops,git,kanban,packages,self-hosted",2018-11-06T02:57:01Z,2026-06-04T22:13:55Z,2026-06-04T22:33:56Z,False
291,GLips/Figma-Context-MCP,https://github.com/GLips/Figma-Context-MCP,MCP server to provide Figma layout information to AI coding agents like Cursor,14995,3,1185,0,23,TypeScript,"ai,cursor,figma,mcp,typescript",2025-02-13T02:55:06Z,2026-06-04T22:35:31Z,2026-05-27T22:18:23Z,False
292,vercel-labs/json-render,https://github.com/vercel-labs/json-render,The Generative UI framework,14988,5,811,0,93,TypeScript,,2026-01-14T17:22:39Z,2026-06-04T18:22:47Z,2026-05-20T19:19:47Z,False
293,rowboatlabs/rowboat,https://github.com/rowboatlabs/rowboat,"Open-source AI coworker, with memory",14894,5,1518,0,114,TypeScript,"agents,agents-sdk,ai,ai-agents,ai-agents-automation,chatgpt,claude-code,claude-cowork,generative-ai,llm,multiagent,opeani,open-source,orchestration,productivity",2025-01-13T09:30:40Z,2026-06-04T22:40:25Z,2026-06-04T19:19:50Z,False
294,llmware-ai/llmware,https://github.com/llmware-ai/llmware,"Unified framework for building enterprise RAG pipelines with small, specialized models",14847,-2,2923,-2,87,Python,"agents,generative-ai-tools,llamacpp,llm,onnx,openvino,parsing,retrieval-augmented-generation,small-specialized-models",2023-09-29T15:19:06Z,2026-06-04T15:55:24Z,2026-05-17T13:53:37Z,False
295,danielmiessler/Personal_AI_Infrastructure,https://github.com/danielmiessler/Personal_AI_Infrastructure,Agentic AI Infrastructure for magnifying HUMAN capabilities.,14633,18,2078,3,204,TypeScript,"ai,augmentation,humans,productivity",2025-09-08T16:18:30Z,2026-06-05T00:16:44Z,2026-05-20T21:33:46Z,False
296,wasp-lang/open-saas,https://github.com/wasp-lang/open-saas,"A 100% free modern JS SaaS boilerplate (React, NodeJS, Prisma). Full-featured: Auth (email, google, github, slack, MS), Email sending, Background jobs, Landing page, Payments (Stripe, Polar.sh), Shadcn UI, S3 file upload. AI-ready with tailored AGENTS.md, skills, and Claude Code plugin. One cmd deploy. Powered by Wasp full-stack framework.",14618,5,1738,2,115,TypeScript,"ai,authentication,aws-s3,boilerplate,chatgpt,full-stack,google-auth,hacktoberfest,nodejs,open-source,openai-api,postgresql,prisma,react,saas,saas-boilerplate,saas-starter,saas-template,typesafe,typescript",2023-12-01T13:54:36Z,2026-06-04T20:52:28Z,2026-06-03T17:56:32Z,False
297,maurosoria/dirsearch,https://github.com/maurosoria/dirsearch,Web path scanner,14334,3,2439,0,41,Python,"appsec,brute,bug-bounty,bugbounty,dirsearch,enumeration,fuzzer,fuzzing,hacking,hacking-tool,infosec,penetration-testing,pentest-tool,pentesting,python,red-teaming,redteam,scanner,security,wordlist",2013-04-30T15:57:40Z,2026-06-04T18:08:50Z,2026-06-03T10:49:47Z,False
298,AndyMik90/Aperant,https://github.com/AndyMik90/Aperant,Autonomous multi-session AI coding,14321,0,1930,0,359,TypeScript,,2025-12-04T22:10:37Z,2026-06-04T18:51:52Z,2026-03-23T19:47:59Z,False
299,steipete/CodexBar,https://github.com/steipete/CodexBar,"Show usage stats for OpenAI Codex and Claude Code, without having to login.",14239,19,1128,1,84,Swift,"ai,claude-code,codex,swift",2025-11-16T17:00:44Z,2026-06-04T23:34:15Z,2026-06-03T23:21:26Z,False
300,electerm/electerm,https://github.com/electerm/electerm,"📻Terminal/ssh/sftp/ftp/telnet/serialport/RDP/VNC/Spice client(linux, mac, win)",14217,3,1144,1,301,JavaScript,"ai,electerm,electron,file-manager,ftp,linux-app,macos-app,mcp,open-source,rdp,serialport,sftp,spice,ssh,telnet,terminal,vnc,windows-app,zmodem",2017-10-07T09:54:11Z,2026-06-04T22:12:08Z,2026-06-04T23:17:08Z,False
301,eigent-ai/eigent,https://github.com/eigent-ai/eigent,Eigent: The Open Source Cowork Desktop to Unlock Your Exceptional Productivity. Local and Free Alternative to Claude Cowork.,14208,0,1682,0,186,TypeScript,"agent-framework,agent-skills,agentic-ai,agentic-workflow,claude-cowork,claude-cowork-alternative,claude-cowork-free,desktop-agent,multi-agent-systems",2025-07-29T15:56:02Z,2026-06-04T16:52:59Z,2026-06-03T13:50:09Z,False
302,mukul975/Anthropic-Cybersecurity-Skills,https://github.com/mukul975/Anthropic-Cybersecurity-Skills,"754 structured cybersecurity skills for AI agents · Mapped to 5 frameworks: MITRE ATT&CK, NIST CSF 2.0, MITRE ATLAS, D3FEND & NIST AI RMF · agentskills.io standard · Works with Claude Code, GitHub Copilot, Codex CLI, Cursor, Gemini CLI & 20+ platforms · 26 security domains · Apache 2.0",14170,132,1662,14,16,Python,"ai-agents,claude-code,cloud-security,cybersecurity,devsecops,ethical-hacking,incident-response,infosec,llm,malware-analysis,mcp,mitre-attack,nist-csf,osint,penetration-testing,red-team,security,security-automation,threat-hunting,threat-intelligence",2026-02-25T09:47:50Z,2026-06-05T00:15:22Z,2026-06-01T10:15:48Z,False
303,xpipe-io/xpipe,https://github.com/xpipe-io/xpipe,Access your entire server infrastructure from your local desktop,14167,4,537,0,51,Java,"bash,docker,filemanager,files,incus,java,javafx,k8s,kubernetes,lxd,networking,podman,sftp,ssh,tailscale,wsl",2023-01-27T02:25:38Z,2026-06-04T21:13:18Z,2026-06-04T10:10:58Z,False
304,h4ckf0r0day/obscura,https://github.com/h4ckf0r0day/obscura,The headless browser for AI agents and web scraping,14130,15,921,2,9,Rust,"antidetect,antidetect-browser,browser,browser-automation,cdp,headless,playwright,puppeteer,rust",2026-04-13T10:31:41Z,2026-06-05T00:17:49Z,2026-06-04T18:20:51Z,False
305,open-metadata/OpenMetadata,https://github.com/open-metadata/OpenMetadata,"The Open Context Layer for Data and AI ,  OpenMetadata is the open platform for building trusted data context and business semantics for humans, AI assistants, and agents.",14107,1,2136,0,859,TypeScript,"context,context-layer,data-catalog,data-collaboration,data-contracts,data-discovery,data-governance,data-lineage,data-observability,data-profiling,data-quality,data-quality-checks,datadiscovery,dataengineering,dataquality,mcp,mcp-server,metadata,metadata-management,semantics",2021-08-01T21:17:17Z,2026-06-04T20:42:13Z,2026-06-05T00:08:40Z,False
306,jbranchaud/til,https://github.com/jbranchaud/til,:memo: Today I Learned,14103,1,758,0,23,Vim Script,"learn-in-public,til,today-i-learned,writing",2015-02-07T04:03:24Z,2026-06-04T18:14:40Z,2026-05-24T22:36:41Z,False
307,ag-ui-protocol/ag-ui,https://github.com/ag-ui-protocol/ag-ui,AG-UI: the Agent-User Interaction Protocol. Bring Agents into Frontend Applications.,14031,12,1257,4,321,TypeScript,"ag-ui-protocol,agent-frontend,agent-ui,agentic-workflow,ai-agents",2025-05-07T12:49:37Z,2026-06-05T00:06:28Z,2026-06-04T23:43:29Z,False
308,xpzouying/xiaohongshu-mcp,https://github.com/xpzouying/xiaohongshu-mcp,MCP for xiaohongshu.com,13972,1,2112,0,271,Go,"mcp,mcp-server,xiaohongshu-mcp",2025-08-03T09:08:45Z,2026-06-04T23:51:56Z,2026-05-29T12:50:29Z,False
309,yusufkaraaslan/Skill_Seekers,https://github.com/yusufkaraaslan/Skill_Seekers,"Convert documentation websites, GitHub repositories, and PDFs into Claude AI skills with automatic conflict detection",13944,10,1441,0,98,Python,"ai-tools,ast-parser,automation,claude-ai,claude-skills,code-analysis,conflict-detection,documentation,documentation-generator,github,github-scraper,mcp,mcp-server,multi-source,ocr,pdf,python,web-scraping",2025-10-17T14:43:48Z,2026-06-04T22:52:50Z,2026-06-04T20:37:33Z,False
310,prowler-cloud/prowler,https://github.com/prowler-cloud/prowler,Prowler is the world’s most widely used open-source cloud security platform that automates security and compliance across any cloud environment.,13941,5,2162,1,230,Python,"aws,azure,cis-benchmark,cloud,cloudsecurity,compliance,cspm,devsecops,forensics,gcp,gdpr,hacktoberfest,hardening,iam,multi-cloud,python,security,security-audit,security-hardening,security-tools",2016-08-24T15:12:24Z,2026-06-04T21:01:53Z,2026-06-04T22:43:26Z,False
311,grokability/snipe-it,https://github.com/grokability/snipe-it,A free open source IT asset/license management system,13886,1,3849,1,1050,PHP,"asset-management,asset-manager,assets-management,itam,license-management",2013-11-12T22:25:47Z,2026-06-04T18:30:36Z,2026-06-04T17:22:55Z,False
312,jnMetaCode/agency-agents-zh,https://github.com/jnMetaCode/agency-agents-zh,🎭 211 个即插即用的 AI 专家角色 — 支持 Hermes Agent/Claude Code/Cursor/Copilot 等 16 种工具，覆盖工程/设计/营销/金融等 18 个部门。含 46 个中国市场原创智能体（小红书/抖音/微信/飞书/钉钉等）,13886,31,2463,2,2,Shell,"agency-orchestrator,agent-definitions,ai-agents,ai-roles,chinese,claude,claude-code,copilot-agent,cursor-rules,deepseek,hermes-agent,llm,multi-agent,no-code,prompt-engineering,qwen,system-prompt,workbuddy,workflow",2026-03-06T11:11:51Z,2026-06-05T00:15:25Z,2026-06-03T15:32:03Z,False
313,andrewyng/aisuite,https://github.com/andrewyng/aisuite,"Simple, unified interface to multiple Generative AI providers ",13797,2,1453,0,129,Python,,2024-06-30T20:07:46Z,2026-06-04T17:59:39Z,2025-12-15T23:26:33Z,False
314,NevaMind-AI/memU,https://github.com/NevaMind-AI/memU,Memory for 24/7 proactive agents like OpenClaw.,13778,-1,1031,-2,109,Python,"agent-memory,agentic-workflow,claude,claude-skills,mcp,memory,openclaw,openclaw-skills,proactive,proactive-ai,sandbox,skills",2025-07-29T01:54:40Z,2026-06-04T21:29:47Z,2026-04-22T12:36:17Z,False
315,casdoor/casdoor,https://github.com/casdoor/casdoor,"An open-source Agent-first Identity and Access Management (IAM) /LLM MCP & agent gateway and auth server with web UI supporting OpenClaw, MCP, OAuth, OIDC, SAML, CAS, LDAP, SCIM, WebAuthn, TOTP, MFA, Face ID, Google Workspace, Azure AD",13732,4,1705,1,104,Go,"agent,agentic-ai,agi,ai-gateway,auth,authentication,iam,llm,mcp,mcp-gateway,mfa,oauth,oidc,openclaw,radius,saml,scim,single-sign-on,sso,webauthn",2020-10-22T14:40:03Z,2026-06-04T20:15:24Z,2026-06-04T14:15:32Z,False
316,semaphoreui/semaphore,https://github.com/semaphoreui/semaphore,"Modern UI and powerful API for Ansible, Terraform/OpenTofu/Terragrunt, PowerShell and other DevOps tools.",13703,3,1266,4,992,Go,"ansible,awx,ci,cicd,devops,docker,docker-ui,go,golang,jenkins,opentofu,pulumi,terraform,terraform-ui,terragrunt",2014-08-23T22:43:31Z,2026-06-04T22:16:44Z,2026-06-04T11:05:40Z,False
317,KKKKhazix/khazix-skills,https://github.com/KKKKhazix/khazix-skills,数字生命卡兹克开源的 AI Skills 合集,13606,40,1723,0,30,Python,,2026-04-06T07:37:02Z,2026-06-04T23:56:16Z,2026-06-04T22:21:41Z,False
318,kyegomez/OpenMythos,https://github.com/kyegomez/OpenMythos,"A theoretical reconstruction of the Claude Mythos architecture, built from first principles using the available research literature.",13563,7,3076,1,58,Python,"ai,anthropic,attention,claude,claude-ai,claude-code,claude-code-plugin,claude-mythos,claude-sonnet,deepmind,gpt-5,gpt-7,jax,looped-transformers,ml,pytorch,sonnet,torch",2026-04-18T12:57:52Z,2026-06-04T23:44:19Z,2026-05-23T11:58:48Z,False
319,HKUDS/OpenHarness,https://github.com/HKUDS/OpenHarness,"""OpenHarness: Open Agent Harness with a Built-in Personal Agent--Ohmo!""",13528,9,2217,3,29,Python,,2026-04-01T15:37:13Z,2026-06-04T20:07:51Z,2026-06-04T02:42:40Z,False
320,GreyDGL/PentestGPT,https://github.com/GreyDGL/PentestGPT,Automated Penetration Testing Agentic Framework Powered by Large Language Models,13491,5,2338,1,75,Python,"large-language-models,llm,penetration-testing,python",2023-02-27T06:01:53Z,2026-06-05T00:04:57Z,2026-02-23T15:48:40Z,False
321,coleam00/context-engineering-intro,https://github.com/coleam00/context-engineering-intro,"Context engineering is the new vibe coding - it's the way to actually make AI coding assistants work. Claude Code is the best for this so that's what this repo is centered around, but you can apply this strategy with any AI coding assistant!",13421,-2,2707,0,33,Python,,2025-07-02T11:54:47Z,2026-06-04T19:14:47Z,2026-03-16T12:13:59Z,False
322,nesquena/hermes-webui,https://github.com/nesquena/hermes-webui,Hermes WebUI: The best way to use Hermes Agent from the web or from your phone!,13387,66,1631,6,250,Python,"agent,ai-agents,hermes,hermes-agent,nous-research",2026-03-30T21:50:12Z,2026-06-05T00:16:36Z,2026-06-05T00:16:37Z,False
323,genlayerlabs/genlayer-project-boilerplate,https://github.com/genlayerlabs/genlayer-project-boilerplate,,13316,6,672,0,27,TypeScript,,2024-06-28T06:59:47Z,2026-06-04T22:19:57Z,2026-06-04T11:06:47Z,False
324,browserless/browserless,https://github.com/browserless/browserless,Deploy headless browsers in Docker. Run on our cloud or bring your own. Free for non-commercial uses.,13274,1,1009,0,27,TypeScript,"browserless,chrome,docker,firefox,nodejs,playwright,puppeteer,typescript,webkit,websocket",2017-11-17T04:35:31Z,2026-06-04T17:51:05Z,2026-06-04T14:52:47Z,False
325,aiming-lab/AutoResearchClaw,https://github.com/aiming-lab/AutoResearchClaw,Fully autonomous & self-evolving research from idea to paper. Chat an Idea. Get a Paper. 🦞,13156,8,1538,1,10,Python,"autonomous-research,citation-verification,llm-agents,metaclaw,multi-agent-debate,openclaw,paper-generation,scientific-discovery,self-evolving",2026-03-15T03:38:49Z,2026-06-05T00:07:34Z,2026-06-03T15:58:09Z,False
326,ccfos/nightingale,https://github.com/ccfos/nightingale,Nightingale is to monitoring and alerting what Grafana is to visualization.,13057,2,1720,0,217,Go,"alerting,ccf,metrics,monitoring,nightingale,observability,open-falcon,time-series,tsdb",2020-03-03T17:08:26Z,2026-06-04T22:50:21Z,2026-06-04T14:21:48Z,False
327,ixartz/Next-js-Boilerplate,https://github.com/ixartz/Next-js-Boilerplate,"🚀🎉📚 Nextjs Boilerplate and Starter with App Router and Page Router support, Tailwind CSS 4 and TypeScript ⚡️ Made with developer experience first: Next.js 16 + TypeScript + ESLint + Prettier + Drizzle ORM + Husky + Lint-Staged + Vitest + Testing Library + Playwright + Storybook + Commitlint + VSCode + Sentry + PostCSS + Tailwind CSS ✨",12962,0,2383,0,4,TypeScript,"boilerplate,boilerplate-code,jamstack,javascript,js-boilerplate,netlify-template,next-js,next-theme,nextjs,nextjs-starter,nextjs-template,react,react-boilerplate,reactjs,starter-kit,starter-project,starter-template,tailwind-css,tailwindcss,typescript",2020-07-22T19:47:35Z,2026-06-04T10:02:57Z,2026-06-01T22:59:36Z,False
328,antirez/ds4,https://github.com/antirez/ds4,DeepSeek 4 Flash local inference engine for Metal and CUDA,12940,30,1128,3,155,C,,2026-05-06T17:17:05Z,2026-06-04T23:39:36Z,2026-06-04T21:00:02Z,False
329,markmap/markmap,https://github.com/markmap/markmap,Build mindmaps with plain text,12844,0,977,0,61,TypeScript,"markmap,mindmap",2020-01-13T10:23:34Z,2026-06-04T16:02:27Z,2025-06-12T02:21:16Z,False
330,EleutherAI/lm-evaluation-harness,https://github.com/EleutherAI/lm-evaluation-harness,A framework for few-shot evaluation of language models.,12818,4,3319,-1,834,Python,"evaluation-framework,language-model,transformer",2020-08-28T00:09:15Z,2026-06-04T23:21:57Z,2026-06-02T15:06:38Z,False
331,BasedHardware/omi,https://github.com/BasedHardware/omi,"AI that sees your screen, listens to your conversations and tells you what to do",12722,6,2025,1,517,Dart,"ai,app,bci,c,flutter,friend,mobile,necklace,nextjs,omi,personas,python,smartglasses,summary,transcription,wearable",2024-03-22T18:12:25Z,2026-06-05T00:04:13Z,2026-06-04T19:47:43Z,False
332,pipecat-ai/pipecat,https://github.com/pipecat-ai/pipecat,Open Source framework for voice and multimodal conversational AI,12653,6,2159,6,181,Python,"ai,chatbot-framework,chatbots,real-time,voice,voice-assistant",2023-12-27T12:59:00Z,2026-06-04T19:41:58Z,2026-06-04T22:52:59Z,False
333,neuml/txtai,https://github.com/neuml/txtai,"💡 All-in-one AI framework for semantic search, LLM orchestration and language model workflows",12631,2,827,0,11,Python,"agents,ai,ai-agents,embeddings,information-retrieval,language-model,large-language-models,llm,nlp,python,rag,retrieval-augmented-generation,search,search-engine,semantic-search,sentence-embeddings,transformers,txtai,vector-database,vector-search",2020-08-09T19:14:59Z,2026-06-04T20:18:34Z,2026-06-04T15:04:40Z,False
334,modelcontextprotocol/typescript-sdk,https://github.com/modelcontextprotocol/typescript-sdk,The official TypeScript SDK for Model Context Protocol servers and clients,12606,3,1901,1,480,TypeScript,,2024-09-24T20:45:31Z,2026-06-04T23:17:53Z,2026-06-04T05:36:01Z,False
335,lsdefine/GenericAgent,https://github.com/lsdefine/GenericAgent,"Self-evolving agent: grows skill tree from 3.3K-line seed, achieving full system control with 6x less token consumption",12555,11,1451,2,125,Python,"ai-agent,automation,autonomous-agent,browser-automation,claude,computer-control,desktop-automation,gemini,lightweight,llm-agent,memory-system,python,self-evolving,skill-tree,task-automation",2026-01-16T15:45:24Z,2026-06-04T22:01:06Z,2026-06-04T09:48:50Z,False
336,chopratejas/headroom,https://github.com/chopratejas/headroom,"Compress tool outputs, logs, files, and RAG chunks before they reach the LLM. 60-95% fewer tokens, same answers. Library, proxy, MCP server.",12438,1004,807,62,162,Python,"agent,ai,anthropic,claude-code,compression,context-engineering,context-window,cursor,fastapi,langchain,llm,mcp,openai,prompt-engineering,proxy,python,rag,token-optimization,tokens,typescript",2026-01-07T19:58:51Z,2026-06-05T00:17:50Z,2026-06-04T23:42:24Z,False
337,nearai/ironclaw,https://github.com/nearai/ironclaw,"IronClaw is an Agent OS focused on privacy, security and extensibility",12394,0,1445,0,1107,Rust,"codeact,openclaw,rlm,rust,wasm",2026-02-03T06:57:10Z,2026-06-04T23:08:01Z,2026-06-05T00:11:45Z,False
338,MiniMax-AI/skills,https://github.com/MiniMax-AI/skills,,12375,11,1060,2,54,C#,,2026-03-17T07:19:25Z,2026-06-05T00:02:40Z,2026-04-18T09:48:47Z,False
339,YishenTu/claudian,https://github.com/YishenTu/claudian,An Obsidian plugin that embeds Claude Code/Codex as an AI collaborator in your vault,12334,23,755,2,74,TypeScript,"claude-code,codex,ide,obsidian,obsidian-plugin,productivity",2025-12-05T17:58:26Z,2026-06-04T23:19:00Z,2026-06-01T16:02:53Z,False
