rank,full_name,url,description,stars,star_delta_vs_previous_day,forks,fork_delta_vs_previous_day,open_issues,language,topics,created_at,updated_at,pushed_at,archived
340,talkgo/night,https://github.com/talkgo/night,Weekly Go Online Meetup via Bilibili｜Go 夜读｜通过 bilibili 在线直播的方式分享 Go 相关的技术话题，每天大家在微信/telegram/Slack 上及时沟通交流编程技术话题。,12296,0,1162,0,9,Go,"bilibili,bilibili-live,daily,discuss,go,golang,gopher,learning,offline,online,reading,reading-go,share,shenzhen,slack,study,wechat,zoom,zoom-us",2018-03-17T15:28:14Z,2026-06-04T06:18:41Z,2026-06-03T23:40:45Z,False
341,coreui/coreui-free-bootstrap-admin-template,https://github.com/coreui/coreui-free-bootstrap-admin-template,Free Bootstrap Admin & Dashboard Template Built for AI-Assisted Development,12216,0,3142,-1,4,HTML,"admin,admin-dashboard,admin-panel,admin-template,admin-theme,admin-ui,adminlte,bootstrap,bootstrap-admin,bootstrap-admin-dashboard,bootstrap-admin-panel,bootstrap-admin-template,bootstrap-admin-template-free,bootstrap5,bootstrap5-template,css,dashboard,scss,template,theme",2016-08-04T12:30:57Z,2026-06-04T08:17:30Z,2026-05-05T09:19:54Z,False
342,smol-ai/developer,https://github.com/smol-ai/developer,the first library to let you embed a developer agent in your own app!,12189,0,1078,0,86,Python,,2023-05-13T07:19:57Z,2026-06-04T07:19:33Z,2024-04-07T07:11:03Z,False
343,langgptai/LangGPT,https://github.com/langgptai/LangGPT,"LangGPT: Empowering everyone to become a prompt expert! 🚀  📌 结构化提示词（Structured Prompt）提出者 📌 元提示词（Meta-Prompt）发起者   📌 最流行的提示词落地范式 | Language of GPT  The pioneering framework for structured & meta-prompt design 10,000+ ⭐ | Battle-tested by thousands of users worldwide  Created by 云中江树",12161,-2,936,1,0,Jupyter Notebook,"chatgpt,claude,deeplearning,doubao,framework,gemini,gpt-4,gpt3-prompts,langgpt,meta-prompting,prompt,prompt-engineering,qwen,structured-prompts",2023-05-06T13:49:43Z,2026-06-04T14:32:10Z,2026-05-29T04:16:44Z,False
344,blackboardsh/electrobun,https://github.com/blackboardsh/electrobun,"Build ultra fast, tiny, and cross-platform desktop apps with Typescript.",12128,3,323,0,227,TypeScript,,2024-02-28T03:18:15Z,2026-06-04T22:08:02Z,2026-05-17T05:05:21Z,False
345,logto-io/logto,https://github.com/logto-io/logto,"🧑‍🚀 Authentication and authorization infrastructure for SaaS and AI apps, built on OIDC and OAuth 2.1 with multi-tenancy, SSO, and RBAC.",12115,1,819,0,189,TypeScript,"authentication,authorization,email,identity,jwt,login,logto,mfa,oauth2,openid-connect,password,passwordless,rbac,saml,signup,sms,social-login,sso,totp,typescript",2021-06-19T03:01:50Z,2026-06-04T23:06:56Z,2026-06-04T16:04:50Z,False
346,datahub-project/datahub,https://github.com/datahub-project/datahub,The Context Platform for your Data and AI Stack,12040,3,3503,0,927,Python,"agent-platform,context-management,data-catalog,data-discovery,data-governance,data-observability,datahub,metadata",2015-11-18T05:47:40Z,2026-06-04T22:46:17Z,2026-06-05T00:03:17Z,False
347,axolotl-ai-cloud/axolotl,https://github.com/axolotl-ai-cloud/axolotl,Go ahead and axolotl questions,12006,4,1360,1,219,Python,"fine-tuning,llm",2023-04-14T04:25:47Z,2026-06-04T20:53:11Z,2026-06-04T22:43:47Z,False
348,encoredev/encore,https://github.com/encoredev/encore,Automate infrastructure from local to your cloud,12000,1,581,1,114,Go,"aws,backend,cloud,cloud-native,database,devops,devops-automation,distributed-systems,encore,gcp,go,golang,infrastructure-as-code,infrastructure-automation,microservices,serverless,typescript",2021-02-17T16:33:24Z,2026-06-04T21:03:41Z,2026-06-04T14:04:57Z,False
349,simonw/llm,https://github.com/simonw/llm,Access large language models from the command-line,11987,4,867,0,615,Python,"ai,llms,openai",2023-04-01T21:16:57Z,2026-06-04T17:58:12Z,2026-05-17T01:38:18Z,False
350,refactoringhq/tolaria,https://github.com/refactoringhq/tolaria,Desktop app to manage markdown knowledge bases,11981,199,863,9,42,TypeScript,,2026-02-14T19:43:14Z,2026-06-05T00:12:50Z,2026-06-01T14:32:54Z,False
351,Wei-Shaw/claude-relay-service,https://github.com/Wei-Shaw/claude-relay-service,CRS-自建Claude Code镜像，一站式开源中转服务，让 Claude、OpenAI、Gemini、Droid 订阅统一接入，支持拼车共享，更高效分摊成本，原生工具无缝使用。,11976,3,1802,0,339,JavaScript,"claude,claude-api,claude-code,claude-proxy,codex-cli,crs,droid,droid-cli,droid2api,gemini-cli",2025-07-14T10:11:32Z,2026-06-04T18:33:37Z,2026-06-01T01:40:36Z,False
352,Portkey-AI/gateway,https://github.com/Portkey-AI/gateway,"A blazing fast AI Gateway with integrated guardrails. Route to 1,600+ LLMs, 50+ AI Guardrails with 1 fast & friendly API.",11970,3,1105,1,187,TypeScript,"ai-gateway,gateway,generative-ai,hacktoberfest,langchain,llm,llm-gateway,llmops,llms,mcp,mcp-client,mcp-gateway,mcp-servers,model-router,openai",2023-08-23T11:52:47Z,2026-06-04T19:58:56Z,2026-05-25T13:54:51Z,False
353,sanbuphy/learn-coding-agent,https://github.com/sanbuphy/learn-coding-agent,Research on Coding Agents,11954,2,19713,2,60,,,2026-03-31T09:07:08Z,2026-06-04T22:26:43Z,2026-04-01T10:55:06Z,False
354,phuryn/pm-skills,https://github.com/phuryn/pm-skills,"PM Skills Marketplace: 100+ agentic skills, commands, and plugins — from discovery to strategy, execution, launch, and growth.",11937,14,1409,1,15,,"agent-skill-repository,agent-skills,agentic-skills,claude-code-marketplace,claude-code-plugins,claude-cowork-plugin,product-management",2026-03-01T23:33:44Z,2026-06-05T00:17:20Z,2026-06-04T10:58:16Z,False
355,kubeshark/kubeshark,https://github.com/kubeshark/kubeshark,"eBPF-powered network observability for Kubernetes. Indexes L4/L7 traffic with full K8s context, decrypts TLS without keys. Queryable by AI agents via MCP and humans via dashboard.",11922,0,538,0,139,Go,"cloud-native,devops,docker,ebpf,golang,grpc,incident-response,kubernetes,mcp,network-analysis,network-engineering,network-observability,network-security,observability,pcap,rest,root-cause-analysis,sniffer,sre,wireshark",2021-04-19T10:29:56Z,2026-06-04T10:10:52Z,2026-06-03T18:01:45Z,False
356,tadata-org/fastapi_mcp,https://github.com/tadata-org/fastapi_mcp,"Expose your FastAPI endpoints as Model Context Protocol (MCP) tools, with Auth!",11895,1,946,0,155,Python,"ai,authentication,authorization,claude,cursor,fastapi,llm,mcp,mcp-server,mcp-servers,modelcontextprotocol,openapi,windsurf",2025-03-08T11:15:43Z,2026-06-04T14:34:32Z,2025-11-24T14:51:54Z,False
357,StarTrail-org/LEANN,https://github.com/StarTrail-org/LEANN,"[MLsys2026]: RAG on Everything with LEANN. Enjoy 97% storage savings while running a fast, accurate, and 100% private RAG application on your personal device.",11868,4,1054,1,66,Python,"ai,faiss,gpt-oss,langchain,llama-index,llm,localstorage,offline-first,ollama,privacy,python,rag,retrieval-augmented-generation,vector-database,vector-search,vectors",2025-06-09T06:52:59Z,2026-06-04T22:55:55Z,2026-06-04T17:47:55Z,False
358,hangwin/mcp-chrome,https://github.com/hangwin/mcp-chrome,"Chrome MCP Server is a Chrome extension-based Model Context Protocol (MCP) server that exposes your Chrome browser functionality to AI assistants like Claude, enabling complex browser automation, content analysis, and semantic search.",11836,2,1060,1,210,TypeScript,,2025-06-09T09:07:06Z,2026-06-04T23:45:57Z,2026-01-06T13:05:39Z,False
359,zaidmukaddam/scira,https://github.com/zaidmukaddam/scira,Scira (Formerly MiniPerplx) is a minimalistic AI-powered search engine that helps you find information on the internet and cites it too. Powered by Vercel AI SDK!,11712,-1,1472,2,22,TypeScript,"ai-search-engine,minimalistic-ai-search-engine,open-source-perplexity-ai,perplexity-ai,perplexity-alternative,scira,scira-ai,search-engine",2024-08-07T13:29:49Z,2026-06-04T14:53:06Z,2026-03-20T15:56:31Z,False
360,zilliztech/claude-context,https://github.com/zilliztech/claude-context,Code search MCP for Claude Code. Make entire codebase the context for any coding agent.,11710,6,862,1,112,TypeScript,"agent,agentic-rag,ai-coding,claude-code,code-generation,code-search,cursor,embedding,gemini-cli,mcp,merkle-tree,nodejs,openai,rag,semantic-search,typescript,vector-database,vibe-coding,voyage-ai,vscode-extension",2025-06-06T02:12:47Z,2026-06-04T21:56:13Z,2026-05-22T07:26:05Z,False
361,siteboon/claudecodeui,https://github.com/siteboon/claudecodeui,"Use Claude Code, OpenCode, Cursor CLI, and Codex on mobile and web with CloudCLI (aka Claude Code UI). CloudCLI is a free open source webui/GUI that helps you manage your Claude Code session and projects remotely.",11642,8,1577,1,137,TypeScript,"anthropic,anthropic-ai,anthropic-claude,claude,claude-api,claude-code,claude-code-ui,claudecode,gui,mobile-first,react,ui",2025-06-25T12:51:12Z,2026-06-04T22:36:17Z,2026-06-04T21:43:48Z,False
362,bytedance/trae-agent,https://github.com/bytedance/trae-agent,Trae Agent is an LLM-based agent for general purpose software engineering tasks.,11625,0,1277,0,139,Python,"agent,llm,software-engineering",2025-06-13T12:05:15Z,2026-06-04T01:17:10Z,2026-02-05T11:21:00Z,False
363,chenhg5/cc-connect,https://github.com/chenhg5/cc-connect,"Bridge local AI coding agents (Claude Code, Cursor, Gemini CLI, Codex) to messaging platforms (Feishu/Lark, DingTalk, Slack, Telegram, Discord, LINE, WeChat Work). Chat with your AI dev assistant from anywhere — no public IP required for most platforms.",11622,33,1076,1,479,Go,,2026-02-28T02:39:39Z,2026-06-04T18:27:26Z,2026-06-04T09:01:11Z,False
364,BeehiveInnovations/pal-mcp-server,https://github.com/BeehiveInnovations/pal-mcp-server,The power of Claude Code / GeminiCLI / CodexCLI + [Gemini / OpenAI / OpenRouter / Azure / Grok / Ollama / Custom Model / All Of The Above] working as one.,11587,2,1010,0,133,Python,,2025-06-08T15:36:50Z,2026-06-04T21:10:43Z,2025-12-15T17:07:31Z,False
365,langchain-ai/open_deep_research,https://github.com/langchain-ai/open_deep_research,,11585,11,1658,1,60,Python,,2024-11-20T17:37:22Z,2026-06-04T23:50:53Z,2026-06-03T23:44:21Z,False
366,kubescape/kubescape,https://github.com/kubescape/kubescape,"Kubescape is an open-source Kubernetes security platform for your IDE, CI/CD pipelines, and clusters. It includes risk analysis, security, compliance, and misconfiguration scanning, saving Kubernetes users and administrators precious time, effort, and resources.",11461,4,954,0,72,Go,"best-practice,devops,kubernetes,mitre-attack,nsa,security,vulnerability-detection",2021-08-12T10:39:29Z,2026-06-04T20:47:59Z,2026-06-04T20:05:54Z,False
367,wanshuiyin/Auto-claude-code-research-in-sleep,https://github.com/wanshuiyin/Auto-claude-code-research-in-sleep,"ARIS ⚔️ (Auto-Research-In-Sleep) — Lightweight Markdown-only skills for autonomous ML research: cross-model review loops, idea discovery, and experiment automation. No framework, no lock-in — works with Claude Code, Codex, OpenClaw, or any LLM agent.",11394,24,1060,4,49,Python,"ai-research,ai-tools,aris,autonomous-agent,claude,claude-code,claude-code-skills,codex,deep-learning,gpt,idea-generation,llm,machine-learning,mcp,mcp-server,ml-research,openai,paper-review,paper-writing,research-automation",2026-03-10T07:31:45Z,2026-06-04T21:38:32Z,2026-06-04T11:56:58Z,False
368,EvanLi/Github-Ranking,https://github.com/EvanLi/Github-Ranking,:star:Github Ranking:star: Github stars and forks ranking list. Github Top100 stars list of different languages. Automatically update daily. | Github仓库排名，每日自动更新,11290,-1,664,-1,32,Python,"forks,github-rank,github-stars,python,ranking,stars",2018-12-16T15:38:31Z,2026-06-04T22:25:51Z,2026-06-04T04:07:47Z,False
369,supertone-inc/supertonic,https://github.com/supertone-inc/supertonic,"Lightning-Fast, On-Device, Multilingual TTS — running natively via ONNX.",11261,15,1170,4,112,Swift,"cpp,csharp,flutter,go,ios,java,lightweight,multilingual,nodejs,on-device,onnx,onnxruntime,python,rust,speech-synthesis,swift,text-to-speech,tts,web,webgpu",2025-11-18T08:23:58Z,2026-06-04T23:29:44Z,2026-05-22T05:05:12Z,False
370,browseros-ai/BrowserOS,https://github.com/browseros-ai/BrowserOS,"🌐 The open-source Agentic browser; alternative to ChatGPT Atlas, Perplexity Comet, Dia.",11234,0,1143,1,124,TypeScript,"agent,browser,browseros,chromium,hacktoberfest,linux,llm,lmstudio,macos,ollama,windows",2025-05-18T16:23:54Z,2026-06-04T22:30:43Z,2026-06-04T22:30:38Z,False
371,0xJacky/nginx-ui,https://github.com/0xJacky/nginx-ui,Yet another WebUI for Nginx,11189,5,831,0,86,Go,"chatgpt-app,code-completion,copilot,cron,deepseek-r1,docker,go,letsencrypt,linux,macos,mcp,mcp-server,nginx,self-hosted,vue,webui,windows",2021-02-19T10:51:04Z,2026-06-04T23:58:04Z,2026-06-04T19:05:03Z,False
372,toss/es-toolkit,https://github.com/toss/es-toolkit,A modern JavaScript utility library that's 2-3 times faster and up to 97% smaller—a major upgrade to lodash.,11122,3,562,0,125,TypeScript,,2024-04-25T11:56:31Z,2026-06-04T20:31:23Z,2026-06-04T10:23:30Z,False
373,microsoft/playwright-cli,https://github.com/microsoft/playwright-cli,"CLI for common Playwright actions. Record and generate Playwright code, inspect selectors and take screenshots.",11037,8,575,1,12,TypeScript,playwright,2020-06-19T18:34:03Z,2026-06-04T20:27:51Z,2026-05-07T23:01:25Z,False
374,windingwind/zotero-pdf-translate,https://github.com/windingwind/zotero-pdf-translate,"Translate PDF, EPub, webpage, metadata, annotations, notes to the target language. Support 20+ translate services.",11023,2,484,0,17,TypeScript,"pdf,plugin,translate,translation,zotero,zotero-plugin,zotero7",2022-03-09T08:42:33Z,2026-06-04T14:50:20Z,2026-05-18T13:38:52Z,False
375,Piebald-AI/claude-code-system-prompts,https://github.com/Piebald-AI/claude-code-system-prompts,"All parts of Claude Code's system prompt, 27 builtin tool descriptions, sub agent prompts (Plan/Explore/Task), utility prompts (CLAUDE.md, compact,  statusline, magic docs, WebFetch, Bash cmd, security review, agent creation).  Updated for each Claude Code version.",10779,9,1883,1,4,JavaScript,"claude-code,claude-code-system-prompts,system-prompts",2025-11-18T21:26:33Z,2026-06-04T22:20:56Z,2026-06-04T21:17:47Z,False
376,huggingface/chat-ui,https://github.com/huggingface/chat-ui,The open source codebase powering HuggingChat,10743,1,1644,0,234,TypeScript,"chatgpt,hacktoberfest,huggingface,llm,svelte,svelte-kit,sveltekit,tailwindcss,typescript",2023-02-17T15:31:50Z,2026-06-04T23:59:10Z,2026-06-04T19:51:01Z,False
377,NoeFabris/opencode-antigravity-auth,https://github.com/NoeFabris/opencode-antigravity-auth,Enable Opencode to authenticate against Antigravity (Google's IDE) via OAuth so you can use Antigravity rate limits and access models like gemini-3-pro and claude-opus-4-5-thinking with your Google credentials.,10740,1,21,-1,40,TypeScript,"claude,gemini,google,opencode",2025-12-09T23:46:18Z,2026-06-04T23:44:44Z,2026-04-28T22:22:39Z,False
378,emdash-cms/emdash,https://github.com/emdash-cms/emdash,EmDash is a full-stack TypeScript CMS based on Astro; the spiritual successor to WordPress,10738,1,969,0,164,TypeScript,"astro,cms,emdash,typescript",2026-04-01T08:45:02Z,2026-06-04T21:58:33Z,2026-06-04T20:00:52Z,False
379,The-Pocket/PocketFlow,https://github.com/The-Pocket/PocketFlow,Pocket Flow: 100-line LLM framework. Let Agents build Agents!,10716,3,1167,0,69,Python,"agentic-ai,agentic-framework,agentic-workflow,agents,ai-framework,ai-frameworks,aiagent,aiagents,artificial-intelligence,flow-based-programming,flow-engineering,large-language-model,large-language-models,llm-agent,llm-framework,pocket-flow,pocketflow,retrieval-augmented-generation,workflow,workflow-orchestration",2024-12-24T02:43:30Z,2026-06-04T19:23:56Z,2026-03-27T18:48:41Z,False
380,HKUDS/Vibe-Trading,https://github.com/HKUDS/Vibe-Trading,"""Vibe-Trading: Your Personal Trading Agent""",10626,114,2084,30,9,Python,"ai-agent,algorithmic-trading,backtesting,fintech,llm,mcp,multi-agent,python,quantitative-finance,trading",2026-04-01T09:52:20Z,2026-06-05T00:13:43Z,2026-06-04T15:40:08Z,False
381,huggingface/skills,https://github.com/huggingface/skills,Give your agents the power of the Hugging Face ecosystem,10619,0,696,2,31,Python,,2025-11-24T07:31:48Z,2026-06-04T12:33:25Z,2026-06-04T05:46:36Z,False
382,can1357/oh-my-pi,https://github.com/can1357/oh-my-pi,"⌥  AI Coding agent for the terminal — hash-anchored edits, optimized tool harness, LSP, Python, browser, subagents, and more",10548,103,880,7,288,TypeScript,"ai-agent,ai-coding-agent,anthropic,bun,claude,cli,coding-assistant,llm,mcp,multi-provider,openai,rust,terminal,tui,typescript",2025-12-31T14:01:28Z,2026-06-05T00:11:19Z,2026-06-04T22:27:39Z,False
383,aden-hive/hive,https://github.com/aden-hive/hive,Multi-Agent Harness for Production AI,10496,1,5658,1,1290,Python,"agent,agent-framework,agent-skills,anthropic,automation,autonomous-agents,claude,harness,harness-engineering,human-in-the-loop,openai,python,self-hosted,self-improving",2026-01-12T00:04:22Z,2026-06-05T00:00:20Z,2026-05-29T21:55:22Z,False
384,nashsu/llm_wiki,https://github.com/nashsu/llm_wiki,"LLM Wiki is a cross-platform desktop application that turns your documents into an organized, interlinked knowledge base — automatically. Instead of traditional RAG (retrieve-and-answer from scratch every time), the LLM incrementally builds and maintains a persistent wiki from your sources。",10438,29,1295,2,174,TypeScript,,2026-04-08T11:24:01Z,2026-06-04T23:32:40Z,2026-06-04T06:46:45Z,False
385,infosecn1nja/Red-Teaming-Toolkit,https://github.com/infosecn1nja/Red-Teaming-Toolkit,This repository contains cutting-edge open-source security tools (OST) for a red teamer and threat hunter.,10377,1,2347,-1,6,,"hacking,infosec,pentesting,red-team",2018-04-26T13:35:09Z,2026-06-04T17:51:34Z,2026-05-07T23:44:01Z,False
386,numman-ali/openskills,https://github.com/numman-ali/openskills,Universal skills loader for AI coding agents - npm i -g openskills,10328,0,657,0,42,TypeScript,,2025-10-26T19:43:54Z,2026-06-04T21:07:28Z,2026-01-18T13:09:50Z,False
387,CoplayDev/unity-mcp,https://github.com/CoplayDev/unity-mcp,"Unity MCP acts as a bridge between AI assistants and your Unity Editor. Give your LLM tools to manage assets, control scenes, edit scripts, and automate tasks within Unity.",10327,11,1160,0,51,C#,"ai,ai-integration,anthropic,claude,copilot,cursor,game-development,gamedev,gemini,llm,mcp,model-context-protocol,openai,unity,unity3d,videogames",2025-03-18T11:01:58Z,2026-06-04T22:54:14Z,2026-05-27T05:20:11Z,False
388,fathah/hermes-desktop,https://github.com/fathah/hermes-desktop,Desktop Companion for Hermes Agent,10276,133,1206,9,248,TypeScript,,2026-04-02T15:26:49Z,2026-06-05T00:09:56Z,2026-06-04T23:27:26Z,False
389,sirmalloc/ccstatusline,https://github.com/sirmalloc/ccstatusline,"🚀 Beautiful highly customizable statusline for Claude Code CLI with powerline support, themes, and more.",10220,21,446,0,90,TypeScript,"ai-tools,claude-code,cli,developer-tools,git,powerline,statusbar,statusline,terminal,themeing",2025-08-08T11:19:28Z,2026-06-05T00:14:33Z,2026-06-02T13:54:09Z,False
390,Mooler0410/LLMsPracticalGuide,https://github.com/Mooler0410/LLMsPracticalGuide,"A curated list of practical guide resources of LLMs (LLMs Tree, Examples, Papers)",10191,0,786,0,17,,"large-language-models,natural-language-processing,nlp,survey",2023-04-23T04:22:20Z,2026-06-04T03:24:49Z,2026-04-08T18:26:44Z,False
391,calesthio/Crucix,https://github.com/calesthio/Crucix,Your personal intelligence agent. Watches the world from multiple data sources and pings you when something changes.,10171,5,1613,0,61,JavaScript,"ai,intelligence,osint",2026-03-14T07:33:06Z,2026-06-04T22:58:09Z,2026-05-20T00:50:21Z,False
392,1N3/Sn1per,https://github.com/1N3/Sn1per,Attack Surface Management Platform,10060,0,2079,0,7,Shell,"attack-surface,attack-surface-management,attacksurface,bugbounty-platform,cybersecurity,hacking,hacking-tools,osint-framework,osint-tool,penetration-testing,pentest-scripts,pentest-tool,pentest-tools,pentesting,pentesting-tools,security,security-tools,sn1per,sn1per-professional",2015-09-06T15:47:38Z,2026-06-04T23:31:46Z,2026-06-04T23:31:38Z,False
393,OpenGVLab/InternVL,https://github.com/OpenGVLab/InternVL,[CVPR 2024 Oral] InternVL Family: A Pioneering Open-Source Alternative to GPT-4o.  接近GPT-4o表现的开源多模态对话模型,10054,0,782,0,316,Python,"gpt,gpt-4o,gpt-4v,image-classification,image-text-retrieval,llm,multi-modal,semantic-segmentation,video-classification,vision-language-model,vit-22b,vit-6b",2023-11-22T08:08:08Z,2026-06-04T08:45:59Z,2025-09-22T01:36:48Z,False
394,mcp-use/mcp-use,https://github.com/mcp-use/mcp-use,The fullstack MCP framework to develop MCP Apps for ChatGPT / Claude & MCP Servers for AI Agents.,10046,4,1315,1,97,TypeScript,"agentic-framework,ai,apps-sdk,chatgpt,claude-code,llms,mcp,mcp-apps,mcp-client,mcp-gateway,mcp-host,mcp-inspector,mcp-server,mcp-servers,mcp-tools,mcp-ui,model-context-protocol,modelcontextprotocol,openclaw,skills",2025-03-28T10:06:31Z,2026-06-04T22:28:30Z,2026-06-04T21:55:56Z,False
395,modelcontextprotocol/inspector,https://github.com/modelcontextprotocol/inspector,Visual testing tool for MCP servers,9992,5,1355,1,287,TypeScript,,2024-10-03T21:47:42Z,2026-06-04T20:38:54Z,2026-06-04T17:23:41Z,False
396,cloudflare/moltworker,https://github.com/cloudflare/moltworker,"Run OpenClaw, (formerly Moltbot, formerly Clawdbot) on Cloudflare Workers",9911,-1,1774,0,97,TypeScript,"ai-agents,cloudflare-workers",2026-01-27T11:09:39Z,2026-06-04T23:35:37Z,2026-05-09T02:37:13Z,False
397,alibaba/spring-ai-alibaba,https://github.com/alibaba/spring-ai-alibaba,Agentic AI Framework for Java Developers,9891,3,2201,0,285,Java,"agentic,artificial-intelligence,context-engineering,graph,java,multi-agent,reactagent,spring-ai,workflow",2024-09-09T01:35:50Z,2026-06-04T15:15:52Z,2026-06-04T14:15:16Z,False
398,yzhao062/pyod,https://github.com/yzhao062/pyod,"A Python library for anomaly detection across tabular, time series, graph, text, and image data. 60+ detectors, benchmark-backed ADEngine orchestration, and an agentic workflow for AI agents.",9868,1,1478,1,229,Python,"agentic-ai,anomaly-detection,data-mining,data-science,deep-learning,foundation-models,fraud-detection,graph-anomaly-detection,image-anomaly-detection,machine-learning,multimodal,nlp-anomaly-detection,novelty-detection,out-of-distribution-detection,outlier-detection,outlier-ensembles,time-series,time-series-anomaly-detection,unsupervised-learning",2017-10-03T20:29:04Z,2026-06-04T22:38:00Z,2026-06-04T22:39:19Z,False
399,Kuberwastaken/claurst,https://github.com/Kuberwastaken/claurst,Agentic Coding for Builders who Ship,9763,5,7791,2,29,Rust,"claude,claude-code,claurst,cli,codex,gemini,rust,tui",2026-03-31T09:23:58Z,2026-06-04T22:39:43Z,2026-06-04T17:50:01Z,False
400,Jeffallan/claude-skills,https://github.com/Jeffallan/claude-skills,66 Specialized Skills for Full-Stack Developers. Transform Claude Code into your expert pair programmer.,9630,19,819,0,37,Python,"ai-agents,claude,claude-code,claude-marketplace,claude-skills",2025-10-20T20:27:22Z,2026-06-05T00:10:07Z,2026-05-20T13:35:05Z,False
401,Open-LLM-VTuber/Open-LLM-VTuber,https://github.com/Open-LLM-VTuber/Open-LLM-VTuber,"Talk to any LLM with hands-free voice interaction, voice interruption, and Live2D taking face running locally across platforms",9575,,1151,,127,Python,"ai,ai-companion,ai-vtuber,ai-waifu,chatbots,live2d,live2d-web,llm,neuro-sama,ollama",2023-11-24T04:55:43Z,2026-06-05T00:17:00Z,2026-05-15T07:18:04Z,False
402,ntegrals/openbrowser,https://github.com/ntegrals/openbrowser,Let AI agents browse the web. An autonomous toolkit for browser-based AI agents.,9461,0,864,0,19,TypeScript,"ai-agents,automation,claude,playwright,puppeteer,sandbox",2019-04-11T15:59:04Z,2026-06-04T10:11:30Z,2026-04-02T12:55:42Z,False
403,goplus/xgo,https://github.com/goplus/xgo,"XGo is a programming language that reads like plain English. But it's also incredibly powerful — it lets you leverage assets from C/C++, Go, Python, and JavaScript/TypeScript, creating a unified software engineering ecosystem. Our vision is to enable everyone to become a builder of the world.",9435,0,564,0,59,Go,"ai-native,data-science,golang,goplus,low-code,programming-language,scientific-computing,stem,stem-education,xgo",2015-12-12T01:21:39Z,2026-06-01T05:45:56Z,2026-05-31T23:52:25Z,False
404,OpenBMB/MiniCPM,https://github.com/OpenBMB/MiniCPM,"MiniCPM5-1B: A SOTA 1B on-device LLM, small yet powerful.",9382,1,612,0,16,Jupyter Notebook,,2024-01-29T08:21:15Z,2026-06-04T20:10:27Z,2026-05-31T09:32:22Z,False
405,VoltAgent/voltagent,https://github.com/VoltAgent/voltagent,AI Agent Engineering Platform built on an Open Source TypeScript AI Agent Framework,9367,10,972,1,57,TypeScript,"agents,ai,ai-agents,ai-agents-framework,aiagentframework,chatbots,chatgpt,framework,javascript,llm,llm-observability,mcp,multiagent,nodejs,observability,open-source,openai,rag,tts,typescript",2025-04-16T15:41:18Z,2026-06-04T22:57:27Z,2026-06-04T03:46:51Z,False
406,ChinaSiro/claude-code-sourcemap,https://github.com/ChinaSiro/claude-code-sourcemap,,9323,0,14685,2,12,TypeScript,,2026-03-31T08:15:54Z,2026-06-04T11:30:40Z,2026-03-31T08:30:55Z,False
407,Orchestra-Research/AI-Research-SKILLs,https://github.com/Orchestra-Research/AI-Research-SKILLs,Comprehensive open-source library of AI research and engineering skills for any AI model. Package the skills and your claude code/codex/gemini agent will be an AI research agent with full horsepower. Maintained by Orchestra Research.,9321,16,708,0,15,TeX,"ai,ai-research,claude,claude-code,claude-skills,codex,gemini,gpt-5,grpo,huggingface,machine-leanring,megatron,skills,vllm",2025-11-03T06:13:06Z,2026-06-04T23:39:01Z,2026-04-28T05:09:27Z,False
