rank,full_name,url,description,stars,star_delta_vs_previous_day,forks,fork_delta_vs_previous_day,open_issues,language,topics,created_at,updated_at,pushed_at,archived
331,MemoriLabs/Memori,https://github.com/MemoriLabs/Memori,"Memori is agent-native memory infrastructure. A LLM-agnostic layer that turns agent execution and conversation into structured, persistent state for production systems. Built for enterprise, Memori works with the data infrastructure you already run, no rip-and-replace, and deploys across managed cloud, single-tenant cloud, VPC, and on-premises.",15578,-1,2819,2,25,Python,"agent,agent-memory,agenticai,ai,ai-memory,claude-code,enterprise,hermes,llm,long-short-term-memory,memory,memory-management,openclaw,python,rag,state-management,stateful,typescript",2025-07-24T07:07:51Z,2026-07-15T19:08:32Z,2026-06-15T23:18:56Z,False
332,spree/spree,https://github.com/spree/spree,"Open Source eCommerce Platform for B2B, Marketplace, and Enterprise. REST API, TypeScript SDK, and production-ready Next.js storefront. Self-host it. Own your stack. No vendor lock-in. Zero platform fees.",15549,1,5284,1,132,Ruby,"b2b-commerce,e-commerce,ecommerce,ecommerce-api,ecommerce-framework,ecommerce-platform,headless,headless-commerce,headless-ecommerce,marketplace,multi-tenant,multi-vendor,multi-vendor-ecommerce,open-source,spree-commerce",2008-03-10T14:45:35Z,2026-07-15T22:00:22Z,2026-07-15T22:25:29Z,False
333,ag-grid/ag-grid,https://github.com/ag-grid/ag-grid,The best JavaScript Data Table for building Enterprise Applications. Supports React / Angular / Vue / Plain JavaScript.,15466,0,2076,1,143,TypeScript,"angular,angular-grid,angular-table,charting,datagrid,datatable,excel,filtering,grid,grouping,javascript-table,pagination,pivoting,react,react-grid,react-table,sorting,table,vue-table,vuejs",2014-12-23T16:20:14Z,2026-07-15T14:21:04Z,2026-07-15T15:18:21Z,False
334,GLips/Figma-Context-MCP,https://github.com/GLips/Figma-Context-MCP,MCP server to provide Figma layout information to AI coding agents like Cursor,15403,6,1214,2,22,TypeScript,"ai,cursor,figma,mcp,typescript",2025-02-13T02:55:06Z,2026-07-15T21:26:35Z,2026-07-03T14:24:36Z,False
335,WEIFENG2333/VideoCaptioner,https://github.com/WEIFENG2333/VideoCaptioner,🎬 卡卡字幕助手 | VideoCaptioner - 基于 LLM 的智能字幕助手 - 视频字幕生成、断句、校正、字幕翻译全流程处理！- A powered tool for easy and efficient video subtitling.,15329,9,1303,3,180,Python,"ai,subtitle,translate,video-subtile",2024-10-31T03:06:23Z,2026-07-15T18:39:22Z,2026-07-12T16:48:30Z,False
336,lra/mackup,https://github.com/lra/mackup,Backup and keep your application settings in sync.,15288,0,947,0,294,Python,,2013-04-06T19:22:54Z,2026-07-14T12:06:53Z,2026-06-15T00:33:53Z,False
337,MODSetter/SurfSense,https://github.com/MODSetter/SurfSense,"NotebookLM for Competitive Intelligence Research. Give your AI agents access to live data from Reddit, YouTube, Instagram, TikTok, Google Maps, Google Search, open web etc. Join our Discord: https://discord.gg/ejRNvftDp9",15263,9,1467,-1,110,Python,"agent,agents,ai,chrome-extension,extension,fastapi,langchain,langgraph,nextjs,notebooklm,ollama,perplexity,python,rag,typescript",2024-07-30T23:00:09Z,2026-07-15T17:34:01Z,2026-07-15T04:38:07Z,False
338,jaywcjlove/reference,https://github.com/jaywcjlove/reference,面向开发者的技术速查清单（Cheat Sheets）集合，整理常见技术、工具与开发流程，帮助快速查阅关键信息，提高开发效率。,15152,1,2222,0,196,Dockerfile,"cheatsheet,docker,javascript,npm,npm-package,react,reactjs,references,semver,toml,typescript,vue3,vuejs",2022-09-24T17:49:19Z,2026-07-15T11:19:40Z,2026-07-12T11:48:15Z,False
339,Unstructured-IO/unstructured,https://github.com/Unstructured-IO/unstructured,"Convert documents to structured data effortlessly. Unstructured is open-source ETL solution for transforming complex documents into clean, structured formats for language models.  Visit our website to learn more about our enterprise grade Platform product for production grade workflows, partitioning, enrichments, chunking and embedding.",15138,7,1270,0,270,HTML,"data-pipelines,deep-learning,document-image-analysis,document-image-processing,document-parser,document-parsing,docx,donut,information-retrieval,langchain,llm,machine-learning,ml,natural-language-processing,nlp,ocr,pdf,pdf-to-json,pdf-to-text,preprocessing",2022-09-26T21:53:41Z,2026-07-15T21:10:44Z,2026-07-15T21:10:36Z,False
340,theonedev/onedev,https://github.com/theonedev/onedev,"Git Server with CI/CD, Kanban, and Packages. Seamless integration. Unparalleled experience.",15095,0,965,1,0,Java,"ci-cd,devops,git,kanban,packages,self-hosted",2018-11-06T02:57:01Z,2026-07-15T11:07:12Z,2026-07-14T14:38:54Z,False
341,andrewyng/aisuite,https://github.com/andrewyng/aisuite,"Simple, unified interface to multiple Generative AI providers ",14932,2,1579,0,153,Python,,2024-06-30T20:07:46Z,2026-07-15T22:43:20Z,2026-07-15T21:48:37Z,False
342,wasp-lang/open-saas,https://github.com/wasp-lang/open-saas,"A 100% free modern JS SaaS boilerplate (React, NodeJS, Prisma). Full-featured: Auth (email, google, github, slack, MS), Email sending, Background jobs, Landing page, Payments (Stripe, Polar.sh), Shadcn UI, S3 file upload. AI-ready with tailored AGENTS.md, skills, and Claude Code plugin. One cmd deploy. Powered by Wasp full-stack framework.",14922,12,1778,2,114,TypeScript,"ai,authentication,aws-s3,boilerplate,chatgpt,full-stack,google-auth,hacktoberfest,nodejs,open-source,openai-api,postgresql,prisma,react,saas,saas-boilerplate,saas-starter,saas-template,typesafe,typescript",2023-12-01T13:54:36Z,2026-07-15T22:51:11Z,2026-07-14T09:07:42Z,False
343,google/skills,https://github.com/google/skills,Agent Skills for Google products and technologies,14847,56,1137,2,33,Python,"google,googlecloud,skills",2026-03-31T19:02:20Z,2026-07-15T22:55:57Z,2026-07-15T22:55:53Z,False
344,HKUDS/OpenHarness,https://github.com/HKUDS/OpenHarness,"""OpenHarness: Open Agent Harness with a Built-in Personal Agent--Ohmo!""",14819,29,2417,9,68,Python,,2026-04-01T15:37:13Z,2026-07-15T21:51:11Z,2026-06-04T02:42:40Z,False
345,llmware-ai/llmware,https://github.com/llmware-ai/llmware,"Unified framework for building enterprise RAG pipelines with small, specialized models",14812,-1,2910,0,92,Python,"agents,generative-ai-tools,llamacpp,llm,onnx,openvino,parsing,retrieval-augmented-generation,small-specialized-models",2023-09-29T15:19:06Z,2026-07-15T12:42:55Z,2026-05-17T13:53:37Z,False
346,ag-ui-protocol/ag-ui,https://github.com/ag-ui-protocol/ag-ui,AG-UI: the Agent-User Interaction Protocol. Bring Agents into Frontend Applications.,14757,19,1340,1,324,TypeScript,"ag-ui-protocol,agent-frontend,agent-ui,agentic-workflow,ai-agents",2025-05-07T12:49:37Z,2026-07-15T23:06:04Z,2026-07-15T23:06:01Z,False
347,kyegomez/OpenMythos,https://github.com/kyegomez/OpenMythos,"A theoretical reconstruction of the Claude Mythos architecture, built from first principles using the available research literature.",14693,10,3298,-2,59,Python,"ai,anthropic,attention,claude,claude-ai,claude-code,claude-code-plugin,claude-mythos,claude-sonnet,deepmind,gpt-5,gpt-7,jax,looped-transformers,ml,pytorch,sonnet,torch",2026-04-18T12:57:52Z,2026-07-15T19:26:04Z,2026-05-23T11:58:48Z,False
348,xpzouying/xiaohongshu-mcp,https://github.com/xpzouying/xiaohongshu-mcp,MCP for xiaohongshu.com,14689,20,2173,1,286,Go,"mcp,mcp-server,xiaohongshu-mcp",2025-08-03T09:08:45Z,2026-07-15T16:18:06Z,2026-07-13T07:21:41Z,False
349,nashsu/llm_wiki,https://github.com/nashsu/llm_wiki,"LLM Wiki is a cross-platform desktop application that turns your documents into an organized, interlinked knowledge base — automatically. Instead of traditional RAG (retrieve-and-answer from scratch every time), the LLM incrementally builds and maintains a persistent wiki from your sources。",14649,95,1741,3,206,TypeScript,,2026-04-08T11:24:01Z,2026-07-15T21:57:59Z,2026-07-15T10:06:16Z,False
350,eigent-ai/eigent,https://github.com/eigent-ai/eigent,Eigent: The Open Source Cowork Desktop to Unlock Your Exceptional Productivity. Local and Free Alternative to Claude Cowork.,14568,7,1725,3,199,TypeScript,"agent-framework,agent-skills,agentic-ai,agentic-workflow,claude-cowork,claude-cowork-alternative,claude-cowork-free,desktop-agent,multi-agent-systems",2025-07-29T15:56:02Z,2026-07-15T22:56:27Z,2026-07-15T10:50:46Z,False
351,maurosoria/dirsearch,https://github.com/maurosoria/dirsearch,Web path scanner,14501,9,2438,0,26,Python,"appsec,brute,bug-bounty,bugbounty,dirsearch,enumeration,fuzzer,fuzzing,hacking,hacking-tool,infosec,penetration-testing,pentest-tool,pentesting,python,red-teaming,redteam,scanner,security,wordlist",2013-04-30T15:57:40Z,2026-07-15T18:49:33Z,2026-07-01T03:25:55Z,False
352,electerm/electerm,https://github.com/electerm/electerm,"📻Terminal/ssh/sftp/ftp/telnet/serialport/RDP/VNC/Spice client(linux, mac, win)",14496,7,1156,1,314,JavaScript,"ai,electerm,electron,file-manager,ftp,linux-app,macos-app,mcp,open-source,rdp,serialport,sftp,spice,ssh,telnet,terminal,vnc,windows-app,zmodem",2017-10-07T09:54:11Z,2026-07-15T21:57:12Z,2026-07-15T01:28:41Z,False
353,open-metadata/OpenMetadata,https://github.com/open-metadata/OpenMetadata,"The Open Context Layer for Data and AI ,  OpenMetadata is the open platform for building trusted data context and business semantics for humans, AI assistants, and agents.",14479,5,2237,0,941,TypeScript,"context,context-layer,data-catalog,data-collaboration,data-contracts,data-discovery,data-governance,data-lineage,data-observability,data-profiling,data-quality,data-quality-checks,datadiscovery,dataengineering,dataquality,mcp,mcp-server,metadata,metadata-management,semantics",2021-08-01T21:17:17Z,2026-07-15T21:04:40Z,2026-07-15T21:06:06Z,False
354,yusufkaraaslan/Skill_Seekers,https://github.com/yusufkaraaslan/Skill_Seekers,"Convert documentation websites, GitHub repositories, and PDFs into Claude AI skills with automatic conflict detection",14468,14,1474,2,104,Python,"ai-tools,ast-parser,automation,claude-ai,claude-skills,code-analysis,conflict-detection,documentation,documentation-generator,github,github-scraper,mcp,mcp-server,multi-source,ocr,pdf,python,web-scraping",2025-10-17T14:43:48Z,2026-07-15T23:01:29Z,2026-07-14T15:52:11Z,False
355,AndyMik90/Aperant,https://github.com/AndyMik90/Aperant,Autonomous multi-session AI coding,14452,1,1923,0,81,TypeScript,,2025-12-04T22:10:37Z,2026-07-15T20:02:33Z,2026-06-14T08:27:00Z,False
356,xpipe-io/xpipe,https://github.com/xpipe-io/xpipe,Access your entire server infrastructure from your local desktop,14353,0,549,0,62,Java,"bash,docker,filemanager,files,incus,java,javafx,k8s,kubernetes,lxd,networking,podman,sftp,ssh,tailscale,wsl",2023-01-27T02:25:38Z,2026-07-15T13:39:44Z,2026-07-15T10:40:15Z,False
357,sindresorhus/pure,https://github.com/sindresorhus/pure,"Pretty, minimal and fast ZSH prompt",14352,1,1009,0,1,Shell,"git,minimal,prompt,pure,shell,shell-prompt,shell-theme,terminal,theme,zsh",2012-09-20T18:14:58Z,2026-07-15T20:25:29Z,2026-07-13T11:42:16Z,False
358,GreyDGL/PentestGPT,https://github.com/GreyDGL/PentestGPT,Automated Penetration Testing Agentic Framework Powered by Large Language Models,14257,18,2483,5,61,Python,"large-language-models,llm,penetration-testing,python",2023-02-27T06:01:53Z,2026-07-15T22:58:09Z,2026-07-14T12:58:31Z,False
359,genlayerlabs/genlayer-project-boilerplate,https://github.com/genlayerlabs/genlayer-project-boilerplate,,14193,5,717,0,32,TypeScript,,2024-06-28T06:59:47Z,2026-07-15T17:06:30Z,2026-07-01T18:43:33Z,False
360,logto-io/logto,https://github.com/logto-io/logto,"🧑‍🚀 Authentication and authorization infrastructure for SaaS and AI apps, built on OIDC and OAuth 2.1 with multi-tenancy, SSO, and RBAC.",14163,12,1114,8,171,TypeScript,"authentication,authorization,email,identity,jwt,login,logto,mfa,oauth2,openid-connect,password,passwordless,rbac,saml,signup,sms,social-login,sso,totp,typescript",2021-06-19T03:01:50Z,2026-07-15T20:20:17Z,2026-07-15T14:52:38Z,False
361,prowler-cloud/prowler,https://github.com/prowler-cloud/prowler,Prowler is the world’s most widely used open-source cloud security platform that automates security and compliance across any cloud environment.,14137,3,2245,1,198,Python,"aws,azure,cis-benchmark,cloud,cloudsecurity,compliance,cspm,devsecops,forensics,gcp,gdpr,hacktoberfest,hardening,iam,multi-cloud,python,security,security-audit,security-hardening,security-tools",2016-08-24T15:12:24Z,2026-07-15T18:43:42Z,2026-07-15T22:54:09Z,False
362,jbranchaud/til,https://github.com/jbranchaud/til,:memo: Today I Learned,14124,0,756,0,22,Vim Script,"learn-in-public,til,today-i-learned,writing",2015-02-07T04:03:24Z,2026-07-15T14:19:08Z,2026-07-15T14:16:50Z,False
363,YishenTu/claudian,https://github.com/YishenTu/claudian,An Obsidian plugin that embeds Claude Code/Codex as an AI collaborator in your vault,14074,38,892,7,100,TypeScript,"claude-code,codex,ide,obsidian,obsidian-plugin,productivity",2025-12-05T17:58:26Z,2026-07-15T19:10:29Z,2026-07-15T06:39:21Z,False
364,grokability/snipe-it,https://github.com/grokability/snipe-it,A free open source IT asset/license management system,14060,4,3875,0,1032,PHP,"asset-management,asset-manager,assets-management,itam,license-management",2013-11-12T22:25:47Z,2026-07-15T15:34:04Z,2026-07-15T21:10:23Z,False
365,pingdotgg/t3code,https://github.com/pingdotgg/t3code,,14031,38,2975,25,734,TypeScript,,2026-02-08T23:46:22Z,2026-07-15T22:28:55Z,2026-07-15T22:17:46Z,False
366,NevaMind-AI/memU,https://github.com/NevaMind-AI/memU,Personal memory across agents,14031,8,1041,-1,85,Python,"agent-memory,claude-skills,harness,loop-engineering,mcp,memory,openclaw,openclaw-skills,sandbox,skills",2025-07-29T01:54:40Z,2026-07-15T22:56:09Z,2026-07-15T17:09:15Z,False
367,chenhg5/cc-connect,https://github.com/chenhg5/cc-connect,"Bridge local AI coding agents (Claude Code, Cursor, Gemini CLI, Codex) to messaging platforms (Feishu/Lark, DingTalk, Slack, Telegram, Discord, LINE, WeChat Work). Chat with your AI dev assistant from anywhere — no public IP required for most platforms.",14029,49,1342,10,490,Go,,2026-02-28T02:39:39Z,2026-07-15T20:02:21Z,2026-07-14T14:48:32Z,False
368,casdoor/casdoor,https://github.com/casdoor/casdoor,"An open-source Agent-first Identity and Access Management (IAM) /LLM MCP & agent gateway and auth server with web UI supporting OpenClaw, MCP, OAuth, OIDC, SAML, CAS, LDAP, SCIM, WebAuthn, TOTP, MFA, Face ID, Google Workspace, Azure AD",13949,12,1739,2,102,Go,"agent,agentic-ai,agi,ai-gateway,auth,authentication,iam,llm,mcp,mcp-gateway,mfa,oauth,oidc,openclaw,radius,saml,scim,single-sign-on,sso,webauthn",2020-10-22T14:40:03Z,2026-07-15T21:57:30Z,2026-07-14T07:44:56Z,False
369,hardikpandya/stop-slop,https://github.com/hardikpandya/stop-slop,A skill file for removing AI tells from prose,13882,62,977,4,39,,,2026-01-11T12:00:59Z,2026-07-15T22:25:50Z,2026-03-17T18:50:39Z,False
370,semaphoreui/semaphore,https://github.com/semaphoreui/semaphore,"Modern UI and powerful API for Ansible, Terraform/OpenTofu/Terragrunt, PowerShell and other DevOps tools.",13873,0,1274,0,1023,Go,"ansible,awx,ci,cicd,devops,docker,docker-ui,go,golang,jenkins,opentofu,pulumi,terraform,terraform-ui,terragrunt",2014-08-23T22:43:31Z,2026-07-15T09:18:39Z,2026-07-15T19:53:52Z,False
371,fish2018/pansou,https://github.com/fish2018/pansou,PanSou是一款高性能的网盘资源搜索API服务，支持TG频道和插件搜索。系统设计以性能和可扩展性为核心，支持多频道多插件并发搜索、结果智能排序和网盘类型分类。docker集成前后端，一键启动，开箱即用。仅供学习研究，请勿以各种形式用于盈利目的。 ,13871,13,3329,1,12,Go,,2025-07-10T07:17:46Z,2026-07-15T18:26:50Z,2026-06-14T14:06:26Z,False
372,millionco/react-doctor,https://github.com/millionco/react-doctor,Your agent writes bad React. This catches it,13850,59,440,2,71,TypeScript,"agents,code-review,doctor,react,skill",2026-02-13T09:02:13Z,2026-07-15T21:40:23Z,2026-07-15T23:01:33Z,False
373,aiming-lab/AutoResearchClaw,https://github.com/aiming-lab/AutoResearchClaw,Fully autonomous & self-evolving research from idea to paper. Chat an Idea. Get a Paper. 🦞,13814,14,1622,0,4,Python,"autonomous-research,citation-verification,llm-agents,metaclaw,multi-agent-debate,openclaw,paper-generation,scientific-discovery,self-evolving",2026-03-15T03:38:49Z,2026-07-15T22:38:41Z,2026-07-13T08:57:26Z,False
374,andrewyng/context-hub,https://github.com/andrewyng/context-hub,,13790,2,1202,1,136,JavaScript,,2025-10-30T12:20:34Z,2026-07-15T12:10:17Z,2026-05-31T18:41:45Z,False
375,coleam00/context-engineering-intro,https://github.com/coleam00/context-engineering-intro,"Context engineering is the new vibe coding - it's the way to actually make AI coding assistants work. Claude Code is the best for this so that's what this repo is centered around, but you can apply this strategy with any AI coding assistant!",13711,0,2726,-4,33,Python,,2025-07-02T11:54:47Z,2026-07-15T14:59:41Z,2026-03-16T12:13:59Z,False
376,jlcodes99/cockpit-tools,https://github.com/jlcodes99/cockpit-tools," 🚀 通用 AI IDE 账号管理工具：支持 Antigravity / Codex / GitHub Copilot / Windsurf / Kiro / Cursor / Gemini-cli / CodeBuddy，多账号切换、配额监控、自动唤醒与多开实例管理。 🚀 Universal AI IDE account manager for Antigravity / Codex / GitHub Copilot / Windsurf / Kiro / Cursor / Gemini-cli / CodeBuddy, with multi-account switching, quota monitoring, wake-up automation, and multi-insta",13541,120,1242,8,445,Rust,"account-manager,ai,antigravity,codebuddy,codex,cursor,github-copilot,kiro,windsurf",2026-01-16T07:09:32Z,2026-07-15T22:52:33Z,2026-07-15T19:18:36Z,False
377,browserless/browserless,https://github.com/browserless/browserless,Deploy headless browsers in Docker. Run on our cloud or bring your own. Free for non-commercial uses.,13477,3,1026,1,27,TypeScript,"browserless,chrome,docker,firefox,nodejs,playwright,puppeteer,typescript,webkit,websocket",2017-11-17T04:35:31Z,2026-07-15T17:39:12Z,2026-07-14T13:59:40Z,False
378,wanshuiyin/Auto-claude-code-research-in-sleep,https://github.com/wanshuiyin/Auto-claude-code-research-in-sleep,"ARIS ⚔️ (Auto-Research-In-Sleep) — Lightweight Markdown-only skills for autonomous ML research: cross-model review loops, idea discovery, and experiment automation. No framework, no lock-in — works with Claude Code, Codex, OpenClaw, or any LLM agent.",13451,59,1213,4,58,Python,"ai-research,ai-tools,aris,autonomous-agent,claude,claude-code,claude-code-skills,codex,deep-learning,gpt,idea-generation,llm,machine-learning,mcp,mcp-server,ml-research,openai,paper-review,paper-writing,research-automation",2026-03-10T07:31:45Z,2026-07-15T23:14:59Z,2026-07-14T17:24:18Z,False
379,lsdefine/GenericAgent,https://github.com/lsdefine/GenericAgent,"Self-evolving agent: grows skill tree from 3.3K-line seed, achieving full system control with 6x less token consumption",13443,14,1554,4,170,Python,"ai-agent,automation,autonomous-agent,browser-automation,claude,computer-control,desktop-automation,gemini,lightweight,llm-agent,memory-system,python,self-evolving,skill-tree,task-automation",2026-01-16T15:45:24Z,2026-07-15T21:31:24Z,2026-07-15T10:20:07Z,False
380,pipecat-ai/pipecat,https://github.com/pipecat-ai/pipecat,Open Source framework for voice and multimodal conversational AI,13440,17,2318,5,222,Python,"ai,chatbot-framework,chatbots,real-time,voice,voice-assistant",2023-12-27T12:59:00Z,2026-07-15T22:46:01Z,2026-07-15T22:45:57Z,False
381,NanmiCoder/cc-haha,https://github.com/NanmiCoder/cc-haha,Claude Code 泄露源码 - 本地可运行版本，新增跨平台桌面端软件补齐Computer Use（附带核心模块解析）,13413,18,8459,3,125,TypeScript,,2026-03-31T17:30:14Z,2026-07-15T20:07:18Z,2026-07-14T06:37:40Z,False
382,fathah/hermes-desktop,https://github.com/fathah/hermes-desktop,Desktop Companion for Hermes Agent,13333,15,1523,8,362,TypeScript,"ai,ai-agent,autonomous-agents,chatbot,hermes,llm",2026-04-02T15:26:49Z,2026-07-15T20:41:48Z,2026-07-15T16:01:41Z,False
383,dreammis/social-auto-upload,https://github.com/dreammis/social-auto-upload,自动化上传视频到社交媒体：抖音、小红书、视频号、tiktok、youtube、bilibili,13314,30,2309,4,64,Python,"bilibili,douyin,tiktok,xiaohongshu,youtube",2023-12-04T07:49:16Z,2026-07-15T18:47:23Z,2026-07-15T05:23:46Z,False
384,EleutherAI/lm-evaluation-harness,https://github.com/EleutherAI/lm-evaluation-harness,A framework for few-shot evaluation of language models.,13295,16,3412,4,910,Python,"evaluation-framework,language-model,transformer",2020-08-28T00:09:15Z,2026-07-15T18:15:35Z,2026-07-13T20:18:15Z,False
385,op7418/Humanizer-zh,https://github.com/op7418/Humanizer-zh,Humanizer 的汉化版本，Claude Code Skills，旨在消除文本中 AI 生成的痕迹。,13244,67,920,0,21,,,2026-01-19T04:23:44Z,2026-07-15T19:57:53Z,2026-01-19T07:46:35Z,False
386,NVIDIA/SkillSpector,https://github.com/NVIDIA/SkillSpector,"Security scanner for AI agent skills. Detect vulnerabilities, malicious patterns, and security risks.",13243,70,1077,10,78,Python,,2026-03-21T00:28:43Z,2026-07-15T23:15:45Z,2026-07-14T23:13:01Z,False
387,xbtlin/ai-berkshire,https://github.com/xbtlin/ai-berkshire,AI 时代的伯克希尔：基于 Claude Code / Codex 的价值投资研究框架。巴菲特·芒格·段永平·李录四大师方法论 + 多Agent并行研究。| AI-era Berkshire: a value investing research framework built for Claude Code / Codex. 4 masters' methodologies + multi-agent adversarial analysis.,13223,76,1921,19,21,Python,"ai,ai-agent,anthropic,berkshire-hathaway,charlie-munger,china-stock,claude,claude-code,financial-analysis,fintech,fundamental-analysis,investment,investment-research,llm,mcp,portfolio-management,stock-analysis,stock-market,value-investing,warren-buffett",2026-04-07T11:19:51Z,2026-07-15T23:12:13Z,2026-07-15T16:51:51Z,False
388,plantuml/plantuml,https://github.com/plantuml/plantuml,Generate diagrams from textual description,13182,-1,1216,0,601,Java,"diagram,diagram-as-code,diagrams,diagrams-as-code,java,plantuml,uml,uml-diagram",2010-11-04T15:55:50Z,2026-07-15T22:01:07Z,2026-07-15T22:14:55Z,False
389,MetaMask/metamask-extension,https://github.com/MetaMask/metamask-extension,:globe_with_meridians: :electric_plug: The MetaMask browser extension enables browsing Ethereum blockchain enabled websites,13178,0,5559,1,2756,TypeScript,"brave,chrome,dapp,dapp-developers,edge,ethereum,extension,firefox,opera",2015-09-06T16:34:48Z,2026-07-15T22:27:23Z,2026-07-15T23:01:45Z,False
390,ccfos/nightingale,https://github.com/ccfos/nightingale,Nightingale is to monitoring and alerting what Grafana is to visualization.,13142,2,1733,1,222,Go,"alerting,ccf,metrics,monitoring,nightingale,observability,open-falcon,time-series,tsdb",2020-03-03T17:08:26Z,2026-07-15T08:25:58Z,2026-07-15T14:21:40Z,False
391,supertone-inc/supertonic,https://github.com/supertone-inc/supertonic,"Lightning-Fast, On-Device, Multilingual TTS — running natively via ONNX.",13119,50,1349,5,123,Swift,"cpp,csharp,flutter,go,ios,java,lightweight,multilingual,nodejs,on-device,onnx,onnxruntime,python,rust,speech-synthesis,swift,text-to-speech,tts,web,webgpu",2025-11-18T08:23:58Z,2026-07-15T23:17:02Z,2026-06-30T07:07:06Z,False
392,MiniMax-AI/skills,https://github.com/MiniMax-AI/skills,,13092,29,1122,0,60,C#,,2026-03-17T07:19:25Z,2026-07-15T23:01:43Z,2026-04-18T09:48:47Z,False
393,ixartz/Next-js-Boilerplate,https://github.com/ixartz/Next-js-Boilerplate,"🚀🎉📚 Nextjs Boilerplate and Starter with App Router and Page Router support, Tailwind CSS 4 and TypeScript ⚡️ Made with developer experience first: Next.js 16 + TypeScript + ESLint + Prettier + Drizzle ORM + Husky + Lint-Staged + Vitest + Testing Library + Playwright + Storybook + Commitlint + VSCode + Sentry + PostCSS + Tailwind CSS ✨",13021,1,2404,2,6,TypeScript,"boilerplate,boilerplate-code,jamstack,javascript,js-boilerplate,netlify-template,next-js,next-theme,nextjs,nextjs-starter,nextjs-template,react,react-boilerplate,reactjs,starter-kit,starter-project,starter-template,tailwind-css,tailwindcss,typescript",2020-07-22T19:47:35Z,2026-07-15T12:04:27Z,2026-07-08T15:27:26Z,False
394,BasedHardware/omi,https://github.com/BasedHardware/omi,"AI that sees your screen, listens to your conversations and tells you what to do",13012,8,2121,2,708,Dart,"ai,app,bci,c,flutter,friend,mobile,necklace,nextjs,omi,personas,python,smartglasses,summary,transcription,wearable",2024-03-22T18:12:25Z,2026-07-15T22:27:22Z,2026-07-15T22:52:38Z,False
395,markmap/markmap,https://github.com/markmap/markmap,Build mindmaps with plain text,12960,5,994,0,63,TypeScript,"markmap,mindmap",2020-01-13T10:23:34Z,2026-07-15T11:41:01Z,2026-06-21T03:38:23Z,False
396,tiny-craft/tiny-rdm,https://github.com/tiny-craft/tiny-rdm,"Tiny RDM (Tiny Redis Desktop Manager) - A modern, colorful, super lightweight Redis GUI client for Mac, Windows, and Linux. It also provides a web version that can be deployed via Docker.",12952,5,657,1,174,Vue,"go,golang,icon-pack,naive-ui,redis,redis-client,redis-desktop,redis-gui,redis-manager,redis-web,vue,wails,wails-app,web-view",2023-06-27T07:06:25Z,2026-07-15T21:57:46Z,2026-07-12T14:23:05Z,False
397,modelcontextprotocol/typescript-sdk,https://github.com/modelcontextprotocol/typescript-sdk,The official TypeScript SDK for Model Context Protocol servers and clients,12862,9,1986,6,461,TypeScript,,2024-09-24T20:45:31Z,2026-07-15T17:03:05Z,2026-07-15T08:20:33Z,False
