rank,full_name,url,description,stars,star_delta_vs_previous_day,forks,fork_delta_vs_previous_day,open_issues,language,topics,created_at,updated_at,pushed_at,archived
1,obra/superpowers,https://github.com/obra/superpowers,An agentic skills framework & software development methodology that works.,216915,1057,19308,80,257,Shell,,2025-10-09T19:45:18Z,2026-06-04T00:13:57Z,2026-06-03T05:46:02Z,False
2,affaan-m/ECC,https://github.com/affaan-m/ECC,"The agent harness performance optimization system. Skills, instincts, memory, security, and research-first development for Claude Code, Codex, Opencode, Cursor and beyond.",205706,1801,31583,302,69,JavaScript,"ai-agents,anthropic,claude,claude-code,developer-tools,llm,mcp,productivity",2026-01-18T00:51:51Z,2026-06-04T00:16:03Z,2026-06-03T13:54:32Z,False
3,ultraworkers/claw-code,https://github.com/ultraworkers/claw-code,The repo is finally unlocked. enjoy the party! The fastest repo in history to surpass 100K stars ⭐. Join Discord: https://discord.gg/5TUQKqFWd Built in Rust using oh-my-codex.,193213,46,109977,-13,979,Rust,,2026-03-31T08:58:08Z,2026-06-04T00:15:20Z,2026-06-03T18:58:44Z,False
4,NousResearch/hermes-agent,https://github.com/NousResearch/hermes-agent,The agent that grows with you,179080,1751,30673,341,17248,Python,"ai,ai-agent,ai-agents,anthropic,chatgpt,claude,claude-code,clawdbot,codex,hermes,hermes-agent,llm,moltbot,nous-research,openai,openclaw",2025-07-22T22:22:28Z,2026-06-04T00:17:13Z,2026-06-04T00:15:01Z,False
5,ollama/ollama,https://github.com/ollama/ollama,"Get up and running with Kimi-K2.6, GLM-5.1, MiniMax, DeepSeek, gpt-oss, Qwen, Gemma and other models.",173066,105,16416,12,3316,Go,"deepseek,gemma,gemma3,glm,go,golang,gpt-oss,llama,llama3,llm,llms,minimax,mistral,ollama,qwen",2023-06-26T19:39:32Z,2026-06-03T23:53:11Z,2026-06-04T00:09:11Z,False
6,multica-ai/andrej-karpathy-skills,https://github.com/multica-ai/andrej-karpathy-skills,"A single CLAUDE.md file to improve Claude Code behavior, derived from Andrej Karpathy's observations on LLM coding pitfalls.",166864,1004,17069,97,117,,,2026-01-27T03:53:13Z,2026-06-04T00:13:55Z,2026-04-20T10:05:04Z,False
7,langflow-ai/langflow,https://github.com/langflow-ai/langflow,Langflow is a powerful tool for building and deploying AI-powered agents and workflows.,149188,70,9183,11,922,Python,"agents,chatgpt,generative-ai,large-language-models,multiagent,react-flow",2023-02-08T22:28:03Z,2026-06-03T22:52:44Z,2026-06-04T00:10:09Z,False
8,anthropics/skills,https://github.com/anthropics/skills,Public repository for Agent Skills,146104,445,17217,53,921,Python,agent-skills,2025-09-22T15:53:31Z,2026-06-04T00:10:08Z,2026-05-29T02:02:28Z,False
9,x1xhlol/system-prompts-and-models-of-ai-tools,https://github.com/x1xhlol/system-prompts-and-models-of-ai-tools,"FULL Augment Code, Claude Code, Cluely, CodeBuddy, Comet, Cursor, Devin AI, Junie, Kiro, Leap.new, Lovable, Manus, NotionAI, Orchids.app, Perplexity, Poke, Qoder, Replit, Same.dev, Trae, Traycer AI, VSCode Agent, Warp.dev, Windsurf, Xcode, Z.ai Code, Dia & v0. (And other Open Sourced) System Prompts, Internal Tools & AI Models",138741,41,34511,1,146,,"ai,bolt,cluely,copilot,cursor,cursorai,devin,github-copilot,lovable,open-source,perplexity,replit,system-prompts,trae,trae-ai,trae-ide,v0,vscode,windsurf,windsurf-ai",2025-03-05T16:38:29Z,2026-06-03T23:44:50Z,2026-05-23T11:15:30Z,False
10,anthropics/claude-code,https://github.com/anthropics/claude-code,"Claude Code is an agentic coding tool that lives in your terminal, understands your codebase, and helps you code faster by executing routine tasks, explaining complex code, and handling git workflows - all through natural language commands.",129854,244,21108,30,8404,Python,,2025-02-22T17:41:21Z,2026-06-04T00:04:37Z,2026-06-03T21:31:35Z,False
11,firecrawl/firecrawl,https://github.com/firecrawl/firecrawl,"The API to search, scrape, and interact with the web at scale. 🔥",128249,513,7641,27,361,TypeScript,"ai,ai-agents,ai-crawler,ai-scraping,ai-search,crawler,data-extraction,html-to-markdown,llm,markdown,scraper,scraping,web-crawler,web-data,web-data-extraction,web-scraper,web-scraping,web-search,webscraping",2024-04-15T21:02:29Z,2026-06-04T00:17:40Z,2026-06-04T00:13:33Z,False
12,mattpocock/skills,https://github.com/mattpocock/skills,Skills for Real Engineers. Straight from my .claude directory.,116418,1182,10197,100,57,Shell,,2026-02-03T11:15:53Z,2026-06-04T00:17:14Z,2026-06-03T11:46:30Z,False
13,github/spec-kit,https://github.com/github/spec-kit,💫 Toolkit to help you get started with Spec-Driven Development,108108,300,9568,31,415,Python,"ai,copilot,development,engineering,prd,spec,spec-driven",2025-08-21T22:54:31Z,2026-06-04T00:13:40Z,2026-06-03T22:44:30Z,False
14,msitarzewski/agency-agents,https://github.com/msitarzewski/agency-agents,"A complete AI agency at your fingertips - From frontend wizards to Reddit community ninjas, from whimsy injectors to reality checkers. Each agent is a specialized expert with personality, processes, and proven deliverables.",107231,250,17683,40,132,Shell,,2025-10-13T12:12:29Z,2026-06-04T00:16:20Z,2026-06-03T23:59:48Z,False
15,garrytan/gstack,https://github.com/garrytan/gstack,"Use Garry Tan's exact Claude Code setup: 23 opinionated tools that serve as CEO, Designer, Eng Manager, Release Manager, Doc Engineer, and QA",106745,441,15876,51,590,TypeScript,,2026-03-11T21:22:45Z,2026-06-03T23:58:13Z,2026-06-03T15:52:12Z,False
16,google-gemini/gemini-cli,https://github.com/google-gemini/gemini-cli,An open-source AI agent that brings the power of Gemini directly into your terminal.,104904,41,13989,10,1339,TypeScript,"ai,ai-agents,cli,gemini,gemini-api,mcp-client,mcp-server",2025-04-17T17:04:31Z,2026-06-03T23:49:00Z,2026-06-03T20:14:33Z,False
17,browser-use/browser-use,https://github.com/browser-use/browser-use,🌐 Make websites accessible for AI agents. Automate tasks online with ease.,97023,239,10856,19,256,Python,"ai-agents,ai-tools,browser-automation,browser-use,llm,playwright,python",2024-10-31T16:00:56Z,2026-06-04T00:08:08Z,2026-06-01T18:49:47Z,False
18,puppeteer/puppeteer,https://github.com/puppeteer/puppeteer,JavaScript API for Chrome and Firefox,94413,11,9424,-4,266,TypeScript,"automation,chrome,chromium,developer-tools,firefox,headless-chrome,node-module,testing,web",2017-05-09T22:16:13Z,2026-06-03T23:15:59Z,2026-06-03T16:02:51Z,False
19,farion1231/cc-switch,https://github.com/farion1231/cc-switch,"A cross-platform desktop All-in-One assistant for Claude Code, Codex, OpenCode, OpenClaw, Gemini CLI & Hermes Agent. Only official website: ccswitch.io",90541,1282,5902,85,1285,Rust,"ai-tools,claude-code,codex,desktop-app,hermes,hermes-agent,mcp,minimax,omo,open-source,openclaw,openclaw-ui,opencode,provider-management,rust,skills,skills-management,tauri,typescript,wsl-support",2025-08-04T14:16:16Z,2026-06-04T00:01:41Z,2026-06-03T15:03:13Z,False
20,microsoft/playwright,https://github.com/microsoft/playwright,"Playwright is a framework for Web Testing and Automation. It allows testing Chromium, Firefox and WebKit with a single API. ",90212,90,5853,4,158,TypeScript,"automation,chrome,chromium,e2e-testing,electron,end-to-end-testing,firefox,javascript,playwright,test,test-automation,testing,testing-tools,web,webkit",2019-11-15T18:32:42Z,2026-06-04T00:05:32Z,2026-06-03T20:48:15Z,False
21,ChatGPTNextWeb/NextChat,https://github.com/ChatGPTNextWeb/NextChat,✨ Light and Fast AI Assistant. Support: Web | iOS | MacOS | Android |  Linux | Windows,88172,10,59662,-11,836,TypeScript,"calclaude,chatgpt,claude,cross-platform,desktop,fe,gemini,gemini-pro,gemini-server,gemini-ultra,gpt-4o,groq,nextjs,ollama,react,tauri,tauri-app,vercel,webui",2023-03-10T18:27:54Z,2026-06-04T00:13:14Z,2026-05-15T01:19:01Z,False
22,nextlevelbuilder/ui-ux-pro-max-skill,https://github.com/nextlevelbuilder/ui-ux-pro-max-skill,An AI SKILL that provide design intelligence for building professional UI/UX multiple platforms,86957,462,8984,51,168,Python,"ai-skills,antigravity,claude,claude-code,codex,command-line,copilot,cursor-ai,html5,kiro,landing-page,mobile-ui,qoder,react,tailwindcss,trae,ui-design,uikit,windsurf-ai",2025-11-30T11:36:31Z,2026-06-04T00:15:42Z,2026-04-03T05:08:19Z,False
23,modelcontextprotocol/servers,https://github.com/modelcontextprotocol/servers,Model Context Protocol Servers,86692,51,10908,9,499,TypeScript,,2024-11-19T01:10:17Z,2026-06-03T22:14:48Z,2026-06-03T20:40:12Z,False
24,laravel/laravel,https://github.com/laravel/laravel,"Laravel is a web application framework with expressive, elegant syntax. We’ve already laid the foundation for your next big idea — freeing you to create without sweating the small things.",84356,-6,24734,-6,31,Blade,"framework,laravel,php",2011-06-08T03:06:08Z,2026-06-03T17:58:44Z,2026-06-03T15:18:30Z,False
25,TauricResearch/TradingAgents,https://github.com/TauricResearch/TradingAgents,TradingAgents: Multi-Agents LLM Financial Trading Framework,82675,371,16031,61,298,Python,"agent,finance,llm,multiagent,trading",2024-12-28T03:31:08Z,2026-06-04T00:10:26Z,2026-06-01T02:02:48Z,False
26,thedotmack/claude-mem,https://github.com/thedotmack/claude-mem,"Persistent Context Across Sessions for Every Agent –  Captures everything your agent does during sessions, compresses it with AI, and injects relevant context back into future sessions. Works with Claude Code, OpenClaw, Codex, Gemini, Hermes, Copilot, OpenCode + More",80473,205,6925,15,150,TypeScript,"ai,ai-agents,ai-memory,anthropic,artificial-intelligence,chromadb,claude,claude-agent-sdk,claude-agents,claude-code,claude-code-plugin,claude-skills,embeddings,long-term-memory,mem0,memory-engine,openmemory,rag,sqlite,supermemory",2025-08-31T20:50:03Z,2026-06-04T00:01:40Z,2026-06-03T08:39:38Z,False
27,OpenHands/OpenHands,https://github.com/OpenHands/OpenHands,🙌 OpenHands: AI-Driven Development,75752,70,9611,12,354,Python,"agent,artificial-intelligence,chatgpt,claude-ai,cli,developer-tools,gpt,llm,openai",2024-03-13T03:33:31Z,2026-06-03T23:56:59Z,2026-06-03T22:23:06Z,False
28,thedaviddias/Front-End-Checklist,https://github.com/thedaviddias/Front-End-Checklist,"🗂 The essential checklist for modern web development, for humans and AI agents",72800,11,6653,1,1,MDX,"ai-agent,ai-agents,checklist,css,front-end-developer-tool,front-end-development,frontend,guidelines,html,javascript,lists,reference,resources,rules,web-development",2017-10-16T10:12:36Z,2026-06-03T23:33:32Z,2026-06-02T15:27:13Z,False
29,daytonaio/daytona,https://github.com/daytonaio/daytona,Daytona is a Secure and Elastic Infrastructure for Running AI-Generated Code,72501,1,5611,4,432,TypeScript,"agentic-workflow,ai,ai-agents,ai-runtime,ai-sandboxes,code-execution,code-interpreter,developer-tools",2024-02-06T08:21:20Z,2026-06-03T23:54:21Z,2026-06-03T15:38:07Z,False
30,Eugeny/tabby,https://github.com/Eugeny/tabby,A terminal for a more modern age,71839,37,4036,4,2699,TypeScript,"serial,ssh-client,telnet-client,terminal,terminal-emulators",2016-12-23T09:06:10Z,2026-06-03T22:35:22Z,2026-05-20T22:03:28Z,False
31,bytedance/deer-flow,https://github.com/bytedance/deer-flow,"An open-source long-horizon SuperAgent harness that researches, codes, and creates. With the help of sandboxes, memories, tools, skill, subagents and message gateway, it handles different levels of tasks that could take minutes to hours.",70389,85,9515,28,926,Python,"agent,agentic,agentic-framework,agentic-workflow,ai,ai-agents,deep-research,harness,langchain,langgraph,langmanus,llm,multi-agent,nodejs,podcast,python,superagent,typescript",2025-05-07T02:50:19Z,2026-06-04T00:04:13Z,2026-06-03T23:11:00Z,False
32,paperclipai/paperclip,https://github.com/paperclipai/paperclip,The open-source app everyone uses to manage agents at work,68966,152,12786,34,4749,TypeScript,,2026-03-02T15:01:51Z,2026-06-03T23:24:40Z,2026-06-03T23:35:41Z,False
33,OpenBB-finance/OpenBB,https://github.com/OpenBB-finance/OpenBB,"Financial data platform for analysts, quants and AI agents.",68552,110,6912,21,67,Python,"ai,crypto,derivatives,economics,equity,finance,fixed-income,machine-learning,openbb,options,python,quantitative-finance,stocks",2020-12-20T10:46:38Z,2026-06-03T23:20:51Z,2026-06-03T20:27:55Z,False
34,JuliusBrussee/caveman,https://github.com/JuliusBrussee/caveman,🪨 why use many token when few token do trick — Claude Code skill that cuts 65% of tokens by talking like caveman,68385,443,3847,22,268,JavaScript,"ai,anthropic,caveman,claude,claude-code,llm,meme,prompt-engineering,skill,tokens",2026-04-04T10:03:00Z,2026-06-04T00:15:51Z,2026-05-20T10:44:54Z,False
35,unclecode/crawl4ai,https://github.com/unclecode/crawl4ai,"🚀🤖 Crawl4AI: Open-source LLM Friendly Web Crawler & Scraper. Don't be shy, join here: https://discord.gg/jP8KfhDhyN",67718,88,6919,12,87,Python,,2024-05-09T09:48:50Z,2026-06-03T23:54:05Z,2026-06-01T14:44:47Z,False
36,opendatalab/MinerU,https://github.com/opendatalab/MinerU,Transforms complex documents like PDFs and Office docs into LLM-ready markdown/JSON for your Agentic workflows.,66313,177,5584,13,20,Python,"ai4science,document-analysis,docx,extract-data,layout-analysis,ocr,parser,pdf,pdf-converter,pdf-extractor-llm,pdf-extractor-pretrain,pdf-extractor-rag,pdf-parser,pptx,python,xlsx",2024-02-29T08:52:34Z,2026-06-04T00:18:03Z,2026-06-02T15:13:43Z,False
37,xtekky/gpt4free,https://github.com/xtekky/gpt4free,The official gpt4free repository | various collection of powerful language models | opus 4.6 gpt 5.3 kimi 2.5 deepseek v3.2 gemini 3,66283,3,13582,-4,8,Python,"chatbot,chatbots,chatgpt,chatgpt-4,chatgpt-api,chatgpt-free,chatgpt4,deepseek,deepseek-api,deepseek-r1,gpt,gpt-4,gpt-4o,gpt4,gpt4-api,language-model,openai,openai-api,openai-chatgpt,reverse-engineering",2023-03-29T17:00:43Z,2026-06-03T22:53:02Z,2026-06-03T22:33:06Z,False
38,bradtraversy/design-resources-for-developers,https://github.com/bradtraversy/design-resources-for-developers,"Curated list of design and UI resources from stock photos, web templates, CSS frameworks, UI libraries, tools and much more",65936,9,12068,2,31,,,2020-05-06T14:40:35Z,2026-06-03T23:14:51Z,2026-05-24T10:07:48Z,False
39,unslothai/unsloth,https://github.com/unslothai/unsloth,"Unsloth Studio is a web UI for training and running open models like Gemma 4, Qwen3.6, DeepSeek, gpt-oss locally.",65669,68,5871,8,1348,Python,"agent,deepseek,fine-tuning,gemma,gemma3,gpt-oss,llama,llama3,llm,llms,mistral,openai,qwen,reinforcement-learning,self-hosted,text-to-speech,tts,ui,unsloth",2023-11-29T16:50:09Z,2026-06-03T23:59:27Z,2026-06-03T17:22:27Z,False
40,shareAI-lab/learn-claude-code,https://github.com/shareAI-lab/learn-claude-code,"Bash is all you need -  A nano claude code–like 「agent harness」, built from 0 to 1",64510,217,10536,31,71,Python,"agent,agent-development,ai-agent,claude,claude-code,educational,llm,python,teaching,tutorial",2025-06-29T15:34:15Z,2026-06-04T00:10:28Z,2026-06-03T15:33:36Z,False
41,gsd-build/get-shit-done,https://github.com/gsd-build/get-shit-done,"A light-weight and powerful meta-prompting, context engineering and spec-driven development system for Claude Code by TÂCHES.",63897,52,5445,9,0,JavaScript,"claude-code,context-engineering,meta-prompting,spec-driven-development",2025-12-14T14:17:12Z,2026-06-03T23:26:17Z,2026-05-31T17:46:54Z,False
42,cline/cline,https://github.com/cline/cline,"Autonomous coding agent as an SDK, IDE extension, or CLI assistant.",62715,50,6597,7,980,TypeScript,,2024-07-06T07:28:10Z,2026-06-03T23:34:22Z,2026-06-03T23:59:23Z,False
43,warpdotdev/warp,https://github.com/warpdotdev/warp,"Warp is an agentic development environment, born out of the terminal.",60961,75,4870,4,4264,Rust,"bash,linux,macos,rust,shell,terminal,wasm,zsh",2021-07-08T18:48:08Z,2026-06-04T00:17:17Z,2026-06-04T00:12:14Z,False
44,docling-project/docling,https://github.com/docling-project/docling,Get your documents ready for gen AI,60922,60,4249,7,929,Python,"ai,convert,document-parser,document-parsing,documents,docx,html,markdown,pdf,pdf-converter,pdf-to-json,pdf-to-text,pptx,tables,xlsx",2024-07-09T07:50:26Z,2026-06-03T23:45:42Z,2026-06-03T16:24:57Z,False
45,code-yeongyu/oh-my-openagent,https://github.com/code-yeongyu/oh-my-openagent,"omo; the one and only agent harness for complex codebases. the pickaxe for complex software engineering. For your Codex, for your OpenCode",60888,155,4937,9,672,TypeScript,"ai,ai-agents,anthropic,chatgpt,claude,claude-skills,codex,cursor,gemini,ide,openai,opencode,orchestration,tui,typescript",2025-12-03T01:40:05Z,2026-06-03T23:45:36Z,2026-06-03T21:21:47Z,False
46,D4Vinci/Scrapling,https://github.com/D4Vinci/Scrapling,🕷️ An adaptive Web Scraping framework that handles everything from a single request to a full-scale crawl!,60214,1076,5802,89,24,Python,"ai,ai-scraping,automation,crawler,crawling,crawling-python,data,data-extraction,mcp,mcp-server,playwright,python,scraping,selectors,stealth,web-scraper,web-scraping,web-scraping-python,webscraping,xpath",2024-10-13T20:29:53Z,2026-06-04T00:17:05Z,2026-06-03T17:43:44Z,False
47,safishamsi/graphify,https://github.com/safishamsi/graphify,"AI coding assistant skill (Claude Code, Codex, OpenCode, Cursor, Gemini CLI, and more). Turn any folder of code, SQL schemas, R scripts, shell scripts, docs, papers, images, or videos into a queryable knowledge graph. App code + database schema + infrastructure in one graph.",58903,496,6145,46,285,Python,"antigravity,claude-code,codex,gemini,graphrag,knowledge-graph,leiden,openclaw,rag,skills,tree-sitter",2026-04-03T15:49:07Z,2026-06-04T00:11:50Z,2026-06-03T22:08:56Z,False
48,sansan0/TrendRadar,https://github.com/sansan0/TrendRadar,"⭐AI-driven public opinion & trend monitor with multi-platform aggregation, RSS, and smart alerts.🎯 告别信息过载，你的 AI 舆情监控助手与热点筛选工具！聚合多平台热点 +  RSS 订阅，支持关键词精准筛选。AI 智能筛选新闻 + AI 翻译 +  AI 分析简报直推手机，也支持接入 MCP 架构，赋能 AI 自然语言对话分析、情感洞察与趋势预测等。支持 Docker ，数据本地/云端自持。集成微信/飞书/钉钉/Telegram/邮件/ntfy/bark/slack 等渠道智能推送。",58782,49,24484,3,45,Python,"ai,bark,data-analysis,docker,hot-news,llm,mail,mcp,mcp-server,news,ntfy,python,rss,trending-topics,wechat,wework",2025-04-28T11:42:16Z,2026-06-03T23:33:02Z,2026-06-02T13:47:09Z,False
49,microsoft/autogen,https://github.com/microsoft/autogen,A programming framework for agentic AI,58671,24,8858,4,880,Python,"agentic,agentic-agi,agents,ai,autogen,autogen-ecosystem,chatgpt,framework,llm-agent,llm-framework",2023-08-18T11:43:45Z,2026-06-03T23:24:46Z,2026-04-15T11:59:09Z,False
50,rtk-ai/rtk,https://github.com/rtk-ai/rtk,"CLI proxy that reduces LLM token consumption by 60-90% on common dev commands. Single Rust binary, zero dependencies",58430,482,3592,32,1068,Rust,"agentic-coding,ai-coding,anthropic,claude-code,cli,command-line-tool,cost-reduction,developer-tools,llm,open-source,productivity,rust,token-optimization",2026-01-22T16:54:16Z,2026-06-04T00:17:32Z,2026-06-03T15:27:18Z,False
51,nexu-io/open-design,https://github.com/nexu-io/open-design,"🎨 Local-first, open-source Claude Design alternative. 🖥️ Native desktop app. ⚡ 259+ Skills · ✨ 142+ Design Systems 🖼️ Web · desktop · mobile prototypes · slides · images · videos · HyperFrames 📦 Sandboxed preview · HTML/PDF/PPTX/MP4 export 🤖 Claude Code / OpenClaw / Codex / Cursor / OpenCode / Qwen / Copilot / Hermes / Kimi & 17+ CLIs.",58139,544,6567,60,335,TypeScript,"agent-skills,ai-agents,ai-design,byok,claude-code-for-design,claude-design,codex-design,coding-agents,cursor-design,design-systems,design-tools,desktop-app,figma-alternative,generative-ai,hermes-agent,local-first,no-code,prototyping,ui-generator,vibe-coding",2026-04-28T04:25:20Z,2026-06-04T00:17:00Z,2026-06-03T22:21:31Z,False
52,meilisearch/meilisearch,https://github.com/meilisearch/meilisearch,A lightning-fast search engine API bringing AI-powered hybrid search to your sites and applications.,57926,9,2563,1,311,Rust,"ai,api,app-search,database,enterprise-search,faceting,full-text-search,fuzzy-search,geosearch,hybrid-search,instantsearch,search,search-as-you-type,search-engine,semantic-search,site-search,typo-tolerance,vector-database,vector-search,vectors",2018-04-23T11:45:28Z,2026-06-03T23:04:17Z,2026-06-03T16:12:22Z,False
53,ruvnet/ruflo,https://github.com/ruvnet/ruflo,"🌊 The leading agent meta-harness for Claude. Deploy intelligent multi-agent swarms, coordinate autonomous workflows, and build conversational AI systems. Features adaptive memory, self-learning swarm intelligence, RAG integration, and native Claude Code / Codex Integration",57707,179,6598,25,613,TypeScript,"agentic-ai,agentic-framework,agentic-rag,agentic-workflow,agents,ai-agents,ai-assistant,ai-coding,ai-skills,autonomous-agents,claude-code,codex,mcp-server,multi-agent,multi-agent-systems,npm,skills,swarm,swarm-intelligence,typescript",2025-06-02T21:24:20Z,2026-06-04T00:08:38Z,2026-06-03T06:07:41Z,False
54,mem0ai/mem0,https://github.com/mem0ai/mem0,Universal memory layer for AI Agents,57613,172,6583,20,424,Python,"agents,ai,ai-agents,application,chatbots,chatgpt,genai,llm,long-term-memory,memory,memory-management,python,rag,state-management",2023-06-20T08:58:36Z,2026-06-03T23:19:18Z,2026-06-03T15:27:59Z,False
55,zylon-ai/private-gpt,https://github.com/zylon-ai/private-gpt,"Interact with your documents using the power of GPT, 100% privately, no data leaks",57205,-3,7601,3,0,Python,"ai,ai-tools,on-premise",2023-05-02T09:15:31Z,2026-06-03T23:03:01Z,2026-06-03T15:27:11Z,False
56,upstash/context7,https://github.com/upstash/context7,Context7 Platform -- Up-to-date code documentation for LLMs and AI code editors,56676,72,2677,3,142,TypeScript,"llm,mcp,mcp-server,vibe-coding",2025-03-26T23:40:39Z,2026-06-04T00:02:13Z,2026-06-03T15:29:02Z,False
57,coollabsio/coolify,https://github.com/coollabsio/coolify,"An open-source, self-hostable PaaS alternative to Vercel, Heroku & Netlify that lets you easily deploy static sites, databases, full-stack applications and 280+ one-click services on your own servers.",56408,45,4701,7,763,PHP,"coolify,databases,deployment,docker,docker-compose,inertiajs,laravel,mariadb,mysql,nextjs,nodejs,php,postgres,redis,self-hosted,self-hosting,server,static-site,svelte,svelte5",2021-01-25T20:54:01Z,2026-06-04T00:12:13Z,2026-06-03T13:43:26Z,False
58,shanraisshan/claude-code-best-practice,https://github.com/shanraisshan/claude-code-best-practice,from vibe coding to agentic engineering - practice makes claude perfect,56239,151,5655,26,11,HTML,"agentic-ai,agentic-coding,agentic-engineering,agentic-workflow,ai,ai-agents,anthropic,best-practices,boris,claude,claude-ai,claude-code,claude-code-agents,claude-code-best-practices,claude-code-commands,claude-code-skills,context-engineering,pakistan,pakistani-developer,vibe-coding",2025-10-31T14:15:28Z,2026-06-03T23:50:43Z,2026-06-03T18:05:53Z,False
59,Zie619/n8n-workflows,https://github.com/Zie619/n8n-workflows,all of the workflows of n8n i could find (also from the site itself),54952,19,7261,4,27,Python,,2025-05-14T08:43:59Z,2026-06-03T20:58:46Z,2026-05-31T14:09:36Z,False
60,MemPalace/mempalace,https://github.com/MemPalace/mempalace,The best-benchmarked open-source AI memory system. And it's free.,53374,50,7043,5,591,Python,"ai,chromadb,llm,mcp,memory,python",2026-04-05T01:12:07Z,2026-06-04T00:14:46Z,2026-06-03T05:18:15Z,False
61,OpenCut-app/OpenCut,https://github.com/OpenCut-app/OpenCut,The open-source CapCut alternative,53092,689,5779,98,315,TypeScript,"editor,oss,videoeditor",2025-06-22T08:02:17Z,2026-06-04T00:14:37Z,2026-05-27T22:37:31Z,False
62,crewAIInc/crewAI,https://github.com/crewAIInc/crewAI,"Framework for orchestrating role-playing, autonomous AI agents. By fostering collaborative intelligence, CrewAI empowers agents to work together seamlessly, tackling complex tasks.",52776,86,7364,15,388,Python,"agents,ai,ai-agents,aiagentframework,llms",2023-10-27T03:26:59Z,2026-06-04T00:17:16Z,2026-06-04T00:17:43Z,False
63,Fission-AI/OpenSpec,https://github.com/Fission-AI/OpenSpec,Spec-driven development (SDD) for AI coding assistants.,52642,232,3686,19,369,TypeScript,"ai,context-engineering,engineering,planning,prd,sdd,sdlc,spec,spec-driven-development,specification",2025-08-05T10:37:45Z,2026-06-04T00:12:41Z,2026-06-03T09:36:11Z,False
64,Lum1104/Understand-Anything,https://github.com/Lum1104/Understand-Anything,"Graphs that teach > graphs that impress. Turn any code into an interactive knowledge graph you can explore, search, and ask questions about. Works with Claude Code, Codex, Cursor, Copilot, Gemini CLI, and more.",51109,1031,4172,97,157,TypeScript,"antigravity-skills,business-knowledge,claude-code,claude-skills,codebase-analysis,codex,codex-skills,developer-tools-ai-agent,gemini-cli-skills,karpathy-llm-wiki,knowledge-base,knowledge-graph,memory,opencode-skills,pi-agent,understandcode,vibe-coding",2026-03-15T02:30:51Z,2026-06-04T00:17:13Z,2026-06-02T09:49:02Z,False
65,charlax/professional-programming,https://github.com/charlax/professional-programming,A collection of learning resources for curious software engineers,51037,3,3994,0,3,Python,"architecture,computer-science,concepts,documentation,engineer,learning,lessons-learned,professional,programmer,programming-language,read-articles,scalability,software-engineering",2015-11-07T05:07:52Z,2026-06-04T00:01:42Z,2026-06-01T11:47:06Z,False
66,NanmiCoder/MediaCrawler,https://github.com/NanmiCoder/MediaCrawler,小红书笔记 | 评论爬虫、抖音视频 | 评论爬虫、快手视频 | 评论爬虫、B 站视频 ｜ 评论爬虫、微博帖子 ｜ 评论爬虫、百度贴吧帖子 ｜ 百度贴吧评论回复爬虫  | 知乎问答文章｜评论爬虫,50630,40,10656,12,167,Python,,2023-06-09T12:14:34Z,2026-06-03T19:55:59Z,2026-05-29T13:34:08Z,False
