rank,full_name,url,description,stars,star_delta_vs_previous_day,forks,fork_delta_vs_previous_day,open_issues,language,topics,created_at,updated_at,pushed_at,archived
274,datawhalechina/easy-vibe,https://github.com/datawhalechina/easy-vibe,💻 vibe coding 2026 | Your first modern Coding course beginners to master step by step.,16909,26,1592,4,18,JavaScript,"agent,ai,coding,course,deepseek,gemini,genai,gpt,llm,low-code,mcp,nextjs,no-code,openai,programming,tutorial,vibe-coding,vibecoding,vscode,workflow",2025-12-28T16:45:28Z,2026-06-14T23:56:51Z,2026-06-10T06:32:00Z,False
275,windmill-labs/windmill,https://github.com/windmill-labs/windmill,"Open-source developer platform to power your entire infra and turn scripts into webhooks, workflows and UIs. Fastest workflow engine (13x vs Airflow). Open-source alternative to Retool and Temporal.",16771,2,994,2,767,Rust,"low-code,open-source,platform,postgresql,python,self-hostable,typescript",2022-05-05T02:21:17Z,2026-06-14T22:07:51Z,2026-06-14T23:15:12Z,False
276,apache/apisix,https://github.com/apache/apisix,The Cloud-Native API Gateway and AI Gateway,16726,2,2884,0,280,Lua,"ai-gateway,api,api-gateway,api-management,apisix,cloud-native,devops,iot,kubernetes,kubernetes-ingress,loadbalancing,luajit,microservices,nginx,reverse-proxy,serverless",2019-04-10T02:02:05Z,2026-06-14T14:47:33Z,2026-06-12T08:48:42Z,False
277,QwenLM/Qwen3-Coder,https://github.com/QwenLM/Qwen3-Coder,"Qwen3-Coder is the code version of Qwen3, the large language model series developed by Qwen team.",16619,2,1204,0,108,Python,,2024-04-16T11:49:01Z,2026-06-14T23:25:21Z,2026-03-24T08:22:10Z,False
278,jundot/omlx,https://github.com/jundot/omlx,LLM inference server with continuous batching & SSD caching for Apple Silicon — managed from the macOS menu bar,16608,28,1409,1,549,Python,"apple-silicon,inference-server,llm,macos,mlx,openai-api",2026-02-13T14:13:27Z,2026-06-15T00:07:01Z,2026-06-14T15:32:28Z,False
279,muratcankoylan/Agent-Skills-for-Context-Engineering,https://github.com/muratcankoylan/Agent-Skills-for-Context-Engineering,"A comprehensive collection of Agent Skills for context engineering, multi-agent architectures, and production agent systems. Use when building, optimizing, or debugging agent systems that require effective context management.",16549,8,1344,2,24,Python,,2025-12-21T02:43:42Z,2026-06-14T23:48:01Z,2026-05-26T05:36:56Z,False
280,QwenLM/Qwen-Agent,https://github.com/QwenLM/Qwen-Agent,"Agent framework and applications built upon Qwen>=3.0, featuring Function Calling, MCP, Code Interpreter, RAG, Chrome extension, etc.",16535,5,1638,0,509,Python,,2023-09-22T02:24:56Z,2026-06-14T23:48:34Z,2026-03-04T08:15:07Z,False
281,microsoft/mcp-for-beginners,https://github.com/microsoft/mcp-for-beginners,"This open-source curriculum introduces the fundamentals of Model Context Protocol (MCP) through real-world, cross-language examples in .NET, Java, TypeScript, JavaScript, Rust and Python. Designed for developers, it focuses on practical techniques for building modular, scalable, and secure AI workflows from session setup to service orchestration.",16533,5,5397,0,6,Jupyter Notebook,"csharp,java,javascript,javascript-applications,mcp,mcp-client,mcp-security,mcp-server,model,model-context-protocol,modelcontextprotocol,python,rust,typescript",2025-04-04T20:46:17Z,2026-06-14T20:48:35Z,2026-06-12T20:35:50Z,False
282,teng-lin/notebooklm-py,https://github.com/teng-lin/notebooklm-py,"Unofficial Python API and agentic skill for Google NotebookLM. Full programmatic access to NotebookLM's features—including capabilities the web UI doesn't expose—via Python, CLI, and AI agents like Claude Code, Codex, and OpenClaw.",16427,43,2238,5,6,Python,"agentic-skill,api,claude,claude-skills,google-notebooklm,notebooklm,notebooklm-api,notebooklm-skill,openclaw-skills,podcast-generator,python,python-api,sdk,skills",2026-01-07T15:27:19Z,2026-06-14T23:51:48Z,2026-06-14T22:04:06Z,False
283,vectorize-io/hindsight,https://github.com/vectorize-io/hindsight,Hindsight: Agent Memory That  Learns,16384,28,938,3,71,Python,"agentic-ai,agents,ai-memory,memory",2025-10-30T11:49:48Z,2026-06-14T23:25:52Z,2026-06-14T02:33:22Z,False
284,langbot-app/LangBot,https://github.com/langbot-app/LangBot,"Production-grade platform for building agentic IM bots - 生产级多平台智能机器人开发平台/ Agent、知识库编排、插件系统 / Bots for Discord / Slack / LINE / Telegram / WeChat(企业微信, 企微智能机器人, 公众号) / 飞书 / 钉钉 / QQ / Matrix e.g. Integrated with ChatGPT(GPT), DeepSeek, Dify, n8n, Langflow, Coze, Claude, Gemini, MiniMax, Ollama, SiliconFlow, Moonshot, openclaw / hermes agent, deerflow",16329,2,1448,2,125,Python,"agent,coze,deepseek,dify,dingtalk,discord,feishu,kook,langbot,lark,line,llm,n8n,ollama,openai,plugins,qq,rag,telegram,wechat",2022-12-07T08:48:02Z,2026-06-14T19:40:40Z,2026-06-14T13:37:11Z,False
285,weaviate/weaviate,https://github.com/weaviate/weaviate,"Weaviate is an open-source vector database that stores both objects and vectors, allowing for the combination of vector search with structured filtering with the fault tolerance and scalability of a cloud-native database​.",16323,1,1308,0,531,Go,"approximate-nearest-neighbor-search,generative-search,grpc,hnsw,hybrid-search,image-search,information-retrieval,mlops,nearest-neighbor-search,neural-search,recommender-system,search-engine,semantic-search,semantic-search-engine,similarity-search,vector-database,vector-search,vector-search-engine,vectors,weaviate",2016-03-30T15:03:17Z,2026-06-14T23:11:41Z,2026-06-14T11:17:05Z,False
286,Tencent/WeKnora,https://github.com/Tencent/WeKnora,"Open-source LLM knowledge platform: turn raw documents into a queryable RAG, an autonomous reasoning agent, and a self-maintaining Wiki.",16262,11,2100,3,245,Go,"agent,agentic,ai,chatbot,embeddings,evaluation,generative-ai,golang,knowledge-base,llm,multi-tenant,multimodel,ollama,openai,question-answering,rag,reranking,semantic-search,vector-search,wiki",2025-07-22T08:01:23Z,2026-06-14T21:12:26Z,2026-06-12T15:10:40Z,False
287,refactoringhq/tolaria,https://github.com/refactoringhq/tolaria,Desktop app to manage markdown knowledge bases,16209,64,1111,13,34,TypeScript,,2026-02-14T19:43:14Z,2026-06-15T00:02:42Z,2026-06-15T00:18:51Z,False
288,tradingview/lightweight-charts,https://github.com/tradingview/lightweight-charts,Performant financial charts built with HTML5 canvas,16186,6,2462,3,127,TypeScript,"canvas,charting,charting-library,charts,finance,financial-charting-library,html5-charts,javascript,typescript",2019-05-24T14:41:49Z,2026-06-14T23:32:35Z,2026-06-12T09:09:10Z,False
289,ccusage/ccusage,https://github.com/ccusage/ccusage,npx ccusage,16158,22,653,2,15,Rust,,2025-05-29T16:56:50Z,2026-06-14T23:08:55Z,2026-06-14T23:35:41Z,False
290,confident-ai/deepeval,https://github.com/confident-ai/deepeval,The LLM Evaluation Framework,16153,9,1531,2,287,Python,"evaluation-framework,evaluation-metrics,llm-evaluation,llm-evaluation-framework,llm-evaluation-metrics,python",2023-08-10T05:35:04Z,2026-06-14T23:07:20Z,2026-06-14T16:08:39Z,False
291,different-ai/openwork,https://github.com/different-ai/openwork,An open-source alternative to Claude Cowork (powered by opencode),16038,14,1589,2,175,TypeScript,,2026-01-14T01:39:31Z,2026-06-15T00:12:00Z,2026-06-14T21:20:25Z,False
292,chiphuyen/aie-book,https://github.com/chiphuyen/aie-book,"[WIP] Resources for AI engineers. Also contains supporting materials for the book AI Engineering (Chip Huyen, 2025)",15993,5,2324,0,21,Jupyter Notebook,,2024-12-03T19:43:36Z,2026-06-15T00:01:12Z,2026-06-09T13:22:59Z,False
293,danielmiessler/Personal_AI_Infrastructure,https://github.com/danielmiessler/Personal_AI_Infrastructure,Agentic AI Infrastructure for magnifying HUMAN capabilities.,15927,17,2202,1,223,TypeScript,"ai,augmentation,humans,productivity",2025-09-08T16:18:30Z,2026-06-14T22:57:51Z,2026-05-20T21:33:46Z,False
294,gastownhall/gastown,https://github.com/gastownhall/gastown,Gas Town - multi-agent workspace manager,15900,7,1484,2,272,Go,,2025-12-16T00:33:33Z,2026-06-14T20:51:30Z,2026-06-14T13:18:43Z,False
295,getmaxun/maxun,https://github.com/getmaxun/maxun,"🔥 The open-source no-code platform for web scraping, crawling, search and AI data extraction • Turn websites into structured APIs in minutes 🔥 ",15883,3,1325,1,109,TypeScript,"agents,api,automation,browser-automation,crawler,crawling,data-extraction,no-code,nocode,playwright,robotic-process-automation,rpa,scraper,self-hosted,web-scraper,web-scraping,web-search,webscraping",2023-10-23T21:40:19Z,2026-06-14T18:09:14Z,2026-06-11T11:05:40Z,False
296,HKUDS/DeepCode,https://github.com/HKUDS/DeepCode,"""DeepCode: Open Agentic Coding (Paper2Code & Text2Web & Text2Backend)""",15827,2,2092,-1,51,Python,"agentic-coding,llm-agent",2025-05-14T05:23:02Z,2026-06-14T19:55:40Z,2026-05-18T03:30:41Z,False
297,liyupi/ai-guide,https://github.com/liyupi/ai-guide,程序员鱼皮的 AI 资源大全 + Vibe Coding 零基础教程，分享 OpenClaw 保姆级教程、大模型玩法（DeepSeek / GPT / Gemini / Claude）、最新 AI 资讯、Prompt 提示词大全、AI 知识百科（Agent Skills / RAG / MCP / A2A）、AI 编程教程（Harness Engineering）、AI 工具用法（Cursor / Claude Code / TRAE / Codex / Copilot）、AI 开发框架教程（Spring AI / LangChain）、AI 产品变现指南，帮你快速掌握 AI 技术，走在时代前沿。本项目为开源文档，已升级为鱼皮 AI 导航网站,15774,22,1767,0,3,JavaScript,"ai,algorithm,artificial-intelligence,chatgpt,claude,cursor,deep-learning,deepseek,gemini,generative-ai,gpt,llm,mcp,openai,python,rag,vibe-coding,vibecoding,vue,vuepress",2025-02-13T05:47:46Z,2026-06-14T21:22:22Z,2026-06-04T12:40:40Z,False
298,alshedivat/al-folio,https://github.com/alshedivat/al-folio,"A beautiful, simple, clean, and responsive Jekyll theme for academics",15730,0,13049,2,34,HTML,"academic,academic-website,github-pages,hacktoberfest,jekyll,jekyll-blog,jekyll-theme,personal-website,portfolio-website,theme",2016-05-30T16:32:46Z,2026-06-14T09:33:14Z,2026-06-13T19:42:15Z,False
299,mukul975/Anthropic-Cybersecurity-Skills,https://github.com/mukul975/Anthropic-Cybersecurity-Skills,"754 structured cybersecurity skills for AI agents · Mapped to 5 frameworks: MITRE ATT&CK, NIST CSF 2.0, MITRE ATLAS, D3FEND & NIST AI RMF · agentskills.io standard · Works with Claude Code, GitHub Copilot, Codex CLI, Cursor, Gemini CLI & 20+ platforms · 26 security domains · Apache 2.0",15697,49,1895,9,19,Python,"ai-agents,claude-code,cloud-security,cybersecurity,devsecops,ethical-hacking,incident-response,infosec,llm,malware-analysis,mcp,mitre-attack,nist-csf,osint,penetration-testing,red-team,security,security-automation,threat-hunting,threat-intelligence",2026-02-25T09:47:50Z,2026-06-14T23:13:25Z,2026-06-01T10:15:48Z,False
300,h4ckf0r0day/obscura,https://github.com/h4ckf0r0day/obscura,The headless browser for AI agents and web scraping,15691,34,1069,6,5,Rust,"antidetect,antidetect-browser,browser,browser-automation,cdp,headless,playwright,puppeteer,rust",2026-04-13T10:31:41Z,2026-06-15T00:04:10Z,2026-06-13T16:24:59Z,False
301,googleapis/mcp-toolbox,https://github.com/googleapis/mcp-toolbox,MCP Toolbox for Databases is an open source MCP server for databases.,15614,5,1600,3,244,Go,"agent,agents,ai,bigquery,clickhouse,cockroachdb,database,elasticsearch,firestore,genai,llm,mcp,mongodb,mysql,oracle,postgresql,redis,server,spanner,tidb",2024-06-07T20:52:54Z,2026-06-14T21:58:54Z,2026-06-13T06:55:20Z,False
302,Canner/WrenAI,https://github.com/Canner/WrenAI,"Give AI agents the context to query business data correctly through the open context layer that gives AI agents grounded, governed memory, context, SQL across 20+ data sources, that helps you build agentic GenBI, text-to-sql, dashboards, and agentic analytics.",15537,3,1767,1,333,Python,"agent,anthropic,bigquery,charts,context-engineering,duckdb,genbi,llm,openai,postgresql,rag,sql,sqlai,text-to-chart,text-to-sql,text2sql,vertex",2024-03-13T06:18:20Z,2026-06-14T23:33:25Z,2026-06-12T20:27:38Z,False
303,semgrep/semgrep,https://github.com/semgrep/semgrep,Lightweight static analysis for many languages. Find bug variants with patterns that look like source code.,15504,7,966,0,872,OCaml,"c,go,java,javascript,python,r2c,ruby,sast,semgrep,static-analysis,static-code-analysis,typescript",2019-12-13T09:29:54Z,2026-06-14T22:39:10Z,2026-06-12T15:11:31Z,False
304,spree/spree,https://github.com/spree/spree,"Open-source headless eCommerce platform with REST API, TypeScript SDK, and Next.js storefront for cross-border, B2B or marketplace eCommerce.",15479,0,5261,0,119,Ruby,"b2b-commerce,e-commerce,ecommerce,ecommerce-api,ecommerce-framework,ecommerce-platform,headless,headless-commerce,headless-ecommerce,marketplace,multi-tenant,multi-vendor,multi-vendor-ecommerce,open-source,spree-commerce",2008-03-10T14:45:35Z,2026-06-14T08:53:16Z,2026-06-14T21:44:08Z,False
305,ag-grid/ag-grid,https://github.com/ag-grid/ag-grid,The best JavaScript Data Table for building Enterprise Applications. Supports React / Angular / Vue / Plain JavaScript.,15388,0,2068,0,137,TypeScript,"angular,angular-grid,angular-table,charting,datagrid,datatable,excel,filtering,grid,grouping,javascript-table,pagination,pivoting,react,react-grid,react-table,sorting,table,vue-table,vuejs",2014-12-23T16:20:14Z,2026-06-14T21:29:51Z,2026-06-14T21:48:57Z,False
306,lra/mackup,https://github.com/lra/mackup,Backup and keep your application settings in sync.,15269,-1,951,0,295,Python,,2013-04-06T19:22:54Z,2026-06-15T00:07:18Z,2026-06-15T00:15:17Z,False
307,jaywcjlove/reference,https://github.com/jaywcjlove/reference,面向开发者的技术速查清单（Cheat Sheets）集合，整理常见技术、工具与开发流程，帮助快速查阅关键信息，提高开发效率。,15127,0,2223,0,194,Dockerfile,"cheatsheet,docker,javascript,npm,npm-package,react,reactjs,references,semver,toml,typescript,vue3,vuejs",2022-09-24T17:49:19Z,2026-06-13T23:13:48Z,2026-06-03T17:14:13Z,False
308,GLips/Figma-Context-MCP,https://github.com/GLips/Figma-Context-MCP,MCP server to provide Figma layout information to AI coding agents like Cursor,15101,2,1195,0,25,TypeScript,"ai,cursor,figma,mcp,typescript",2025-02-13T02:55:06Z,2026-06-14T19:32:33Z,2026-05-27T22:18:23Z,False
309,vercel-labs/json-render,https://github.com/vercel-labs/json-render,The Generative UI framework,15101,0,818,1,93,TypeScript,,2026-01-14T17:22:39Z,2026-06-14T20:14:19Z,2026-06-11T03:06:29Z,False
310,theonedev/onedev,https://github.com/theonedev/onedev,"Git Server with CI/CD, Kanban, and Packages. Seamless integration. Unparalleled experience.",15041,0,958,0,0,Java,"ci-cd,devops,git,kanban,packages,self-hosted",2018-11-06T02:57:01Z,2026-06-14T15:55:25Z,2026-06-14T15:55:19Z,False
311,WEIFENG2333/VideoCaptioner,https://github.com/WEIFENG2333/VideoCaptioner,🎬 卡卡字幕助手 | VideoCaptioner - 基于 LLM 的智能字幕助手 - 视频字幕生成、断句、校正、字幕翻译全流程处理！- A powered tool for easy and efficient video subtitling.,14994,5,1255,0,173,Python,"ai,subtitle,translate,video-subtile",2024-10-31T03:06:23Z,2026-06-14T19:55:50Z,2026-06-14T11:39:20Z,False
312,rowboatlabs/rowboat,https://github.com/rowboatlabs/rowboat,"Open-source AI coworker, with memory",14969,3,1532,1,124,TypeScript,"agents,agents-sdk,ai,ai-agents,ai-agents-automation,chatgpt,claude-code,claude-cowork,generative-ai,llm,multiagent,opeani,open-source,orchestration,productivity",2025-01-13T09:30:40Z,2026-06-14T23:58:55Z,2026-06-14T20:08:37Z,False
313,jnMetaCode/agency-agents-zh,https://github.com/jnMetaCode/agency-agents-zh,🎭 211 个即插即用的 AI 专家角色 — 支持 Hermes Agent/Claude Code/Cursor/Copilot 等 16 种工具，覆盖工程/设计/营销/金融等 18 个部门。含 46 个中国市场原创智能体（小红书/抖音/微信/飞书/钉钉等）,14870,28,2597,4,6,Shell,"agency-orchestrator,agent-definitions,ai-agents,ai-roles,chinese,claude,claude-code,copilot-agent,cursor-rules,deepseek,hermes-agent,llm,multi-agent,no-code,prompt-engineering,qwen,system-prompt,workbuddy,workflow",2026-03-06T11:11:51Z,2026-06-15T00:04:42Z,2026-06-12T23:20:03Z,False
314,llmware-ai/llmware,https://github.com/llmware-ai/llmware,"Unified framework for building enterprise RAG pipelines with small, specialized models",14841,-1,2922,-1,88,Python,"agents,generative-ai-tools,llamacpp,llm,onnx,openvino,parsing,retrieval-augmented-generation,small-specialized-models",2023-09-29T15:19:06Z,2026-06-14T16:53:16Z,2026-05-17T13:53:37Z,False
315,browser-use/browser-harness,https://github.com/browser-use/browser-harness,Browser Harness | Self-healing harness that enables LLMs to complete any task.,14831,36,1391,0,142,Python,"ai-agent,browser-agent,browser-automation,browser-use,browser-use-box,browser-use-cloud,cdp,cloud-browser,llm,persistent-browser,playwright,telegram-agent,vps-agent,web-automation",2026-04-17T01:56:15Z,2026-06-15T00:05:09Z,2026-06-13T23:47:37Z,False
316,steipete/CodexBar,https://github.com/steipete/CodexBar,"Show usage stats for OpenAI Codex and Claude Code, without having to login.",14787,25,1209,7,61,Swift,"ai,claude-code,codex,swift",2025-11-16T17:00:44Z,2026-06-14T23:34:36Z,2026-06-14T21:43:49Z,False
317,KKKKhazix/khazix-skills,https://github.com/KKKKhazix/khazix-skills,数字生命卡兹克开源的 AI Skills 合集,14756,37,1798,3,32,Python,,2026-04-06T07:37:02Z,2026-06-15T00:05:50Z,2026-06-14T17:12:08Z,False
318,wasp-lang/open-saas,https://github.com/wasp-lang/open-saas,"A 100% free modern JS SaaS boilerplate (React, NodeJS, Prisma). Full-featured: Auth (email, google, github, slack, MS), Email sending, Background jobs, Landing page, Payments (Stripe, Polar.sh), Shadcn UI, S3 file upload. AI-ready with tailored AGENTS.md, skills, and Claude Code plugin. One cmd deploy. Powered by Wasp full-stack framework.",14689,5,1748,1,111,TypeScript,"ai,authentication,aws-s3,boilerplate,chatgpt,full-stack,google-auth,hacktoberfest,nodejs,open-source,openai-api,postgresql,prisma,react,saas,saas-boilerplate,saas-starter,saas-template,typesafe,typescript",2023-12-01T13:54:36Z,2026-06-14T16:17:11Z,2026-06-11T10:50:16Z,False
319,nesquena/hermes-webui,https://github.com/nesquena/hermes-webui,Hermes WebUI: The best way to use Hermes Agent from the web or from your phone!,14416,27,1794,4,276,Python,"agent,ai-agents,hermes,hermes-agent,nous-research",2026-03-30T21:50:12Z,2026-06-14T23:47:31Z,2026-06-15T00:15:31Z,False
320,maurosoria/dirsearch,https://github.com/maurosoria/dirsearch,Web path scanner,14394,6,2444,0,26,Python,"appsec,brute,bug-bounty,bugbounty,dirsearch,enumeration,fuzzer,fuzzing,hacking,hacking-tool,infosec,penetration-testing,pentest-tool,pentesting,python,red-teaming,redteam,scanner,security,wordlist",2013-04-30T15:57:40Z,2026-06-14T23:03:26Z,2026-06-12T19:41:03Z,False
321,andrewyng/aisuite,https://github.com/andrewyng/aisuite,"Simple, unified interface to multiple Generative AI providers ",14385,146,1504,11,134,Python,,2024-06-30T20:07:46Z,2026-06-15T00:15:23Z,2026-06-14T05:57:09Z,False
322,AndyMik90/Aperant,https://github.com/AndyMik90/Aperant,Autonomous multi-session AI coding,14354,4,1931,0,89,TypeScript,,2025-12-04T22:10:37Z,2026-06-14T23:20:31Z,2026-06-14T08:27:00Z,False
323,eigent-ai/eigent,https://github.com/eigent-ai/eigent,Eigent: The Open Source Cowork Desktop to Unlock Your Exceptional Productivity. Local and Free Alternative to Claude Cowork.,14282,7,1689,0,203,TypeScript,"agent-framework,agent-skills,agentic-ai,agentic-workflow,claude-cowork,claude-cowork-alternative,claude-cowork-free,desktop-agent,multi-agent-systems",2025-07-29T15:56:02Z,2026-06-14T23:50:04Z,2026-06-12T13:22:40Z,False
324,electerm/electerm,https://github.com/electerm/electerm,"📻Terminal/ssh/sftp/ftp/telnet/serialport/RDP/VNC/Spice client(linux, mac, win)",14268,1,1144,0,308,JavaScript,"ai,electerm,electron,file-manager,ftp,linux-app,macos-app,mcp,open-source,rdp,serialport,sftp,spice,ssh,telnet,terminal,vnc,windows-app,zmodem",2017-10-07T09:54:11Z,2026-06-14T22:53:36Z,2026-06-12T11:31:03Z,False
325,ag-ui-protocol/ag-ui,https://github.com/ag-ui-protocol/ag-ui,AG-UI: the Agent-User Interaction Protocol. Bring Agents into Frontend Applications.,14263,11,1286,0,322,Python,"ag-ui-protocol,agent-frontend,agent-ui,agentic-workflow,ai-agents",2025-05-07T12:49:37Z,2026-06-15T00:02:38Z,2026-06-13T18:00:52Z,False
326,xpipe-io/xpipe,https://github.com/xpipe-io/xpipe,Access your entire server infrastructure from your local desktop,14200,1,537,0,52,Java,"bash,docker,filemanager,files,incus,java,javafx,k8s,kubernetes,lxd,networking,podman,sftp,ssh,tailscale,wsl",2023-01-27T02:25:38Z,2026-06-14T22:43:48Z,2026-06-14T21:32:25Z,False
327,open-metadata/OpenMetadata,https://github.com/open-metadata/OpenMetadata,"The Open Context Layer for Data and AI ,  OpenMetadata is the open platform for building trusted data context and business semantics for humans, AI assistants, and agents.",14191,7,2160,0,895,TypeScript,"context,context-layer,data-catalog,data-collaboration,data-contracts,data-discovery,data-governance,data-lineage,data-observability,data-profiling,data-quality,data-quality-checks,datadiscovery,dataengineering,dataquality,mcp,mcp-server,metadata,metadata-management,semantics",2021-08-01T21:17:17Z,2026-06-14T23:35:17Z,2026-06-14T18:31:24Z,False
328,xpzouying/xiaohongshu-mcp,https://github.com/xpzouying/xiaohongshu-mcp,MCP for xiaohongshu.com,14154,4,2128,0,272,Go,"mcp,mcp-server,xiaohongshu-mcp",2025-08-03T09:08:45Z,2026-06-14T22:06:48Z,2026-06-12T14:04:53Z,False
329,jbranchaud/til,https://github.com/jbranchaud/til,:memo: Today I Learned,14109,-1,758,0,22,Vim Script,"learn-in-public,til,today-i-learned,writing",2015-02-07T04:03:24Z,2026-06-14T19:28:50Z,2026-06-10T19:02:10Z,False
330,yusufkaraaslan/Skill_Seekers,https://github.com/yusufkaraaslan/Skill_Seekers,"Convert documentation websites, GitHub repositories, and PDFs into Claude AI skills with automatic conflict detection",14077,6,1454,-1,102,Python,"ai-tools,ast-parser,automation,claude-ai,claude-skills,code-analysis,conflict-detection,documentation,documentation-generator,github,github-scraper,mcp,mcp-server,multi-source,ocr,pdf,python,web-scraping",2025-10-17T14:43:48Z,2026-06-14T23:53:37Z,2026-06-11T21:20:13Z,False
331,prowler-cloud/prowler,https://github.com/prowler-cloud/prowler,Prowler is the world’s most widely used open-source cloud security platform that automates security and compliance across any cloud environment.,13996,2,2180,2,236,Python,"aws,azure,cis-benchmark,cloud,cloudsecurity,compliance,cspm,devsecops,forensics,gcp,gdpr,hacktoberfest,hardening,iam,multi-cloud,python,security,security-audit,security-hardening,security-tools",2016-08-24T15:12:24Z,2026-06-14T20:33:28Z,2026-06-14T20:05:26Z,False
332,grokability/snipe-it,https://github.com/grokability/snipe-it,A free open source IT asset/license management system,13934,2,3858,0,1061,PHP,"asset-management,asset-manager,assets-management,itam,license-management",2013-11-12T22:25:47Z,2026-06-14T12:42:07Z,2026-06-13T19:33:26Z,False
333,HKUDS/OpenHarness,https://github.com/HKUDS/OpenHarness,"""OpenHarness: Open Agent Harness with a Built-in Personal Agent--Ohmo!""",13857,22,2272,7,44,Python,,2026-04-01T15:37:13Z,2026-06-14T23:06:41Z,2026-06-04T02:42:40Z,False
334,NevaMind-AI/memU,https://github.com/NevaMind-AI/memU,"The memory harness for proactive AI agents — structured storage, intent capture, 10x token reduction.",13854,5,1036,0,97,Python,"agent-memory,agentic-workflow,claude,claude-skills,mcp,memory,openclaw,openclaw-skills,proactive,proactive-ai,sandbox,skills",2025-07-29T01:54:40Z,2026-06-14T18:57:25Z,2026-06-14T11:40:34Z,False
335,kyegomez/OpenMythos,https://github.com/kyegomez/OpenMythos,"A theoretical reconstruction of the Claude Mythos architecture, built from first principles using the available research literature.",13852,21,3125,8,58,Python,"ai,anthropic,attention,claude,claude-ai,claude-code,claude-code-plugin,claude-mythos,claude-sonnet,deepmind,gpt-5,gpt-7,jax,looped-transformers,ml,pytorch,sonnet,torch",2026-04-18T12:57:52Z,2026-06-15T00:12:49Z,2026-05-23T11:58:48Z,False
336,antirez/ds4,https://github.com/antirez/ds4,"DeepSeek 4 Flash and PRO local inference engine for Metal, CUDA and ROCm",13782,112,1214,7,199,C,,2026-05-06T17:17:05Z,2026-06-15T00:13:37Z,2026-06-11T08:22:45Z,False
337,casdoor/casdoor,https://github.com/casdoor/casdoor,"An open-source Agent-first Identity and Access Management (IAM) /LLM MCP & agent gateway and auth server with web UI supporting OpenClaw, MCP, OAuth, OIDC, SAML, CAS, LDAP, SCIM, WebAuthn, TOTP, MFA, Face ID, Google Workspace, Azure AD",13773,4,1715,0,105,Go,"agent,agentic-ai,agi,ai-gateway,auth,authentication,iam,llm,mcp,mcp-gateway,mfa,oauth,oidc,openclaw,radius,saml,scim,single-sign-on,sso,webauthn",2020-10-22T14:40:03Z,2026-06-14T20:33:30Z,2026-06-14T14:32:11Z,False
338,semaphoreui/semaphore,https://github.com/semaphoreui/semaphore,"Modern UI and powerful API for Ansible, Terraform/OpenTofu/Terragrunt, PowerShell and other DevOps tools.",13758,4,1264,0,1002,Go,"ansible,awx,ci,cicd,devops,docker,docker-ui,go,golang,jenkins,opentofu,pulumi,terraform,terraform-ui,terragrunt",2014-08-23T22:43:31Z,2026-06-14T19:28:05Z,2026-06-14T13:35:57Z,False
339,GreyDGL/PentestGPT,https://github.com/GreyDGL/PentestGPT,Automated Penetration Testing Agentic Framework Powered by Large Language Models,13718,19,2381,3,58,Python,"large-language-models,llm,penetration-testing,python",2023-02-27T06:01:53Z,2026-06-14T23:54:00Z,2026-06-07T07:25:45Z,False
340,andrewyng/context-hub,https://github.com/andrewyng/context-hub,,13588,7,1185,0,127,JavaScript,,2025-10-30T12:20:34Z,2026-06-14T20:51:43Z,2026-05-31T18:41:45Z,False
