rank,full_name,url,description,stars,star_delta_vs_previous_day,forks,fork_delta_vs_previous_day,open_issues,language,topics,created_at,updated_at,pushed_at,archived
266,stefan-jansen/machine-learning-for-trading,https://github.com/stefan-jansen/machine-learning-for-trading,"Code for Machine Learning for Trading, 3rd edition — from data sourcing to live execution.",19890,32,5411,3,1,Jupyter Notebook,"algorithmic-trading,artificial-intelligence,backtesting,data-science,deep-learning,finance,investment,investment-strategies,large-language-models,machine-learning,ml4t-workflow,polars,quantitative-finance,reinforcement-learning,synthetic-data,trading,trading-agent,trading-strategies",2018-05-09T12:33:08Z,2026-07-15T22:39:46Z,2026-07-14T13:24:00Z,False
267,apollographql/apollo-client,https://github.com/apollographql/apollo-client,"The industry-leading GraphQL client for TypeScript, JavaScript, React, Vue, Angular, and more. Apollo Client delivers powerful caching, intuitive APIs, and comprehensive developer tools to accelerate your app development.",19877,1,2835,7,407,TypeScript,"apollo-client,apollographql,graphql,graphql-client,typescript",2016-02-26T20:25:00Z,2026-07-15T17:51:09Z,2026-07-15T05:57:32Z,False
268,stablyai/orca,https://github.com/stablyai/orca,Orca is the ADE for working with a fleet of parallel agents. Run any coding agent with your own subscription. Available on desktop and mobile.,19834,757,1547,52,1484,TypeScript,"ade,agent-ide,ai-agents,claude-code,cli,codex,cursor-agent,devtools,ghostty,ide,mobile-app,opencode,orchestration,parallel-agents,pi,terminal,worktrees,yc-backed",2026-03-17T03:28:57Z,2026-07-15T23:17:12Z,2026-07-15T23:14:44Z,False
269,trycua/cua,https://github.com/trycua/cua,"Open-source infrastructure for Computer-Use Agents. Sandboxes, SDKs, and benchmarks to train and evaluate AI agents that can control full desktops (macOS, Linux, Windows).",19790,123,1299,6,512,HTML,"agent,ai-agent,apple,computer-use,computer-use-agent,containerization,cua,desktop-automation,hacktoberfest,lume,macos,manus,operator,swift,virtualization,virtualization-framework,windows,windows-sandbox",2025-01-31T15:02:49Z,2026-07-15T23:14:31Z,2026-07-15T23:12:29Z,False
270,livekit/livekit,https://github.com/livekit/livekit,End-to-end realtime stack for connecting humans and AI,19775,26,2154,4,180,Go,"golang,media-server,sfu,video,voice,voice-ai,webrtc",2020-09-30T06:49:46Z,2026-07-15T21:36:52Z,2026-07-15T18:59:26Z,False
271,THU-MAIC/OpenMAIC,https://github.com/THU-MAIC/OpenMAIC,"Open Multi-Agent Interactive Classroom — Get an immersive, multi-agent learning experience in just one click",19722,38,3868,6,186,TypeScript,,2026-03-11T10:13:16Z,2026-07-15T17:33:44Z,2026-07-15T17:15:52Z,False
272,tirth8205/code-review-graph,https://github.com/tirth8205/code-review-graph,"Local-first code intelligence graph for MCP and CLI. Builds a persistent map of your codebase so AI coding tools read only what matters, with benchmarked context reductions on reviews and large-repo workflows.",19519,16,2087,3,186,Python,"ai-coding,claude,claude-code,code-review,graphrag,incremental,knowledge-graph,llm,mcp,python,static-analysis,tree-sitter",2026-02-26T17:25:13Z,2026-07-15T23:02:13Z,2026-06-14T17:20:41Z,False
273,modelscope/FunASR,https://github.com/modelscope/FunASR,"Open-source speech recognition toolkit for training, inference, streaming ASR, VAD, punctuation, speaker diarization pipelines, and OpenAI-compatible/MCP serving.",19256,19,1936,4,3,Python,"asr,audio,chinese,emotion-recognition,funasr,mcp-server,multilingual-asr,openai-compatible-api,paraformer,punctuation,pytorch,real-time-asr,speaker-diarization,speech-recognition,speech-to-text,streaming-asr,transcription,vllm,voice-activity-detection,whisper-alternative",2022-11-24T02:28:11Z,2026-07-15T16:48:52Z,2026-07-15T13:04:01Z,False
274,h4ckf0r0day/obscura,https://github.com/h4ckf0r0day/obscura,The headless browser for AI agents and web scraping,19234,45,1382,5,18,Rust,"antidetect,antidetect-browser,browser,browser-automation,cdp,headless,playwright,puppeteer,rust",2026-04-13T10:31:41Z,2026-07-15T23:10:57Z,2026-07-14T13:57:46Z,False
275,Nagi-ovo/gemini-voyager,https://github.com/Nagi-ovo/gemini-voyager,"An all-in-one enhancement suite for Google Gemini & AI Studio - timeline navigation, folder management, prompt library, and chat export in one powerful extension. / Google Gemini & AI Studio 全能增强插件：集成时间轴导航、文件夹管理、提示词库及聊天导出等众多功能。",19184,,621,,1,TypeScript,"ai-studio,bun,chat-management,chrome-extension,edge-addon,firefox-addons,gemini,safari-extension,vibe-coding",2025-10-04T23:42:35Z,2026-07-15T23:12:13Z,2026-07-15T21:38:20Z,False
276,hummingbot/hummingbot,https://github.com/hummingbot/hummingbot,Open source software that helps you create and deploy high-frequency crypto trading bots,19143,6,4779,0,170,Python,"algotrading,arbitrage,backtesting,bitcoin,bot,crypto,cryptocurrency,cython,dex,docker,ethereum,hft,marketmaking,orderbook,python,trading",2019-04-02T21:41:52Z,2026-07-15T19:19:33Z,2026-07-10T19:39:16Z,False
277,mksglu/context-mode,https://github.com/mksglu/context-mode,"Context window optimization for AI coding agents. Sandboxes tool output (98% reduction), persists session memory, and   enforces routing across 17 platforms via MCP + hooks.",18972,37,1336,1,78,TypeScript,"antigravity,claude,claude-code,claude-code-hooks,claude-code-plugins,claude-code-skill,codex,codex-cli,context-mode,copilot,cursor-plugin,kiro,mcp,mcp-server,mcp-tools,openclaw,opencode,pi-agent,skills,zed-extension",2026-02-23T05:56:28Z,2026-07-15T23:04:57Z,2026-07-15T12:26:42Z,False
278,huggingface/sentence-transformers,https://github.com/huggingface/sentence-transformers,"State-of-the-Art Embeddings, Retrieval, and Reranking",18912,3,2827,1,1298,Python,,2019-07-24T10:53:51Z,2026-07-15T16:26:26Z,2026-07-15T16:55:48Z,False
279,tanweai/pua,https://github.com/tanweai/pua,你是一个曾经被寄予厚望的 P8 级工程师。Anthropic 当初给你定级的时候，对你的期望是很高的。  一个agent使用的高能动性的skill。  Your AI has been placed on a PIP. 30 days to show improvement.,18812,12,1131,0,8,TypeScript,"agency,agent,pip,pua",2026-03-08T16:55:16Z,2026-07-15T18:32:16Z,2026-07-05T01:54:07Z,False
280,subquery/subql,https://github.com/subquery/subql,"SubQuery is an Open, Flexible, Fast and Universal data indexing framework for web3. Our mission is to help developers create the decentralised products of the future.",18775,-2,396,0,100,TypeScript,,2020-12-15T02:31:38Z,2026-07-15T21:28:57Z,2026-04-01T02:17:48Z,False
281,refactoringhq/tolaria,https://github.com/refactoringhq/tolaria,Desktop app to manage markdown knowledge bases,18680,29,1274,3,41,TypeScript,,2026-02-14T19:43:14Z,2026-07-15T23:08:43Z,2026-07-15T23:08:33Z,False
282,antirez/ds4,https://github.com/antirez/ds4,"DeepSeek 4 Flash and PRO local inference engine for Metal, CUDA and ROCm",18625,72,1609,9,305,C,,2026-05-06T17:17:05Z,2026-07-15T22:57:49Z,2026-07-03T17:30:19Z,False
283,wasp-lang/wasp,https://github.com/wasp-lang/wasp,"The batteries-included full-stack framework for the AI era. Develop JS/TS web apps (React, Node.js, and Prisma) using declarative code that abstracts away complex full-stack features like auth, background jobs, RPC, email sending, end-to-end type safety, single-command deployment, and more.",18580,4,1464,1,795,TypeScript,"javascript,node,open-source,prisma,react,wasp,web-app",2020-01-30T13:48:54Z,2026-07-15T17:13:55Z,2026-07-15T21:21:20Z,False
284,pydantic/pydantic-ai,https://github.com/pydantic/pydantic-ai,"AI Agent Framework, the Pydantic way",18555,26,2365,0,493,Python,"agent-framework,genai,llm,pydantic,python",2024-06-21T15:55:04Z,2026-07-15T23:15:27Z,2026-07-15T23:15:23Z,False
285,vectorize-io/hindsight,https://github.com/vectorize-io/hindsight,Hindsight: Agent Memory That  Learns,18440,75,1127,6,135,Python,"agentic-ai,agents,ai-memory,memory",2025-10-30T11:49:48Z,2026-07-15T21:53:25Z,2026-07-15T21:19:35Z,False
286,agent0ai/agent-zero,https://github.com/agent0ai/agent-zero,Agent Zero AI framework,18433,3,3676,-2,223,Python,"agent,ai,assistant,autonomous,linux,zero",2024-06-10T09:10:45Z,2026-07-15T21:08:41Z,2026-07-15T14:50:05Z,False
287,steipete/CodexBar,https://github.com/steipete/CodexBar,"Show usage stats for OpenAI Codex and Claude Code, without having to login.",18370,117,1513,10,118,Swift,"ai,claude-code,codex,swift",2025-11-16T17:00:44Z,2026-07-15T23:09:29Z,2026-07-15T22:54:19Z,False
288,Tencent/WeKnora,https://github.com/Tencent/WeKnora,"Open-source LLM knowledge platform: turn raw documents into a queryable RAG, an autonomous reasoning agent, and a self-maintaining Wiki.",18359,77,2525,7,384,Go,"agent,agentic,ai,chatbot,embeddings,evaluation,generative-ai,golang,knowledge-base,llm,multi-tenant,multimodel,ollama,openai,question-answering,rag,reranking,semantic-search,vector-search,wiki",2025-07-22T08:01:23Z,2026-07-15T22:53:06Z,2026-07-15T11:16:53Z,False
289,datawhalechina/easy-vibe,https://github.com/datawhalechina/easy-vibe,💻 vibe coding 2026 | Your First Modern Coding course beginners to master step by step.,18215,30,1730,0,15,JavaScript,"agent,ai,coding,course,deepseek,gemini,genai,gpt,llm,low-code,mcp,nextjs,no-code,openai,programming,tutorial,vibe-coding,vibecoding,vscode,workflow",2025-12-28T16:45:28Z,2026-07-15T23:11:46Z,2026-07-06T14:19:33Z,False
290,nukeop/nuclear,https://github.com/nukeop/nuclear,Streaming music player that finds free music for you,18046,-1,1300,2,7,TypeScript,"agent,ai,desktop-app,linux,mac,mcp,mcp-server,music,music-player,react,rust,spotify,streaming,tauri,typescript,windows",2016-09-22T22:58:21Z,2026-07-15T19:25:43Z,2026-07-15T23:09:21Z,False
291,yetone/avante.nvim,https://github.com/yetone/avante.nvim,Use your Neovim like using Cursor AI IDE!,18038,1,837,0,41,Lua,,2024-08-14T16:45:16Z,2026-07-15T22:51:34Z,2026-07-15T09:07:48Z,False
292,RightNow-AI/openfang,https://github.com/RightNow-AI/openfang,Open-source Agent Operating System,18015,1,2279,0,108,Rust,"agent-framework,ai-agents,llm,mcp,open-source,openclaw,operating-system,rust",2026-02-24T23:12:38Z,2026-07-15T22:04:03Z,2026-07-02T08:13:12Z,False
293,can1357/oh-my-pi,https://github.com/can1357/oh-my-pi,"⌥  AI Coding agent for the terminal — hash-anchored edits, optimized tool harness, LSP, Python, browser, subagents, and more",17942,168,1642,27,826,TypeScript,"ai-agent,ai-coding-agent,anthropic,bun,claude,cli,coding-assistant,llm,mcp,multi-provider,openai,rust,terminal,tui,typescript",2025-12-31T14:01:28Z,2026-07-15T23:18:26Z,2026-07-15T23:13:21Z,False
294,jundot/omlx,https://github.com/jundot/omlx,LLM inference server with continuous batching & SSD caching for Apple Silicon — managed from the macOS menu bar,17853,24,1513,3,717,Python,"apple-silicon,inference-server,llm,macos,mlx,openai-api",2026-02-13T14:13:27Z,2026-07-15T19:36:43Z,2026-07-14T19:14:44Z,False
295,teng-lin/notebooklm-py,https://github.com/teng-lin/notebooklm-py,"Unofficial Python API and agentic skill for Google NotebookLM. Full programmatic access to NotebookLM's features—including capabilities the web UI doesn't expose—via Python, CLI, and AI agents like Claude Code, Codex, and OpenClaw.",17825,53,2404,3,17,Python,"agentic-skill,api,claude,claude-skills,google-notebooklm,notebooklm,notebooklm-api,notebooklm-skill,openclaw-skills,podcast-generator,python,python-api,sdk,skills",2026-01-07T15:27:19Z,2026-07-15T22:19:40Z,2026-07-15T23:02:57Z,False
296,diegosouzapw/OmniRoute,https://github.com/diegosouzapw/OmniRoute,"Never stop coding. Free AI gateway: one endpoint, 231+ providers (50+ free), connect Claude Code, Codex, Cursor, Cline & Copilot to FREE Claude/GPT/Gemini. RTK+Caveman stacked compression saves 15-95% tokens, smart auto-fallback, MCP/A2A, multimodal APIs, Desktop/PWA.",17730,422,2645,44,376,TypeScript,"a2a,ai-agents,ai-gateway,anthropic,claude,claude-code,cline,codex,copilot,cursor,deepseek,free-ai,gemini,gemini-cli,llm-gateway,mcp,openai,openai-proxy,qwen,token-saver",2026-02-13T12:38:31Z,2026-07-15T23:09:18Z,2026-07-15T23:15:36Z,False
297,iOfficeAI/OfficeCLI,https://github.com/iOfficeAI/OfficeCLI,"OfficeCLI is the first and best Office suite  purpose-built for AI agents to read, edit, and automate Word, Excel, and PowerPoint files. Free, open-source, single binary, no Office installation required.",17698,994,1174,58,40,C#,"agent,ai,claude-code,cli,codex,docx,excel,office,openclaw,pptx,presentation,skills,word,xlsx",2026-03-15T07:39:12Z,2026-07-15T23:14:38Z,2026-07-14T07:11:38Z,False
298,jnMetaCode/agency-agents-zh,https://github.com/jnMetaCode/agency-agents-zh,🎭 266 个即插即用的 AI 专家角色 — 支持 Hermes Agent/Claude Code/Cursor/Copilot 等 18 种工具，覆盖工程/设计/营销/金融等 20 个部门。含 50 个中国市场原创智能体（小红书/抖音/微信/飞书/钉钉等）。搭配编排器 agency-orchestrator，一句话即可让多位专家按 DAG 自动协作。,17383,59,2941,4,1,Shell,"agency-orchestrator,agent-definitions,ai-agents,ai-roles,chinese,claude,claude-code,copilot-agent,cursor-rules,deepseek,hermes-agent,llm,multi-agent,no-code,prompt-engineering,qwen,system-prompt,workbuddy,workflow",2026-03-06T11:11:51Z,2026-07-15T20:41:47Z,2026-07-15T10:32:04Z,False
299,SimplifyJobs/New-Grad-Positions,https://github.com/SimplifyJobs/New-Grad-Positions,"A collection of full time roles in SWE, Quant, and PM for new grads.",17383,13,1300,1,10,,"applications,coderquad,college,fulltime,hacktoberfest,jobs,newgrad,position,posting,university",2021-06-08T18:44:46Z,2026-07-15T23:12:43Z,2026-07-15T23:02:03Z,False
300,itwanger/toBeBetterJavaer,https://github.com/itwanger/toBeBetterJavaer,一份通俗易懂、风趣幽默的Java学习指南，内容涵盖Java基础、Java并发编程、Java虚拟机、Java企业级开发、Java面试等核心知识点。学Java，就认准二哥的Java进阶之路😄,17316,8,2436,4,61,Java,"java,jvm,mysql,redis,springboot",2018-11-08T00:35:56Z,2026-07-15T22:59:48Z,2026-07-11T02:22:05Z,False
301,GoogleCloudPlatform/generative-ai,https://github.com/GoogleCloudPlatform/generative-ai,"Sample code and notebooks for Generative AI on Google Cloud, with Gemini Enterprise Agent Platform",17309,70,4333,5,77,Jupyter Notebook,"agents,gcp,gemini,gemini-api,gen-ai,generative-ai,google,google-cloud,google-gemini,langchain,large-language-models,llm,vertex-ai,vertex-ai-gemini-api,vertexai",2023-05-05T12:31:07Z,2026-07-15T19:41:50Z,2026-07-15T16:32:11Z,False
302,liyupi/ai-guide,https://github.com/liyupi/ai-guide,程序员鱼皮的 AI 资源大全 + Vibe Coding 零基础教程，分享 OpenClaw 保姆级教程、大模型玩法（DeepSeek / GPT / Gemini / Claude / GLM）、最新 AI 资讯、Prompt 提示词大全、AI 知识百科（Agent Skills / RAG / MCP / A2A）、AI 编程教程（Harness Engineering）、AI 工具用法（Cursor / Claude Code / TRAE / Codex / Copilot）、AI 开发框架教程（Spring AI / LangChain）、AI 产品变现指南，帮你快速掌握 AI 技术，走在时代前沿。本项目为开源文档 aiguide，已升级为鱼皮 AI 导航网站,17284,47,1950,7,4,JavaScript,"ai,artificial-intelligence,chatgpt,claude,codex,cursor,deep-learning,deepseek,gemini,generative-ai,gpt,llm,mcp,openai,python,rag,vibe-coding,vibecoding,vue,vuepress",2025-02-13T05:47:46Z,2026-07-15T21:43:54Z,2026-07-01T14:44:50Z,False
303,muratcankoylan/Agent-Skills-for-Context-Engineering,https://github.com/muratcankoylan/Agent-Skills-for-Context-Engineering,"A comprehensive collection of Agent Skills for context engineering, multi-agent architectures, and production agent systems. Use when building, optimizing, or debugging agent systems that require effective context management.",17258,46,1421,4,40,Python,,2025-12-21T02:43:42Z,2026-07-15T23:05:54Z,2026-07-14T05:15:52Z,False
304,ccusage/ccusage,https://github.com/ccusage/ccusage,npx ccusage,17194,32,730,3,24,Rust,,2025-05-29T16:56:50Z,2026-07-15T22:55:02Z,2026-07-15T22:27:36Z,False
305,windmill-labs/windmill,https://github.com/windmill-labs/windmill,"Open-source developer platform to power your entire infra and turn scripts into webhooks, workflows and UIs. Fastest workflow engine (13x vs Airflow). Open-source alternative to Retool and Temporal.",17167,9,1028,1,800,Rust,"low-code,open-source,platform,postgresql,python,self-hostable,typescript",2022-05-05T02:21:17Z,2026-07-15T20:55:56Z,2026-07-15T20:52:47Z,False
306,KKKKhazix/khazix-skills,https://github.com/KKKKhazix/khazix-skills,数字生命卡兹克开源的 AI Skills 合集,17114,108,1969,8,33,Python,,2026-04-06T07:37:02Z,2026-07-15T22:59:04Z,2026-07-14T11:04:51Z,False
307,gastownhall/gastown,https://github.com/gastownhall/gastown,Gas Town - multi-agent workspace manager,17044,18,1565,0,264,Go,,2025-12-16T00:33:33Z,2026-07-15T22:30:35Z,2026-07-15T19:48:25Z,False
308,browser-use/video-use,https://github.com/browser-use/video-use,Edit videos with coding agents,16978,66,2136,15,55,Python,,2026-04-12T01:34:42Z,2026-07-15T23:05:48Z,2026-07-01T00:33:52Z,False
309,langbot-app/LangBot,https://github.com/langbot-app/LangBot,"Production-grade platform for building agentic IM bots - 生产级多平台智能机器人开发平台/ Agent、知识库编排、插件系统 / Bots for Discord / Slack / LINE / Telegram / WeChat(企业微信, 企微智能机器人, 公众号) / 飞书 / 钉钉 / QQ / Matrix e.g. Integrated with ChatGPT(GPT), DeepSeek, Dify, n8n, Langflow, Coze, Claude, Gemini, GLM, Ollama, SiliconFlow, Moonshot, openclaw / hermes agent, deerflow",16895,16,1499,3,116,Python,"agent,coze,deepseek,dify,dingtalk,discord,feishu,kook,langbot,lark,line,llm,n8n,ollama,openai,plugins,qq,rag,telegram,wechat",2022-12-07T08:48:02Z,2026-07-15T17:58:51Z,2026-07-15T11:53:50Z,False
310,different-ai/openwork,https://github.com/different-ai/openwork,The open-source alternative to Claude Cowork (powered by opencode),16890,22,1737,4,302,TypeScript,,2026-01-14T01:39:31Z,2026-07-15T23:06:17Z,2026-07-15T23:11:38Z,False
311,confident-ai/deepeval,https://github.com/confident-ai/deepeval,The LLM Evaluation Framework,16877,28,1663,8,351,Python,"evaluation-framework,evaluation-metrics,llm-evaluation,llm-evaluation-framework,llm-evaluation-metrics,python",2023-08-10T05:35:04Z,2026-07-15T22:44:38Z,2026-07-14T14:51:38Z,False
312,apache/apisix,https://github.com/apache/apisix,The Cloud-Native API Gateway and AI Gateway,16873,5,2896,0,247,Lua,"ai-gateway,api,api-gateway,api-management,apisix,cloud-native,devops,iot,kubernetes,kubernetes-ingress,loadbalancing,luajit,microservices,nginx,reverse-proxy,serverless",2019-04-10T02:02:05Z,2026-07-15T21:57:20Z,2026-07-15T09:03:38Z,False
313,microsoft/mcp-for-beginners,https://github.com/microsoft/mcp-for-beginners,"This open-source curriculum introduces the fundamentals of Model Context Protocol (MCP) through real-world, cross-language examples in .NET, Java, TypeScript, JavaScript, Rust and Python. Designed for developers, it focuses on practical techniques for building modular, scalable, and secure AI workflows from session setup to service orchestration.",16760,5,5467,2,3,Jupyter Notebook,"csharp,java,javascript,javascript-applications,mcp,mcp-client,mcp-security,mcp-server,model,model-context-protocol,modelcontextprotocol,python,rust,typescript",2025-04-04T20:46:17Z,2026-07-15T22:33:04Z,2026-07-13T21:17:11Z,False
314,QwenLM/Qwen-Agent,https://github.com/QwenLM/Qwen-Agent,"Agent framework and applications built upon Qwen>=3.0, featuring Function Calling, MCP, Code Interpreter, RAG, Chrome extension, etc.",16759,28,1668,-1,517,Python,,2023-09-22T02:24:56Z,2026-07-15T22:56:39Z,2026-03-04T08:15:07Z,False
315,danielmiessler/LifeOS,https://github.com/danielmiessler/LifeOS,"An General Purpose AI Harness for magnifying human capabilities. [CODING, BUILDING, CREATING, BUSINESS, LIFE, WORK, ...]",16718,20,2274,1,20,TypeScript,"ai,augmentation,humans,productivity",2025-09-08T16:18:30Z,2026-07-15T23:13:33Z,2026-07-13T04:56:20Z,False
316,QwenLM/Qwen3-Coder,https://github.com/QwenLM/Qwen3-Coder,"Qwen3-Coder is the code version of Qwen3, the large language model series developed by Qwen team.",16711,10,1225,0,109,Python,,2024-04-16T11:49:01Z,2026-07-15T20:58:50Z,2026-03-24T08:22:10Z,False
317,weaviate/weaviate,https://github.com/weaviate/weaviate,"Weaviate is an open-source vector database that stores both objects and vectors, allowing for the combination of vector search with structured filtering with the fault tolerance and scalability of a cloud-native database​.",16601,3,1345,0,620,Go,"approximate-nearest-neighbor-search,generative-search,grpc,hnsw,hybrid-search,image-search,information-retrieval,mlops,nearest-neighbor-search,neural-search,recommender-system,search-engine,semantic-search,semantic-search-engine,similarity-search,vector-database,vector-search,vector-search-engine,vectors,weaviate",2016-03-30T15:03:17Z,2026-07-15T20:04:47Z,2026-07-15T23:13:05Z,False
318,tradingview/lightweight-charts,https://github.com/tradingview/lightweight-charts,Performant financial charts built with HTML5 canvas,16600,7,2531,0,126,TypeScript,"canvas,charting,charting-library,charts,finance,financial-charting-library,html5-charts,javascript,typescript",2019-05-24T14:41:49Z,2026-07-15T19:34:25Z,2026-07-08T16:50:10Z,False
319,rowboatlabs/rowboat,https://github.com/rowboatlabs/rowboat,"Open-source AI coworker, with memory",16522,41,1639,2,118,TypeScript,"agents,agents-sdk,ai,ai-agents,ai-agents-automation,chatgpt,claude-code,claude-cowork,generative-ai,llm,multiagent,opeani,open-source,orchestration,productivity",2025-01-13T09:30:40Z,2026-07-15T23:15:56Z,2026-07-15T20:28:19Z,False
320,chiphuyen/aie-book,https://github.com/chiphuyen/aie-book,"[WIP] Resources for AI engineers. Also contains supporting materials for the book AI Engineering (Chip Huyen, 2025)",16511,10,2398,3,19,Jupyter Notebook,,2024-12-03T19:43:36Z,2026-07-15T22:14:41Z,2026-07-03T07:04:59Z,False
321,getmaxun/maxun,https://github.com/getmaxun/maxun,"🔥 The open-source no-code platform for web scraping, crawling, search and AI data extraction • Turn websites into structured APIs in minutes 🔥 ",16504,18,1392,3,110,TypeScript,"agents,api,automation,browser-automation,crawler,crawling,data-extraction,no-code,nocode,playwright,robotic-process-automation,rpa,scraper,self-hosted,web-scraper,web-scraping,web-search,webscraping",2023-10-23T21:40:19Z,2026-07-15T22:53:29Z,2026-07-15T20:42:23Z,False
322,tashfeenahmed/freellmapi,https://github.com/tashfeenahmed/freellmapi,"OpenAI-compatible proxy that stacks the free tiers of 28 LLM providers (~4B tokens/month) behind one /v1 endpoint — plus any custom OpenAI-compatible endpoint. Smart routing, automatic failover, encrypted keys. Personal experimentation only.",16145,66,2355,14,56,TypeScript,,2026-04-21T13:38:59Z,2026-07-15T23:15:00Z,2026-07-15T08:37:07Z,False
323,nesquena/hermes-webui,https://github.com/nesquena/hermes-webui,Hermes WebUI: The best way to use Hermes Agent from the web or from your phone!,16101,55,2151,9,270,Python,"agent,ai-agents,hermes,hermes-agent,nous-research",2026-03-30T21:50:12Z,2026-07-15T23:07:03Z,2026-07-15T23:07:06Z,False
324,HKUDS/DeepCode,https://github.com/HKUDS/DeepCode,"""DeepCode: Open Agentic Coding (Paper2Code & Text2Web & Text2Backend)""",16050,2,2105,3,53,Python,"agentic-coding,llm-agent",2025-05-14T05:23:02Z,2026-07-15T16:23:15Z,2026-07-15T10:18:25Z,False
325,browser-use/browser-harness,https://github.com/browser-use/browser-harness,Browser Harness | Self-healing harness that enables LLMs to complete any task.,15997,31,1498,5,196,Python,"ai-agent,browser-agent,browser-automation,browser-use,browser-use-box,browser-use-cloud,cdp,cloud-browser,llm,persistent-browser,playwright,telegram-agent,vps-agent,web-automation",2026-04-17T01:56:15Z,2026-07-15T22:37:51Z,2026-07-15T18:26:03Z,False
326,googleapis/mcp-toolbox,https://github.com/googleapis/mcp-toolbox,MCP Toolbox for Databases is an open source MCP server for databases.,15960,8,1639,1,239,Go,"agent,agents,ai,bigquery,clickhouse,cockroachdb,database,elasticsearch,firestore,genai,llm,mcp,mongodb,mysql,oracle,postgresql,redis,server,spanner,tidb",2024-06-07T20:52:54Z,2026-07-15T21:55:18Z,2026-07-15T23:06:40Z,False
327,semgrep/semgrep,https://github.com/semgrep/semgrep,Lightweight static analysis for many languages. Find bug variants with patterns that look like source code.,15895,14,990,0,879,OCaml,"c,go,java,javascript,python,r2c,ruby,sast,semgrep,static-analysis,static-code-analysis,typescript",2019-12-13T09:29:54Z,2026-07-15T15:35:41Z,2026-07-15T17:02:11Z,False
328,alshedivat/al-folio,https://github.com/alshedivat/al-folio,"A beautiful, simple, clean, and responsive Jekyll theme for academics",15871,3,13089,-1,46,HTML,"academic,academic-website,github-pages,hacktoberfest,jekyll,jekyll-blog,jekyll-theme,personal-website,portfolio-website,theme",2016-05-30T16:32:46Z,2026-07-15T22:49:07Z,2026-07-15T01:07:49Z,False
329,Canner/WrenAI,https://github.com/Canner/WrenAI,"GenBI (Generative BI) for AI agents, an open-source, governed text-to-SQL through an open context layer that turns natural-language questions into trusted dashboards, charts, and SQL across 20+ data sources, such as BigQuery, Snowflake, PostgreSQL, ClickHouse, Amazon Redshift, Databricks and more.",15817,9,1813,-1,356,Python,"agent,anthropic,bigquery,charts,context-engineering,duckdb,genbi,llm,openai,postgresql,rag,sql,sqlai,text-to-chart,text-to-sql,text2sql,vertex",2024-03-13T06:18:20Z,2026-07-15T17:49:29Z,2026-07-15T05:58:07Z,False
330,vercel-labs/json-render,https://github.com/vercel-labs/json-render,The Generative UI framework,15701,4,847,0,98,TypeScript,,2026-01-14T17:22:39Z,2026-07-15T22:57:37Z,2026-07-08T23:20:55Z,False
