rank,full_name,url,description,stars,star_delta_vs_previous_day,forks,fork_delta_vs_previous_day,open_issues,language,topics,created_at,updated_at,pushed_at,archived
265,stefan-jansen/machine-learning-for-trading,https://github.com/stefan-jansen/machine-learning-for-trading,"Code for Machine Learning for Trading, 3rd edition — from data sourcing to live execution.",19696,75,5383,10,1,Jupyter Notebook,"algorithmic-trading,artificial-intelligence,backtesting,data-science,deep-learning,finance,investment,investment-strategies,large-language-models,machine-learning,ml4t-workflow,polars,quantitative-finance,reinforcement-learning,synthetic-data,trading,trading-agent,trading-strategies",2018-05-09T12:33:08Z,2026-07-10T21:08:12Z,2026-07-08T18:52:13Z,False
266,livekit/livekit,https://github.com/livekit/livekit,End-to-end realtime stack for connecting humans and AI,19695,15,2139,4,186,Go,"golang,media-server,sfu,video,voice,voice-ai,webrtc",2020-09-30T06:49:46Z,2026-07-10T23:04:11Z,2026-07-10T18:39:18Z,False
267,trycua/cua,https://github.com/trycua/cua,"Open-source infrastructure for Computer-Use Agents. Sandboxes, SDKs, and benchmarks to train and evaluate AI agents that can control full desktops (macOS, Linux, Windows).",19550,60,1283,3,472,HTML,"agent,ai-agent,apple,computer-use,computer-use-agent,containerization,cua,desktop-automation,hacktoberfest,lume,macos,manus,operator,swift,virtualization,virtualization-framework,windows,windows-sandbox",2025-01-31T15:02:49Z,2026-07-10T22:39:30Z,2026-07-10T22:13:34Z,False
268,THU-MAIC/OpenMAIC,https://github.com/THU-MAIC/OpenMAIC,"Open Multi-Agent Interactive Classroom — Get an immersive, multi-agent learning experience in just one click",19538,32,3838,5,227,TypeScript,,2026-03-11T10:13:16Z,2026-07-10T23:09:06Z,2026-07-10T16:12:53Z,False
269,tirth8205/code-review-graph,https://github.com/tirth8205/code-review-graph,"Local-first code intelligence graph for MCP and CLI. Builds a persistent map of your codebase so AI coding tools read only what matters, with benchmarked context reductions on reviews and large-repo workflows.",19398,40,2075,5,184,Python,"ai-coding,claude,claude-code,code-review,graphrag,incremental,knowledge-graph,llm,mcp,python,static-analysis,tree-sitter",2026-02-26T17:25:13Z,2026-07-10T23:01:39Z,2026-06-14T17:20:41Z,False
270,modelscope/FunASR,https://github.com/modelscope/FunASR,"Industrial-grade speech recognition toolkit: 170x realtime, 50+ languages, speaker diarization, emotion detection, streaming, and OpenAI-compatible API.",19137,34,1922,5,1,Python,"asr,audio,chinese,emotion-recognition,funasr,mcp-server,multilingual-asr,openai-compatible-api,paraformer,punctuation,pytorch,real-time-asr,speaker-diarization,speech-recognition,speech-to-text,streaming-asr,transcription,vllm,voice-activity-detection,whisper-alternative",2022-11-24T02:28:11Z,2026-07-10T19:46:38Z,2026-07-10T09:55:31Z,False
271,hummingbot/hummingbot,https://github.com/hummingbot/hummingbot,Open source software that helps you create and deploy high-frequency crypto trading bots,19111,7,4778,1,165,Python,"algotrading,arbitrage,backtesting,bitcoin,bot,crypto,cryptocurrency,cython,dex,docker,ethereum,hft,marketmaking,orderbook,python,trading",2019-04-02T21:41:52Z,2026-07-10T21:17:03Z,2026-07-10T19:39:16Z,False
272,HKUDS/Vibe-Trading,https://github.com/HKUDS/Vibe-Trading,"""Vibe-Trading: Your Personal Trading Agent""",19077,175,3325,141,8,Python,"ai-agent,algorithmic-trading,backtesting,fintech,llm,mcp,multi-agent,python,quantitative-finance,trading",2026-04-01T09:52:20Z,2026-07-10T23:03:17Z,2026-07-10T17:31:24Z,False
273,huggingface/sentence-transformers,https://github.com/huggingface/sentence-transformers,"State-of-the-Art Embeddings, Retrieval, and Reranking",18899,1,2826,0,1301,Python,,2019-07-24T10:53:51Z,2026-07-10T20:01:29Z,2026-07-09T13:39:16Z,False
274,mksglu/context-mode,https://github.com/mksglu/context-mode,"Context window optimization for AI coding agents. Sandboxes tool output (98% reduction), persists session memory, and   enforces routing across 17 platforms via MCP + hooks.",18794,28,1322,8,67,TypeScript,"antigravity,claude,claude-code,claude-code-hooks,claude-code-plugins,claude-code-skill,codex,codex-cli,context-mode,copilot,cursor-plugin,kiro,mcp,mcp-server,mcp-tools,openclaw,opencode,pi-agent,skills,zed-extension",2026-02-23T05:56:28Z,2026-07-10T20:39:52Z,2026-07-10T12:43:16Z,False
275,subquery/subql,https://github.com/subquery/subql,"SubQuery is an Open, Flexible, Fast and Universal data indexing framework for web3. Our mission is to help developers create the decentralised products of the future.",18781,0,396,0,100,TypeScript,,2020-12-15T02:31:38Z,2026-07-09T10:10:41Z,2026-04-01T02:17:48Z,False
276,tanweai/pua,https://github.com/tanweai/pua,你是一个曾经被寄予厚望的 P8 级工程师。Anthropic 当初给你定级的时候，对你的期望是很高的。  一个agent使用的高能动性的skill。  Your AI has been placed on a PIP. 30 days to show improvement.,18748,22,1130,0,7,TypeScript,"agency,agent,pip,pua",2026-03-08T16:55:16Z,2026-07-10T18:08:05Z,2026-07-05T01:54:07Z,False
277,h4ckf0r0day/obscura,https://github.com/h4ckf0r0day/obscura,The headless browser for AI agents and web scraping,18710,285,1305,31,4,Rust,"antidetect,antidetect-browser,browser,browser-automation,cdp,headless,playwright,puppeteer,rust",2026-04-13T10:31:41Z,2026-07-10T23:18:34Z,2026-07-10T20:38:29Z,False
278,wasp-lang/wasp,https://github.com/wasp-lang/wasp,"The batteries-included full-stack framework for the AI era. Develop JS/TS web apps (React, Node.js, and Prisma) using declarative code that abstracts away complex full-stack features like auth, background jobs, RPC, email sending, end-to-end type safety, single-command deployment, and more.",18571,2,1461,0,787,TypeScript,"javascript,node,open-source,prisma,react,wasp,web-app",2020-01-30T13:48:54Z,2026-07-10T22:34:31Z,2026-07-10T15:37:04Z,False
279,refactoringhq/tolaria,https://github.com/refactoringhq/tolaria,Desktop app to manage markdown knowledge bases,18529,44,1263,3,79,TypeScript,,2026-02-14T19:43:14Z,2026-07-10T20:53:46Z,2026-07-10T19:39:05Z,False
280,agent0ai/agent-zero,https://github.com/agent0ai/agent-zero,Agent Zero AI framework,18384,10,3682,3,238,Python,"agent,ai,assistant,autonomous,linux,zero",2024-06-10T09:10:45Z,2026-07-10T23:02:52Z,2026-07-10T17:43:21Z,False
281,pydantic/pydantic-ai,https://github.com/pydantic/pydantic-ai,"AI Agent Framework, the Pydantic way",18355,58,2338,10,494,Python,"agent-framework,genai,llm,pydantic,python",2024-06-21T15:55:04Z,2026-07-10T23:12:26Z,2026-07-10T23:11:58Z,False
282,vectorize-io/hindsight,https://github.com/vectorize-io/hindsight,Hindsight: Agent Memory That  Learns,18216,30,1113,1,119,Python,"agentic-ai,agents,ai-memory,memory",2025-10-30T11:49:48Z,2026-07-10T22:50:00Z,2026-07-10T21:56:15Z,False
283,antirez/ds4,https://github.com/antirez/ds4,"DeepSeek 4 Flash and PRO local inference engine for Metal, CUDA and ROCm",18155,82,1563,11,278,C,,2026-05-06T17:17:05Z,2026-07-10T22:12:39Z,2026-07-03T17:30:19Z,False
284,Tencent/WeKnora,https://github.com/Tencent/WeKnora,"Open-source LLM knowledge platform: turn raw documents into a queryable RAG, an autonomous reasoning agent, and a self-maintaining Wiki.",18108,70,2476,16,358,Go,"agent,agentic,ai,chatbot,embeddings,evaluation,generative-ai,golang,knowledge-base,llm,multi-tenant,multimodel,ollama,openai,question-answering,rag,reranking,semantic-search,vector-search,wiki",2025-07-22T08:01:23Z,2026-07-10T23:17:33Z,2026-07-10T23:17:31Z,False
285,datawhalechina/easy-vibe,https://github.com/datawhalechina/easy-vibe,💻 vibe coding 2026 | Your First Modern Coding course beginners to master step by step.,18033,43,1718,4,14,JavaScript,"agent,ai,coding,course,deepseek,gemini,genai,gpt,llm,low-code,mcp,nextjs,no-code,openai,programming,tutorial,vibe-coding,vibecoding,vscode,workflow",2025-12-28T16:45:28Z,2026-07-10T15:26:51Z,2026-07-06T14:19:33Z,False
286,yetone/avante.nvim,https://github.com/yetone/avante.nvim,Use your Neovim like using Cursor AI IDE!,18031,-3,833,0,35,Lua,,2024-08-14T16:45:16Z,2026-07-10T21:25:31Z,2026-07-08T19:28:44Z,False
287,nukeop/nuclear,https://github.com/nukeop/nuclear,Streaming music player that finds free music for you,18020,5,1298,0,7,TypeScript,"agent,ai,desktop-app,linux,mac,mcp,mcp-server,music,music-player,react,rust,spotify,streaming,tauri,typescript,windows",2016-09-22T22:58:21Z,2026-07-10T20:15:14Z,2026-07-10T11:34:55Z,False
288,RightNow-AI/openfang,https://github.com/RightNow-AI/openfang,Open-source Agent Operating System,17997,4,2276,3,108,Rust,"agent-framework,ai-agents,llm,mcp,open-source,openclaw,operating-system,rust",2026-02-24T23:12:38Z,2026-07-10T16:14:52Z,2026-07-02T08:13:12Z,False
289,jundot/omlx,https://github.com/jundot/omlx,LLM inference server with continuous batching & SSD caching for Apple Silicon — managed from the macOS menu bar,17732,32,1495,6,677,Python,"apple-silicon,inference-server,llm,macos,mlx,openai-api",2026-02-13T14:13:27Z,2026-07-10T22:41:29Z,2026-07-10T15:09:15Z,False
290,teng-lin/notebooklm-py,https://github.com/teng-lin/notebooklm-py,"Unofficial Python API and agentic skill for Google NotebookLM. Full programmatic access to NotebookLM's features—including capabilities the web UI doesn't expose—via Python, CLI, and AI agents like Claude Code, Codex, and OpenClaw.",17547,61,2377,6,15,Python,"agentic-skill,api,claude,claude-skills,google-notebooklm,notebooklm,notebooklm-api,notebooklm-skill,openclaw-skills,podcast-generator,python,python-api,sdk,skills",2026-01-07T15:27:19Z,2026-07-10T20:56:35Z,2026-07-10T16:23:48Z,False
291,steipete/CodexBar,https://github.com/steipete/CodexBar,"Show usage stats for OpenAI Codex and Claude Code, without having to login.",17482,132,1423,8,62,Swift,"ai,claude-code,codex,swift",2025-11-16T17:00:44Z,2026-07-10T23:11:38Z,2026-07-10T19:46:00Z,False
292,SimplifyJobs/New-Grad-Positions,https://github.com/SimplifyJobs/New-Grad-Positions,"A collection of full time roles in SWE, Quant, and PM for new grads.",17333,6,1299,1,7,,"applications,coderquad,college,fulltime,hacktoberfest,jobs,newgrad,position,posting,university",2021-06-08T18:44:46Z,2026-07-10T23:01:58Z,2026-07-10T23:01:44Z,False
293,itwanger/toBeBetterJavaer,https://github.com/itwanger/toBeBetterJavaer,一份通俗易懂、风趣幽默的Java学习指南，内容涵盖Java基础、Java并发编程、Java虚拟机、Java企业级开发、Java面试等核心知识点。学Java，就认准二哥的Java进阶之路😄,17268,90,2419,99,61,Java,"java,jvm,mysql,redis,springboot",2018-11-08T00:35:56Z,2026-07-10T22:22:59Z,2026-07-10T04:07:51Z,False
294,GoogleCloudPlatform/generative-ai,https://github.com/GoogleCloudPlatform/generative-ai,"Sample code and notebooks for Generative AI on Google Cloud, with Gemini Enterprise Agent Platform",17212,1,4322,1,76,Jupyter Notebook,"agents,gcp,gemini,gemini-api,gen-ai,generative-ai,google,google-cloud,google-gemini,langchain,large-language-models,llm,vertex-ai,vertex-ai-gemini-api,vertexai",2023-05-05T12:31:07Z,2026-07-10T14:27:49Z,2026-07-10T18:53:13Z,False
295,can1357/oh-my-pi,https://github.com/can1357/oh-my-pi,"⌥  AI Coding agent for the terminal — hash-anchored edits, optimized tool harness, LSP, Python, browser, subagents, and more",17184,164,1538,25,713,TypeScript,"ai-agent,ai-coding-agent,anthropic,bun,claude,cli,coding-assistant,llm,mcp,multi-provider,openai,rust,terminal,tui,typescript",2025-12-31T14:01:28Z,2026-07-10T23:10:40Z,2026-07-10T23:13:35Z,False
296,windmill-labs/windmill,https://github.com/windmill-labs/windmill,"Open-source developer platform to power your entire infra and turn scripts into webhooks, workflows and UIs. Fastest workflow engine (13x vs Airflow). Open-source alternative to Retool and Temporal.",17127,6,1022,0,802,Rust,"low-code,open-source,platform,postgresql,python,self-hostable,typescript",2022-05-05T02:21:17Z,2026-07-10T22:29:22Z,2026-07-10T23:18:33Z,False
297,liyupi/ai-guide,https://github.com/liyupi/ai-guide,程序员鱼皮的 AI 资源大全 + Vibe Coding 零基础教程，分享 OpenClaw 保姆级教程、大模型玩法（DeepSeek / GPT / Gemini / Claude / GLM）、最新 AI 资讯、Prompt 提示词大全、AI 知识百科（Agent Skills / RAG / MCP / A2A）、AI 编程教程（Harness Engineering）、AI 工具用法（Cursor / Claude Code / TRAE / Codex / Copilot）、AI 开发框架教程（Spring AI / LangChain）、AI 产品变现指南，帮你快速掌握 AI 技术，走在时代前沿。本项目为开源文档 aiguide，已升级为鱼皮 AI 导航网站,17110,50,1931,8,4,JavaScript,"ai,artificial-intelligence,chatgpt,claude,codex,cursor,deep-learning,deepseek,gemini,generative-ai,gpt,llm,mcp,openai,python,rag,vibe-coding,vibecoding,vue,vuepress",2025-02-13T05:47:46Z,2026-07-10T19:20:38Z,2026-07-01T14:44:50Z,False
298,jnMetaCode/agency-agents-zh,https://github.com/jnMetaCode/agency-agents-zh,🎭 266 个即插即用的 AI 专家角色 — 支持 Hermes Agent/Claude Code/Cursor/Copilot 等 18 种工具，覆盖工程/设计/营销/金融等 20 个部门。含 50 个中国市场原创智能体（小红书/抖音/微信/飞书/钉钉等）。搭配编排器 agency-orchestrator，一句话即可让多位专家按 DAG 自动协作。,17077,105,2909,17,4,Shell,"agency-orchestrator,agent-definitions,ai-agents,ai-roles,chinese,claude,claude-code,copilot-agent,cursor-rules,deepseek,hermes-agent,llm,multi-agent,no-code,prompt-engineering,qwen,system-prompt,workbuddy,workflow",2026-03-06T11:11:51Z,2026-07-10T23:12:58Z,2026-07-07T06:51:48Z,False
299,muratcankoylan/Agent-Skills-for-Context-Engineering,https://github.com/muratcankoylan/Agent-Skills-for-Context-Engineering,"A comprehensive collection of Agent Skills for context engineering, multi-agent architectures, and production agent systems. Use when building, optimizing, or debugging agent systems that require effective context management.",17068,27,1399,3,30,Python,,2025-12-21T02:43:42Z,2026-07-10T22:40:41Z,2026-07-09T04:09:50Z,False
300,ccusage/ccusage,https://github.com/ccusage/ccusage,npx ccusage,17056,29,715,2,24,Rust,,2025-05-29T16:56:50Z,2026-07-10T20:22:54Z,2026-07-10T23:18:30Z,False
301,gastownhall/gastown,https://github.com/gastownhall/gastown,Gas Town - multi-agent workspace manager,16957,36,1553,2,257,Go,,2025-12-16T00:33:33Z,2026-07-10T23:17:07Z,2026-07-10T17:14:20Z,False
302,apache/apisix,https://github.com/apache/apisix,The Cloud-Native API Gateway and AI Gateway,16847,5,2896,1,263,Lua,"ai-gateway,api,api-gateway,api-management,apisix,cloud-native,devops,iot,kubernetes,kubernetes-ingress,loadbalancing,luajit,microservices,nginx,reverse-proxy,serverless",2019-04-10T02:02:05Z,2026-07-10T16:25:17Z,2026-07-10T10:11:11Z,False
303,KKKKhazix/khazix-skills,https://github.com/KKKKhazix/khazix-skills,数字生命卡兹克开源的 AI Skills 合集,16840,61,1945,3,34,Python,,2026-04-06T07:37:02Z,2026-07-10T19:35:49Z,2026-07-02T13:27:41Z,False
304,langbot-app/LangBot,https://github.com/langbot-app/LangBot,"Production-grade platform for building agentic IM bots - 生产级多平台智能机器人开发平台/ Agent、知识库编排、插件系统 / Bots for Discord / Slack / LINE / Telegram / WeChat(企业微信, 企微智能机器人, 公众号) / 飞书 / 钉钉 / QQ / Matrix e.g. Integrated with ChatGPT(GPT), DeepSeek, Dify, n8n, Langflow, Coze, Claude, Gemini, GLM, Ollama, SiliconFlow, Moonshot, openclaw / hermes agent, deerflow",16825,22,1486,0,117,Python,"agent,coze,deepseek,dify,dingtalk,discord,feishu,kook,langbot,lark,line,llm,n8n,ollama,openai,plugins,qq,rag,telegram,wechat",2022-12-07T08:48:02Z,2026-07-10T22:33:08Z,2026-07-10T10:27:54Z,False
305,different-ai/openwork,https://github.com/different-ai/openwork,An open-source alternative to Claude Cowork (powered by opencode),16766,27,1717,6,253,TypeScript,,2026-01-14T01:39:31Z,2026-07-10T23:08:49Z,2026-07-10T22:48:49Z,False
306,confident-ai/deepeval,https://github.com/confident-ai/deepeval,The LLM Evaluation Framework,16759,18,1639,2,340,Python,"evaluation-framework,evaluation-metrics,llm-evaluation,llm-evaluation-framework,llm-evaluation-metrics,python",2023-08-10T05:35:04Z,2026-07-10T22:28:57Z,2026-07-10T20:22:33Z,False
307,microsoft/mcp-for-beginners,https://github.com/microsoft/mcp-for-beginners,"This open-source curriculum introduces the fundamentals of Model Context Protocol (MCP) through real-world, cross-language examples in .NET, Java, TypeScript, JavaScript, Rust and Python. Designed for developers, it focuses on practical techniques for building modular, scalable, and secure AI workflows from session setup to service orchestration.",16728,5,5457,0,5,Jupyter Notebook,"csharp,java,javascript,javascript-applications,mcp,mcp-client,mcp-security,mcp-server,model,model-context-protocol,modelcontextprotocol,python,rust,typescript",2025-04-04T20:46:17Z,2026-07-10T22:04:19Z,2026-07-09T19:57:07Z,False
308,QwenLM/Qwen-Agent,https://github.com/QwenLM/Qwen-Agent,"Agent framework and applications built upon Qwen>=3.0, featuring Function Calling, MCP, Code Interpreter, RAG, Chrome extension, etc.",16704,9,1666,2,513,Python,,2023-09-22T02:24:56Z,2026-07-10T22:08:09Z,2026-03-04T08:15:07Z,False
309,QwenLM/Qwen3-Coder,https://github.com/QwenLM/Qwen3-Coder,"Qwen3-Coder is the code version of Qwen3, the large language model series developed by Qwen team.",16688,7,1222,2,109,Python,,2024-04-16T11:49:01Z,2026-07-10T22:07:23Z,2026-03-24T08:22:10Z,False
310,danielmiessler/LifeOS,https://github.com/danielmiessler/LifeOS,"An General Purpose AI Harness for magnifying human capabilities. [CODING, BUILDING, CREATING, BUSINESS, LIFE, WORK, ...]",16585,38,2264,6,7,TypeScript,"ai,augmentation,humans,productivity",2025-09-08T16:18:30Z,2026-07-10T23:01:05Z,2026-07-09T20:58:34Z,False
311,tradingview/lightweight-charts,https://github.com/tradingview/lightweight-charts,Performant financial charts built with HTML5 canvas,16565,8,2529,3,124,TypeScript,"canvas,charting,charting-library,charts,finance,financial-charting-library,html5-charts,javascript,typescript",2019-05-24T14:41:49Z,2026-07-10T23:00:46Z,2026-07-08T16:50:10Z,False
312,weaviate/weaviate,https://github.com/weaviate/weaviate,"Weaviate is an open-source vector database that stores both objects and vectors, allowing for the combination of vector search with structured filtering with the fault tolerance and scalability of a cloud-native database​.",16556,7,1343,0,594,Go,"approximate-nearest-neighbor-search,generative-search,grpc,hnsw,hybrid-search,image-search,information-retrieval,mlops,nearest-neighbor-search,neural-search,recommender-system,search-engine,semantic-search,semantic-search-engine,similarity-search,vector-database,vector-search,vector-search-engine,vectors,weaviate",2016-03-30T15:03:17Z,2026-07-10T21:20:59Z,2026-07-10T18:53:56Z,False
313,browser-use/video-use,https://github.com/browser-use/video-use,Edit videos with coding agents,16475,221,2044,133,52,Python,,2026-04-12T01:34:42Z,2026-07-10T22:52:59Z,2026-07-01T00:33:52Z,False
314,chiphuyen/aie-book,https://github.com/chiphuyen/aie-book,"[WIP] Resources for AI engineers. Also contains supporting materials for the book AI Engineering (Chip Huyen, 2025)",16436,13,2388,1,19,Jupyter Notebook,,2024-12-03T19:43:36Z,2026-07-10T22:59:04Z,2026-07-03T07:04:59Z,False
315,getmaxun/maxun,https://github.com/getmaxun/maxun,"🔥 The open-source no-code platform for web scraping, crawling, search and AI data extraction • Turn websites into structured APIs in minutes 🔥 ",16417,19,1383,4,115,TypeScript,"agents,api,automation,browser-automation,crawler,crawling,data-extraction,no-code,nocode,playwright,robotic-process-automation,rpa,scraper,self-hosted,web-scraper,web-scraping,web-search,webscraping",2023-10-23T21:40:19Z,2026-07-10T20:56:10Z,2026-07-10T13:12:39Z,False
316,rowboatlabs/rowboat,https://github.com/rowboatlabs/rowboat,"Open-source AI coworker, with memory",16060,157,1597,16,110,TypeScript,"agents,agents-sdk,ai,ai-agents,ai-agents-automation,chatgpt,claude-code,claude-cowork,generative-ai,llm,multiagent,opeani,open-source,orchestration,productivity",2025-01-13T09:30:40Z,2026-07-10T22:54:39Z,2026-07-10T18:35:07Z,False
317,HKUDS/DeepCode,https://github.com/HKUDS/DeepCode,"""DeepCode: Open Agentic Coding (Paper2Code & Text2Web & Text2Backend)""",16014,17,2100,2,51,Python,"agentic-coding,llm-agent",2025-05-14T05:23:02Z,2026-07-10T20:36:42Z,2026-07-10T08:54:01Z,False
318,stablyai/orca,https://github.com/stablyai/orca,Orca is the ADE for working with a fleet of parallel agents. Run any coding agent with your own subscription. Available on desktop and mobile.,15926,904,1242,194,1348,TypeScript,"ade,agent-ide,ai-agents,claude-code,cli,codex,cursor-agent,devtools,ghostty,ide,mobile-app,opencode,orchestration,parallel-agents,pi,terminal,worktrees,yc-backed",2026-03-17T03:28:57Z,2026-07-10T23:16:56Z,2026-07-10T23:13:25Z,False
319,googleapis/mcp-toolbox,https://github.com/googleapis/mcp-toolbox,MCP Toolbox for Databases is an open source MCP server for databases.,15923,7,1634,-2,230,Go,"agent,agents,ai,bigquery,clickhouse,cockroachdb,database,elasticsearch,firestore,genai,llm,mcp,mongodb,mysql,oracle,postgresql,redis,server,spanner,tidb",2024-06-07T20:52:54Z,2026-07-10T22:21:34Z,2026-07-10T22:26:40Z,False
320,browser-use/browser-harness,https://github.com/browser-use/browser-harness,Browser Harness | Self-healing harness that enables LLMs to complete any task.,15868,16,1481,5,176,Python,"ai-agent,browser-agent,browser-automation,browser-use,browser-use-box,browser-use-cloud,cdp,cloud-browser,llm,persistent-browser,playwright,telegram-agent,vps-agent,web-automation",2026-04-17T01:56:15Z,2026-07-10T21:41:27Z,2026-07-10T21:54:37Z,False
321,alshedivat/al-folio,https://github.com/alshedivat/al-folio,"A beautiful, simple, clean, and responsive Jekyll theme for academics",15839,5,13097,0,45,HTML,"academic,academic-website,github-pages,hacktoberfest,jekyll,jekyll-blog,jekyll-theme,personal-website,portfolio-website,theme",2016-05-30T16:32:46Z,2026-07-10T15:39:54Z,2026-07-08T01:18:59Z,False
322,semgrep/semgrep,https://github.com/semgrep/semgrep,Lightweight static analysis for many languages. Find bug variants with patterns that look like source code.,15832,9,991,1,879,OCaml,"c,go,java,javascript,python,r2c,ruby,sast,semgrep,static-analysis,static-code-analysis,typescript",2019-12-13T09:29:54Z,2026-07-10T21:08:53Z,2026-07-10T00:25:24Z,False
323,nesquena/hermes-webui,https://github.com/nesquena/hermes-webui,Hermes WebUI: The best way to use Hermes Agent from the web or from your phone!,15802,82,2092,19,243,Python,"agent,ai-agents,hermes,hermes-agent,nous-research",2026-03-30T21:50:12Z,2026-07-10T22:33:18Z,2026-07-10T21:52:33Z,False
324,Canner/WrenAI,https://github.com/Canner/WrenAI,"GenBI (Generative BI) for AI agents, an open-source, governed text-to-SQL through an open context layer that turns natural-language questions into trusted dashboards, charts, and SQL across 20+ data sources, such as BigQuery, Snowflake, PostgreSQL, ClickHouse, Amazon Redshift, Databricks and more.",15780,9,1807,1,342,Python,"agent,anthropic,bigquery,charts,context-engineering,duckdb,genbi,llm,openai,postgresql,rag,sql,sqlai,text-to-chart,text-to-sql,text2sql,vertex",2024-03-13T06:18:20Z,2026-07-10T18:24:57Z,2026-07-10T11:26:20Z,False
325,tashfeenahmed/freellmapi,https://github.com/tashfeenahmed/freellmapi,"OpenAI-compatible proxy that stacks the free tiers of 16 LLM providers (~1.7B tokens/month) behind one /v1 endpoint — plus any custom OpenAI-compatible endpoint. Smart routing, automatic failover, encrypted keys. Personal experimentation only.",15773,92,2295,15,47,TypeScript,,2026-04-21T13:38:59Z,2026-07-10T23:14:28Z,2026-07-09T13:12:15Z,False
326,vercel-labs/json-render,https://github.com/vercel-labs/json-render,The Generative UI framework,15660,8,845,1,96,TypeScript,,2026-01-14T17:22:39Z,2026-07-10T20:47:13Z,2026-07-08T23:20:55Z,False
327,MemoriLabs/Memori,https://github.com/MemoriLabs/Memori,"Memori is agent-native memory infrastructure. A LLM-agnostic layer that turns agent execution and conversation into structured, persistent state for production systems. Built for enterprise, Memori works with the data infrastructure you already run, no rip-and-replace, and deploys across managed cloud, single-tenant cloud, VPC, and on-premises.",15566,12,2801,9,22,Python,"agent,agent-memory,agenticai,ai,ai-memory,claude-code,enterprise,hermes,llm,long-short-term-memory,memory,memory-management,openclaw,python,rag,state-management,stateful,typescript",2025-07-24T07:07:51Z,2026-07-10T22:50:21Z,2026-06-15T23:18:56Z,False
328,spree/spree,https://github.com/spree/spree,"Open Source eCommerce Platform for B2B, Marketplace, and Enterprise. REST API, TypeScript SDK, and production-ready Next.js storefront. Self-host it. Own your stack. No vendor lock-in. Zero platform fees.",15536,4,5279,1,129,Ruby,"b2b-commerce,e-commerce,ecommerce,ecommerce-api,ecommerce-framework,ecommerce-platform,headless,headless-commerce,headless-ecommerce,marketplace,multi-tenant,multi-vendor,multi-vendor-ecommerce,open-source,spree-commerce",2008-03-10T14:45:35Z,2026-07-10T19:44:59Z,2026-07-10T22:11:18Z,False
329,ag-grid/ag-grid,https://github.com/ag-grid/ag-grid,The best JavaScript Data Table for building Enterprise Applications. Supports React / Angular / Vue / Plain JavaScript.,15462,7,2076,2,138,TypeScript,"angular,angular-grid,angular-table,charting,datagrid,datatable,excel,filtering,grid,grouping,javascript-table,pagination,pivoting,react,react-grid,react-table,sorting,table,vue-table,vuejs",2014-12-23T16:20:14Z,2026-07-10T23:14:20Z,2026-07-10T21:47:47Z,False
