rank,full_name,url,description,stars,star_delta_vs_previous_day,forks,fork_delta_vs_previous_day,open_issues,language,topics,created_at,updated_at,pushed_at,archived
135,Imbad0202/academic-research-skills,https://github.com/Imbad0202/academic-research-skills,Academic Research Skills for Claude Code: research → write → review → revise → finalize,31380,179,2581,13,7,Python,"academic-pipeline,academic-writing,ai-research,claude,claude-code,literature-review,peer-review,prompt-engineering",2026-02-26T06:31:01Z,2026-06-15T00:12:31Z,2026-06-13T16:11:35Z,False
136,lightpanda-io/browser,https://github.com/lightpanda-io/browser,Lightpanda: the headless browser designed for AI and automation,31109,12,1373,1,106,Zig,"browser,browser-automation,cdp,headless,lightpanda,playwright,puppeteer,zig",2023-02-07T15:19:34Z,2026-06-15T00:10:09Z,2026-06-14T22:34:52Z,False
137,anthropics/financial-services,https://github.com/anthropics/financial-services,,31092,30,4407,6,163,Python,,2026-02-23T19:24:50Z,2026-06-15T00:13:29Z,2026-06-05T20:53:09Z,False
138,linshenkx/prompt-optimizer,https://github.com/linshenkx/prompt-optimizer,An AI prompt optimizer for writing better prompts and getting better AI results.,30848,17,3605,4,17,TypeScript,"ai-prompts,ai-tools,llm,prompt,prompt-engineering,prompt-optimization,prompt-optimizer,prompt-testing,prompt-toolkit,prompt-tuning",2025-02-12T06:06:49Z,2026-06-14T23:33:45Z,2026-06-09T07:34:07Z,False
139,github/github-mcp-server,https://github.com/github/github-mcp-server,GitHub's official MCP Server,30673,18,4393,5,306,Go,"github,mcp,mcp-server",2025-03-04T16:42:04Z,2026-06-14T23:34:19Z,2026-06-12T17:56:54Z,False
140,lfnovo/open-notebook,https://github.com/lfnovo/open-notebook,An Open Source implementation of Notebook LM with more flexibility and features,30522,233,3462,21,146,TypeScript,"assistant,learning,note-taking,notebook,notes-app,self-learning",2024-10-21T17:58:46Z,2026-06-15T00:16:03Z,2026-06-13T12:16:12Z,False
141,anthropics/claude-plugins-official,https://github.com/anthropics/claude-plugins-official,"Official, Anthropic-managed directory of high quality Claude Code Plugins.",30126,39,3257,8,747,Python,"claude-code,mcp,skills",2025-11-20T18:36:20Z,2026-06-15T00:02:22Z,2026-06-15T00:02:19Z,False
142,jamiepine/voicebox,https://github.com/jamiepine/voicebox,"The open-source AI voice studio. Clone, dictate, create.",29975,19,3699,9,447,TypeScript,"ai,cuda,mlx,qwen3-tts,qwen3-tts-ui,voice-ai,voice-clone,whisper",2026-01-25T12:27:03Z,2026-06-14T21:33:28Z,2026-04-26T20:29:17Z,False
143,nanocoai/nanoclaw,https://github.com/nanocoai/nanoclaw,"A lightweight alternative to OpenClaw that runs in containers for security. Connects to WhatsApp, Telegram, Slack, Discord, Gmail and other messaging apps,, has memory, scheduled jobs, and runs directly on Anthropic's Agents SDK",29851,2,12892,-2,726,TypeScript,"ai-agents,ai-assistant,claude-code,claude-skills,openclaw",2026-01-31T15:47:22Z,2026-06-14T23:24:12Z,2026-06-14T23:24:08Z,False
144,lbjlaq/Antigravity-Manager,https://github.com/lbjlaq/Antigravity-Manager,Professional Antigravity Account Manager & Switcher. One-click seamless account switching for Antigravity Tools. Built with Tauri v2 + React (Rust).专业的 Antigravity 账号管理与切换工具。为 Antigravity 提供一键无缝账号切换功能。,29756,6,3222,-1,1722,Rust,"account-manager,antigravity",2025-11-26T10:47:13Z,2026-06-14T22:54:41Z,2026-06-12T08:31:41Z,False
145,heroui-inc/heroui,https://github.com/heroui-inc/heroui,"🚀 Beautiful, fast and modern React UI library. (Previously NextUI)",29631,5,2164,2,63,MDX,"component-library,components,library,reactjs",2021-04-22T13:06:23Z,2026-06-14T20:38:58Z,2026-06-14T17:13:07Z,False
146,JushBJJ/Mr.-Ranedeer-AI-Tutor,https://github.com/JushBJJ/Mr.-Ranedeer-AI-Tutor,A GPT-4 AI Tutor Prompt for customizable personalized learning experiences.,29599,-2,3305,-1,18,,"ai,education,gpt-4,llm",2023-03-31T12:37:26Z,2026-06-14T22:34:48Z,2025-09-30T08:08:00Z,False
147,sipeed/picoclaw,https://github.com/sipeed/picoclaw,"Tiny, Fast, and Deployable anywhere — automate the mundane, unleash your creativity",29402,11,4214,2,76,Go,,2026-02-04T12:32:35Z,2026-06-14T23:27:54Z,2026-06-14T19:22:53Z,False
148,langfuse/langfuse,https://github.com/langfuse/langfuse,"🪢 Open source AI engineering platform: LLM evals, observability, metrics, prompt management, playground, datasets. Integrates with OpenTelemetry, LangChain, OpenAI SDK, LiteLLM, and more. 🍊YC W23 ",29070,32,3011,1,666,TypeScript,"analytics,autogen,evaluation,langchain,large-language-models,llama-index,llm,llm-evaluation,llm-observability,llmops,monitoring,observability,open-source,openai,playground,prompt-engineering,prompt-management,self-hosted,ycombinator",2023-05-18T17:47:09Z,2026-06-15T00:10:33Z,2026-06-13T21:33:32Z,False
149,sgl-project/sglang,https://github.com/sgl-project/sglang,SGLang is a high-performance serving framework for large language models and multimodal models.,29000,22,6530,7,3487,Python,"attention,blackwell,cuda,deepseek,diffusion,glm,gpt-oss,inference,llama,llm,minimax,moe,qwen,qwen-image,reinforcement-learning,transformer,vlm,wan",2024-01-08T04:15:52Z,2026-06-14T23:55:37Z,2026-06-14T23:34:03Z,False
150,tastejs/todomvc,https://github.com/tastejs/todomvc,"Helping you select a JavaScript framework - Todo apps for React.js, Angular, Vue and many more",28933,0,13748,1,72,JavaScript,,2011-06-03T19:56:33Z,2026-06-14T08:21:05Z,2026-06-06T23:35:53Z,False
151,Gitlawb/openclaude,https://github.com/Gitlawb/openclaude,runs anywhere. uses anything,28776,93,8738,6,179,TypeScript,"ai,ai-agent,ai-tools,cli,coding",2026-04-01T03:15:49Z,2026-06-15T00:01:21Z,2026-06-14T12:37:11Z,False
152,ComposioHQ/composio,https://github.com/ComposioHQ/composio,"Composio powers 1000+ toolkits, tool search, context management, authentication, and a sandboxed workbench to help you build AI agents that turn intent into action.",28767,7,4623,3,137,TypeScript,"agentic-ai,agents,ai,ai-agents,aiagents,developer-tools,function-calling,gpt-4,javascript,js,llm,llmops,mcp,python,remote-mcp-server,sse,typescript",2024-02-23T13:58:27Z,2026-06-14T22:56:59Z,2026-06-14T18:05:29Z,False
153,Panniantong/Agent-Reach,https://github.com/Panniantong/Agent-Reach,"Give your AI agent eyes to see the entire internet. Read & search Twitter, Reddit, YouTube, GitHub, Bilibili, XiaoHongShu — one CLI, zero API fees.",28726,516,2355,49,57,Python,"agent-infrastructure,ai-agent,ai-search,automation,bilibili,claude-code,cli,cursor,free-api,llm-tools,mcp,python,reddit-scraper,twitter-scraper,web-scraper,xiaohongshu,youtube-transcript",2026-02-24T02:10:24Z,2026-06-15T00:18:22Z,2026-06-12T14:55:09Z,False
154,iOfficeAI/AionUi,https://github.com/iOfficeAI/AionUi,"Free, local, open-source 24/7 Cowork app for OpenClaw, Hermes Agent, Claude Code, Codex, OpenCode, Gemini CLI and 20+ more CLI | Customize your assistants | Star if you like it!",28236,25,2767,5,634,TypeScript,"acp,agent-team,ai,ai-agent,chat,chatbot,claude-code,clawdbot,codex,cowork,gemini,gemini-cli,hermes,llm,nano-banana,office,openclaw,opencode,skills,webui",2025-08-07T10:29:51Z,2026-06-14T22:48:48Z,2026-06-14T14:10:57Z,False
155,K-Dense-AI/scientific-agent-skills,https://github.com/K-Dense-AI/scientific-agent-skills,"Turn any AI agent into an AI Scientist. The #1 Agent Skills library for science, used by 160,000+ scientists worldwide. 140 ready-to-use skills plus 100+ scientific databases covering biology, chemistry, medicine, and drug discovery. Compatible with Cursor, Claude Code, Codex, Pi, Antigravity, and the open Agent Skills standard.",28197,29,2898,1,29,Python,"agent-skills,ai-scientist,bioinformatics,chemoinformatics,claude,claude-skills,claudecode,clinical-research,computational-biology,data-analysis,drug-discovery,genomics,materials-science,metabolomics,proteomics,scientific-computing,scientific-visualization",2025-10-19T20:54:15Z,2026-06-14T22:44:03Z,2026-06-13T14:30:30Z,False
156,microsoft/semantic-kernel,https://github.com/microsoft/semantic-kernel,Integrate cutting-edge LLM technology quickly and easily into your apps,28119,4,4648,1,283,C#,"ai,artificial-intelligence,llm,openai,sdk",2023-02-27T17:39:42Z,2026-06-14T22:52:07Z,2026-06-12T22:35:21Z,False
157,TanStack/table,https://github.com/TanStack/table,"🤖 Headless UI for building powerful tables & datagrids for TS/JS -  React-Table, Vue-Table, Solid-Table, Svelte-Table",28090,2,3525,0,385,TypeScript,"datagrid,datagrids,datatable,filtering,grid,grouping,hooks,javascript,pagination,react,reactjs,solid,solidjs,sorting,svelte,sveltejs,table,typescript,vue",2016-10-20T17:25:08Z,2026-06-14T23:15:30Z,2026-06-14T23:20:32Z,False
158,davila7/claude-code-templates,https://github.com/davila7/claude-code-templates,CLI tool for configuring and monitoring Claude Code,28053,17,2906,-1,173,Python,"anthropic,anthropic-claude,claude,claude-code",2025-07-04T01:26:26Z,2026-06-14T23:38:36Z,2026-06-14T04:35:57Z,False
159,AlexsJones/llmfit,https://github.com/AlexsJones/llmfit,Hundreds of models & providers. One command to find what runs on your hardware.,27885,28,1707,1,73,Rust,"gguf,llm,localai,mlx,skill,unsloth",2026-02-15T16:11:31Z,2026-06-15T00:10:27Z,2026-06-13T09:52:22Z,False
160,huggingface/smolagents,https://github.com/huggingface/smolagents,🤗 smolagents: a barebones library for agents that think in code.,27857,10,2688,1,599,Python,,2024-12-05T11:28:04Z,2026-06-14T23:42:02Z,2026-06-09T18:35:29Z,False
161,assafelovic/gpt-researcher,https://github.com/assafelovic/gpt-researcher,An autonomous agent that conducts deep research on any data using any LLM providers,27702,8,3734,1,222,Python,"agent,ai,automation,deepresearch,llms,mcp,mcp-server,python,research,search,webscraping",2023-05-12T10:33:54Z,2026-06-14T23:56:10Z,2026-05-28T07:41:25Z,False
162,Wei-Shaw/sub2api,https://github.com/Wei-Shaw/sub2api,"Sub2API is an open-source relay platform that unifies Claude, OpenAI, Gemini, and Antigravity subscriptions into a single endpoint. It supports account sharing and cost-sharing, with seamless native tool compatibility.",27701,61,5614,22,1635,Go,"2api,antigravity2api,cc2api,claude,claude-code,codex,crs,crs2,gemini",2025-12-18T02:26:18Z,2026-06-15T00:12:40Z,2026-06-14T17:24:16Z,False
163,heygen-com/hyperframes,https://github.com/heygen-com/hyperframes,Write HTML. Render video. Built for agents.,27628,154,2599,16,73,TypeScript,"ai,animation,ffmpeg,framework,gsap,html,mcp,puppeteer,rendering,typescript,video",2026-03-10T01:51:06Z,2026-06-15T00:17:19Z,2026-06-15T00:17:16Z,False
164,chopratejas/headroom,https://github.com/chopratejas/headroom,"Compress tool outputs, logs, files, and RAG chunks before they reach the LLM. 60-95% fewer tokens, same answers. Library, proxy, MCP server.",27556,732,1868,68,260,Python,"agent,ai,anthropic,claude-code,compression,context-engineering,context-window,cursor,fastapi,langchain,llm,mcp,openai,prompt-engineering,proxy,python,rag,token-optimization,tokens,typescript",2026-01-07T19:58:51Z,2026-06-15T00:18:09Z,2026-06-14T06:38:37Z,False
165,eyaltoledano/claude-task-master,https://github.com/eyaltoledano/claude-task-master,"An AI-powered task-management system you can drop into Cursor, Lovable, Windsurf, Roo, and others.",27518,17,2580,1,197,JavaScript,"ai,cursor,cursor-ai,cursorai,lovable,lovable-dev,roocode,task-manager,tasks,tasks-list,windsurf,windsurf-ai",2025-03-04T18:54:54Z,2026-06-14T23:42:56Z,2026-04-28T13:27:12Z,False
166,hugohe3/ppt-master,https://github.com/hugohe3/ppt-master,"AI generates a real, editable PowerPoint from any document — native shapes & animations, speaker notes voiced as audio narration, and the option to follow your own .pptx template, not slide images · by Hugo He",27515,159,2448,12,15,Python,"ai-agent,aippt,office,powerpoint,powerpoint-generation,ppt,pptx,presentation,slide,slides",2025-12-10T06:54:33Z,2026-06-15T00:11:23Z,2026-06-14T14:15:50Z,False
167,getzep/graphiti,https://github.com/getzep/graphiti,Build Real-Time Knowledge Graphs for AI Agents,27425,23,2743,2,373,Python,"agents,graph,llms,rag",2024-08-08T22:08:30Z,2026-06-14T23:28:32Z,2026-06-12T22:16:03Z,False
168,fingerprintjs/fingerprintjs,https://github.com/fingerprintjs/fingerprintjs,The most advanced free and open-source browser fingerprinting library,27302,1,2539,0,17,TypeScript,"audio-fingerprinting,browser,browser-fingerprint,browser-fingerprinting,detection,fingerprint,fingerprinting,fingerprintjs,fraud,fraud-detection,identification,javascript,visitor-identifier",2015-02-11T08:49:54Z,2026-06-14T15:34:11Z,2026-06-10T21:31:53Z,False
169,ScrapeGraphAI/Scrapegraph-ai,https://github.com/ScrapeGraphAI/Scrapegraph-ai,Python scraper based on AI,27205,21,2564,4,0,Python,"ai-crawler,ai-scraping,ai-search,crawler,data-extraction,firecrawl-alternative,large-language-model,llm,markdown,rag,scraping,scraping-python,web-crawler,web-crawlers,web-data,web-data-extraction,web-scraper,web-scraping,web-search,webscraping",2024-01-27T16:54:38Z,2026-06-14T23:49:18Z,2026-06-11T09:17:55Z,False
170,virattt/dexter,https://github.com/virattt/dexter,An autonomous agent for deep financial research,27069,11,3367,1,98,TypeScript,,2025-10-14T21:02:00Z,2026-06-14T23:33:46Z,2026-06-10T00:49:14Z,False
171,BloopAI/vibe-kanban,https://github.com/BloopAI/vibe-kanban,"Get 10X more out of Claude Code, Codex or any coding agent",26998,5,2852,0,532,Rust,"agent,ai-agents,kanban,management,task-manager",2025-06-14T19:10:21Z,2026-06-15T00:01:36Z,2026-04-24T09:17:34Z,False
172,supermemoryai/supermemory,https://github.com/supermemoryai/supermemory,"Memory and context engine + app that is extremely fast, scalable, and can be run fully locally. The Memory API for the AI era.",26993,27,2347,3,43,TypeScript,"agent-memory,ai-memory,cloudflare-kv,cloudflare-pages,cloudflare-workers,drizzle-orm,memory,postgres,remix,tailwindcss,typescript,vite",2024-02-27T20:10:04Z,2026-06-15T00:13:54Z,2026-06-14T20:21:50Z,False
173,mbadolato/iTerm2-Color-Schemes,https://github.com/mbadolato/iTerm2-Color-Schemes,"Over 450 terminal color schemes/themes for iTerm/iTerm2. Includes ports to Terminal, Konsole, PuTTY, Xresources, XRDB, Remmina, Termite, XFCE, Tilda, FreeBSD VT, Terminator, Kitty, MobaXterm, LXTerminal, Microsoft's Windows Terminal, Visual Studio, Alacritty, Ghostty, and many more",26978,2,6519,1,28,Shell,"color-scheme,freebsd-vt,iterm,iterm2,konsole,konsole-color-schemes,lxterminal,osx-terminal-themes,putty,putty-color-schemes,schemes,terminal,terminal-schemes,terminal-themes,terminator,theme,themes,windows-terminal,xrdb,xresources",2011-04-01T04:01:46Z,2026-06-14T20:55:36Z,2026-06-08T16:04:44Z,False
174,tobi/qmd,https://github.com/tobi/qmd,"mini cli search engine for your docs, knowledge bases, meeting notes, whatever. Tracking current sota approaches while being all local",26543,31,1666,1,141,TypeScript,,2025-12-08T14:22:57Z,2026-06-14T23:08:46Z,2026-06-08T16:50:52Z,False
175,mlflow/mlflow,https://github.com/mlflow/mlflow,"The open source AI engineering platform for agents, LLMs, and ML models. MLflow enables teams of all sizes to debug, evaluate, monitor, and optimize production-quality AI applications while controlling costs and managing access to models and data.",26520,12,5844,6,1979,Python,"agentops,agents,ai,ai-governance,apache-spark,evaluation,langchain,llm-evaluation,llmops,machine-learning,ml,mlflow,mlops,model-management,observability,open-source,openai,prompt-engineering",2018-06-05T16:05:58Z,2026-06-15T00:12:20Z,2026-06-15T00:12:17Z,False
176,huggingface/open-r1,https://github.com/huggingface/open-r1,Fully open reproduction of DeepSeek-R1,26310,2,2440,3,341,Python,,2025-01-24T15:44:11Z,2026-06-14T21:59:30Z,2026-04-02T14:03:15Z,False
177,yamadashy/repomix,https://github.com/yamadashy/repomix,"📦 Repomix is a powerful tool that packs your entire repository into a single, AI-friendly file. Perfect for when you need to feed your codebase to Large Language Models (LLMs) or other AI tools like Claude, ChatGPT, DeepSeek, Perplexity, Gemini, Gemma, Llama, Grok, and more.",26269,20,1371,1,163,TypeScript,"ai,anthropic,artificial-intelligence,chatbot,chatgpt,claude,deepseek,developer-tools,gemini,genai,generative-ai,gpt,javascript,language-model,llama,llm,mcp,nodejs,openai,typescript",2024-07-13T07:11:32Z,2026-06-14T23:30:14Z,2026-06-14T14:45:58Z,False
178,volcengine/OpenViking,https://github.com/volcengine/OpenViking,"OpenViking is an open-source context database designed specifically for AI Agents(such as openclaw). OpenViking unifies the management of context (memory, resources, and skills) that Agents need through a file system paradigm, enabling hierarchical context delivery and self-evolving.",25637,13,1979,0,234,Python,"agent,agentic-rag,ai-agents,clawbot,context-database,context-engineering,filesystem,llm,memory,openclaw,opencode,rag,skill",2026-01-05T07:11:17Z,2026-06-14T22:26:45Z,2026-06-14T18:20:00Z,False
179,PrefectHQ/fastmcp,https://github.com/PrefectHQ/fastmcp,"🚀 The fast, Pythonic way to build MCP servers and clients.",25626,6,2067,0,265,Python,"agents,fastmcp,llms,mcp,mcp-clients,mcp-servers,mcp-tools,model-context-protocol,python",2024-11-30T01:47:40Z,2026-06-14T22:42:29Z,2026-06-06T01:30:50Z,False
180,deepset-ai/haystack,https://github.com/deepset-ai/haystack,"Open-source AI orchestration framework for building context-engineered, production-ready LLM applications. Design modular pipelines and agent workflows with explicit control over retrieval, routing, memory, and generation. Built for scalable agents, RAG, multimodal applications, semantic search, and conversational systems.",25566,4,2853,5,137,MDX,"agent,agents,ai,gemini,generative-ai,gpt-4,information-retrieval,large-language-models,llm,machine-learning,nlp,orchestration,python,pytorch,question-answering,rag,retrieval-augmented-generation,semantic-search,summarization,transformers",2019-11-14T09:05:28Z,2026-06-14T23:20:32Z,2026-06-12T15:45:23Z,False
181,zai-org/Open-AutoGLM,https://github.com/zai-org/Open-AutoGLM,An Open Phone Agent Model & Framework. Unlocking the AI Phone for Everyone,25517,6,3973,-1,253,Python,"agent,phone-use-agent",2025-12-08T09:23:44Z,2026-06-14T18:04:31Z,2026-03-06T08:38:39Z,False
182,oraios/serena,https://github.com/oraios/serena,"A powerful MCP toolkit for coding, providing semantic retrieval and editing capabilities  - the IDE for your agent",25349,14,1697,2,127,Python,"agent,ai,ai-coding,claude,claude-code,codex,ide,jetbrains,language-server,mcp-server,programming,vibe-coding",2025-03-23T22:35:24Z,2026-06-14T23:52:21Z,2026-06-12T22:40:08Z,False
183,charmbracelet/crush,https://github.com/charmbracelet/crush,Glamourous agentic coding for all 💘,25317,21,1815,2,503,Go,"agentic-ai,ai,llms,ravishing",2025-05-21T12:14:57Z,2026-06-14T22:53:02Z,2026-06-14T19:44:48Z,False
184,lucidrains/vit-pytorch,https://github.com/lucidrains/vit-pytorch,"Implementation of Vision Transformer, a simple way to achieve SOTA in vision classification with only a single transformer encoder, in Pytorch",25311,2,3501,0,141,Python,"artificial-intelligence,attention-mechanism,computer-vision,image-classification,transformers",2020-10-03T22:47:24Z,2026-06-14T17:21:41Z,2026-06-14T16:34:26Z,False
185,QwenLM/qwen-code,https://github.com/QwenLM/qwen-code,An open-source AI coding agent that lives in your terminal.,25211,17,2504,4,760,TypeScript,,2025-06-26T01:37:46Z,2026-06-14T22:04:27Z,2026-06-14T22:04:07Z,False
186,jarrodwatts/claude-hud,https://github.com/jarrodwatts/claude-hud,"A Claude Code plugin that shows what's happening - context usage, active tools, running agents, and todo progress",25156,18,1141,-1,7,JavaScript,"anthropic,claude,claude-code,cli,plugin,statusline,typescript",2026-01-02T01:35:07Z,2026-06-14T21:31:52Z,2026-06-13T21:32:29Z,False
187,mastra-ai/mastra,https://github.com/mastra-ai/mastra,"From the team behind Gatsby, Mastra is a framework for building AI-powered applications and agents with a modern TypeScript stack.",25069,21,2229,4,420,TypeScript,"agents,ai,chatbots,evals,javascript,llm,mcp,nextjs,nodejs,reactjs,tts,typescript,workflows",2024-08-06T20:44:31Z,2026-06-15T00:09:47Z,2026-06-14T20:35:27Z,False
188,vercel/ai,https://github.com/vercel/ai,"The AI Toolkit for TypeScript. From the creators of Next.js, the AI SDK is a free open-source library for building AI-powered applications and agents ",24864,11,4596,2,1746,TypeScript,"anthropic,artificial-intelligence,gemini,generative-ai,generative-ui,javascript,language-model,llm,nextjs,openai,react,svelte,typescript,vercel,vue",2023-05-23T15:04:08Z,2026-06-15T00:13:45Z,2026-06-14T23:38:40Z,False
189,HKUDS/DeepTutor,https://github.com/HKUDS/DeepTutor,DeepTutor: Agent-native Personalized Tutoring. https://deeptutor.info/.,24761,8,3350,1,53,Python,"ai-agents,ai-tutor,clawdbot,cli-tool,deepresearch,interactive-learning,large-language-models,multi-agent-systems,rag",2025-12-28T15:35:54Z,2026-06-14T22:52:22Z,2026-06-14T08:16:35Z,False
190,langchain-ai/deepagents,https://github.com/langchain-ai/deepagents,The batteries-included agent harness.,24613,23,3487,3,113,Python,"ai,deepagents,langchain,langgraph,python,typescript",2025-07-27T23:07:53Z,2026-06-14T23:50:01Z,2026-06-14T23:26:35Z,False
191,toon-format/toon,https://github.com/toon-format/toon,"🎒 Token-Oriented Object Notation (TOON) – Compact, human-readable, schema-aware JSON for LLM prompts. Spec, benchmarks, TypeScript SDK.",24556,-1,1090,0,16,TypeScript,"data-format,llm,serialization,tokenization",2025-10-22T18:17:32Z,2026-06-14T22:52:14Z,2026-06-12T16:01:19Z,False
192,gastownhall/beads,https://github.com/gastownhall/beads,Beads - A memory upgrade for your coding agent,24522,10,1643,2,472,Go,"agents,claude-code,coding",2025-10-12T03:09:46Z,2026-06-15T00:14:55Z,2026-06-14T19:57:11Z,False
193,jackwener/OpenCLI,https://github.com/jackwener/OpenCLI,Make Any Website into CLI & Use your logged-in browser by AI agent. ,24346,42,2437,3,167,JavaScript,"ai-agent,ai-agents,ai-tools,browser-automation,browser-use,cli,playwright",2026-03-14T22:10:23Z,2026-06-14T20:56:33Z,2026-06-14T17:48:20Z,False
194,alchaincyf/nuwa-skill,https://github.com/alchaincyf/nuwa-skill,你想蒸馏的下一个员工，何必是同事。蒸馏任何人的思维方式——心智模型、决策启发式、表达DNA。Distill how anyone thinks.,24294,39,3561,3,16,Python,,2026-04-05T04:33:04Z,2026-06-14T23:55:49Z,2026-06-14T12:25:29Z,False
195,blader/humanizer,https://github.com/blader/humanizer,Claude Code skill that removes signs of AI-generated writing from text,24178,96,2298,13,55,,,2026-01-18T05:30:15Z,2026-06-15T00:01:14Z,2026-06-07T23:28:05Z,False
196,jhao104/proxy_pool,https://github.com/jhao104/proxy_pool,Python ProxyPool for web spider,23409,2,5388,-1,297,Python,"crawler,http,proxy,redis,spider",2016-11-25T13:49:07Z,2026-06-14T22:43:22Z,2026-06-09T13:04:09Z,False
197,timqian/chinese-independent-blogs,https://github.com/timqian/chinese-independent-blogs,中文独立博客列表,23312,2,2646,1,25,Python,"blog,china,rss",2019-10-22T09:22:45Z,2026-06-14T15:18:39Z,2026-06-13T03:29:04Z,False
198,modelcontextprotocol/python-sdk,https://github.com/modelcontextprotocol/python-sdk,The official Python SDK for Model Context Protocol servers and clients,23308,3,3545,1,556,Python,,2024-09-24T21:01:35Z,2026-06-14T23:18:41Z,2026-06-12T18:46:11Z,False
199,SuperClaude-Org/SuperClaude_Framework,https://github.com/SuperClaude-Org/SuperClaude_Framework,"A configuration framework that enhances Claude Code with specialized commands, cognitive personas, and development methodologies.",23302,4,1978,0,67,Python,,2025-06-22T12:03:53Z,2026-06-15T00:16:11Z,2026-06-13T16:40:33Z,False
200,OthmanAdi/planning-with-files,https://github.com/OthmanAdi/planning-with-files,"Persistent file-based planning for AI coding agents and long-running agentic tasks. Crash-proof markdown plans that survive context loss and /clear, plus a deterministic completion gate and multi-agent shared state on disk. Manus-style. Works with Claude Code, Codex CLI, Cursor, Kiro, OpenCode and 60+ agents via the SKILL.md standard.",23298,31,2048,6,7,Python,"agent-skills,agentic-ai,ai-agents,autonomous-agents,claude,claude-code,claude-skills,codex,coding-agent,context-engineering,copilot,cursor,developer-tools,github-copilot,llm-agents,long-running-agents,manus,multi-agent-systems,pi,planning",2026-01-03T07:37:28Z,2026-06-14T23:48:03Z,2026-06-14T23:47:56Z,False
201,spmallick/learnopencv,https://github.com/spmallick/learnopencv,Learn OpenCV  : C++ and Python Examples,22971,1,11693,0,262,Jupyter Notebook,"ai,computer-vision,computervision,deep-learning,deep-neural-networks,deeplearning,machine-learning,opencv,opencv-cpp,opencv-library,opencv-python,opencv-tutorial,opencv3",2015-02-17T08:00:51Z,2026-06-14T13:54:44Z,2026-06-11T12:38:49Z,False
202,rohitg00/agentmemory,https://github.com/rohitg00/agentmemory,#1 Persistent memory for AI coding agents based on real-world benchmarks,22802,63,1877,8,303,TypeScript,"agentmemory,agents,ai,claude,claudecode,codex,copilot,cursor,genai,harness,hermes,memory,openclaw",2026-02-25T07:32:52Z,2026-06-15T00:06:57Z,2026-06-11T09:48:24Z,False
203,micro/go-micro,https://github.com/micro/go-micro,A Go framework for services and agents,22775,0,2405,0,1,Go,"distributed-systems,go,golang,micro,microservices,rpc",2015-01-13T23:30:18Z,2026-06-14T02:49:42Z,2026-06-10T10:05:43Z,False
204,activepieces/activepieces,https://github.com/activepieces/activepieces,AI Agents & MCPs & AI Workflow Automation • (~400 MCP servers for AI agents) • AI Automation / AI Agent with MCPs • AI Workflows & AI Agents • MCPs for AI Agents,22760,10,3804,2,515,TypeScript,"ai-agent,ai-agent-tools,ai-agents,ai-agents-framework,mcp,mcp-server,mcp-tools,mcps,n8n-alternative,no-code-automation,workflow,workflow-automation,workflows",2022-12-03T02:52:46Z,2026-06-15T00:13:58Z,2026-06-14T22:53:25Z,False
