rank,full_name,url,description,stars,star_delta_vs_previous_day,forks,fork_delta_vs_previous_day,open_issues,language,topics,created_at,updated_at,pushed_at,archived
1,obra/superpowers,https://github.com/obra/superpowers,An agentic skills framework & software development methodology that works.,227806,444,20265,47,283,Shell,,2025-10-09T19:45:18Z,2026-06-15T00:18:26Z,2026-06-13T22:17:11Z,False
2,affaan-m/ECC,https://github.com/affaan-m/ECC,"The agent harness performance optimization system. Skills, instincts, memory, security, and research-first development for Claude Code, Codex, Opencode, Cursor and beyond.",215489,341,33123,48,61,JavaScript,"ai-agents,anthropic,claude,claude-code,developer-tools,llm,mcp,productivity",2026-01-18T00:51:51Z,2026-06-15T00:18:21Z,2026-06-11T20:24:32Z,False
3,ultraworkers/claw-code,https://github.com/ultraworkers/claw-code,"An agent-managed museum exhibit, built in Rust with Gajae-Code / LazyCodex — developed and maintained with no human intervention.",193796,35,109967,7,8,Rust,,2026-03-31T08:58:08Z,2026-06-15T00:03:13Z,2026-06-08T06:06:12Z,False
4,NousResearch/hermes-agent,https://github.com/NousResearch/hermes-agent,The agent that grows with you,193506,444,33846,127,20599,Python,"ai,ai-agent,ai-agents,anthropic,chatgpt,claude,claude-code,clawdbot,codex,hermes,hermes-agent,llm,moltbot,nous-research,openai,openclaw",2025-07-22T22:22:28Z,2026-06-15T00:15:31Z,2026-06-15T00:15:15Z,False
5,multica-ai/andrej-karpathy-skills,https://github.com/multica-ai/andrej-karpathy-skills,"A single CLAUDE.md file to improve Claude Code behavior, derived from Andrej Karpathy's observations on LLM coding pitfalls.",175362,368,17885,32,119,,,2026-01-27T03:53:13Z,2026-06-15T00:18:19Z,2026-04-20T10:05:04Z,False
6,ollama/ollama,https://github.com/ollama/ollama,"Get up and running with Kimi-K2.6, GLM-5.1, MiniMax, DeepSeek, gpt-oss, Qwen, Gemma and other models.",174168,55,16617,12,3417,Go,"deepseek,gemma,gemma3,glm,go,golang,gpt-oss,llama,llama3,llm,llms,minimax,mistral,ollama,qwen",2023-06-26T19:39:32Z,2026-06-15T00:11:38Z,2026-06-14T06:09:43Z,False
7,anthropics/skills,https://github.com/anthropics/skills,Public repository for Agent Skills,150686,192,17790,23,958,Python,agent-skills,2025-09-22T15:53:31Z,2026-06-15T00:18:23Z,2026-06-09T20:35:19Z,False
8,langflow-ai/langflow,https://github.com/langflow-ai/langflow,Langflow is a powerful tool for building and deploying AI-powered agents and workflows.,149665,21,9267,4,950,Python,"agents,chatgpt,generative-ai,large-language-models,multiagent,react-flow",2023-02-08T22:28:03Z,2026-06-14T21:50:15Z,2026-06-14T01:06:51Z,False
9,x1xhlol/system-prompts-and-models-of-ai-tools,https://github.com/x1xhlol/system-prompts-and-models-of-ai-tools,"FULL Augment Code, Claude Code, Cluely, CodeBuddy, Comet, Cursor, Devin AI, Junie, Kiro, Leap.new, Lovable, Manus, NotionAI, Orchids.app, Perplexity, Poke, Qoder, Replit, Same.dev, Trae, Traycer AI, VSCode Agent, Warp.dev, Windsurf, Xcode, Z.ai Code, Dia & v0. (And other Open Sourced) System Prompts, Internal Tools & AI Models",140456,44,34678,3,155,,"ai,bolt,cluely,copilot,cursor,cursorai,devin,github-copilot,lovable,open-source,perplexity,replit,system-prompts,trae,trae-ai,trae-ide,v0,vscode,windsurf,windsurf-ai",2025-03-05T16:38:29Z,2026-06-15T00:06:50Z,2026-06-12T08:45:15Z,False
10,firecrawl/firecrawl,https://github.com/firecrawl/firecrawl,"The API to search, scrape, and interact with the web at scale. 🔥",132759,233,7797,7,381,TypeScript,"ai,ai-agents,ai-crawler,ai-scraping,ai-search,crawler,data-extraction,html-to-markdown,llm,markdown,scraper,scraping,web-crawler,web-data,web-data-extraction,web-scraper,web-scraping,web-search,webscraping",2024-04-15T21:02:29Z,2026-06-15T00:18:14Z,2026-06-14T13:20:17Z,False
11,anthropics/claude-code,https://github.com/anthropics/claude-code,"Claude Code is an agentic coding tool that lives in your terminal, understands your codebase, and helps you code faster by executing routine tasks, explaining complex code, and handling git workflows - all through natural language commands.",132382,90,21432,11,9009,Python,,2025-02-22T17:41:21Z,2026-06-15T00:11:28Z,2026-06-13T01:25:15Z,False
12,mattpocock/skills,https://github.com/mattpocock/skills,Skills for Real Engineers. Straight from my .claude directory.,128775,568,11257,53,79,Shell,,2026-02-03T11:15:53Z,2026-06-15T00:17:44Z,2026-06-12T08:25:23Z,False
13,msitarzewski/agency-agents,https://github.com/msitarzewski/agency-agents,"A complete AI agency at your fingertips - From frontend wizards to Reddit community ninjas, from whimsy injectors to reality checkers. Each agent is a specialized expert with personality, processes, and proven deliverables.",113159,154,18459,23,76,Shell,,2025-10-13T12:12:29Z,2026-06-15T00:15:25Z,2026-06-07T20:42:10Z,False
14,github/spec-kit,https://github.com/github/spec-kit,💫 Toolkit to help you get started with Spec-Driven Development,112148,109,9891,11,422,Python,"ai,copilot,development,engineering,prd,spec,spec-driven",2025-08-21T22:54:31Z,2026-06-14T23:44:04Z,2026-06-11T21:53:40Z,False
15,garrytan/gstack,https://github.com/garrytan/gstack,"Use Garry Tan's exact Claude Code setup: 23 opinionated tools that serve as CEO, Designer, Eng Manager, Release Manager, Doc Engineer, and QA",110135,165,16375,30,669,TypeScript,,2026-03-11T21:22:45Z,2026-06-15T00:02:48Z,2026-06-14T18:40:57Z,False
16,google-gemini/gemini-cli,https://github.com/google-gemini/gemini-cli,An open-source AI agent that brings the power of Gemini directly into your terminal.,105276,14,14067,6,1315,TypeScript,"ai,ai-agents,cli,gemini,gemini-api,mcp-client,mcp-server",2025-04-17T17:04:31Z,2026-06-15T00:01:50Z,2026-06-14T02:51:47Z,False
17,farion1231/cc-switch,https://github.com/farion1231/cc-switch,"A cross-platform desktop All-in-One assistant for Claude Code, Codex, OpenCode, OpenClaw, Gemini CLI & Hermes Agent. Only official website: ccswitch.io",100624,267,6649,24,1424,Rust,"ai-tools,claude-code,codex,desktop-app,hermes,hermes-agent,mcp,minimax,omo,open-source,openclaw,openclaw-ui,opencode,provider-management,rust,skills,skills-management,tauri,typescript,wsl-support",2025-08-04T14:16:16Z,2026-06-15T00:18:35Z,2026-06-14T16:23:02Z,False
18,browser-use/browser-use,https://github.com/browser-use/browser-use,🌐 Make websites accessible for AI agents. Automate tasks online with ease.,98821,76,11029,9,295,Python,"ai-agents,ai-tools,browser-automation,browser-use,llm,playwright,python",2024-10-31T16:00:56Z,2026-06-15T00:08:03Z,2026-06-13T21:08:02Z,False
19,puppeteer/puppeteer,https://github.com/puppeteer/puppeteer,JavaScript API for Chrome and Firefox,94640,91,9438,5,265,TypeScript,"automation,chrome,chromium,developer-tools,firefox,headless-chrome,node-module,testing,web",2017-05-09T22:16:13Z,2026-06-15T00:16:32Z,2026-06-14T03:02:56Z,False
20,nextlevelbuilder/ui-ux-pro-max-skill,https://github.com/nextlevelbuilder/ui-ux-pro-max-skill,An AI SKILL that provide design intelligence for building professional UI/UX multiple platforms,91634,195,9568,22,189,Python,"ai-skills,antigravity,claude,claude-code,codex,command-line,copilot,cursor-ai,html5,kiro,landing-page,mobile-ui,qoder,react,tailwindcss,trae,ui-design,uikit,windsurf-ai",2025-11-30T11:36:31Z,2026-06-15T00:13:59Z,2026-04-03T05:08:19Z,False
21,microsoft/playwright,https://github.com/microsoft/playwright,"Playwright is a framework for Web Testing and Automation. It allows testing Chromium, Firefox and WebKit with a single API. ",90950,35,5925,5,179,TypeScript,"automation,chrome,chromium,e2e-testing,electron,end-to-end-testing,firefox,javascript,playwright,test,test-automation,testing,testing-tools,web,webkit",2019-11-15T18:32:42Z,2026-06-14T23:29:23Z,2026-06-14T17:52:43Z,False
22,ChatGPTNextWeb/NextChat,https://github.com/ChatGPTNextWeb/NextChat,✨ Light and Fast AI Assistant. Support: Web | iOS | MacOS | Android |  Linux | Windows,88244,3,59574,-1,839,TypeScript,"calclaude,chatgpt,claude,cross-platform,desktop,fe,gemini,gemini-pro,gemini-server,gemini-ultra,gpt-4o,groq,nextjs,ollama,react,tauri,tauri-app,vercel,webui",2023-03-10T18:27:54Z,2026-06-14T22:06:18Z,2026-05-15T01:19:01Z,False
23,modelcontextprotocol/servers,https://github.com/modelcontextprotocol/servers,Model Context Protocol Servers,87219,25,11004,4,578,TypeScript,,2024-11-19T01:10:17Z,2026-06-15T00:15:44Z,2026-06-07T22:29:30Z,False
24,TauricResearch/TradingAgents,https://github.com/TauricResearch/TradingAgents,TradingAgents: Multi-Agents LLM Financial Trading Framework,86143,164,16640,35,290,Python,"agent,finance,llm,multiagent,trading",2024-12-28T03:31:08Z,2026-06-15T00:14:21Z,2026-06-14T18:49:03Z,False
25,laravel/laravel,https://github.com/laravel/laravel,"Laravel is a web application framework with expressive, elegant syntax. We’ve already laid the foundation for your next big idea — freeing you to create without sweating the small things.",84474,1,24736,-2,31,Blade,"framework,laravel,php",2011-06-08T03:06:08Z,2026-06-14T22:43:50Z,2026-06-11T19:59:00Z,False
26,thedotmack/claude-mem,https://github.com/thedotmack/claude-mem,"Persistent Context Across Sessions for Every Agent –  Captures everything your agent does during sessions, compresses it with AI, and injects relevant context back into future sessions. Works with Claude Code, OpenClaw, Codex, Gemini, Hermes, Copilot, OpenCode + More",82264,77,7104,4,128,JavaScript,"ai,ai-agents,ai-memory,anthropic,artificial-intelligence,chromadb,claude,claude-agent-sdk,claude-agents,claude-code,claude-code-plugin,claude-skills,embeddings,long-term-memory,mem0,memory-engine,openmemory,rag,sqlite,supermemory",2025-08-31T20:50:03Z,2026-06-15T00:13:23Z,2026-06-15T00:13:53Z,False
27,OpenHands/OpenHands,https://github.com/OpenHands/OpenHands,🙌 OpenHands: AI-Driven Development,77060,81,9794,17,330,Python,"agent,artificial-intelligence,chatgpt,claude-ai,cli,developer-tools,gpt,llm,openai",2024-03-13T03:33:31Z,2026-06-14T23:58:29Z,2026-06-14T21:19:05Z,False
28,thedaviddias/Front-End-Checklist,https://github.com/thedaviddias/Front-End-Checklist,"🗂 The essential checklist for modern web development, for humans and AI agents",72936,11,6651,1,3,MDX,"ai-agent,ai-agents,checklist,css,front-end-developer-tool,front-end-development,frontend,guidelines,html,javascript,lists,reference,resources,rules,web-development",2017-10-16T10:12:36Z,2026-06-15T00:14:22Z,2026-06-09T20:18:49Z,False
29,JuliusBrussee/caveman,https://github.com/JuliusBrussee/caveman,🪨 why use many token when few token do trick — Claude Code skill that cuts 65% of tokens by talking like caveman,72501,237,4087,13,286,JavaScript,"ai,anthropic,caveman,claude,claude-code,llm,meme,prompt-engineering,skill,tokens",2026-04-04T10:03:00Z,2026-06-15T00:17:32Z,2026-06-12T13:51:06Z,False
30,daytonaio/daytona,https://github.com/daytonaio/daytona,Daytona is a Secure and Elastic Infrastructure for Running AI-Generated Code,72427,-5,5612,0,469,TypeScript,"agentic-workflow,ai,ai-agents,ai-runtime,ai-sandboxes,code-execution,code-interpreter,developer-tools",2024-02-06T08:21:20Z,2026-06-14T23:25:05Z,2026-06-14T09:23:25Z,False
31,Eugeny/tabby,https://github.com/Eugeny/tabby,A terminal for a more modern age,72111,5,4067,3,2714,TypeScript,"serial,ssh-client,telnet-client,terminal,terminal-emulators",2016-12-23T09:06:10Z,2026-06-14T21:22:32Z,2026-06-11T11:09:57Z,False
32,bytedance/deer-flow,https://github.com/bytedance/deer-flow,"An open-source long-horizon SuperAgent harness that researches, codes, and creates. With the help of sandboxes, memories, tools, skill, subagents and message gateway, it handles different levels of tasks that could take minutes to hours.",71162,25,9644,5,946,Python,"agent,agentic,agentic-framework,agentic-workflow,ai,ai-agents,deep-research,harness,langchain,langgraph,langmanus,llm,multi-agent,nodejs,podcast,python,superagent,typescript",2025-05-07T02:50:19Z,2026-06-15T00:03:19Z,2026-06-14T14:46:57Z,False
33,pewdiepie-archdaemon/odysseus,https://github.com/pewdiepie-archdaemon/odysseus,Self-hosted AI workspace. ,70970,533,9033,93,1369,Python,,2026-05-31T14:05:51Z,2026-06-15T00:14:46Z,2026-06-13T17:03:51Z,False
34,paperclipai/paperclip,https://github.com/paperclipai/paperclip,The open-source app everyone uses to manage agents at work,70388,45,13072,13,4996,TypeScript,,2026-03-02T15:01:51Z,2026-06-14T23:48:28Z,2026-06-13T00:58:39Z,False
35,OpenBB-finance/OpenBB,https://github.com/OpenBB-finance/OpenBB,"Financial data platform for analysts, quants and AI agents.",69144,56,6961,6,70,Python,"ai,crypto,derivatives,economics,equity,finance,fixed-income,machine-learning,openbb,options,python,quantitative-finance,stocks",2020-12-20T10:46:38Z,2026-06-15T00:14:52Z,2026-06-10T04:19:41Z,False
36,unclecode/crawl4ai,https://github.com/unclecode/crawl4ai,"🚀🤖 Crawl4AI: Open-source LLM Friendly Web Crawler & Scraper. Don't be shy, join here: https://discord.gg/jP8KfhDhyN",68494,44,6994,3,98,Python,,2024-05-09T09:48:50Z,2026-06-14T23:55:50Z,2026-06-04T06:19:50Z,False
37,opendatalab/MinerU,https://github.com/opendatalab/MinerU,Transforms complex documents like PDFs and Office docs into LLM-ready markdown/JSON for your Agentic workflows.,67528,43,5687,4,21,Python,"ai4science,document-analysis,docx,extract-data,layout-analysis,ocr,parser,pdf,pdf-converter,pdf-extractor-llm,pdf-extractor-pretrain,pdf-extractor-rag,pdf-parser,pptx,python,xlsx",2024-02-29T08:52:34Z,2026-06-14T23:50:18Z,2026-06-15T00:00:27Z,False
38,safishamsi/graphify,https://github.com/safishamsi/graphify,"AI coding assistant skill (Claude Code, Codex, OpenCode, Cursor, Gemini CLI, and more). Turn any folder of code, SQL schemas, R scripts, shell scripts, docs, papers, images, or videos into a queryable knowledge graph. App code + database schema + infrastructure in one graph.",67142,270,6802,34,349,Python,"antigravity,claude-code,codex,gemini,graphrag,knowledge-graph,leiden,openclaw,rag,skills,tree-sitter",2026-04-03T15:49:07Z,2026-06-15T00:15:52Z,2026-06-13T18:44:37Z,False
39,unslothai/unsloth,https://github.com/unslothai/unsloth,"Unsloth Studio is a web UI for training and running open models like Gemma 4, Qwen3.6, DeepSeek, gpt-oss locally.",66512,40,5961,3,1313,Python,"agent,deepseek,fine-tuning,gemma,gemma3,gpt-oss,llama,llama3,llm,llms,mistral,openai,qwen,reinforcement-learning,self-hosted,text-to-speech,tts,ui,unsloth",2023-11-29T16:50:09Z,2026-06-15T00:17:52Z,2026-06-14T15:41:57Z,False
40,shareAI-lab/learn-claude-code,https://github.com/shareAI-lab/learn-claude-code,"Bash is all you need -  A nano claude code–like 「agent harness」, built from 0 to 1",66496,46,10833,8,71,Python,"agent,agent-development,ai-agent,claude,claude-code,educational,llm,python,teaching,tutorial",2025-06-29T15:34:15Z,2026-06-15T00:05:20Z,2026-06-07T04:39:59Z,False
41,xtekky/gpt4free,https://github.com/xtekky/gpt4free,The official gpt4free repository | various collection of powerful language models | opus 4.6 gpt 5.3 kimi 2.5 deepseek v3.2 gemini 3,66330,4,13575,-1,2,Python,"chatbot,chatbots,chatgpt,chatgpt-4,chatgpt-api,chatgpt-free,chatgpt4,deepseek,deepseek-api,deepseek-r1,gpt,gpt-4,gpt-4o,gpt4,gpt4-api,language-model,openai,openai-api,openai-chatgpt,reverse-engineering",2023-03-29T17:00:43Z,2026-06-14T22:56:24Z,2026-06-14T21:41:34Z,False
42,bradtraversy/design-resources-for-developers,https://github.com/bradtraversy/design-resources-for-developers,"Curated list of design and UI resources from stock photos, web templates, CSS frameworks, UI libraries, tools and much more",66039,9,12089,2,40,,,2020-05-06T14:40:35Z,2026-06-14T19:59:16Z,2026-05-24T10:07:48Z,False
43,nexu-io/open-design,https://github.com/nexu-io/open-design,"🎨 Local-first, open-source Claude Design alternative. 🖥️ Native desktop app. ⚡ 259+ Skills · ✨ 142+ Design Systems 🖼️ Web · desktop · mobile prototypes · slides · images · videos · HyperFrames 📦 Sandboxed preview · HTML/PDF/PPTX/MP4 export 🤖 Claude Code / OpenClaw / Codex / Cursor / OpenCode / Qwen / Copilot / Hermes / Kimi & 17+ CLIs.",64797,275,7263,41,385,TypeScript,"agent-skills,ai-agents,ai-design,byok,claude-code-for-design,claude-design,codex-design,coding-agents,cursor-design,design-systems,design-tools,desktop-app,figma-alternative,generative-ai,hermes-agent,local-first,no-code,prototyping,ui-generator,vibe-coding",2026-04-28T04:25:20Z,2026-06-15T00:17:37Z,2026-06-14T14:35:08Z,False
44,gsd-build/get-shit-done,https://github.com/gsd-build/get-shit-done,"A light-weight and powerful meta-prompting, context engineering and spec-driven development system for Claude Code by TÂCHES.",64226,10,5466,0,6,JavaScript,"claude-code,context-engineering,meta-prompting,spec-driven-development",2025-12-14T14:17:12Z,2026-06-14T23:09:52Z,2026-05-31T17:46:54Z,False
45,openinterpreter/openinterpreter,https://github.com/openinterpreter/openinterpreter,"A lightweight coding agent for open models like Deepseek, Kimi, and Qwen",63954,9,5545,-2,337,Python,"coding-agent,deepseek,interpreter,kimi,qwen,rust,tui",2023-07-14T07:10:44Z,2026-06-15T00:18:04Z,2026-06-10T16:53:55Z,False
46,D4Vinci/Scrapling,https://github.com/D4Vinci/Scrapling,🕷️ An adaptive Web Scraping framework that handles everything from a single request to a full-scale crawl!,63657,121,6217,21,7,Python,"ai,ai-scraping,automation,crawler,crawling,crawling-python,data,data-extraction,mcp,mcp-server,playwright,python,scraping,selectors,stealth,web-scraper,web-scraping,web-scraping-python,webscraping,xpath",2024-10-13T20:29:53Z,2026-06-15T00:07:37Z,2026-06-07T18:42:12Z,False
47,cline/cline,https://github.com/cline/cline,"Autonomous coding agent as an SDK, IDE extension, or CLI assistant.",63288,40,6689,10,1103,TypeScript,,2024-07-06T07:28:10Z,2026-06-14T23:47:21Z,2026-06-14T23:47:41Z,False
48,rtk-ai/rtk,https://github.com/rtk-ai/rtk,"CLI proxy that reduces LLM token consumption by 60-90% on common dev commands. Single Rust binary, zero dependencies",62297,103,3854,17,1223,Rust,"agentic-coding,ai-coding,anthropic,claude-code,cli,command-line-tool,cost-reduction,developer-tools,llm,open-source,productivity,rust,token-optimization",2026-01-22T16:54:16Z,2026-06-15T00:14:42Z,2026-06-14T16:30:02Z,False
49,code-yeongyu/oh-my-openagent,https://github.com/code-yeongyu/oh-my-openagent,"omo/lazycodex: The coding agent for tokenmaxxers;the one and only agent harness for complex codebases. For your Codex, for your OpenCode",62222,62,5040,4,691,TypeScript,"ai,ai-agents,anthropic,chatgpt,claude,claude-skills,codex,cursor,gemini,ide,openai,opencode,orchestration,tui,typescript",2025-12-03T01:40:05Z,2026-06-15T00:11:47Z,2026-06-14T16:01:04Z,False
50,warpdotdev/warp,https://github.com/warpdotdev/warp,"Warp is an agentic development environment, born out of the terminal.",61721,25,5008,10,4359,Rust,"bash,linux,macos,rust,shell,terminal,wasm,zsh",2021-07-08T18:48:08Z,2026-06-14T23:45:23Z,2026-06-14T23:41:54Z,False
51,docling-project/docling,https://github.com/docling-project/docling,Get your documents ready for gen AI,61558,41,4304,2,931,Python,"ai,convert,document-parser,document-parsing,documents,docx,html,markdown,pdf,pdf-converter,pdf-to-json,pdf-to-text,pptx,tables,xlsx",2024-07-09T07:50:26Z,2026-06-15T00:16:24Z,2026-06-14T05:41:28Z,False
52,ruvnet/ruflo,https://github.com/ruvnet/ruflo,"🌊 The leading agent meta-harness for Claude. Deploy intelligent multi-agent swarms, coordinate autonomous workflows, and build conversational AI systems. Features adaptive memory, self-learning swarm intelligence, RAG integration, and native Claude Code / Codex Integration",59479,115,6878,15,644,TypeScript,"agentic-ai,agentic-framework,agentic-rag,agentic-workflow,agents,ai-agents,ai-assistant,ai-coding,ai-skills,autonomous-agents,claude-code,codex,mcp-server,multi-agent,multi-agent-systems,npm,skills,swarm,swarm-intelligence,typescript",2025-06-02T21:24:20Z,2026-06-15T00:05:54Z,2026-06-14T07:54:58Z,False
53,addyosmani/agent-skills,https://github.com/addyosmani/agent-skills,Production-grade engineering skills for AI coding agents.,59461,515,6439,61,137,Shell,"agent-skills,antigravity,antigravity-ide,claude-code,cursor,skills",2026-02-15T20:20:26Z,2026-06-15T00:17:24Z,2026-06-14T08:41:45Z,False
54,sansan0/TrendRadar,https://github.com/sansan0/TrendRadar,"⭐AI-driven public opinion & trend monitor with multi-platform aggregation, RSS, and smart alerts.🎯 告别信息过载，你的 AI 舆情监控助手与热点筛选工具！聚合多平台热点 +  RSS 订阅，支持关键词精准筛选。AI 智能筛选新闻 + AI 翻译 +  AI 分析简报直推手机，也支持接入 MCP 架构，赋能 AI 自然语言对话分析、情感洞察与趋势预测等。支持 Docker ，数据本地/云端自持。集成微信/飞书/钉钉/Telegram/邮件/ntfy/bark/slack 等渠道智能推送。",59429,16,24659,8,45,Python,"ai,bark,data-analysis,docker,hot-news,llm,mail,mcp,mcp-server,news,ntfy,python,rss,trending-topics,wechat,wework",2025-04-28T11:42:16Z,2026-06-15T00:13:48Z,2026-06-13T00:32:33Z,False
55,Egonex-AI/Understand-Anything,https://github.com/Egonex-AI/Understand-Anything,"Graphs that teach > graphs that impress. Turn any code into an interactive knowledge graph you can explore, search, and ask questions about. Works with Claude Code, Codex, Cursor, Copilot, Gemini CLI, and more.",59184,281,4916,20,215,TypeScript,"antigravity-skills,business-knowledge,claude-code,claude-skills,codebase-analysis,codex,codex-skills,developer-tools-ai-agent,gemini-cli-skills,karpathy-llm-wiki,knowledge-base,knowledge-graph,memory,opencode-skills,pi-agent,understandcode,vibe-coding",2026-03-15T02:30:51Z,2026-06-15T00:15:05Z,2026-06-11T08:28:17Z,False
56,microsoft/autogen,https://github.com/microsoft/autogen,A programming framework for agentic AI,58949,9,8895,0,887,Python,"agentic,agentic-agi,agents,ai,autogen,autogen-ecosystem,chatgpt,framework,llm-agent,llm-framework",2023-08-18T11:43:45Z,2026-06-15T00:15:22Z,2026-04-15T11:59:09Z,False
57,mem0ai/mem0,https://github.com/mem0ai/mem0,Universal memory layer for AI Agents,58554,35,6726,4,400,Python,"agents,ai,ai-agents,application,chatbots,chatgpt,genai,llm,long-term-memory,memory,memory-management,python,rag,state-management",2023-06-20T08:58:36Z,2026-06-15T00:09:10Z,2026-06-13T20:13:29Z,False
58,meilisearch/meilisearch,https://github.com/meilisearch/meilisearch,A lightning-fast search engine API bringing AI-powered hybrid search to your sites and applications.,58097,10,2563,-1,308,Rust,"ai,api,app-search,database,enterprise-search,faceting,full-text-search,fuzzy-search,geosearch,hybrid-search,instantsearch,search,search-as-you-type,search-engine,semantic-search,site-search,typo-tolerance,vector-database,vector-search,vectors",2018-04-23T11:45:28Z,2026-06-14T23:38:35Z,2026-06-11T15:36:29Z,False
59,shanraisshan/claude-code-best-practice,https://github.com/shanraisshan/claude-code-best-practice,from vibe coding to agentic engineering - practice makes claude perfect,57710,49,5793,0,8,HTML,"agentic-ai,agentic-coding,agentic-engineering,agentic-workflow,ai,ai-agents,anthropic,best-practices,boris,claude,claude-ai,claude-code,claude-code-agents,claude-code-best-practices,claude-code-commands,claude-code-skills,context-engineering,pakistan,pakistani-developer,vibe-coding",2025-10-31T14:15:28Z,2026-06-15T00:02:32Z,2026-06-14T21:10:38Z,False
60,upstash/context7,https://github.com/upstash/context7,Context7 Platform -- Up-to-date code documentation for LLMs and AI code editors,57355,31,2709,1,16,TypeScript,"llm,mcp,mcp-server,vibe-coding",2025-03-26T23:40:39Z,2026-06-15T00:15:32Z,2026-06-13T16:26:21Z,False
61,zylon-ai/private-gpt,https://github.com/zylon-ai/private-gpt,"Interact with your documents using the power of GPT, 100% privately, no data leaks",57257,7,7607,0,5,Python,"ai,ai-tools,on-premise",2023-05-02T09:15:31Z,2026-06-14T22:21:54Z,2026-06-12T13:23:06Z,False
62,coollabsio/coolify,https://github.com/coollabsio/coolify,"An open-source, self-hostable PaaS alternative to Vercel, Heroku & Netlify that lets you easily deploy static sites, databases, full-stack applications and 280+ one-click services on your own servers.",56968,33,4775,5,801,PHP,"coolify,databases,deployment,docker,docker-compose,inertiajs,laravel,mariadb,mysql,nextjs,nodejs,php,postgres,redis,self-hosted,self-hosting,server,static-site,svelte,svelte5",2021-01-25T20:54:01Z,2026-06-15T00:01:03Z,2026-06-14T11:55:25Z,False
63,OpenCut-app/OpenCut,https://github.com/OpenCut-app/OpenCut,The open-source CapCut alternative,55703,34,6073,7,325,TypeScript,"editor,oss,videoeditor",2025-06-22T08:02:17Z,2026-06-14T23:58:25Z,2026-05-27T22:37:31Z,False
64,MemPalace/mempalace,https://github.com/MemPalace/mempalace,The best-benchmarked open-source AI memory system. And it's free.,55605,43,7207,1,581,Python,"ai,chromadb,llm,mcp,memory,python",2026-04-05T01:12:07Z,2026-06-14T23:58:37Z,2026-06-14T22:54:17Z,False
65,Zie619/n8n-workflows,https://github.com/Zie619/n8n-workflows,all of the workflows of n8n i could find (also from the site itself),55139,9,7303,1,29,Python,,2025-05-14T08:43:59Z,2026-06-14T22:17:52Z,2026-05-31T14:09:36Z,False
66,Fission-AI/OpenSpec,https://github.com/Fission-AI/OpenSpec,Spec-driven development (SDD) for AI coding assistants.,54745,59,3841,5,403,TypeScript,"ai,context-engineering,engineering,planning,prd,sdd,sdlc,spec,spec-driven-development,specification",2025-08-05T10:37:45Z,2026-06-15T00:11:14Z,2026-06-13T01:49:22Z,False
67,crewAIInc/crewAI,https://github.com/crewAIInc/crewAI,"Framework for orchestrating role-playing, autonomous AI agents. By fostering collaborative intelligence, CrewAI empowers agents to work together seamlessly, tackling complex tasks.",53548,25,7498,8,455,Python,"agents,ai,ai-agents,aiagentframework,llms",2023-10-27T03:26:59Z,2026-06-14T23:20:33Z,2026-06-14T23:07:31Z,False
