rank,full_name,url,description,stars,star_delta_vs_previous_day,forks,fork_delta_vs_previous_day,open_issues,language,topics,created_at,updated_at,pushed_at,archived
330,GLips/Figma-Context-MCP,https://github.com/GLips/Figma-Context-MCP,MCP server to provide Figma layout information to AI coding agents like Cursor,15365,8,1210,2,22,TypeScript,"ai,cursor,figma,mcp,typescript",2025-02-13T02:55:06Z,2026-07-10T15:34:13Z,2026-07-03T14:24:36Z,False
331,lra/mackup,https://github.com/lra/mackup,Backup and keep your application settings in sync.,15286,-1,946,-1,294,Python,,2013-04-06T19:22:54Z,2026-07-10T17:57:00Z,2026-06-15T00:33:53Z,False
332,WEIFENG2333/VideoCaptioner,https://github.com/WEIFENG2333/VideoCaptioner,🎬 卡卡字幕助手 | VideoCaptioner - 基于 LLM 的智能字幕助手 - 视频字幕生成、断句、校正、字幕翻译全流程处理！- A powered tool for easy and efficient video subtitling.,15285,10,1293,0,178,Python,"ai,subtitle,translate,video-subtile",2024-10-31T03:06:23Z,2026-07-10T16:47:27Z,2026-07-05T13:02:03Z,False
333,MODSetter/SurfSense,https://github.com/MODSetter/SurfSense,NotebookLM for Competitive Intelligence Research. Give your AI agents Competitive Intelligence. Join our Discord: https://discord.gg/ejRNvftDp9,15219,5,1462,2,109,Python,"agent,agents,ai,chrome-extension,extension,fastapi,langchain,langgraph,nextjs,notebooklm,ollama,perplexity,python,rag,typescript",2024-07-30T23:00:09Z,2026-07-10T22:26:56Z,2026-07-10T22:38:15Z,False
334,jaywcjlove/reference,https://github.com/jaywcjlove/reference,面向开发者的技术速查清单（Cheat Sheets）集合，整理常见技术、工具与开发流程，帮助快速查阅关键信息，提高开发效率。,15149,1,2220,0,196,Dockerfile,"cheatsheet,docker,javascript,npm,npm-package,react,reactjs,references,semver,toml,typescript,vue3,vuejs",2022-09-24T17:49:19Z,2026-07-10T18:11:17Z,2026-07-02T14:57:00Z,False
335,theonedev/onedev,https://github.com/theonedev/onedev,"Git Server with CI/CD, Kanban, and Packages. Seamless integration. Unparalleled experience.",15083,4,965,0,0,Java,"ci-cd,devops,git,kanban,packages,self-hosted",2018-11-06T02:57:01Z,2026-07-10T18:43:04Z,2026-07-10T13:18:33Z,False
336,diegosouzapw/OmniRoute,https://github.com/diegosouzapw/OmniRoute,"Never stop coding. Free AI gateway: one endpoint, 231+ providers (50+ free), connect Claude Code, Codex, Cursor, Cline & Copilot to FREE Claude/GPT/Gemini. RTK+Caveman stacked compression saves 15-95% tokens, smart auto-fallback, MCP/A2A, multimodal APIs, Desktop/PWA.",15037,748,2299,186,234,TypeScript,"a2a,ai-agents,ai-gateway,anthropic,claude,claude-code,cline,codex,copilot,cursor,deepseek,free-ai,gemini,gemini-cli,llm-gateway,mcp,openai,openai-proxy,qwen,token-saver",2026-02-13T12:38:31Z,2026-07-10T23:16:36Z,2026-07-10T22:54:17Z,False
337,andrewyng/aisuite,https://github.com/andrewyng/aisuite,"Simple, unified interface to multiple Generative AI providers ",14917,6,1578,3,150,Python,,2024-06-30T20:07:46Z,2026-07-10T18:25:10Z,2026-06-26T13:11:34Z,False
338,wasp-lang/open-saas,https://github.com/wasp-lang/open-saas,"A 100% free modern JS SaaS boilerplate (React, NodeJS, Prisma). Full-featured: Auth (email, google, github, slack, MS), Email sending, Background jobs, Landing page, Payments (Stripe, Polar.sh), Shadcn UI, S3 file upload. AI-ready with tailored AGENTS.md, skills, and Claude Code plugin. One cmd deploy. Powered by Wasp full-stack framework.",14874,8,1774,0,114,TypeScript,"ai,authentication,aws-s3,boilerplate,chatgpt,full-stack,google-auth,hacktoberfest,nodejs,open-source,openai-api,postgresql,prisma,react,saas,saas-boilerplate,saas-starter,saas-template,typesafe,typescript",2023-12-01T13:54:36Z,2026-07-10T17:17:22Z,2026-07-08T14:37:49Z,False
339,llmware-ai/llmware,https://github.com/llmware-ai/llmware,"Unified framework for building enterprise RAG pipelines with small, specialized models",14815,-1,2909,0,90,Python,"agents,generative-ai-tools,llamacpp,llm,onnx,openvino,parsing,retrieval-augmented-generation,small-specialized-models",2023-09-29T15:19:06Z,2026-07-10T10:52:43Z,2026-05-17T13:53:37Z,False
340,HKUDS/OpenHarness,https://github.com/HKUDS/OpenHarness,"""OpenHarness: Open Agent Harness with a Built-in Personal Agent--Ohmo!""",14699,20,2396,3,55,Python,,2026-04-01T15:37:13Z,2026-07-10T19:09:48Z,2026-06-04T02:42:40Z,False
341,ag-ui-protocol/ag-ui,https://github.com/ag-ui-protocol/ag-ui,AG-UI: the Agent-User Interaction Protocol. Bring Agents into Frontend Applications.,14666,17,1328,1,326,TypeScript,"ag-ui-protocol,agent-frontend,agent-ui,agentic-workflow,ai-agents",2025-05-07T12:49:37Z,2026-07-10T22:19:55Z,2026-07-10T22:43:33Z,False
342,kyegomez/OpenMythos,https://github.com/kyegomez/OpenMythos,"A theoretical reconstruction of the Claude Mythos architecture, built from first principles using the available research literature.",14663,0,3296,-2,59,Python,"ai,anthropic,attention,claude,claude-ai,claude-code,claude-code-plugin,claude-mythos,claude-sonnet,deepmind,gpt-5,gpt-7,jax,looped-transformers,ml,pytorch,sonnet,torch",2026-04-18T12:57:52Z,2026-07-10T22:23:24Z,2026-05-23T11:58:48Z,False
343,xpzouying/xiaohongshu-mcp,https://github.com/xpzouying/xiaohongshu-mcp,MCP for xiaohongshu.com,14617,8,2170,1,284,Go,"mcp,mcp-server,xiaohongshu-mcp",2025-08-03T09:08:45Z,2026-07-10T22:44:25Z,2026-07-06T03:04:08Z,False
344,eigent-ai/eigent,https://github.com/eigent-ai/eigent,Eigent: The Open Source Cowork Desktop to Unlock Your Exceptional Productivity. Local and Free Alternative to Claude Cowork.,14531,7,1721,-1,200,TypeScript,"agent-framework,agent-skills,agentic-ai,agentic-workflow,claude-cowork,claude-cowork-alternative,claude-cowork-free,desktop-agent,multi-agent-systems",2025-07-29T15:56:02Z,2026-07-10T22:07:34Z,2026-07-10T16:17:36Z,False
345,google/skills,https://github.com/google/skills,Agent Skills for Google products and technologies,14502,14,1113,1,31,Python,"google,googlecloud,skills",2026-03-31T19:02:20Z,2026-07-10T23:08:07Z,2026-07-10T22:35:09Z,False
346,maurosoria/dirsearch,https://github.com/maurosoria/dirsearch,Web path scanner,14476,4,2437,0,26,Python,"appsec,brute,bug-bounty,bugbounty,dirsearch,enumeration,fuzzer,fuzzing,hacking,hacking-tool,infosec,penetration-testing,pentest-tool,pentesting,python,red-teaming,redteam,scanner,security,wordlist",2013-04-30T15:57:40Z,2026-07-10T16:36:52Z,2026-07-01T03:25:55Z,False
347,electerm/electerm,https://github.com/electerm/electerm,"📻Terminal/ssh/sftp/ftp/telnet/serialport/RDP/VNC/Spice client(linux, mac, win)",14455,9,1155,0,310,JavaScript,"ai,electerm,electron,file-manager,ftp,linux-app,macos-app,mcp,open-source,rdp,serialport,sftp,spice,ssh,telnet,terminal,vnc,windows-app,zmodem",2017-10-07T09:54:11Z,2026-07-10T23:04:09Z,2026-07-10T23:04:03Z,False
348,open-metadata/OpenMetadata,https://github.com/open-metadata/OpenMetadata,"The Open Context Layer for Data and AI ,  OpenMetadata is the open platform for building trusted data context and business semantics for humans, AI assistants, and agents.",14449,8,2221,4,976,TypeScript,"context,context-layer,data-catalog,data-collaboration,data-contracts,data-discovery,data-governance,data-lineage,data-observability,data-profiling,data-quality,data-quality-checks,datadiscovery,dataengineering,dataquality,mcp,mcp-server,metadata,metadata-management,semantics",2021-08-01T21:17:17Z,2026-07-10T22:40:15Z,2026-07-10T20:00:11Z,False
349,AndyMik90/Aperant,https://github.com/AndyMik90/Aperant,Autonomous multi-session AI coding,14437,1,1924,-1,81,TypeScript,,2025-12-04T22:10:37Z,2026-07-10T12:15:52Z,2026-06-14T08:27:00Z,False
350,yusufkaraaslan/Skill_Seekers,https://github.com/yusufkaraaslan/Skill_Seekers,"Convert documentation websites, GitHub repositories, and PDFs into Claude AI skills with automatic conflict detection",14422,10,1470,1,103,Python,"ai-tools,ast-parser,automation,claude-ai,claude-skills,code-analysis,conflict-detection,documentation,documentation-generator,github,github-scraper,mcp,mcp-server,multi-source,ocr,pdf,python,web-scraping",2025-10-17T14:43:48Z,2026-07-10T17:55:15Z,2026-07-02T21:50:59Z,False
351,iOfficeAI/OfficeCLI,https://github.com/iOfficeAI/OfficeCLI,"OfficeCLI is the first and best Office suite  purpose-built for AI agents to read, edit, and automate Word, Excel, and PowerPoint files. Free, open-source, single binary, no Office installation required.",14394,1023,977,66,22,C#,"agent,ai,claude-code,cli,codex,docx,excel,office,openclaw,pptx,presentation,skills,word,xlsx",2026-03-15T07:39:12Z,2026-07-10T23:15:53Z,2026-07-10T13:23:49Z,False
352,sindresorhus/pure,https://github.com/sindresorhus/pure,"Pretty, minimal and fast ZSH prompt",14343,2,1008,0,0,Shell,"git,minimal,prompt,pure,shell,shell-prompt,shell-theme,terminal,theme,zsh",2012-09-20T18:14:58Z,2026-07-10T16:08:46Z,2026-07-02T13:37:08Z,False
353,xpipe-io/xpipe,https://github.com/xpipe-io/xpipe,Access your entire server infrastructure from your local desktop,14250,9,541,0,60,Java,"bash,docker,filemanager,files,incus,java,javafx,k8s,kubernetes,lxd,networking,podman,sftp,ssh,tailscale,wsl",2023-01-27T02:25:38Z,2026-07-10T22:00:59Z,2026-07-10T14:22:35Z,False
354,nashsu/llm_wiki,https://github.com/nashsu/llm_wiki,"LLM Wiki is a cross-platform desktop application that turns your documents into an organized, interlinked knowledge base — automatically. Instead of traditional RAG (retrieve-and-answer from scratch every time), the LLM incrementally builds and maintains a persistent wiki from your sources。",14208,79,1697,9,214,TypeScript,,2026-04-08T11:24:01Z,2026-07-10T21:36:56Z,2026-07-10T06:24:34Z,False
355,GreyDGL/PentestGPT,https://github.com/GreyDGL/PentestGPT,Automated Penetration Testing Agentic Framework Powered by Large Language Models,14182,8,2466,1,70,Python,"large-language-models,llm,penetration-testing,python",2023-02-27T06:01:53Z,2026-07-10T20:21:45Z,2026-06-07T07:25:45Z,False
356,jbranchaud/til,https://github.com/jbranchaud/til,:memo: Today I Learned,14123,1,756,0,22,Vim Script,"learn-in-public,til,today-i-learned,writing",2015-02-07T04:03:24Z,2026-07-10T19:07:46Z,2026-07-10T19:07:02Z,False
357,prowler-cloud/prowler,https://github.com/prowler-cloud/prowler,Prowler is the world’s most widely used open-source cloud security platform that automates security and compliance across any cloud environment.,14120,7,2242,3,200,Python,"aws,azure,cis-benchmark,cloud,cloudsecurity,compliance,cspm,devsecops,forensics,gcp,gdpr,hacktoberfest,hardening,iam,multi-cloud,python,security,security-audit,security-hardening,security-tools",2016-08-24T15:12:24Z,2026-07-10T20:50:34Z,2026-07-10T16:22:32Z,False
358,logto-io/logto,https://github.com/logto-io/logto,"🧑‍🚀 Authentication and authorization infrastructure for SaaS and AI apps, built on OIDC and OAuth 2.1 with multi-tenancy, SSO, and RBAC.",14085,76,1094,101,179,TypeScript,"authentication,authorization,email,identity,jwt,login,logto,mfa,oauth2,openid-connect,password,passwordless,rbac,saml,signup,sms,social-login,sso,totp,typescript",2021-06-19T03:01:50Z,2026-07-10T22:50:22Z,2026-07-10T14:52:11Z,False
359,grokability/snipe-it,https://github.com/grokability/snipe-it,A free open source IT asset/license management system,14039,2,3872,0,1038,PHP,"asset-management,asset-manager,assets-management,itam,license-management",2013-11-12T22:25:47Z,2026-07-10T20:32:32Z,2026-07-10T19:53:39Z,False
360,genlayerlabs/genlayer-project-boilerplate,https://github.com/genlayerlabs/genlayer-project-boilerplate,,14015,8,714,1,32,TypeScript,,2024-06-28T06:59:47Z,2026-07-10T21:38:27Z,2026-07-01T18:43:33Z,False
361,NevaMind-AI/memU,https://github.com/NevaMind-AI/memU,"Personal memory for agents - fast memory retrieval, self-evolving skills, and lower cost.",14006,-1,1040,1,85,Python,"agent-memory,claude-skills,harness,loop-engineering,mcp,memory,openclaw,openclaw-skills,sandbox,skills",2025-07-29T01:54:40Z,2026-07-10T15:52:25Z,2026-07-10T03:42:52Z,False
362,casdoor/casdoor,https://github.com/casdoor/casdoor,"An open-source Agent-first Identity and Access Management (IAM) /LLM MCP & agent gateway and auth server with web UI supporting OpenClaw, MCP, OAuth, OIDC, SAML, CAS, LDAP, SCIM, WebAuthn, TOTP, MFA, Face ID, Google Workspace, Azure AD",13921,7,1733,1,100,Go,"agent,agentic-ai,agi,ai-gateway,auth,authentication,iam,llm,mcp,mcp-gateway,mfa,oauth,oidc,openclaw,radius,saml,scim,single-sign-on,sso,webauthn",2020-10-22T14:40:03Z,2026-07-10T21:21:59Z,2026-07-10T15:06:52Z,False
363,semaphoreui/semaphore,https://github.com/semaphoreui/semaphore,"Modern UI and powerful API for Ansible, Terraform/OpenTofu/Terragrunt, PowerShell and other DevOps tools.",13853,-1,1274,0,1025,Go,"ansible,awx,ci,cicd,devops,docker,docker-ui,go,golang,jenkins,opentofu,pulumi,terraform,terraform-ui,terragrunt",2014-08-23T22:43:31Z,2026-07-10T20:39:27Z,2026-07-10T11:05:43Z,False
364,YishenTu/claudian,https://github.com/YishenTu/claudian,An Obsidian plugin that embeds Claude Code/Codex as an AI collaborator in your vault,13825,31,872,2,89,TypeScript,"claude-code,codex,ide,obsidian,obsidian-plugin,productivity",2025-12-05T17:58:26Z,2026-07-10T19:58:24Z,2026-07-10T19:12:46Z,False
365,fish2018/pansou,https://github.com/fish2018/pansou,PanSou是一款高性能的网盘资源搜索API服务，支持TG频道和插件搜索。系统设计以性能和可扩展性为核心，支持多频道多插件并发搜索、结果智能排序和网盘类型分类。docker集成前后端，一键启动，开箱即用。仅供学习研究，请勿以各种形式用于盈利目的。 ,13814,10,3309,6,10,Go,,2025-07-10T07:17:46Z,2026-07-10T18:53:15Z,2026-06-14T14:06:26Z,False
366,chenhg5/cc-connect,https://github.com/chenhg5/cc-connect,"Bridge local AI coding agents (Claude Code, Cursor, Gemini CLI, Codex) to messaging platforms (Feishu/Lark, DingTalk, Slack, Telegram, Discord, LINE, WeChat Work). Chat with your AI dev assistant from anywhere — no public IP required for most platforms.",13787,34,1304,3,470,Go,,2026-02-28T02:39:39Z,2026-07-10T18:34:57Z,2026-07-08T00:26:02Z,False
367,andrewyng/context-hub,https://github.com/andrewyng/context-hub,,13776,5,1198,0,135,JavaScript,,2025-10-30T12:20:34Z,2026-07-10T18:24:27Z,2026-05-31T18:41:45Z,False
368,aiming-lab/AutoResearchClaw,https://github.com/aiming-lab/AutoResearchClaw,Fully autonomous & self-evolving research from idea to paper. Chat an Idea. Get a Paper. 🦞,13758,10,1614,1,19,Python,"autonomous-research,citation-verification,llm-agents,metaclaw,multi-agent-debate,openclaw,paper-generation,scientific-discovery,self-evolving",2026-03-15T03:38:49Z,2026-07-10T19:34:20Z,2026-06-03T15:58:09Z,False
369,coleam00/context-engineering-intro,https://github.com/coleam00/context-engineering-intro,"Context engineering is the new vibe coding - it's the way to actually make AI coding assistants work. Claude Code is the best for this so that's what this repo is centered around, but you can apply this strategy with any AI coding assistant!",13684,5,2729,1,33,Python,,2025-07-02T11:54:47Z,2026-07-10T18:10:50Z,2026-03-16T12:13:59Z,False
370,hardikpandya/stop-slop,https://github.com/hardikpandya/stop-slop,A skill file for removing AI tells from prose,13631,40,959,3,38,,,2026-01-11T12:00:59Z,2026-07-10T21:35:18Z,2026-03-17T18:50:39Z,False
371,pingdotgg/t3code,https://github.com/pingdotgg/t3code,,13523,60,2807,27,694,TypeScript,,2026-02-08T23:46:22Z,2026-07-10T23:13:49Z,2026-07-10T16:20:27Z,False
372,millionco/react-doctor,https://github.com/millionco/react-doctor,Your agent writes bad React. This catches it,13512,25,431,0,58,TypeScript,"agents,code-review,doctor,react,skill",2026-02-13T09:02:13Z,2026-07-10T23:01:42Z,2026-07-10T23:10:38Z,False
373,browserless/browserless,https://github.com/browserless/browserless,Deploy headless browsers in Docker. Run on our cloud or bring your own. Free for non-commercial uses.,13448,4,1023,-1,28,TypeScript,"browserless,chrome,docker,firefox,nodejs,playwright,puppeteer,typescript,webkit,websocket",2017-11-17T04:35:31Z,2026-07-10T17:38:06Z,2026-07-10T05:44:17Z,False
374,lsdefine/GenericAgent,https://github.com/lsdefine/GenericAgent,"Self-evolving agent: grows skill tree from 3.3K-line seed, achieving full system control with 6x less token consumption",13357,13,1540,1,170,Python,"ai-agent,automation,autonomous-agent,browser-automation,claude,computer-control,desktop-automation,gemini,lightweight,llm-agent,memory-system,python,self-evolving,skill-tree,task-automation",2026-01-16T15:45:24Z,2026-07-10T17:23:15Z,2026-07-10T14:27:31Z,False
375,pipecat-ai/pipecat,https://github.com/pipecat-ai/pipecat,Open Source framework for voice and multimodal conversational AI,13338,16,2293,3,229,Python,"ai,chatbot-framework,chatbots,real-time,voice,voice-assistant",2023-12-27T12:59:00Z,2026-07-10T21:58:54Z,2026-07-10T20:39:21Z,False
376,NanmiCoder/cc-haha,https://github.com/NanmiCoder/cc-haha,Claude Code 泄露源码 - 本地可运行版本，新增跨平台桌面端软件补齐Computer Use（附带核心模块解析）,13274,33,8424,7,112,TypeScript,,2026-03-31T17:30:14Z,2026-07-10T21:33:06Z,2026-07-10T21:32:31Z,False
377,fathah/hermes-desktop,https://github.com/fathah/hermes-desktop,Desktop Companion for Hermes Agent,13251,33,1507,1,359,TypeScript,"ai,ai-agent,autonomous-agents,chatbot,hermes,llm",2026-04-02T15:26:49Z,2026-07-10T22:58:48Z,2026-07-10T17:18:57Z,False
378,EleutherAI/lm-evaluation-harness,https://github.com/EleutherAI/lm-evaluation-harness,A framework for few-shot evaluation of language models.,13250,8,3402,0,906,Python,"evaluation-framework,language-model,transformer",2020-08-28T00:09:15Z,2026-07-10T21:47:39Z,2026-06-24T19:51:08Z,False
379,wanshuiyin/Auto-claude-code-research-in-sleep,https://github.com/wanshuiyin/Auto-claude-code-research-in-sleep,"ARIS ⚔️ (Auto-Research-In-Sleep) — Lightweight Markdown-only skills for autonomous ML research: cross-model review loops, idea discovery, and experiment automation. No framework, no lock-in — works with Claude Code, Codex, OpenClaw, or any LLM agent.",13237,40,1191,3,53,Python,"ai-research,ai-tools,aris,autonomous-agent,claude,claude-code,claude-code-skills,codex,deep-learning,gpt,idea-generation,llm,machine-learning,mcp,mcp-server,ml-research,openai,paper-review,paper-writing,research-automation",2026-03-10T07:31:45Z,2026-07-10T19:58:27Z,2026-07-10T16:18:44Z,False
380,dreammis/social-auto-upload,https://github.com/dreammis/social-auto-upload,自动化上传视频到社交媒体：抖音、小红书、视频号、tiktok、youtube、bilibili,13177,14,2290,3,61,Python,"bilibili,douyin,tiktok,xiaohongshu,youtube",2023-12-04T07:49:16Z,2026-07-10T19:36:52Z,2026-06-26T17:16:25Z,False
381,MetaMask/metamask-extension,https://github.com/MetaMask/metamask-extension,:globe_with_meridians: :electric_plug: The MetaMask browser extension enables browsing Ethereum blockchain enabled websites,13172,2,5553,1,2741,TypeScript,"brave,chrome,dapp,dapp-developers,edge,ethereum,extension,firefox,opera",2015-09-06T16:34:48Z,2026-07-10T22:37:45Z,2026-07-10T22:56:41Z,False
382,plantuml/plantuml,https://github.com/plantuml/plantuml,Generate diagrams from textual description,13171,8,1216,1,602,Java,"diagram,diagram-as-code,diagrams,diagrams-as-code,java,plantuml,uml,uml-diagram",2010-11-04T15:55:50Z,2026-07-10T22:08:25Z,2026-07-10T22:04:30Z,False
383,ccfos/nightingale,https://github.com/ccfos/nightingale,Nightingale is to monitoring and alerting what Grafana is to visualization.,13136,-2,1730,0,227,Go,"alerting,ccf,metrics,monitoring,nightingale,observability,open-falcon,time-series,tsdb",2020-03-03T17:08:26Z,2026-07-10T15:57:06Z,2026-07-10T15:25:43Z,False
384,jlcodes99/cockpit-tools,https://github.com/jlcodes99/cockpit-tools," 🚀 通用 AI IDE 账号管理工具：支持 Antigravity / Codex / GitHub Copilot / Windsurf / Kiro / Cursor / Gemini-cli / CodeBuddy，多账号切换、配额监控、自动唤醒与多开实例管理。 🚀 Universal AI IDE account manager for Antigravity / Codex / GitHub Copilot / Windsurf / Kiro / Cursor / Gemini-cli / CodeBuddy, with multi-account switching, quota monitoring, wake-up automation, and multi-insta",13100,103,1208,13,439,Rust,"account-manager,ai,antigravity,codebuddy,codex,cursor,github-copilot,kiro,windsurf",2026-01-16T07:09:32Z,2026-07-10T19:34:13Z,2026-07-10T19:09:10Z,False
385,ixartz/Next-js-Boilerplate,https://github.com/ixartz/Next-js-Boilerplate,"🚀🎉📚 Nextjs Boilerplate and Starter with App Router and Page Router support, Tailwind CSS 4 and TypeScript ⚡️ Made with developer experience first: Next.js 16 + TypeScript + ESLint + Prettier + Drizzle ORM + Husky + Lint-Staged + Vitest + Testing Library + Playwright + Storybook + Commitlint + VSCode + Sentry + PostCSS + Tailwind CSS ✨",13011,0,2398,-1,6,TypeScript,"boilerplate,boilerplate-code,jamstack,javascript,js-boilerplate,netlify-template,next-js,next-theme,nextjs,nextjs-starter,nextjs-template,react,react-boilerplate,reactjs,starter-kit,starter-project,starter-template,tailwind-css,tailwindcss,typescript",2020-07-22T19:47:35Z,2026-07-10T19:59:00Z,2026-07-08T15:27:26Z,False
386,MiniMax-AI/skills,https://github.com/MiniMax-AI/skills,,13006,14,1115,1,60,C#,,2026-03-17T07:19:25Z,2026-07-10T22:15:07Z,2026-04-18T09:48:47Z,False
387,supertone-inc/supertonic,https://github.com/supertone-inc/supertonic,"Lightning-Fast, On-Device, Multilingual TTS — running natively via ONNX.",12974,20,1334,3,123,Swift,"cpp,csharp,flutter,go,ios,java,lightweight,multilingual,nodejs,on-device,onnx,onnxruntime,python,rust,speech-synthesis,swift,text-to-speech,tts,web,webgpu",2025-11-18T08:23:58Z,2026-07-10T19:32:01Z,2026-06-30T07:07:06Z,False
388,BasedHardware/omi,https://github.com/BasedHardware/omi,"AI that sees your screen, listens to your conversations and tells you what to do",12966,3,2110,0,650,Dart,"ai,app,bci,c,flutter,friend,mobile,necklace,nextjs,omi,personas,python,smartglasses,summary,transcription,wearable",2024-03-22T18:12:25Z,2026-07-10T21:59:12Z,2026-07-10T22:38:28Z,False
389,tiny-craft/tiny-rdm,https://github.com/tiny-craft/tiny-rdm,"Tiny RDM (Tiny Redis Desktop Manager) - A modern, colorful, super lightweight Redis GUI client for Mac, Windows, and Linux. It also provides a web version that can be deployed via Docker.",12943,0,655,2,175,Vue,"go,golang,icon-pack,naive-ui,redis,redis-client,redis-desktop,redis-gui,redis-manager,redis-web,vue,wails,wails-app,web-view",2023-06-27T07:06:25Z,2026-07-10T11:08:58Z,2026-07-03T09:11:33Z,False
390,markmap/markmap,https://github.com/markmap/markmap,Build mindmaps with plain text,12941,5,994,0,62,TypeScript,"markmap,mindmap",2020-01-13T10:23:34Z,2026-07-10T17:29:40Z,2026-06-21T03:38:23Z,False
391,op7418/Humanizer-zh,https://github.com/op7418/Humanizer-zh,Humanizer 的汉化版本，Claude Code Skills，旨在消除文本中 AI 生成的痕迹。,12894,86,902,2,20,,,2026-01-19T04:23:44Z,2026-07-10T22:09:25Z,2026-01-19T07:46:35Z,False
392,modelcontextprotocol/typescript-sdk,https://github.com/modelcontextprotocol/typescript-sdk,The official TypeScript SDK for Model Context Protocol servers and clients,12823,2,1967,2,446,TypeScript,,2024-09-24T20:45:31Z,2026-07-10T22:07:14Z,2026-07-10T17:48:00Z,False
393,NVIDIA/SkillSpector,https://github.com/NVIDIA/SkillSpector,"Security scanner for AI agent skills. Detect vulnerabilities, malicious patterns, and security risks.",12769,153,1047,4,88,Python,,2026-03-21T00:28:43Z,2026-07-10T23:00:15Z,2026-07-10T20:16:23Z,False
394,neuml/txtai,https://github.com/neuml/txtai,"💡 All-in-one AI framework for semantic search, LLM orchestration and language model workflows",12715,4,843,0,11,Python,"agents,ai,ai-agents,embeddings,information-retrieval,language-model,large-language-models,llm,nlp,python,rag,retrieval-augmented-generation,search,search-engine,semantic-search,sentence-embeddings,transformers,txtai,vector-database,vector-search",2020-08-09T19:14:59Z,2026-07-10T21:17:46Z,2026-07-02T14:44:53Z,False
395,StarTrail-org/LEANN,https://github.com/StarTrail-org/LEANN,"[MLsys2026]: RAG on Everything with LEANN. Enjoy 97% storage savings while running a fast, accurate, and 100% private RAG application on your personal device.",12663,1,1141,0,44,Python,"ai,faiss,gpt-oss,langchain,llama-index,llm,localstorage,offline-first,ollama,privacy,python,rag,retrieval-augmented-generation,vector-database,vector-search,vectors",2025-06-09T06:52:59Z,2026-07-10T14:30:21Z,2026-07-03T02:43:27Z,False
396,xbtlin/ai-berkshire,https://github.com/xbtlin/ai-berkshire,AI 时代的伯克希尔：基于 Claude Code / Codex 的价值投资研究框架。巴菲特·芒格·段永平·李录四大师方法论 + 多Agent并行研究。| AI-era Berkshire: a value investing research framework built for Claude Code / Codex. 4 masters' methodologies + multi-agent adversarial analysis.,12636,298,1787,136,15,Python,"ai,ai-agent,anthropic,berkshire-hathaway,charlie-munger,china-stock,claude,claude-code,financial-analysis,fintech,fundamental-analysis,investment,investment-research,llm,mcp,portfolio-management,stock-analysis,stock-market,value-investing,warren-buffett",2026-04-07T11:19:51Z,2026-07-10T23:13:31Z,2026-07-10T17:10:38Z,False
397,siteboon/claudecodeui,https://github.com/siteboon/claudecodeui,"Use Claude Code, OpenCode, Cursor CLI, and Codex on mobile and web with CloudCLI (aka Claude Code UI). CloudCLI is a free open source webui/GUI that helps you manage your Claude Code session and projects remotely.",12545,22,1706,6,104,TypeScript,"anthropic,anthropic-ai,anthropic-claude,claude,claude-api,claude-code,claude-code-ui,claudecode,gui,mobile-first,react,ui",2025-06-25T12:51:12Z,2026-07-10T20:59:11Z,2026-07-10T08:00:54Z,False
398,nearai/ironclaw,https://github.com/nearai/ironclaw,"IronClaw is an Agent OS focused on privacy, security and extensibility",12519,5,1468,1,1376,Rust,"codeact,openclaw,rlm,rust,wasm",2026-02-03T06:57:10Z,2026-07-10T23:07:10Z,2026-07-10T23:17:26Z,False
