rank,full_name,url,description,stars,star_delta_vs_previous_day,forks,fork_delta_vs_previous_day,open_issues,language,topics,created_at,updated_at,pushed_at,archived
67,BerriAI/litellm,https://github.com/BerriAI/litellm,"Python SDK, Proxy Server (AI Gateway) to call 100+ LLM APIs in OpenAI (or native) format, with cost tracking, guardrails, loadbalancing and logging. [Bedrock, Azure, OpenAI, VertexAI, Cohere, Anthropic, Sagemaker, HuggingFace, VLLM, NVIDIA NIM]",49192,123,8575,25,3496,Python,"ai-gateway,anthropic,azure-openai,bedrock,gateway,langchain,litellm,llm,llm-gateway,llmops,mcp-gateway,openai,openai-proxy,vertex-ai",2023-07-27T00:09:52Z,2026-06-04T00:00:02Z,2026-06-04T00:16:35Z,False
68,penpot/penpot,https://github.com/penpot/penpot,Penpot: The open-source design tool for design and code collaboration,48862,56,3125,5,646,Clojure,"clojure,clojurescript,design,prototyping,ui,ux-design,ux-experience",2015-12-29T22:09:07Z,2026-06-03T23:38:45Z,2026-06-03T17:58:32Z,False
69,1c7/chinese-independent-developer,https://github.com/1c7/chinese-independent-developer,👩🏿‍💻👨🏾‍💻👩🏼‍💻👨🏽‍💻👩🏻‍💻中国独立开发者项目列表 -- 分享大家都在做什么,48727,14,4176,-1,2,,"china,indie,indie-developer",2017-09-21T11:08:23Z,2026-06-03T21:38:14Z,2026-06-03T17:42:49Z,False
70,bmad-code-org/BMAD-METHOD,https://github.com/bmad-code-org/BMAD-METHOD,Breakthrough Method for Agile Ai Driven Development,48558,60,5646,2,57,JavaScript,,2025-04-13T14:54:25Z,2026-06-03T23:30:36Z,2026-06-03T21:43:45Z,False
71,addyosmani/agent-skills,https://github.com/addyosmani/agent-skills,Production-grade engineering skills for AI coding agents.,48052,248,5325,33,97,Shell,"agent-skills,antigravity,antigravity-ide,claude-code,cursor,skills",2026-02-15T20:20:26Z,2026-06-04T00:12:42Z,2026-06-02T16:16:00Z,False
72,oobabooga/textgen,https://github.com/oobabooga/textgen,"Open-source desktop app for local LLMs. Text, vision, tool-calling, OpenAI/Anthropic-compatible API. 100% private.",47265,3,5976,-1,813,Python,,2022-12-21T04:17:37Z,2026-06-03T22:14:48Z,2026-06-02T03:10:11Z,False
73,serverless/serverless,https://github.com/serverless/serverless,"⚡ Serverless Framework – Effortlessly build apps that auto-scale, incur zero costs when idle, and require minimal maintenance using AWS Lambda and other managed cloud services.",46922,2,5733,1,1214,JavaScript,"aws,aws-dynamodb,aws-lambda,azure-functions,google-cloud-functions,microservice,serverless,serverless-architectures,serverless-framework",2015-04-21T03:48:40Z,2026-06-04T00:13:31Z,2026-06-03T19:12:56Z,False
74,GitHubDaily/GitHubDaily,https://github.com/GitHubDaily/GitHubDaily,"坚持分享 GitHub 上高质量、有趣实用的开源技术教程、开发者工具、编程网站、技术资讯。A list cool, interesting projects of GitHub.",46668,10,4643,2,621,,"ai,algorithms-and-data-structures,backend,developer-tools,development,frontend,github,java,javascript,kubernetes,linux,markdown,open-source,python,tutorials,web",2018-12-30T13:56:58Z,2026-06-03T17:30:45Z,2025-12-31T18:59:20Z,False
75,mudler/LocalAI,https://github.com/mudler/LocalAI,"LocalAI is the open-source AI engine. Run any model - LLMs, vision, voice, image, video - on any hardware. No GPU required.",46650,22,4132,3,195,Go,"agents,ai,api,audio-generation,decentralized,distributed,image-generation,libp2p,llama,llm,mamba,mcp,musicgen,object-detection,rerank,stable-diffusion,text-generation,tts",2023-03-18T22:58:02Z,2026-06-03T23:46:32Z,2026-06-03T22:32:15Z,False
76,jeecgboot/JeecgBoot,https://github.com/jeecgboot/JeecgBoot,AI 低代码平台「低代码 + 零代码」双驱动！低代码可一键生成前后端代码;零代码可 5 分钟搭建系统;AI Skills 一句话画流程、设计表单、生成整套系统。内置 AI聊天、知识库、流程编排、MCP插件等，兼容主流大模型。引领「AI 生成 → 在线配置 → 代码生成 → 手工合并->AI修改」开发模式，消除 Java 项目 80% 的重复工作，提效而不失灵活。,46607,27,16038,4,25,Java,"activiti,agent,ai,antd,claude-code,cli,codegenerator,codex,flowable,langchain4j,llm,low-code,mcp,mybatis-plus,rag,skills,spring-ai,springboot,springcloud,vue3",2018-11-26T10:40:00Z,2026-06-03T20:16:50Z,2026-05-23T11:30:11Z,False
77,aaif-goose/goose,https://github.com/aaif-goose/goose,"an open source, extensible AI agent that goes beyond code suggestions - install, execute, edit, and test with any LLM",46342,93,4823,21,264,Rust,"acp,ai,ai-agents,mcp",2024-08-23T19:03:36Z,2026-06-04T00:05:49Z,2026-06-03T23:59:31Z,False
78,prisma/prisma,https://github.com/prisma/prisma,"Next-generation ORM for Node.js & TypeScript | PostgreSQL, MySQL, MariaDB, SQL Server, SQLite, MongoDB and CockroachDB",46059,8,2234,1,2622,TypeScript,"cockroachdb,database,javascript,mariadb,mongo,mongodb,mongodb-orm,mssql,mysql,nodejs,orm,postgres,postgresql,prisma,prisma-client,query-builder,sql-server,sqlite,sqlserver,typescript",2019-06-20T13:33:47Z,2026-06-03T21:19:56Z,2026-06-03T16:29:53Z,False
79,apache/airflow,https://github.com/apache/airflow,"Apache Airflow - A platform to programmatically author, schedule, and monitor workflows",45683,8,17165,11,1695,Python,"airflow,apache,apache-airflow,automation,dag,data-engineering,data-integration,data-orchestrator,data-pipelines,data-science,elt,etl,machine-learning,mlops,orchestration,python,scheduler,workflow,workflow-engine,workflow-orchestration",2015-04-13T18:04:58Z,2026-06-03T23:56:51Z,2026-06-03T23:56:44Z,False
80,exo-explore/exo,https://github.com/exo-explore/exo,Run frontier AI locally.,45118,31,3213,2,245,Python,,2024-06-24T18:36:22Z,2026-06-04T00:06:23Z,2026-06-03T20:58:04Z,False
81,zhayujie/CowAgent,https://github.com/zhayujie/CowAgent,"Open-source super AI assistant & Agent Harness. Plans tasks, runs tools and skills, autonomously grows with memory and knowledge. Multi-model, multi-channel. Lightweight, extensible, one-line install. (formerly chatgpt-on-wechat)",45040,7,10167,2,8,Python,"ai,ai-agent,ai-agents,chatgpt-on-wechat,claude,claude-code,codex,cowagent,deepseek,harness,llm,mcp,multi-agent,openai,openclaw,skills",2022-08-07T08:33:41Z,2026-06-03T22:53:58Z,2026-06-03T09:43:36Z,False
82,KeygraphHQ/shannon,https://github.com/KeygraphHQ/shannon,"Shannon Lite is an autonomous, white-box AI pentester for web applications and APIs. It analyzes your source code, identifies attack vectors, and executes real exploits to prove vulnerabilities before they reach production.",44195,50,5109,7,10,TypeScript,"penetration-testing,pentesting,security-audit,security-automation,security-tools",2025-09-27T01:51:47Z,2026-06-04T00:02:43Z,2026-06-04T00:02:51Z,False
83,HKUDS/nanobot,https://github.com/HKUDS/nanobot,"Lightweight, open-source AI agent for your tools, chats, and workflows.",43597,58,7716,15,906,Python,"ai,ai-agent,ai-agents,anthropic,chatgpt,claude,claude-code,codex,codex-cli,llm,nanobot,openai,openclaw",2026-02-01T07:16:15Z,2026-06-04T00:14:02Z,2026-06-03T16:51:07Z,False
84,pewdiepie-archdaemon/odysseus,https://github.com/pewdiepie-archdaemon/odysseus,Self-hosted AI workspace. ,43463,,5048,,743,JavaScript,,2026-05-31T14:05:51Z,2026-06-04T00:16:53Z,2026-06-03T23:37:28Z,False
85,janhq/jan,https://github.com/janhq/jan,Jan is an open source alternative to ChatGPT that runs 100% offline on your computer.,42839,18,2904,2,425,TypeScript,"chatgpt,gpt,llamacpp,llm,localai,open-source,self-hosted,tauri",2023-08-17T02:17:10Z,2026-06-03T23:22:13Z,2026-06-02T03:00:21Z,False
86,gradio-app/gradio,https://github.com/gradio-app/gradio,"Build and share delightful machine learning apps, all in Python. 🌟 Star to support our work!",42795,5,3471,0,288,Python,"data-analysis,data-science,data-visualization,deep-learning,deploy,gradio,gradio-interface,interface,machine-learning,models,python,python-notebook,ui,ui-components",2018-12-19T08:24:04Z,2026-06-04T00:12:45Z,2026-06-03T21:58:21Z,False
87,ccxt/ccxt,https://github.com/ccxt/ccxt,A cryptocurrency trading API with more than 100 exchanges in JavaScript / TypeScript / Python / C# / PHP / Go / Java ,42778,15,8691,2,1327,Python,"altcoin,api,arbitrage,bitcoin,bot,btc,crypto,cryptocurrencies,cryptocurrency,eth,ethereum,exchange,invest,library,market-data,memecoin,merchant,strategy,trade,trading",2017-05-14T15:41:56Z,2026-06-03T23:15:07Z,2026-06-03T11:22:10Z,False
88,ChromeDevTools/chrome-devtools-mcp,https://github.com/ChromeDevTools/chrome-devtools-mcp,Chrome DevTools for coding agents,42731,103,2741,7,85,TypeScript,"browser,chrome,chrome-devtools,debugging,devtools,mcp,mcp-server,puppeteer",2025-09-11T10:39:55Z,2026-06-03T23:51:56Z,2026-06-03T17:02:42Z,False
89,danielmiessler/Fabric,https://github.com/danielmiessler/Fabric,Fabric is an open-source framework for augmenting humans using AI. It provides a modular system for solving specific problems using a crowdsourced set of AI prompts that can be used anywhere.,41979,45,4158,3,59,Go,"ai,augmentation,flourishing,life,work",2024-01-03T23:18:31Z,2026-06-03T23:35:55Z,2026-06-02T23:31:31Z,False
90,HKUDS/CLI-Anything,https://github.com/HKUDS/CLI-Anything,"""CLI-Anything: Making ALL Software Agent-Native"" -- CLI-Hub: https://clianything.cc/",41932,102,3963,12,60,Python,,2026-03-08T13:52:57Z,2026-06-04T00:01:25Z,2026-06-03T10:19:30Z,False
91,abhigyanpatwari/GitNexus,https://github.com/abhigyanpatwari/GitNexus,"GitNexus: The Zero-Server Code Intelligence Engine -       GitNexus is a client-side knowledge graph creator that runs entirely in your browser. Drop in a GitHub repo or ZIP file, and get an interactive knowledge graph wit a built in Graph RAG Agent. Perfect for code exploration",41231,86,4703,17,299,TypeScript,,2025-08-02T23:20:31Z,2026-06-04T00:15:04Z,2026-06-03T23:50:30Z,False
92,vuetifyjs/vuetify,https://github.com/vuetifyjs/vuetify,🐉 Vue Component Framework,40994,-3,7133,0,502,TypeScript,"javascript,material,material-components,material-design,material-theme,semantic,typescript,ui,ui-components,ui-design,ui-kit,ui-library,vue,vue-components,vue-material,vuejs,vuejs3,vuetify,vuetifyjs",2016-09-12T00:39:35Z,2026-06-03T17:45:14Z,2026-06-03T17:45:04Z,False
93,agno-agi/agno,https://github.com/agno-agi/agno,"Build, run, and manage agent platforms.",40496,24,5464,7,864,Python,"agents,ai,ai-agents,developer-tools,python",2022-05-04T15:23:02Z,2026-06-04T00:10:30Z,2026-06-04T00:10:24Z,False
94,trpc/trpc,https://github.com/trpc/trpc,🧙‍♀️  Move Fast and Break Nothing. End-to-end typesafe APIs made easy. ,40300,9,1628,0,230,TypeScript,"api,next,nextjs,prisma,react,typescript",2020-07-18T01:17:11Z,2026-06-03T21:54:19Z,2026-06-03T16:07:25Z,False
95,phaserjs/phaser,https://github.com/phaserjs/phaser,"Phaser is a fun, free and fast 2D game framework for making HTML5 games for desktop and mobile web browsers, supporting Canvas and WebGL rendering.",39724,3,7134,1,110,JavaScript,"canvas,discord-activities,facebook-instant-games,game-development,game-frameworks,gamedev,html5-game-development,javascript,phaser,phaser-development,phaserjs,webgl,youtube-playables",2013-04-12T12:27:51Z,2026-06-03T23:28:45Z,2026-06-03T07:27:55Z,False
96,colbymchenry/codegraph,https://github.com/colbymchenry/codegraph,"Pre-indexed code knowledge graph for Claude Code, Codex, Gemini, Cursor, OpenCode, AntiGravity, Kiro, and Hermes Agent — fewer tokens, fewer tool calls, 100% local",39280,1356,2441,96,193,TypeScript,,2026-01-18T21:45:37Z,2026-06-04T00:14:35Z,2026-06-04T00:02:24Z,False
97,vadimdemedes/ink,https://github.com/vadimdemedes/ink,🌈 React for interactive command-line apps,38752,18,1004,0,30,TypeScript,"cli,command-line,flexbox,interactive,javascript,react",2017-06-12T06:12:28Z,2026-06-03T23:46:48Z,2026-05-29T21:15:43Z,False
98,ant-design/ant-design-pro,https://github.com/ant-design/ant-design-pro,👨🏻‍💻👩🏻‍💻 Use Ant Design like a Pro!,38317,7,8242,-1,42,TypeScript,"admin,ant-design,antd,antv,boilerplate,dashboard,enterprise,react,umi",2017-08-25T10:40:44Z,2026-06-03T14:33:10Z,2026-06-03T10:24:38Z,False
99,chatanywhere/GPT_API_free,https://github.com/chatanywhere/GPT_API_free,Free ChatGPT&DeepSeek API Key，免费ChatGPT&DeepSeek API。免费接入DeepSeek API和GPT4 API，支持 gpt | deepseek | claude | gemini | grok 等排名靠前的常用大模型。,38316,19,2657,1,19,,"api,chatgpt,claude,deepseek,gemini,gpt,grok",2023-04-23T12:42:08Z,2026-06-04T00:02:57Z,2026-05-17T18:44:21Z,False
100,danny-avila/LibreChat,https://github.com/danny-avila/LibreChat,"Enhanced ChatGPT Clone: Features Agents, MCP, DeepSeek, Anthropic, AWS, OpenAI, Responses API, Azure, Groq, o1, GPT-5, Mistral, OpenRouter, Vertex AI, Gemini, Artifacts, AI model switching, message search, Code Interpreter, langchain, DALL-E-3, OpenAPI Actions, Functions, Secure Multi-User Auth, Presets, open-source for self-hosting. Active.",38053,105,7819,11,477,TypeScript,"ai,anthropic,artifacts,aws,azure,chatgpt,chatgpt-clone,claude,clone,deepseek,gemini,google,gpt-5,librechat,mcp,o1,openai,responses-api,vision,webui",2023-02-12T01:06:52Z,2026-06-03T23:51:32Z,2026-06-03T23:27:22Z,False
