rank,full_name,url,description,stars,star_delta_vs_previous_day,forks,fork_delta_vs_previous_day,open_issues,language,topics,created_at,updated_at,pushed_at,archived
136,JushBJJ/Mr.-Ranedeer-AI-Tutor,https://github.com/JushBJJ/Mr.-Ranedeer-AI-Tutor,A GPT-4 AI Tutor Prompt for customizable personalized learning experiences.,29612,0,3302,0,17,,"ai,education,gpt-4,llm",2023-03-31T12:37:26Z,2026-06-04T21:35:41Z,2025-09-30T08:08:00Z,False
137,lbjlaq/Antigravity-Manager,https://github.com/lbjlaq/Antigravity-Manager,Professional Antigravity Account Manager & Switcher. One-click seamless account switching for Antigravity Tools. Built with Tauri v2 + React (Rust).专业的 Antigravity 账号管理与切换工具。为 Antigravity 提供一键无缝账号切换功能。,29600,2,3207,1,1724,Rust,"account-manager,antigravity",2025-11-26T10:47:13Z,2026-06-04T23:45:24Z,2026-05-24T11:35:03Z,False
138,heroui-inc/heroui,https://github.com/heroui-inc/heroui,"🚀 Beautiful, fast and modern React UI library. (Previously NextUI)",29551,15,2162,1,61,MDX,"component-library,components,library,reactjs",2021-04-22T13:06:23Z,2026-06-04T20:38:01Z,2026-06-04T19:37:09Z,False
139,anthropics/claude-plugins-official,https://github.com/anthropics/claude-plugins-official,"Official, Anthropic-managed directory of high quality Claude Code Plugins.",29348,25,3146,5,720,Python,"claude-code,mcp,skills",2025-11-20T18:36:20Z,2026-06-04T21:55:45Z,2026-06-05T00:12:36Z,False
140,jamiepine/voicebox,https://github.com/jamiepine/voicebox,"The open-source AI voice studio. Clone, dictate, create.",29296,21,3595,4,426,TypeScript,"ai,cuda,mlx,qwen3-tts,qwen3-tts-ui,voice-ai,voice-clone,whisper",2026-01-25T12:27:03Z,2026-06-05T00:14:19Z,2026-04-26T20:29:17Z,False
141,sipeed/picoclaw,https://github.com/sipeed/picoclaw,"Tiny, Fast, and Deployable anywhere — automate the mundane, unleash your creativity",29286,7,4196,0,82,Go,,2026-02-04T12:32:35Z,2026-06-05T00:03:55Z,2026-06-04T22:02:56Z,False
142,tastejs/todomvc,https://github.com/tastejs/todomvc,"Helping you select a JavaScript framework - Todo apps for React.js, Angular, Vue and many more",28924,0,13746,0,71,JavaScript,,2011-06-03T19:56:33Z,2026-06-03T20:29:26Z,2026-05-03T01:06:22Z,False
143,sgl-project/sglang,https://github.com/sgl-project/sglang,SGLang is a high-performance serving framework for large language models and multimodal models.,28874,-57,6336,11,3727,Python,"attention,blackwell,cuda,deepseek,diffusion,glm,gpt-oss,inference,llama,llm,minimax,moe,qwen,qwen-image,reinforcement-learning,transformer,vlm,wan",2024-01-08T04:15:52Z,2026-06-05T00:13:25Z,2026-06-05T00:13:21Z,False
144,ComposioHQ/composio,https://github.com/ComposioHQ/composio,"Composio powers 1000+ toolkits, tool search, context management, authentication, and a sandboxed workbench to help you build AI agents that turn intent into action.",28620,12,4604,1,125,TypeScript,"agentic-ai,agents,ai,ai-agents,aiagents,developer-tools,function-calling,gpt-4,javascript,js,llm,llmops,mcp,python,remote-mcp-server,sse,typescript",2024-02-23T13:58:27Z,2026-06-05T00:02:59Z,2026-06-04T20:53:40Z,False
145,langfuse/langfuse,https://github.com/langfuse/langfuse,"🪢 Open source LLM engineering platform: LLM Observability, metrics, evals, prompt management, playground, datasets. Integrates with OpenTelemetry, Langchain, OpenAI SDK, LiteLLM, and more. 🍊YC W23 ",28508,14,2950,6,670,TypeScript,"analytics,autogen,evaluation,langchain,large-language-models,llama-index,llm,llm-evaluation,llm-observability,llmops,monitoring,observability,open-source,openai,playground,prompt-engineering,prompt-management,self-hosted,ycombinator",2023-05-18T17:47:09Z,2026-06-04T18:59:56Z,2026-06-04T23:06:28Z,False
146,rohitg00/ai-engineering-from-scratch,https://github.com/rohitg00/ai-engineering-from-scratch,Learn it. Build it. Ship it for others.,28395,220,4646,41,52,Python,"agents,ai,ai-agents,ai-engineering,computer-vision,course,deep-learning,from-scratch,generative-ai,llm,machine-learning,mcp,nlp,python,reinforcement-learning,rust,swarm-intelligence,transformers,tutorial,typescript",2026-03-18T18:38:02Z,2026-06-05T00:16:38Z,2026-06-03T00:12:38Z,False
147,Gitlawb/openclaude,https://github.com/Gitlawb/openclaude,runs anywhere. uses anything,28328,17,8686,6,213,TypeScript,"ai,ai-agent,ai-tools,cli,coding",2026-04-01T03:15:49Z,2026-06-05T00:15:23Z,2026-06-04T23:14:17Z,False
148,TanStack/table,https://github.com/TanStack/table,"🤖 Headless UI for building powerful tables & datagrids for TS/JS -  React-Table, Vue-Table, Solid-Table, Svelte-Table",28058,3,3520,2,391,TypeScript,"datagrid,datagrids,datatable,filtering,grid,grouping,hooks,javascript,pagination,react,reactjs,solid,solidjs,sorting,svelte,sveltejs,table,typescript,vue",2016-10-20T17:25:08Z,2026-06-04T17:24:03Z,2026-06-04T17:24:00Z,False
149,microsoft/semantic-kernel,https://github.com/microsoft/semantic-kernel,Integrate cutting-edge LLM technology quickly and easily into your apps,28055,6,4634,3,281,C#,"ai,artificial-intelligence,llm,openai,sdk",2023-02-27T17:39:42Z,2026-06-04T18:01:53Z,2026-06-04T17:26:20Z,False
150,davila7/claude-code-templates,https://github.com/davila7/claude-code-templates,CLI tool for configuring and monitoring Claude Code,27770,7,2867,2,166,Python,"anthropic,anthropic-claude,claude,claude-code",2025-07-04T01:26:26Z,2026-06-04T23:38:01Z,2026-06-04T04:35:28Z,False
151,huggingface/smolagents,https://github.com/huggingface/smolagents,🤗 smolagents: a barebones library for agents that think in code.,27709,10,2647,2,573,Python,,2024-12-05T11:28:04Z,2026-06-04T20:12:49Z,2026-06-04T00:51:45Z,False
152,iOfficeAI/AionUi,https://github.com/iOfficeAI/AionUi,"Free, local, open-source 24/7 Cowork app for OpenClaw, Hermes Agent, Claude Code, Codex, OpenCode, Gemini CLI and 20+ more CLI | Customize your assistants | Star if you like it!",27593,28,2663,4,608,TypeScript,"acp,agent-team,ai,ai-agent,chat,chatbot,claude-code,clawdbot,codex,cowork,gemini,gemini-cli,hermes,llm,nano-banana,office,openclaw,opencode,skills,webui",2025-08-07T10:29:51Z,2026-06-04T23:53:20Z,2026-06-04T13:57:11Z,False
153,mvanhorn/last30days-skill,https://github.com/mvanhorn/last30days-skill,"AI agent skill that researches any topic across Reddit, X, YouTube, HN, Polymarket, and the web - then synthesizes a grounded summary",27560,286,2345,14,92,Python,"ai-prompts,ai-skill,bluesky,claude,claude-code,clawhub,deep-research,hackernews,instagram,openclaw,polymarket,recency,reddit,research,social-media,tiktok,trends,twitter,web-search,youtube",2026-01-23T20:37:37Z,2026-06-05T00:17:31Z,2026-06-01T14:41:33Z,False
154,assafelovic/gpt-researcher,https://github.com/assafelovic/gpt-researcher,An autonomous agent that conducts deep research on any data using any LLM providers,27506,10,3700,-1,209,Python,"agent,ai,automation,deepresearch,llms,mcp,mcp-server,python,research,search,webscraping",2023-05-12T10:33:54Z,2026-06-04T22:03:13Z,2026-05-28T07:41:25Z,False
155,eyaltoledano/claude-task-master,https://github.com/eyaltoledano/claude-task-master,"An AI-powered task-management system you can drop into Cursor, Lovable, Windsurf, Roo, and others.",27320,1,2555,0,195,JavaScript,"ai,cursor,cursor-ai,cursorai,lovable,lovable-dev,roocode,task-manager,tasks,tasks-list,windsurf,windsurf-ai",2025-03-04T18:54:54Z,2026-06-04T13:48:28Z,2026-04-28T13:27:12Z,False
156,K-Dense-AI/scientific-agent-skills,https://github.com/K-Dense-AI/scientific-agent-skills,"Turn any AI agent into an AI Scientist. The #1 Agent Skills library for science, used by 160,000+ scientists worldwide. 140 ready-to-use skills plus 100+ scientific databases covering biology, chemistry, medicine, and drug discovery. Compatible with Cursor, Claude Code, Codex, Antigravity, and the open Agent Skills standard.",27254,50,2815,4,26,Python,"agent-skills,ai-scientist,bioinformatics,chemoinformatics,claude,claude-skills,claudecode,clinical-research,computational-biology,data-analysis,drug-discovery,genomics,materials-science,metabolomics,proteomics,scientific-computing,scientific-visualization",2025-10-19T20:54:15Z,2026-06-05T00:02:15Z,2026-06-04T18:56:51Z,False
157,fingerprintjs/fingerprintjs,https://github.com/fingerprintjs/fingerprintjs,The most advanced free and open-source browser fingerprinting library,27248,6,2531,0,14,TypeScript,"audio-fingerprinting,browser,browser-fingerprint,browser-fingerprinting,detection,fingerprint,fingerprinting,fingerprintjs,fraud,fraud-detection,identification,javascript,visitor-identifier",2015-02-11T08:49:54Z,2026-06-04T23:30:06Z,2026-05-27T20:15:59Z,False
158,Imbad0202/academic-research-skills,https://github.com/Imbad0202/academic-research-skills,Academic Research Skills for Claude Code: research → write → review → revise → finalize,27227,143,2240,9,32,Python,"academic-pipeline,academic-writing,ai-research,claude,claude-code,literature-review,peer-review,prompt-engineering",2026-02-26T06:31:01Z,2026-06-05T00:14:13Z,2026-06-04T19:47:35Z,False
159,getzep/graphiti,https://github.com/getzep/graphiti,Build Real-Time Knowledge Graphs for AI Agents,27005,14,2692,1,425,Python,"agents,graph,llms,rag",2024-08-08T22:08:30Z,2026-06-04T22:28:26Z,2026-06-04T22:38:31Z,False
160,mbadolato/iTerm2-Color-Schemes,https://github.com/mbadolato/iTerm2-Color-Schemes,"Over 450 terminal color schemes/themes for iTerm/iTerm2. Includes ports to Terminal, Konsole, PuTTY, Xresources, XRDB, Remmina, Termite, XFCE, Tilda, FreeBSD VT, Terminator, Kitty, MobaXterm, LXTerminal, Microsoft's Windows Terminal, Visual Studio, Alacritty, Ghostty, and many more",26929,-1,6519,0,25,Shell,"color-scheme,freebsd-vt,iterm,iterm2,konsole,konsole-color-schemes,lxterminal,osx-terminal-themes,putty,putty-color-schemes,schemes,terminal,terminal-schemes,terminal-themes,terminator,theme,themes,windows-terminal,xrdb,xresources",2011-04-01T04:01:46Z,2026-06-04T20:09:49Z,2026-06-04T20:09:44Z,False
161,virattt/dexter,https://github.com/virattt/dexter,An autonomous agent for deep financial research,26844,4,3346,1,96,TypeScript,,2025-10-14T21:02:00Z,2026-06-04T19:23:12Z,2026-06-03T20:04:44Z,False
162,BloopAI/vibe-kanban,https://github.com/BloopAI/vibe-kanban,"Get 10X more out of Claude Code, Codex or any coding agent",26801,13,2824,4,531,Rust,"agent,ai-agents,kanban,management,task-manager",2025-06-14T19:10:21Z,2026-06-04T22:53:21Z,2026-04-24T09:17:34Z,False
163,ScrapeGraphAI/Scrapegraph-ai,https://github.com/ScrapeGraphAI/Scrapegraph-ai,Python scraper based on AI,26724,19,2485,1,1,Python,"ai-crawler,ai-scraping,ai-search,crawler,data-extraction,firecrawl-alternative,large-language-model,llm,markdown,rag,scraping,scraping-python,web-crawler,web-crawlers,web-data,web-data-extraction,web-scraper,web-scraping,web-search,webscraping",2024-01-27T16:54:38Z,2026-06-04T22:50:32Z,2026-06-02T08:37:21Z,False
164,mlflow/mlflow,https://github.com/mlflow/mlflow,"The open source AI engineering platform for agents, LLMs, and ML models. MLflow enables teams of all sizes to debug, evaluate, monitor, and optimize production-quality AI applications while controlling costs and managing access to models and data.",26301,4,5812,4,2079,Python,"agentops,agents,ai,ai-governance,apache-spark,evaluation,langchain,llm-evaluation,llmops,machine-learning,ml,mlflow,mlops,model-management,observability,open-source,openai,prompt-engineering",2018-06-05T16:05:58Z,2026-06-05T00:08:00Z,2026-06-04T15:06:47Z,False
165,tobi/qmd,https://github.com/tobi/qmd,"mini cli search engine for your docs, knowledge bases, meeting notes, whatever. Tracking current sota approaches while being all local",26117,23,1637,-1,112,TypeScript,,2025-12-08T14:22:57Z,2026-06-04T20:22:52Z,2026-06-01T22:49:03Z,False
166,huggingface/open-r1,https://github.com/huggingface/open-r1,Fully open reproduction of DeepSeek-R1,26033,1,2423,1,341,Python,,2025-01-24T15:44:11Z,2026-06-04T15:27:58Z,2026-04-02T14:03:15Z,False
167,yamadashy/repomix,https://github.com/yamadashy/repomix,"📦 Repomix is a powerful tool that packs your entire repository into a single, AI-friendly file. Perfect for when you need to feed your codebase to Large Language Models (LLMs) or other AI tools like Claude, ChatGPT, DeepSeek, Perplexity, Gemini, Gemma, Llama, Grok, and more.",25974,28,1341,2,163,TypeScript,"ai,anthropic,artificial-intelligence,chatbot,chatgpt,claude,deepseek,developer-tools,gemini,genai,generative-ai,gpt,javascript,language-model,llama,llm,mcp,nodejs,openai,typescript",2024-07-13T07:11:32Z,2026-06-04T22:35:32Z,2026-06-04T21:27:13Z,False
168,supermemoryai/supermemory,https://github.com/supermemoryai/supermemory,"Memory engine and app that is extremely fast, scalable. The Memory API for the AI era.",25509,80,2230,3,30,TypeScript,"agent-memory,ai-memory,cloudflare-kv,cloudflare-pages,cloudflare-workers,drizzle-orm,memory,postgres,remix,tailwindcss,typescript,vite",2024-02-27T20:10:04Z,2026-06-05T00:00:35Z,2026-06-04T22:59:21Z,False
169,PrefectHQ/fastmcp,https://github.com/PrefectHQ/fastmcp,"🚀 The fast, Pythonic way to build MCP servers and clients.",25489,10,2050,1,248,Python,"agents,fastmcp,llms,mcp,mcp-clients,mcp-servers,mcp-tools,model-context-protocol,python",2024-11-30T01:47:40Z,2026-06-04T22:39:10Z,2026-06-04T17:12:48Z,False
170,deepset-ai/haystack,https://github.com/deepset-ai/haystack,"Open-source AI orchestration framework for building context-engineered, production-ready LLM applications. Design modular pipelines and agent workflows with explicit control over retrieval, routing, memory, and generation. Built for scalable agents, RAG, multimodal applications, semantic search, and conversational systems.",25459,2,2829,-1,124,MDX,"agent,agents,ai,gemini,generative-ai,gpt-4,information-retrieval,large-language-models,llm,machine-learning,nlp,orchestration,python,pytorch,question-answering,rag,retrieval-augmented-generation,semantic-search,summarization,transformers",2019-11-14T09:05:28Z,2026-06-04T19:12:35Z,2026-06-04T17:05:37Z,False
171,zai-org/Open-AutoGLM,https://github.com/zai-org/Open-AutoGLM,An Open Phone Agent Model & Framework. Unlocking the AI Phone for Everyone,25424,6,3965,0,252,Python,"agent,phone-use-agent",2025-12-08T09:23:44Z,2026-06-04T20:07:12Z,2026-03-06T08:38:39Z,False
172,lucidrains/vit-pytorch,https://github.com/lucidrains/vit-pytorch,"Implementation of Vision Transformer, a simple way to achieve SOTA in vision classification with only a single transformer encoder, in Pytorch",25286,1,3498,1,141,Python,"artificial-intelligence,attention-mechanism,computer-vision,image-classification,transformers",2020-10-03T22:47:24Z,2026-06-04T17:35:10Z,2026-05-29T20:09:21Z,False
173,Wei-Shaw/sub2api,https://github.com/Wei-Shaw/sub2api,Sub2API 一站式开源中转服务，让 Claude、Openai 、Gemini、Antigravity订阅统一接入，支持拼车共享，更高效分摊成本，原生工具无缝使用。,25269,22,4902,8,1509,Go,"2api,antigravity2api,cc2api,claude,claude-code,codex,crs,crs2,gemini",2025-12-18T02:26:18Z,2026-06-04T21:20:06Z,2026-06-04T11:22:53Z,False
174,volcengine/OpenViking,https://github.com/volcengine/OpenViking,"OpenViking is an open-source context database designed specifically for AI Agents(such as openclaw). OpenViking unifies the management of context (memory, resources, and skills) that Agents need through a file system paradigm, enabling hierarchical context delivery and self-evolving.",25147,11,1935,0,215,Python,"agent,agentic-rag,ai-agents,clawbot,context-database,context-engineering,filesystem,llm,memory,openclaw,opencode,rag,skill",2026-01-05T07:11:17Z,2026-06-05T00:10:02Z,2026-06-04T14:16:05Z,False
175,charmbracelet/crush,https://github.com/charmbracelet/crush,Glamourous agentic coding for all 💘,25009,15,1780,2,480,Go,"agentic-ai,ai,llms,ravishing",2025-05-21T12:14:57Z,2026-06-05T00:12:24Z,2026-06-04T19:56:16Z,False
176,lfnovo/open-notebook,https://github.com/lfnovo/open-notebook,An Open Source implementation of Notebook LM with more flexibility and features,25001,574,2914,57,143,TypeScript,"assistant,learning,note-taking,notebook,notes-app,self-learning",2024-10-21T17:58:46Z,2026-06-05T00:17:08Z,2026-06-04T17:07:02Z,False
177,oraios/serena,https://github.com/oraios/serena,"A powerful MCP toolkit for coding, providing semantic retrieval and editing capabilities  - the IDE for your agent",24943,21,1668,0,113,Python,"agent,ai,ai-coding,claude,claude-code,codex,ide,jetbrains,language-server,mcp-server,programming,vibe-coding",2025-03-23T22:35:24Z,2026-06-05T00:04:55Z,2026-06-04T17:19:13Z,False
178,QwenLM/qwen-code,https://github.com/QwenLM/qwen-code,An open-source AI coding agent that lives in your terminal.,24917,6,2459,2,803,TypeScript,,2025-06-26T01:37:46Z,2026-06-05T00:07:30Z,2026-06-04T22:08:01Z,False
179,mastra-ai/mastra,https://github.com/mastra-ai/mastra,"From the team behind Gatsby, Mastra is a framework for building AI-powered applications and agents with a modern TypeScript stack.",24773,19,2198,4,379,TypeScript,"agents,ai,chatbots,evals,javascript,llm,mcp,nextjs,nodejs,reactjs,tts,typescript,workflows",2024-08-06T20:44:31Z,2026-06-04T23:32:20Z,2026-06-05T00:14:50Z,False
180,vercel/ai,https://github.com/vercel/ai,"The AI Toolkit for TypeScript. From the creators of Next.js, the AI SDK is a free open-source library for building AI-powered applications and agents ",24665,8,4533,6,1678,TypeScript,"anthropic,artificial-intelligence,gemini,generative-ai,generative-ui,javascript,language-model,llm,nextjs,openai,react,svelte,typescript,vercel,vue",2023-05-23T15:04:08Z,2026-06-04T23:22:58Z,2026-06-04T23:11:23Z,False
181,HKUDS/DeepTutor,https://github.com/HKUDS/DeepTutor,"DeepTutor: Agent-native, Open-sourced Personalized Tutoring. https://deeptutor.info/.",24554,6,3326,2,49,Python,"ai-agents,ai-tutor,clawdbot,cli-tool,deepresearch,interactive-learning,large-language-models,multi-agent-systems,rag",2025-12-28T15:35:54Z,2026-06-04T22:36:53Z,2026-05-29T05:45:35Z,False
182,jarrodwatts/claude-hud,https://github.com/jarrodwatts/claude-hud,"A Claude Code plugin that shows what's happening - context usage, active tools, running agents, and todo progress",24480,25,1105,0,14,JavaScript,"anthropic,claude,claude-code,cli,plugin,statusline,typescript",2026-01-02T01:35:07Z,2026-06-05T00:02:57Z,2026-06-04T09:03:00Z,False
183,toon-format/toon,https://github.com/toon-format/toon,"🎒 Token-Oriented Object Notation (TOON) – Compact, human-readable, schema-aware JSON for LLM prompts. Spec, benchmarks, TypeScript SDK.",24476,6,1086,1,14,TypeScript,"data-format,llm,serialization,tokenization",2025-10-22T18:17:32Z,2026-06-04T23:59:25Z,2026-05-23T08:00:46Z,False
184,hugohe3/ppt-master,https://github.com/hugohe3/ppt-master,"AI generates a real, editable PowerPoint from any document — native shapes & animations, speaker notes voiced as audio narration, and the option to follow your own .pptx template, not slide images · by Hugo He",24377,82,2219,5,0,Python,"ai-agent,aippt,office,powerpoint,powerpoint-generation,ppt,pptx,presentation,slide,slides",2025-12-10T06:54:33Z,2026-06-05T00:14:31Z,2026-06-04T14:24:22Z,False
185,gastownhall/beads,https://github.com/gastownhall/beads,Beads - A memory upgrade for your coding agent,24355,16,1623,-1,401,Go,"agents,claude-code,coding",2025-10-12T03:09:46Z,2026-06-04T22:36:07Z,2026-06-03T22:37:55Z,False
186,heygen-com/hyperframes,https://github.com/heygen-com/hyperframes,Write HTML. Render video. Built for agents.,24340,167,2261,13,65,TypeScript,"ai,animation,ffmpeg,framework,gsap,html,mcp,puppeteer,rendering,typescript,video",2026-03-10T01:51:06Z,2026-06-05T00:08:36Z,2026-06-04T22:56:52Z,False
187,langchain-ai/deepagents,https://github.com/langchain-ai/deepagents,The batteries-included agent harness.,23889,31,3375,3,135,Python,"ai,deepagents,langchain,langgraph,python,typescript",2025-07-27T23:07:53Z,2026-06-04T23:43:02Z,2026-06-04T22:59:38Z,False
188,jackwener/OpenCLI,https://github.com/jackwener/OpenCLI,Make Any Website into CLI & Use your logged-in browser by AI agent. ,23517,26,2364,6,126,JavaScript,"ai-agent,ai-agents,ai-tools,cli",2026-03-14T22:10:23Z,2026-06-05T00:12:33Z,2026-06-04T19:26:34Z,False
189,jhao104/proxy_pool,https://github.com/jhao104/proxy_pool,Python ProxyPool for web spider,23384,2,5384,0,297,Python,"crawler,http,proxy,redis,spider",2016-11-25T13:49:07Z,2026-06-04T14:49:46Z,2026-06-03T14:23:51Z,False
190,timqian/chinese-independent-blogs,https://github.com/timqian/chinese-independent-blogs,中文独立博客列表,23295,2,2647,0,23,Python,"blog,china,rss",2019-10-22T09:22:45Z,2026-06-04T16:42:06Z,2026-06-03T02:05:46Z,False
191,modelcontextprotocol/python-sdk,https://github.com/modelcontextprotocol/python-sdk,The official Python SDK for Model Context Protocol servers and clients,23237,9,3506,2,519,Python,,2024-09-24T21:01:35Z,2026-06-04T19:35:57Z,2026-06-04T18:49:06Z,False
192,SuperClaude-Org/SuperClaude_Framework,https://github.com/SuperClaude-Org/SuperClaude_Framework,"A configuration framework that enhances Claude Code with specialized commands, cognitive personas, and development methodologies.",23183,11,1973,1,66,Python,,2025-06-22T12:03:53Z,2026-06-04T21:48:40Z,2026-04-27T03:08:57Z,False
193,spmallick/learnopencv,https://github.com/spmallick/learnopencv,Learn OpenCV  : C++ and Python Examples,22951,0,11689,0,262,Jupyter Notebook,"ai,computer-vision,computervision,deep-learning,deep-neural-networks,deeplearning,machine-learning,opencv,opencv-cpp,opencv-library,opencv-python,opencv-tutorial,opencv3",2015-02-17T08:00:51Z,2026-06-04T08:30:59Z,2026-05-26T16:43:16Z,False
194,micro/go-micro,https://github.com/micro/go-micro,A Go microservices framework for AI agents,22756,-1,2404,0,2,Go,"distributed-systems,go,golang,micro,microservices,rpc",2015-01-13T23:30:18Z,2026-06-04T19:22:45Z,2026-06-04T21:31:53Z,False
195,alchaincyf/nuwa-skill,https://github.com/alchaincyf/nuwa-skill,你想蒸馏的下一个员工，何必是同事。蒸馏任何人的思维方式——心智模型、决策启发式、表达DNA。Distill how anyone thinks.,22699,45,3377,6,16,Python,,2026-04-05T04:33:04Z,2026-06-04T23:44:44Z,2026-05-28T10:54:17Z,False
196,OthmanAdi/planning-with-files,https://github.com/OthmanAdi/planning-with-files,Claude Code skill implementing Manus-style persistent markdown planning — the workflow pattern behind the $2B acquisition.,22696,16,2007,2,14,Python,"adal,agent-skills,antigravity,claude,claude-code,claude-skills,copilot,copilot-skills,hermes,hermes-agent,hermes-skill,kilocode,manus,mastra,openclaw,openclaw-skills,pi,pi-agent,planning",2026-01-03T07:37:28Z,2026-06-04T23:40:46Z,2026-05-26T09:29:04Z,False
197,nocobase/nocobase,https://github.com/nocobase/nocobase,"NocoBase is an open-source AI + no-code platform for building business systems fast. Instead of generating everything from scratch, AI works on top of production-proven infrastructure and a WYSIWYG no-code interface, so you get both speed and reliability.",22646,5,2639,1,300,TypeScript,"admin-dashboard,ai-agent,ai-agents,ai-assistant,ai-tools,airtable,crm,crud,erp,internal-tool,internal-tools,low-code,lowcode,no-code,nocode,project-management,salesforce,self-hosted,workflows",2020-10-24T07:27:48Z,2026-06-05T00:10:01Z,2026-06-05T00:14:53Z,False
198,activepieces/activepieces,https://github.com/activepieces/activepieces,AI Agents & MCPs & AI Workflow Automation • (~400 MCP servers for AI agents) • AI Automation / AI Agent with MCPs • AI Workflows & AI Agents • MCPs for AI Agents,22565,4,3745,1,477,TypeScript,"ai-agent,ai-agent-tools,ai-agents,ai-agents-framework,mcp,mcp-server,mcp-tools,mcps,n8n-alternative,no-code-automation,workflow,workflow-automation,workflows",2022-12-03T02:52:46Z,2026-06-04T20:00:52Z,2026-06-04T22:08:01Z,False
199,blader/humanizer,https://github.com/blader/humanizer,Claude Code skill that removes signs of AI-generated writing from text,22377,52,2147,8,53,,,2026-01-18T05:30:15Z,2026-06-05T00:12:29Z,2026-05-27T02:55:25Z,False
200,NirDiamant/GenAI_Agents,https://github.com/NirDiamant/GenAI_Agents,"50+ tutorials and implementations for Generative AI Agent techniques, from basic conversational bots to complex multi-agent systems.",22376,5,3749,0,7,Jupyter Notebook,"agentic-ai,agents,ai,ai-agents,autonomous-agents,genai,generative-ai,langchain,langgraph,llm,llms,machine-learning,mcp,multi-agent,multi-agent-systems,openai,python,rag,tutorials",2024-09-09T20:10:19Z,2026-06-04T20:48:44Z,2026-06-03T21:02:11Z,False
201,ahujasid/blender-mcp,https://github.com/ahujasid/blender-mcp,,22327,12,2206,1,78,Python,,2025-03-07T09:58:58Z,2026-06-04T20:53:50Z,2026-06-04T07:15:26Z,False
202,coleam00/Archon,https://github.com/coleam00/Archon,The first open-source harness builder for AI coding. Make AI coding deterministic and repeatable.,22178,16,3348,5,286,TypeScript,"ai,automation,bun,claude,cli,coding-assistant,developer-tools,typescript,workflow-engine,yaml",2025-02-07T21:04:12Z,2026-06-05T00:17:37Z,2026-06-04T20:14:36Z,False
203,winfunc/opcode,https://github.com/winfunc/opcode,"A powerful GUI app and Toolkit for Claude Code - Create custom agents, manage interactive Claude Code sessions, run secure background agents, and more.",21998,1,1701,1,329,TypeScript,"anthropic,anthropic-claude,claude,claude-4,claude-4-opus,claude-4-sonnet,claude-ai,claude-code,claude-code-sdk,cursor,ide,llm,llm-code,rust,tauri",2025-06-19T13:53:26Z,2026-06-04T20:10:41Z,2025-10-16T12:05:56Z,False
204,Skyvern-AI/skyvern,https://github.com/Skyvern-AI/skyvern,Automate browser based workflows with AI,21825,5,2033,0,160,Python,"ai,api,automation,browser,browser-automation,computer,gpt,llm,playwright,powerautomate,puppeteer,python,rpa,selenium,vision,workflow",2024-02-28T15:45:19Z,2026-06-05T00:01:56Z,2026-06-05T00:01:54Z,False
