rank,full_name,url,description,stars,star_delta_vs_previous_day,forks,fork_delta_vs_previous_day,open_issues,language,topics,created_at,updated_at,pushed_at,archived
132,songquanpeng/one-api,https://github.com/songquanpeng/one-api,"LLM API 管理 & 分发系统，支持 OpenAI、Azure、Anthropic Claude、Google Gemini、DeepSeek、字节豆包、ChatGLM、文心一言、讯飞星火、通义千问、360 智脑、腾讯混元等主流模型，统一 API 适配，可用于 key 管理与二次分发。单可执行文件，提供 Docker 镜像，一键部署，开箱即用。LLM API management & key redistribution system, unifying multiple providers under a single API. Single binary, Docker-ready, with an English UI.",35745,32,6742,1,1023,JavaScript,"api,api-gateway,azure-openai-api,chatgpt,claude,ernie-bot,gemini,gpt,openai,openai-api,proxy",2023-04-22T12:39:24Z,2026-07-15T18:07:37Z,2026-01-09T03:26:43Z,False
133,lfnovo/open-notebook,https://github.com/lfnovo/open-notebook,An Open Source implementation of Notebook LM with more flexibility and features,35701,43,4135,5,112,TypeScript,"assistant,learning,note-taking,notebook,notes-app,self-learning",2024-10-21T17:58:46Z,2026-07-15T22:53:03Z,2026-07-14T16:41:58Z,False
134,heygen-com/hyperframes,https://github.com/heygen-com/hyperframes,Write HTML. Render video. Built for agents.,35443,292,3324,33,174,TypeScript,"ai,animation,ffmpeg,framework,gsap,html,mcp,puppeteer,rendering,typescript,video",2026-03-10T01:51:06Z,2026-07-15T23:15:22Z,2026-07-15T23:14:56Z,False
135,microsoft/playwright-mcp,https://github.com/microsoft/playwright-mcp,Playwright MCP server,35126,45,2922,9,1,TypeScript,"mcp,playwright",2025-03-21T17:48:36Z,2026-07-15T21:57:53Z,2026-07-15T01:32:35Z,False
136,tinyhumansai/openhuman,https://github.com/tinyhumansai/openhuman,"Your Personal AI super intelligence. A brain that builds a local-first memory of your life, a fantastic orchestrator of agent fleets and workflows, and a deep researcher.",34886,39,3398,6,201,Rust,,2026-02-18T20:01:27Z,2026-07-15T22:45:11Z,2026-07-15T22:49:28Z,False
137,casey/just,https://github.com/casey/just,🤖 Just a command runner,34770,18,817,2,172,Rust,,2016-06-17T06:08:08Z,2026-07-15T21:57:59Z,2026-07-15T21:45:22Z,False
138,ashishpatel26/500-AI-Agents-Projects,https://github.com/ashishpatel26/500-AI-Agents-Projects,"The 500 AI Agents Projects is a curated collection of AI agent use cases across various industries. It showcases practical applications and provides links to open-source projects for implementation, illustrating how AI agents are transforming sectors such as healthcare, finance, education, retail, and more.",34508,64,6136,12,87,Python,"ai-agents,genai",2024-12-20T13:37:15Z,2026-07-15T22:27:34Z,2026-06-06T11:58:47Z,False
139,huggingface/diffusers,https://github.com/huggingface/diffusers,"🤗 Diffusers: State-of-the-art diffusion models for image, video, and audio generation in PyTorch.",34067,6,7155,5,1280,Python,"deep-learning,diffusion,flux,image-generation,image2image,image2video,latent-diffusion-models,pytorch,qwen-image,score-based-generative-modeling,stable-diffusion,stable-diffusion-diffusers,text2image,text2video,video2video",2022-05-30T16:04:02Z,2026-07-15T21:56:00Z,2026-07-15T22:36:54Z,False
140,VectifyAI/PageIndex,https://github.com/VectifyAI/PageIndex,"📑 PageIndex: Document Index for Vectorless, Reasoning-based RAG",34044,20,2972,4,138,Python,"agentic-ai,agents,ai,ai-agents,context-engineering,information-retrieval,llm,rag,reasoning,retrieval,retrieval-augmented-generation,vector-database",2025-04-01T10:53:54Z,2026-07-15T21:04:03Z,2026-07-15T18:24:54Z,False
141,DayuanJiang/next-ai-draw-io,https://github.com/DayuanJiang/next-ai-draw-io,"A next.js web application that integrates AI capabilities with draw.io diagrams. This app allows you to create, modify, and enhance diagrams through natural language commands and AI-assisted visualization.",33628,52,3634,13,171,TypeScript,"ai,diagrams,productivity",2025-03-23T15:03:48Z,2026-07-15T22:51:43Z,2026-07-15T20:54:23Z,False
142,anthropics/financial-services,https://github.com/anthropics/financial-services,,33510,14,4949,5,175,Python,,2026-02-23T19:24:50Z,2026-07-15T21:37:47Z,2026-06-26T21:55:15Z,False
143,zeromicro/go-zero,https://github.com/zeromicro/go-zero,A cloud-native Go microservices framework with cli tool for productivity.,33189,4,4312,2,270,Go,"ai-native,ai-native-development,cloud-native,code-generation,framework,gateway,go,golang,grpc-gateway,microservice,microservice-framework,microservices,microservices-architecture,rest-api,restful,restful-api,rpc,rpc-framework,spec-driven-development,web-framework",2020-08-07T15:37:57Z,2026-07-15T21:57:28Z,2026-07-13T19:52:47Z,False
144,nicolargo/glances,https://github.com/nicolargo/glances,"Glances an Eye on your system. A top/htop alternative for GNU/Linux, BSD, Mac OS and Windows operating systems.",33108,13,1766,1,100,Python,"monitoring,multi-platform,python,restful,restful-api,system,terminal,web",2011-12-04T08:49:15Z,2026-07-15T21:57:45Z,2026-07-14T20:46:56Z,False
145,surrealdb/surrealdb,https://github.com/surrealdb/surrealdb,"A scalable, distributed, collaborative, document-graph database, for the realtime web",32699,11,1303,0,701,Rust,"backend-as-a-service,cloud-database,database,database-as-a-service,developer-tools,devtools,distributed,distributed-database,document-database,graph-database,iot-database,nosql,realtime-database,serverless,sql,surreal,surrealdb,web",2021-12-09T15:03:29Z,2026-07-15T21:38:25Z,2026-07-06T15:57:27Z,False
146,Wei-Shaw/sub2api,https://github.com/Wei-Shaw/sub2api,Sub2API 一站式开源中转服务，让 Claude、Openai 、Gemini、Grok订阅统一接入，支持拼车共享，更高效分摊成本，原生工具无缝使用。,32321,209,6623,48,2109,Go,"2api,antigravity2api,cc2api,claude,claude-code,codex,crs,crs2,gemini",2025-12-18T02:26:18Z,2026-07-15T22:28:35Z,2026-07-15T14:07:10Z,False
147,zeroclaw-labs/zeroclaw,https://github.com/zeroclaw-labs/zeroclaw,"Fast, small, and fully autonomous AI personal assistant infrastructure, any OS, any platform — deploy anywhere, swap anything 🦀",32275,10,4802,3,569,Rust,"agent,agentic,ai,infra,ml,openclaw,os,zeroclaw",2026-02-13T08:56:04Z,2026-07-15T20:39:28Z,2026-07-15T23:18:35Z,False
148,linshenkx/prompt-optimizer,https://github.com/linshenkx/prompt-optimizer,An AI prompt optimizer for writing better prompts and getting better AI results.,32213,51,3764,6,21,TypeScript,"ai-prompts,ai-tools,llm,prompt,prompt-engineering,prompt-optimization,prompt-optimizer,prompt-testing,prompt-toolkit,prompt-tuning",2025-02-12T06:06:49Z,2026-07-15T21:57:53Z,2026-07-06T01:54:21Z,False
149,anthropics/claude-plugins-official,https://github.com/anthropics/claude-plugins-official,"Official, Anthropic-managed directory of high quality Claude Code Plugins.",32174,38,3581,8,815,Python,"claude-code,mcp,skills",2025-11-20T18:36:20Z,2026-07-15T23:16:12Z,2026-07-15T18:18:57Z,False
150,conductor-oss/conductor,https://github.com/conductor-oss/conductor,Conductor is an event driven agentic workflow engine providing durable and highly resilient execution engine for applications and AI Agents,31999,2,959,3,209,Java,"distributed-systems,durable-execution,grpc,java,javascript,microservice-orchestration,orchestration-engine,orchestrator,reactjs,spring-boot,workflow-automation,workflow-engine,workflow-management,workflows",2023-12-08T06:06:09Z,2026-07-15T22:50:23Z,2026-07-15T22:50:53Z,False
151,lightpanda-io/browser,https://github.com/lightpanda-io/browser,Lightpanda: the headless browser designed for AI and automation,31899,44,1419,2,107,Zig,"browser,browser-automation,cdp,headless,lightpanda,playwright,puppeteer,zig",2023-02-07T15:19:34Z,2026-07-15T22:51:28Z,2026-07-15T19:28:40Z,False
152,DeusData/codebase-memory-mcp,https://github.com/DeusData/codebase-memory-mcp,"High-performance code intelligence MCP server. Indexes codebases into a persistent knowledge graph — average repo in milliseconds. 158 languages, sub-ms queries, 99% fewer tokens. Single static binary, zero dependencies.",31844,333,2543,34,242,C,"aider,ast,claude-code,code-analysis,code-intelligence,codex,cursor,cypher,developer-tools,gemini-cli,graph-visualization,kilocode,knowledge-graph,mcp,mcp-server,model-context-protocol,opencode,sqlite,tree-sitter,windsurf",2026-02-24T22:01:00Z,2026-07-15T23:14:19Z,2026-07-15T23:14:10Z,False
153,github/github-mcp-server,https://github.com/github/github-mcp-server,GitHub's official MCP Server,31469,30,4586,5,339,Go,"github,mcp,mcp-server",2025-03-04T16:42:04Z,2026-07-15T22:57:44Z,2026-07-15T13:42:23Z,False
154,langfuse/langfuse,https://github.com/langfuse/langfuse,"🪢 Open source AI engineering platform: LLM evals, observability, metrics, prompt management, playground, datasets. Integrates with OpenTelemetry, LangChain, OpenAI SDK, LiteLLM, and more. 🍊YC W23 ",31215,65,3291,9,720,TypeScript,"analytics,autogen,evaluation,langchain,large-language-models,llama-index,llm,llm-evaluation,llm-observability,llmops,monitoring,observability,open-source,openai,playground,prompt-engineering,prompt-management,self-hosted,ycombinator",2023-05-18T17:47:09Z,2026-07-15T22:08:31Z,2026-07-15T22:57:36Z,False
155,K-Dense-AI/scientific-agent-skills,https://github.com/K-Dense-AI/scientific-agent-skills,"Turn any AI agent into an AI Scientist. The #1 Agent Skills library for science, used by 160,000+ scientists worldwide. 148 ready-to-use skills plus 100+ scientific databases covering biology, chemistry, medicine, and drug discovery. Compatible with Cursor, Claude Code, Codex, Pi, Antigravity, and the open Agent Skills standard.",30974,65,3105,2,38,Python,"agent-skills,ai-scientist,bioinformatics,chemoinformatics,claude,claude-skills,claudecode,clinical-research,computational-biology,data-analysis,drug-discovery,genomics,materials-science,metabolomics,proteomics,scientific-computing,scientific-visualization",2025-10-19T20:54:15Z,2026-07-15T23:01:36Z,2026-07-15T17:44:16Z,False
156,sgl-project/sglang,https://github.com/sgl-project/sglang,SGLang is a high-performance serving framework for large language models and multimodal models.,30345,37,7181,28,4298,Python,"attention,blackwell,cuda,deepseek,diffusion,glm,gpt-oss,inference,llama,llm,minimax,moe,qwen,qwen-image,reinforcement-learning,transformer,vlm,wan",2024-01-08T04:15:52Z,2026-07-15T22:59:39Z,2026-07-15T23:14:19Z,False
157,nanocoai/nanoclaw,https://github.com/nanocoai/nanoclaw,"A lightweight alternative to OpenClaw that runs in containers for security. Connects to WhatsApp, Telegram, Slack, Discord, Gmail and other messaging apps,, has memory, scheduled jobs, and runs directly on Anthropic's Agents SDK",30261,17,12878,-1,844,TypeScript,"ai-agents,ai-assistant,claude-code,claude-skills,openclaw",2026-01-31T15:47:22Z,2026-07-15T22:09:41Z,2026-07-15T08:22:41Z,False
158,iOfficeAI/AionUi,https://github.com/iOfficeAI/AionUi,"Free, local, open-source 24/7 Cowork app for OpenClaw, Hermes Agent, Claude Code, Codex, OpenCode, Gemini CLI and 20+ more CLI | Customize your assistants | Star if you like it!",30130,81,3021,9,679,TypeScript,"acp,agent-team,ai,ai-agent,chat,chatbot,claude-code,clawdbot,codex,cowork,gemini,gemini-cli,hermes,llm,nano-banana,office,openclaw,opencode,skills,webui",2025-08-07T10:29:51Z,2026-07-15T22:20:27Z,2026-07-15T11:57:00Z,False
159,lbjlaq/Antigravity-Manager,https://github.com/lbjlaq/Antigravity-Manager,Professional Antigravity Account Manager & Switcher. One-click seamless account switching for Antigravity Tools. Built with Tauri v2 + React (Rust).专业的 Antigravity 账号管理与切换工具。为 Antigravity 提供一键无缝账号切换功能。,30122,9,3263,1,1766,Rust,"account-manager,antigravity",2025-11-26T10:47:13Z,2026-07-15T20:08:01Z,2026-07-15T05:17:45Z,False
160,Gitlawb/openclaude,https://github.com/Gitlawb/openclaude,runs anywhere. uses anything,30036,43,8863,0,57,TypeScript,"ai,ai-agent,ai-tools,cli,coding",2026-04-01T03:15:49Z,2026-07-15T23:00:11Z,2026-07-15T17:03:32Z,False
161,heroui-inc/heroui,https://github.com/heroui-inc/heroui,"🚀 Beautiful, fast and modern React UI library. (Previously NextUI)",29915,7,2179,2,46,MDX,"component-library,components,library,reactjs",2021-04-22T13:06:23Z,2026-07-15T21:30:28Z,2026-07-15T14:51:31Z,False
162,SigNoz/signoz,https://github.com/SigNoz/signoz,"SigNoz is an open-source, OpenTelemetry-native observability platform for your team and their AI agents. Get logs, metrics, and traces in one tool with features like APM, distributed tracing, log management, infra monitoring, etc. Combined with SigNoz MCP and a native AI teammate (in SigNoz Cloud) it helps you build more resilient apps.",29791,194,2333,5,1523,TypeScript,"apm,application-monitoring,distributed-tracing,go,good-first-issue,jaeger,log,logs,metrics,monitoring,nextjs,observability,open-source,opentelemetry,prometheus,react,reactjs,self-hosted,tracing,typescript",2021-01-03T12:44:36Z,2026-07-15T21:50:16Z,2026-07-15T21:35:48Z,False
163,sipeed/picoclaw,https://github.com/sipeed/picoclaw,"Tiny, Fast, and Deployable anywhere — automate the mundane, unleash your creativity",29758,6,4443,3,67,Go,,2026-02-04T12:32:35Z,2026-07-15T23:03:40Z,2026-07-09T17:19:37Z,False
164,JushBJJ/Mr.-Ranedeer-AI-Tutor,https://github.com/JushBJJ/Mr.-Ranedeer-AI-Tutor,A GPT-4 AI Tutor Prompt for customizable personalized learning experiences.,29612,-1,3296,-1,17,,"ai,education,gpt-4,llm",2023-03-31T12:37:26Z,2026-07-15T20:18:12Z,2025-09-30T08:08:00Z,False
165,davila7/claude-code-templates,https://github.com/davila7/claude-code-templates,CLI tool for configuring and monitoring Claude Code,29556,52,3242,11,202,Python,"anthropic,anthropic-claude,claude,claude-code",2025-07-04T01:26:26Z,2026-07-15T23:18:09Z,2026-07-15T14:10:57Z,False
166,blader/humanizer,https://github.com/blader/humanizer,Claude Code skill that removes signs of AI-generated writing from text,29357,160,2710,16,70,,,2026-01-18T05:30:15Z,2026-07-15T23:17:55Z,2026-06-29T20:43:06Z,False
167,ComposioHQ/composio,https://github.com/ComposioHQ/composio,"Composio powers 1000+ toolkits, tool search, context management, authentication, and a sandboxed workbench to help you build AI agents that turn intent into action.",29248,11,4661,2,65,TypeScript,"agentic-ai,agents,ai,ai-agents,aiagents,developer-tools,function-calling,gpt-4,javascript,js,llm,llmops,mcp,python,remote-mcp-server,sse,typescript",2024-02-23T13:58:27Z,2026-07-15T20:52:13Z,2026-07-15T21:30:45Z,False
168,tastejs/todomvc,https://github.com/tastejs/todomvc,"Helping you select a JavaScript framework - Todo apps for React.js, Angular, Vue and many more",28944,0,13742,0,71,JavaScript,,2011-06-03T19:56:33Z,2026-07-15T17:50:24Z,2026-06-06T23:35:53Z,False
169,Yuan1z0825/nature-skills,https://github.com/Yuan1z0825/nature-skills,符合nature论文学术表达和科研绘图的Skill,28910,291,1732,13,3,Python,"codex-skills,nature,nature-skills",2026-04-24T03:11:46Z,2026-07-15T22:28:04Z,2026-07-15T16:12:19Z,False
170,openai/codex-plugin-cc,https://github.com/openai/codex-plugin-cc,Use Codex from Claude Code to review code or delegate tasks.,28822,193,1893,10,337,JavaScript,,2026-03-30T15:29:52Z,2026-07-15T23:07:22Z,2026-07-08T00:17:31Z,False
171,getzep/graphiti,https://github.com/getzep/graphiti,Build Real-Time Knowledge Graphs for AI Agents,28767,50,2902,5,434,Python,"agents,graph,llms,rag",2024-08-08T22:08:30Z,2026-07-15T22:26:28Z,2026-07-15T11:45:55Z,False
172,NirDiamant/RAG_Techniques,https://github.com/NirDiamant/RAG_Techniques,This repository showcases various advanced techniques for Retrieval-Augmented Generation (RAG) systems. Each technique has a detailed notebook tutorial.,28566,15,3485,2,13,Jupyter Notebook,"agentic-rag,ai,embeddings,generative-ai,gpt,langchain,llama-index,llm,llms,machine-learning,nlp,openai,python,rag,retrieval-augmented-generation,semantic-search,tutorials,vector-database",2024-07-13T16:08:36Z,2026-07-15T20:07:06Z,2026-07-14T18:50:33Z,False
173,JCodesMore/ai-website-cloner-template,https://github.com/JCodesMore/ai-website-cloner-template,Clone any website with one command using AI coding agents,28468,193,4190,42,25,TypeScript,"ai,ai-agents,ai-tools,automation,boilerplate,claude,claude-code,clone,developer-tools,nextjs,react,reverse-engineering,shadcn-ui,skills,tailwindcss,template,typescript,web-scraping,website-clone",2026-03-13T11:14:39Z,2026-07-15T23:00:55Z,2026-07-04T06:49:18Z,False
174,supermemoryai/supermemory,https://github.com/supermemoryai/supermemory,"Memory and context engine + app that is extremely fast, scalable, and can be run fully locally. The Memory API for the AI era.",28393,11,2472,-1,80,TypeScript,"agent-memory,ai-memory,cloudflare-kv,cloudflare-pages,cloudflare-workers,drizzle-orm,memory,postgres,remix,tailwindcss,typescript,vite",2024-02-27T20:10:04Z,2026-07-15T19:42:58Z,2026-07-15T13:43:43Z,False
175,ScrapeGraphAI/Scrapegraph-ai,https://github.com/ScrapeGraphAI/Scrapegraph-ai,Python scraper based on AI,28393,21,2755,2,8,Python,"ai-crawler,ai-scraping,ai-search,crawler,data-extraction,firecrawl-alternative,large-language-model,llm,markdown,rag,scraping,scraping-python,web-crawler,web-crawlers,web-data,web-data-extraction,web-scraper,web-scraping,web-search,webscraping",2024-01-27T16:54:38Z,2026-07-15T19:55:53Z,2026-07-15T11:58:36Z,False
176,huggingface/smolagents,https://github.com/huggingface/smolagents,🤗 smolagents: a barebones library for agents that think in code.,28375,18,2788,3,700,Python,,2024-12-05T11:28:04Z,2026-07-15T22:50:57Z,2026-07-14T18:34:47Z,False
177,assafelovic/gpt-researcher,https://github.com/assafelovic/gpt-researcher,An autonomous agent that conducts deep research on any data using any LLM providers,28332,20,3826,4,70,Python,"agent,ai,automation,deepresearch,llms,mcp,mcp-server,python,research,search,webscraping",2023-05-12T10:33:54Z,2026-07-15T21:29:44Z,2026-07-14T13:13:34Z,False
178,microsoft/semantic-kernel,https://github.com/microsoft/semantic-kernel,Integrate cutting-edge LLM technology quickly and easily into your apps,28316,3,4678,-2,254,C#,"ai,artificial-intelligence,llm,openai,sdk",2023-02-27T17:39:42Z,2026-07-15T20:34:47Z,2026-07-10T22:29:35Z,False
179,TanStack/table,https://github.com/TanStack/table,"🤖 Headless UI for building powerful tables & datagrids for TS/JS -  React-Table, Vue-Table, Solid-Table, Svelte-Table",28185,5,3540,-1,376,TypeScript,"datagrid,datagrids,datatable,filtering,grid,grouping,hooks,javascript,pagination,react,reactjs,solid,solidjs,sorting,svelte,sveltejs,table,typescript,vue",2016-10-20T17:25:08Z,2026-07-15T18:53:50Z,2026-07-15T19:34:00Z,False
180,alchaincyf/nuwa-skill,https://github.com/alchaincyf/nuwa-skill,你想蒸馏的下一个员工，何必是同事。蒸馏任何人的思维方式——心智模型、决策启发式、表达DNA。Distill how anyone thinks.,27959,111,3956,10,7,Python,,2026-04-05T04:33:04Z,2026-07-15T22:30:18Z,2026-07-02T03:11:38Z,False
181,topoteretes/cognee,https://github.com/topoteretes/cognee,Cognee is the open-source AI memory platform for agents. Give your AI agents persistent long-term memory across sessions with a self-hosted knowledge graph engine.,27948,77,2764,14,644,Python,"agent-memory,agent-skills,ai,ai-agents,ai-memory,cognitive-architecture,cognitive-memory,context-engineering,contributions-welcome,good-first-issue,good-first-pr,graph-database,graph-rag,help-wanted,knowledge,knowledge-graph,memory-management,open-source,vector-database",2023-08-16T16:16:33Z,2026-07-15T22:23:54Z,2026-07-15T18:22:55Z,False
182,tobi/qmd,https://github.com/tobi/qmd,"mini cli search engine for your docs, knowledge bases, meeting notes, whatever. Tracking current sota approaches while being all local",27921,43,1735,1,144,TypeScript,,2025-12-08T14:22:57Z,2026-07-15T21:14:17Z,2026-06-24T04:53:48Z,False
183,eyaltoledano/claude-task-master,https://github.com/eyaltoledano/claude-task-master,"An AI-powered task-management system you can drop into Cursor, Lovable, Windsurf, Roo, and others.",27862,6,2623,2,204,JavaScript,"ai,cursor,cursor-ai,cursorai,lovable,lovable-dev,roocode,task-manager,tasks,tasks-list,windsurf,windsurf-ai",2025-03-04T18:54:54Z,2026-07-15T18:30:53Z,2026-04-28T13:27:12Z,False
184,fingerprintjs/fingerprintjs,https://github.com/fingerprintjs/fingerprintjs,The most advanced free and open-source browser fingerprinting library,27752,53,2571,2,25,TypeScript,"audio-fingerprinting,browser,browser-fingerprint,browser-fingerprinting,detection,fingerprint,fingerprinting,fingerprintjs,fraud,fraud-detection,identification,javascript,visitor-identifier",2015-02-11T08:49:54Z,2026-07-15T22:42:14Z,2026-07-15T22:10:55Z,False
185,virattt/dexter,https://github.com/virattt/dexter,An autonomous agent for deep financial research,27390,17,3402,4,98,TypeScript,,2025-10-14T21:02:00Z,2026-07-15T20:42:54Z,2026-07-14T04:26:27Z,False
186,BloopAI/vibe-kanban,https://github.com/BloopAI/vibe-kanban,"Get 10X more out of Claude Code, Codex or any coding agent",27389,13,2908,1,534,Rust,"agent,ai-agents,kanban,management,task-manager",2025-06-14T19:10:21Z,2026-07-15T23:05:34Z,2026-04-24T09:17:34Z,False
187,yamadashy/repomix,https://github.com/yamadashy/repomix,"📦 Repomix is a powerful tool that packs your entire repository into a single, AI-friendly file. Perfect for when you need to feed your codebase to Large Language Models (LLMs) or other AI tools like Claude, ChatGPT, DeepSeek, Perplexity, Gemini, Gemma, Llama, Grok, and more.",27152,30,1437,0,167,TypeScript,"ai,anthropic,artificial-intelligence,chatbot,chatgpt,claude,deepseek,developer-tools,gemini,genai,generative-ai,gpt,javascript,language-model,llama,llm,mcp,nodejs,openai,typescript",2024-07-13T07:11:32Z,2026-07-15T21:54:57Z,2026-07-15T15:34:53Z,False
188,mlflow/mlflow,https://github.com/mlflow/mlflow,"The open source AI engineering platform for agents, LLMs, and ML models. MLflow enables teams of all sizes to debug, evaluate, monitor, and optimize production-quality AI applications while controlling costs and managing access to models and data.",27046,17,6004,5,2054,Python,"agentops,agents,ai,ai-governance,apache-spark,evaluation,langchain,llm-evaluation,llmops,machine-learning,ml,mlflow,mlops,model-management,observability,open-source,openai,prompt-engineering",2018-06-05T16:05:58Z,2026-07-15T20:28:51Z,2026-07-15T20:30:25Z,False
189,mbadolato/iTerm2-Color-Schemes,https://github.com/mbadolato/iTerm2-Color-Schemes,"Over 450 terminal color schemes/themes for iTerm/iTerm2. Includes ports to Terminal, Konsole, PuTTY, Xresources, XRDB, Remmina, Termite, XFCE, Tilda, FreeBSD VT, Terminator, Kitty, MobaXterm, LXTerminal, Microsoft's Windows Terminal, Visual Studio, Alacritty, Ghostty, and many more",27038,5,6519,1,23,Shell,"color-scheme,freebsd-vt,iterm,iterm2,konsole,konsole-color-schemes,lxterminal,osx-terminal-themes,putty,putty-color-schemes,schemes,terminal,terminal-schemes,terminal-themes,terminator,theme,themes,windows-terminal,xrdb,xresources",2011-04-01T04:01:46Z,2026-07-15T21:56:59Z,2026-07-14T14:22:20Z,False
190,volcengine/OpenViking,https://github.com/volcengine/OpenViking,"Self-evolving Context Database for AI Agents. Unify Agent Memory, Knowledge RAG and Skills.",26810,70,2096,5,329,Python,"agent-memory,agent-plugins,agentic-rag,context-database,self-evolving",2026-01-05T07:11:17Z,2026-07-15T22:45:26Z,2026-07-15T13:33:04Z,False
191,alibaba/page-agent,https://github.com/alibaba/page-agent,JavaScript in-page GUI agent. Control web interfaces with natural language.,26745,138,2459,20,48,TypeScript,"agent,ai,ai-agents,browser-automation,javascript,mcp,typescript,web",2025-09-23T09:30:17Z,2026-07-15T23:06:57Z,2026-07-15T09:19:07Z,False
192,jackwener/OpenCLI,https://github.com/jackwener/OpenCLI,Make Any Website into CLI & Use your logged-in browser by AI agent. ,26710,57,2628,7,220,JavaScript,"ai-agent,ai-agents,ai-tools,browser-automation,browser-use,cli,playwright",2026-03-14T22:10:23Z,2026-07-15T23:16:10Z,2026-07-12T19:23:18Z,False
193,charmbracelet/crush,https://github.com/charmbracelet/crush,Glamourous agentic coding for all 💘,26589,30,2115,8,555,Go,"agentic-ai,ai,llms,ravishing",2025-05-21T12:14:57Z,2026-07-15T23:14:40Z,2026-07-15T21:51:23Z,False
194,oraios/serena,https://github.com/oraios/serena,"A powerful MCP toolkit for coding, providing semantic retrieval and editing capabilities  - the IDE for your agent",26489,34,1761,2,117,Python,"agent,ai,ai-coding,claude,claude-code,codex,ide,jetbrains,language-server,mcp-server,programming,vibe-coding",2025-03-23T22:35:24Z,2026-07-15T21:57:42Z,2026-07-15T18:22:25Z,False
195,jarrodwatts/claude-hud,https://github.com/jarrodwatts/claude-hud,"A Claude Code plugin that shows what's happening - context usage, active tools, running agents, and todo progress",26435,34,1220,5,3,JavaScript,"anthropic,claude,claude-code,cli,plugin,statusline,typescript",2026-01-02T01:35:07Z,2026-07-15T22:41:19Z,2026-07-15T00:24:07Z,False
196,huggingface/open-r1,https://github.com/huggingface/open-r1,Fully open reproduction of DeepSeek-R1,26407,3,2444,-1,340,Python,,2025-01-24T15:44:11Z,2026-07-15T18:48:40Z,2026-04-02T14:03:15Z,False
197,garrytan/gbrain,https://github.com/garrytan/gbrain,Garry's Opinionated OpenClaw/Hermes Agent Brain,26314,91,3803,12,1342,TypeScript,,2026-04-05T14:40:56Z,2026-07-15T22:34:32Z,2026-07-15T02:23:23Z,False
198,langchain-ai/deepagents,https://github.com/langchain-ai/deepagents,The batteries-included agent harness.,26282,42,3678,8,171,Python,"ai,deepagents,langchain,langgraph,python,typescript",2025-07-27T23:07:53Z,2026-07-15T21:29:59Z,2026-07-15T23:01:00Z,False
