rank,full_name,url,description,stars,star_delta_vs_previous_day,forks,fork_delta_vs_previous_day,open_issues,language,topics,created_at,updated_at,pushed_at,archived
131,songquanpeng/one-api,https://github.com/songquanpeng/one-api,"LLM API 管理 & 分发系统，支持 OpenAI、Azure、Anthropic Claude、Google Gemini、DeepSeek、字节豆包、ChatGLM、文心一言、讯飞星火、通义千问、360 智脑、腾讯混元等主流模型，统一 API 适配，可用于 key 管理与二次分发。单可执行文件，提供 Docker 镜像，一键部署，开箱即用。LLM API management & key redistribution system, unifying multiple providers under a single API. Single binary, Docker-ready, with an English UI.",35632,20,6728,1,1023,JavaScript,"api,api-gateway,azure-openai-api,chatgpt,claude,ernie-bot,gemini,gpt,openai,openai-api,proxy",2023-04-22T12:39:24Z,2026-07-10T17:40:32Z,2026-01-09T03:26:43Z,False
132,lfnovo/open-notebook,https://github.com/lfnovo/open-notebook,An Open Source implementation of Notebook LM with more flexibility and features,35418,148,4084,113,120,TypeScript,"assistant,learning,note-taking,notebook,notes-app,self-learning",2024-10-21T17:58:46Z,2026-07-10T23:16:04Z,2026-07-10T22:38:54Z,False
133,microsoft/playwright-mcp,https://github.com/microsoft/playwright-mcp,Playwright MCP server,34927,33,2902,4,2,TypeScript,"mcp,playwright",2025-03-21T17:48:36Z,2026-07-10T23:13:45Z,2026-07-09T19:12:14Z,False
134,casey/just,https://github.com/casey/just,🤖 Just a command runner,34700,18,812,0,176,Rust,,2016-06-17T06:08:08Z,2026-07-10T22:10:39Z,2026-07-10T03:56:32Z,False
135,tinyhumansai/openhuman,https://github.com/tinyhumansai/openhuman,"Your Personal AI super intelligence. A brain that builds a local-first memory of your life, a fantastic orchestrator of agent fleets and workflows, and a deep researcher.",34610,55,3375,5,189,Rust,,2026-02-18T20:01:27Z,2026-07-10T21:34:07Z,2026-07-10T21:34:01Z,False
136,heygen-com/hyperframes,https://github.com/heygen-com/hyperframes,Write HTML. Render video. Built for agents.,34159,166,3194,22,160,TypeScript,"ai,animation,ffmpeg,framework,gsap,html,mcp,puppeteer,rendering,typescript,video",2026-03-10T01:51:06Z,2026-07-10T22:50:24Z,2026-07-10T23:12:38Z,False
137,ashishpatel26/500-AI-Agents-Projects,https://github.com/ashishpatel26/500-AI-Agents-Projects,"The 500 AI Agents Projects is a curated collection of AI agent use cases across various industries. It showcases practical applications and provides links to open-source projects for implementation, illustrating how AI agents are transforming sectors such as healthcare, finance, education, retail, and more.",34098,69,6048,12,85,Python,"ai-agents,genai",2024-12-20T13:37:15Z,2026-07-10T22:47:45Z,2026-06-06T11:58:47Z,False
138,huggingface/diffusers,https://github.com/huggingface/diffusers,"🤗 Diffusers: State-of-the-art diffusion models for image, video, and audio generation in PyTorch.",34037,12,7141,8,1264,Python,"deep-learning,diffusion,flux,image-generation,image2image,image2video,latent-diffusion-models,pytorch,qwen-image,score-based-generative-modeling,stable-diffusion,stable-diffusion-diffusers,text2image,text2video,video2video",2022-05-30T16:04:02Z,2026-07-10T16:38:31Z,2026-07-10T18:15:58Z,False
139,VectifyAI/PageIndex,https://github.com/VectifyAI/PageIndex,"📑 PageIndex: Document Index for Vectorless, Reasoning-based RAG",33925,21,2953,-14,134,Python,"agentic-ai,agents,ai,ai-agents,context-engineering,information-retrieval,llm,rag,reasoning,retrieval,retrieval-augmented-generation,vector-database",2025-04-01T10:53:54Z,2026-07-10T17:24:45Z,2026-07-10T06:59:58Z,False
140,anthropics/financial-services,https://github.com/anthropics/financial-services,,33351,48,4906,17,173,Python,,2026-02-23T19:24:50Z,2026-07-10T21:15:14Z,2026-06-26T21:55:15Z,False
141,zeromicro/go-zero,https://github.com/zeromicro/go-zero,A cloud-native Go microservices framework with cli tool for productivity.,33173,8,4312,0,276,Go,"ai-native,ai-native-development,cloud-native,code-generation,framework,gateway,go,golang,grpc-gateway,microservice,microservice-framework,microservices,microservices-architecture,rest-api,restful,restful-api,rpc,rpc-framework,spec-driven-development,web-framework",2020-08-07T15:37:57Z,2026-07-10T16:27:23Z,2026-07-10T19:06:40Z,False
142,DayuanJiang/next-ai-draw-io,https://github.com/DayuanJiang/next-ai-draw-io,"A next.js web application that integrates AI capabilities with draw.io diagrams. This app allows you to create, modify, and enhance diagrams through natural language commands and AI-assisted visualization.",33119,128,3592,122,168,TypeScript,"ai,diagrams,productivity",2025-03-23T15:03:48Z,2026-07-10T23:02:03Z,2026-07-10T23:16:52Z,False
143,nicolargo/glances,https://github.com/nicolargo/glances,"Glances an Eye on your system. A top/htop alternative for GNU/Linux, BSD, Mac OS and Windows operating systems.",33076,3,1765,0,103,Python,"monitoring,multi-platform,python,restful,restful-api,system,terminal,web",2011-12-04T08:49:15Z,2026-07-10T22:04:39Z,2026-07-09T05:15:21Z,False
144,surrealdb/surrealdb,https://github.com/surrealdb/surrealdb,"A scalable, distributed, collaborative, document-graph database, for the realtime web",32653,4,1298,1,698,Rust,"backend-as-a-service,cloud-database,database,database-as-a-service,developer-tools,devtools,distributed,distributed-database,document-database,graph-database,iot-database,nosql,realtime-database,serverless,sql,surreal,surrealdb,web",2021-12-09T15:03:29Z,2026-07-10T15:57:09Z,2026-07-06T15:57:27Z,False
145,zeroclaw-labs/zeroclaw,https://github.com/zeroclaw-labs/zeroclaw,"Fast, small, and fully autonomous AI personal assistant infrastructure, any OS, any platform — deploy anywhere, swap anything 🦀",32217,5,4806,0,510,Rust,"agent,agentic,ai,infra,ml,openclaw,os,zeroclaw",2026-02-13T08:56:04Z,2026-07-10T21:37:02Z,2026-07-10T14:50:02Z,False
146,conductor-oss/conductor,https://github.com/conductor-oss/conductor,Conductor is an event driven agentic workflow engine providing durable and highly resilient execution engine for applications and AI Agents,31989,-3,953,0,207,Java,"distributed-systems,durable-execution,grpc,java,javascript,microservice-orchestration,orchestration-engine,orchestrator,reactjs,spring-boot,workflow-automation,workflow-engine,workflow-management,workflows",2023-12-08T06:06:09Z,2026-07-10T18:02:32Z,2026-07-10T21:35:58Z,False
147,linshenkx/prompt-optimizer,https://github.com/linshenkx/prompt-optimizer,An AI prompt optimizer for writing better prompts and getting better AI results.,31974,21,3730,4,19,TypeScript,"ai-prompts,ai-tools,llm,prompt,prompt-engineering,prompt-optimization,prompt-optimizer,prompt-testing,prompt-toolkit,prompt-tuning",2025-02-12T06:06:49Z,2026-07-10T20:43:06Z,2026-07-06T01:54:21Z,False
148,anthropics/claude-plugins-official,https://github.com/anthropics/claude-plugins-official,"Official, Anthropic-managed directory of high quality Claude Code Plugins.",31954,78,3531,16,812,Python,"claude-code,mcp,skills",2025-11-20T18:36:20Z,2026-07-10T21:42:44Z,2026-07-10T19:03:28Z,False
149,lightpanda-io/browser,https://github.com/lightpanda-io/browser,Lightpanda: the headless browser designed for AI and automation,31732,27,1406,2,95,Zig,"browser,browser-automation,cdp,headless,lightpanda,playwright,puppeteer,zig",2023-02-07T15:19:34Z,2026-07-10T21:29:59Z,2026-07-10T22:53:02Z,False
150,Wei-Shaw/sub2api,https://github.com/Wei-Shaw/sub2api,Sub2API 一站式开源中转服务，让 Claude、Openai 、Gemini、Grok订阅统一接入，支持拼车共享，更高效分摊成本，原生工具无缝使用。,31365,261,6415,54,1927,Go,"2api,antigravity2api,cc2api,claude,claude-code,codex,crs,crs2,gemini",2025-12-18T02:26:18Z,2026-07-10T23:01:46Z,2026-07-10T18:23:32Z,False
151,github/github-mcp-server,https://github.com/github/github-mcp-server,GitHub's official MCP Server,31345,22,4548,10,335,Go,"github,mcp,mcp-server",2025-03-04T16:42:04Z,2026-07-10T21:29:12Z,2026-07-10T17:25:35Z,False
152,langfuse/langfuse,https://github.com/langfuse/langfuse,"🪢 Open source AI engineering platform: LLM evals, observability, metrics, prompt management, playground, datasets. Integrates with OpenTelemetry, LangChain, OpenAI SDK, LiteLLM, and more. 🍊YC W23 ",30899,77,3253,13,707,TypeScript,"analytics,autogen,evaluation,langchain,large-language-models,llama-index,llm,llm-evaluation,llm-observability,llmops,monitoring,observability,open-source,openai,playground,prompt-engineering,prompt-management,self-hosted,ycombinator",2023-05-18T17:47:09Z,2026-07-10T21:53:24Z,2026-07-10T22:57:33Z,False
153,K-Dense-AI/scientific-agent-skills,https://github.com/K-Dense-AI/scientific-agent-skills,"Turn any AI agent into an AI Scientist. The #1 Agent Skills library for science, used by 160,000+ scientists worldwide. 140 ready-to-use skills plus 100+ scientific databases covering biology, chemistry, medicine, and drug discovery. Compatible with Cursor, Claude Code, Codex, Pi, Antigravity, and the open Agent Skills standard.",30638,58,3085,5,39,Python,"agent-skills,ai-scientist,bioinformatics,chemoinformatics,claude,claude-skills,claudecode,clinical-research,computational-biology,data-analysis,drug-discovery,genomics,materials-science,metabolomics,proteomics,scientific-computing,scientific-visualization",2025-10-19T20:54:15Z,2026-07-10T22:34:31Z,2026-07-08T22:23:53Z,False
154,nanocoai/nanoclaw,https://github.com/nanocoai/nanoclaw,"A lightweight alternative to OpenClaw that runs in containers for security. Connects to WhatsApp, Telegram, Slack, Discord, Gmail and other messaging apps,, has memory, scheduled jobs, and runs directly on Anthropic's Agents SDK",30185,13,12882,2,844,TypeScript,"ai-agents,ai-assistant,claude-code,claude-skills,openclaw",2026-01-31T15:47:22Z,2026-07-10T22:35:35Z,2026-07-10T20:29:48Z,False
155,sgl-project/sglang,https://github.com/sgl-project/sglang,SGLang is a high-performance serving framework for large language models and multimodal models.,30163,46,7076,28,4138,Python,"attention,blackwell,cuda,deepseek,diffusion,glm,gpt-oss,inference,llama,llm,minimax,moe,qwen,qwen-image,reinforcement-learning,transformer,vlm,wan",2024-01-08T04:15:52Z,2026-07-10T22:56:39Z,2026-07-10T23:18:21Z,False
156,lbjlaq/Antigravity-Manager,https://github.com/lbjlaq/Antigravity-Manager,Professional Antigravity Account Manager & Switcher. One-click seamless account switching for Antigravity Tools. Built with Tauri v2 + React (Rust).专业的 Antigravity 账号管理与切换工具。为 Antigravity 提供一键无缝账号切换功能。,30057,11,3270,2,1759,Rust,"account-manager,antigravity",2025-11-26T10:47:13Z,2026-07-10T18:32:21Z,2026-07-10T08:51:12Z,False
157,Gitlawb/openclaude,https://github.com/Gitlawb/openclaude,runs anywhere. uses anything,29928,13,8868,2,49,TypeScript,"ai,ai-agent,ai-tools,cli,coding",2026-04-01T03:15:49Z,2026-07-10T23:07:33Z,2026-07-10T08:36:45Z,False
158,heroui-inc/heroui,https://github.com/heroui-inc/heroui,"🚀 Beautiful, fast and modern React UI library. (Previously NextUI)",29860,10,2175,0,44,MDX,"component-library,components,library,reactjs",2021-04-22T13:06:23Z,2026-07-10T20:42:24Z,2026-07-10T15:47:11Z,False
159,iOfficeAI/AionUi,https://github.com/iOfficeAI/AionUi,"Free, local, open-source 24/7 Cowork app for OpenClaw, Hermes Agent, Claude Code, Codex, OpenCode, Gemini CLI and 20+ more CLI | Customize your assistants | Star if you like it!",29784,92,2984,19,672,TypeScript,"acp,agent-team,ai,ai-agent,chat,chatbot,claude-code,clawdbot,codex,cowork,gemini,gemini-cli,hermes,llm,nano-banana,office,openclaw,opencode,skills,webui",2025-08-07T10:29:51Z,2026-07-10T23:04:59Z,2026-07-10T14:08:18Z,False
160,sipeed/picoclaw,https://github.com/sipeed/picoclaw,"Tiny, Fast, and Deployable anywhere — automate the mundane, unleash your creativity",29710,69,4433,115,63,Go,,2026-02-04T12:32:35Z,2026-07-10T18:30:27Z,2026-07-09T17:19:37Z,False
161,DeusData/codebase-memory-mcp,https://github.com/DeusData/codebase-memory-mcp,"High-performance code intelligence MCP server. Indexes codebases into a persistent knowledge graph — average repo in milliseconds. 158 languages, sub-ms queries, 99% fewer tokens. Single static binary, zero dependencies.",29688,547,2359,160,220,C,"aider,ast,claude-code,code-analysis,code-intelligence,codex,cursor,cypher,developer-tools,gemini-cli,graph-visualization,kilocode,knowledge-graph,mcp,mcp-server,model-context-protocol,opencode,sqlite,tree-sitter,windsurf",2026-02-24T22:01:00Z,2026-07-10T23:17:08Z,2026-07-10T22:23:09Z,False
162,JushBJJ/Mr.-Ranedeer-AI-Tutor,https://github.com/JushBJJ/Mr.-Ranedeer-AI-Tutor,A GPT-4 AI Tutor Prompt for customizable personalized learning experiences.,29613,2,3298,0,17,,"ai,education,gpt-4,llm",2023-03-31T12:37:26Z,2026-07-10T22:11:18Z,2025-09-30T08:08:00Z,False
163,ComposioHQ/composio,https://github.com/ComposioHQ/composio,"Composio powers 1000+ toolkits, tool search, context management, authentication, and a sandboxed workbench to help you build AI agents that turn intent into action.",29166,14,4653,5,77,TypeScript,"agentic-ai,agents,ai,ai-agents,aiagents,developer-tools,function-calling,gpt-4,javascript,js,llm,llmops,mcp,python,remote-mcp-server,sse,typescript",2024-02-23T13:58:27Z,2026-07-10T21:27:04Z,2026-07-10T22:36:41Z,False
164,tastejs/todomvc,https://github.com/tastejs/todomvc,"Helping you select a JavaScript framework - Todo apps for React.js, Angular, Vue and many more",28943,-1,13754,1,71,JavaScript,,2011-06-03T19:56:33Z,2026-07-10T21:53:57Z,2026-06-06T23:35:53Z,False
165,SigNoz/signoz,https://github.com/SigNoz/signoz,"SigNoz is an open-source observability platform native to OpenTelemetry with logs, traces and metrics in a single application. An open-source alternative to DataDog, NewRelic, etc. 🔥 🖥.   👉  Open source Application Performance Monitoring (APM) & Observability tool",28802,206,2299,3,1526,TypeScript,"apm,application-monitoring,distributed-tracing,go,good-first-issue,jaeger,log,logs,metrics,monitoring,nextjs,observability,open-source,opentelemetry,prometheus,react,reactjs,self-hosted,tracing,typescript",2021-01-03T12:44:36Z,2026-07-10T23:12:54Z,2026-07-10T19:20:08Z,False
166,davila7/claude-code-templates,https://github.com/davila7/claude-code-templates,CLI tool for configuring and monitoring Claude Code,28752,203,3161,143,192,Python,"anthropic,anthropic-claude,claude,claude-code",2025-07-04T01:26:26Z,2026-07-10T22:53:51Z,2026-07-10T14:13:41Z,False
167,blader/humanizer,https://github.com/blader/humanizer,Claude Code skill that removes signs of AI-generated writing from text,28619,160,2645,18,68,,,2026-01-18T05:30:15Z,2026-07-10T23:16:08Z,2026-06-29T20:43:06Z,False
168,getzep/graphiti,https://github.com/getzep/graphiti,Build Real-Time Knowledge Graphs for AI Agents,28587,31,2880,4,422,Python,"agents,graph,llms,rag",2024-08-08T22:08:30Z,2026-07-10T22:47:20Z,2026-07-09T07:08:39Z,False
169,supermemoryai/supermemory,https://github.com/supermemoryai/supermemory,"Memory and context engine + app that is extremely fast, scalable, and can be run fully locally. The Memory API for the AI era.",28310,18,2456,8,57,TypeScript,"agent-memory,ai-memory,cloudflare-kv,cloudflare-pages,cloudflare-workers,drizzle-orm,memory,postgres,remix,tailwindcss,typescript,vite",2024-02-27T20:10:04Z,2026-07-10T22:48:29Z,2026-07-10T22:48:24Z,False
170,microsoft/semantic-kernel,https://github.com/microsoft/semantic-kernel,Integrate cutting-edge LLM technology quickly and easily into your apps,28292,4,4671,-2,256,C#,"ai,artificial-intelligence,llm,openai,sdk",2023-02-27T17:39:42Z,2026-07-10T19:58:40Z,2026-07-10T22:29:35Z,False
171,huggingface/smolagents,https://github.com/huggingface/smolagents,🤗 smolagents: a barebones library for agents that think in code.,28282,18,2755,5,676,Python,,2024-12-05T11:28:04Z,2026-07-10T21:44:57Z,2026-07-10T05:49:27Z,False
172,ScrapeGraphAI/Scrapegraph-ai,https://github.com/ScrapeGraphAI/Scrapegraph-ai,Python scraper based on AI,28251,25,2728,5,3,Python,"ai-crawler,ai-scraping,ai-search,crawler,data-extraction,firecrawl-alternative,large-language-model,llm,markdown,rag,scraping,scraping-python,web-crawler,web-crawlers,web-data,web-data-extraction,web-scraper,web-scraping,web-search,webscraping",2024-01-27T16:54:38Z,2026-07-10T21:19:06Z,2026-07-08T15:42:38Z,False
173,assafelovic/gpt-researcher,https://github.com/assafelovic/gpt-researcher,An autonomous agent that conducts deep research on any data using any LLM providers,28244,30,3817,4,222,Python,"agent,ai,automation,deepresearch,llms,mcp,mcp-server,python,research,search,webscraping",2023-05-12T10:33:54Z,2026-07-10T20:28:16Z,2026-07-05T14:51:31Z,False
174,TanStack/table,https://github.com/TanStack/table,"🤖 Headless UI for building powerful tables & datagrids for TS/JS -  React-Table, Vue-Table, Solid-Table, Svelte-Table",28175,5,3539,0,380,TypeScript,"datagrid,datagrids,datatable,filtering,grid,grouping,hooks,javascript,pagination,react,reactjs,solid,solidjs,sorting,svelte,sveltejs,table,typescript,vue",2016-10-20T17:25:08Z,2026-07-10T19:44:18Z,2026-07-10T17:56:11Z,False
175,eyaltoledano/claude-task-master,https://github.com/eyaltoledano/claude-task-master,"An AI-powered task-management system you can drop into Cursor, Lovable, Windsurf, Roo, and others.",27810,5,2620,6,203,JavaScript,"ai,cursor,cursor-ai,cursorai,lovable,lovable-dev,roocode,task-manager,tasks,tasks-list,windsurf,windsurf-ai",2025-03-04T18:54:54Z,2026-07-10T20:21:53Z,2026-04-28T13:27:12Z,False
176,tobi/qmd,https://github.com/tobi/qmd,"mini cli search engine for your docs, knowledge bases, meeting notes, whatever. Tracking current sota approaches while being all local",27689,49,1729,2,138,TypeScript,,2025-12-08T14:22:57Z,2026-07-10T22:27:30Z,2026-06-24T04:53:48Z,False
177,fingerprintjs/fingerprintjs,https://github.com/fingerprintjs/fingerprintjs,The most advanced free and open-source browser fingerprinting library,27674,5,2567,0,22,TypeScript,"audio-fingerprinting,browser,browser-fingerprint,browser-fingerprinting,detection,fingerprint,fingerprinting,fingerprintjs,fraud,fraud-detection,identification,javascript,visitor-identifier",2015-02-11T08:49:54Z,2026-07-10T17:17:26Z,2026-06-30T13:37:56Z,False
178,Yuan1z0825/nature-skills,https://github.com/Yuan1z0825/nature-skills,符合nature论文学术表达和科研绘图的Skill,27661,224,1675,15,0,Python,"codex-skills,nature,nature-skills",2026-04-24T03:11:46Z,2026-07-10T22:51:06Z,2026-07-10T03:21:57Z,False
179,topoteretes/cognee,https://github.com/topoteretes/cognee,Cognee is the open-source AI memory platform for agents. Give your AI agents persistent long-term memory across sessions with a self-hosted knowledge graph engine.,27551,121,2725,137,619,Python,"agent-memory,agent-skills,ai,ai-agents,ai-memory,cognitive-architecture,cognitive-memory,context-engineering,contributions-welcome,good-first-issue,good-first-pr,graph-database,graph-rag,help-wanted,knowledge,knowledge-graph,memory-management,open-source,vector-database",2023-08-16T16:16:33Z,2026-07-10T23:11:55Z,2026-07-10T22:45:49Z,False
180,JCodesMore/ai-website-cloner-template,https://github.com/JCodesMore/ai-website-cloner-template,Clone any website with one command using AI coding agents,27502,318,4009,141,25,TypeScript,"ai,ai-agents,ai-tools,automation,boilerplate,claude,claude-code,clone,developer-tools,nextjs,react,reverse-engineering,shadcn-ui,skills,tailwindcss,template,typescript,web-scraping,website-clone",2026-03-13T11:14:39Z,2026-07-10T23:07:54Z,2026-07-04T06:49:18Z,False
181,alchaincyf/nuwa-skill,https://github.com/alchaincyf/nuwa-skill,你想蒸馏的下一个员工，何必是同事。蒸馏任何人的思维方式——心智模型、决策启发式、表达DNA。Distill how anyone thinks.,27466,85,3905,14,4,Python,,2026-04-05T04:33:04Z,2026-07-10T23:10:01Z,2026-07-02T03:11:38Z,False
182,openai/codex-plugin-cc,https://github.com/openai/codex-plugin-cc,Use Codex from Claude Code to review code or delegate tasks.,27421,268,1775,112,305,JavaScript,,2026-03-30T15:29:52Z,2026-07-10T23:07:55Z,2026-07-08T00:17:31Z,False
183,virattt/dexter,https://github.com/virattt/dexter,An autonomous agent for deep financial research,27345,7,3392,1,97,TypeScript,,2025-10-14T21:02:00Z,2026-07-10T23:18:17Z,2026-07-10T20:53:17Z,False
184,BloopAI/vibe-kanban,https://github.com/BloopAI/vibe-kanban,"Get 10X more out of Claude Code, Codex or any coding agent",27329,10,2903,5,533,Rust,"agent,ai-agents,kanban,management,task-manager",2025-06-14T19:10:21Z,2026-07-10T20:21:56Z,2026-04-24T09:17:34Z,False
185,yamadashy/repomix,https://github.com/yamadashy/repomix,"📦 Repomix is a powerful tool that packs your entire repository into a single, AI-friendly file. Perfect for when you need to feed your codebase to Large Language Models (LLMs) or other AI tools like Claude, ChatGPT, DeepSeek, Perplexity, Gemini, Gemma, Llama, Grok, and more.",27048,31,1430,0,168,TypeScript,"ai,anthropic,artificial-intelligence,chatbot,chatgpt,claude,deepseek,developer-tools,gemini,genai,generative-ai,gpt,javascript,language-model,llama,llm,mcp,nodejs,openai,typescript",2024-07-13T07:11:32Z,2026-07-10T22:44:03Z,2026-07-09T16:14:42Z,False
186,mbadolato/iTerm2-Color-Schemes,https://github.com/mbadolato/iTerm2-Color-Schemes,"Over 450 terminal color schemes/themes for iTerm/iTerm2. Includes ports to Terminal, Konsole, PuTTY, Xresources, XRDB, Remmina, Termite, XFCE, Tilda, FreeBSD VT, Terminator, Kitty, MobaXterm, LXTerminal, Microsoft's Windows Terminal, Visual Studio, Alacritty, Ghostty, and many more",27021,2,6518,0,24,Shell,"color-scheme,freebsd-vt,iterm,iterm2,konsole,konsole-color-schemes,lxterminal,osx-terminal-themes,putty,putty-color-schemes,schemes,terminal,terminal-schemes,terminal-themes,terminator,theme,themes,windows-terminal,xrdb,xresources",2011-04-01T04:01:46Z,2026-07-10T20:40:31Z,2026-06-29T16:18:27Z,False
187,mlflow/mlflow,https://github.com/mlflow/mlflow,"The open source AI engineering platform for agents, LLMs, and ML models. MLflow enables teams of all sizes to debug, evaluate, monitor, and optimize production-quality AI applications while controlling costs and managing access to models and data.",26970,16,5979,7,2042,Python,"agentops,agents,ai,ai-governance,apache-spark,evaluation,langchain,llm-evaluation,llmops,machine-learning,ml,mlflow,mlops,model-management,observability,open-source,openai,prompt-engineering",2018-06-05T16:05:58Z,2026-07-10T21:53:17Z,2026-07-10T21:24:26Z,False
188,volcengine/OpenViking,https://github.com/volcengine/OpenViking,"Self-evolving Context Database for AI Agents. Unify Agent Memory, Knowledge RAG and Skills.",26553,76,2077,10,299,Python,"agent-memory,agent-plugins,agentic-rag,context-database,self-evolving",2026-01-05T07:11:17Z,2026-07-10T21:29:17Z,2026-07-10T16:45:39Z,False
189,jackwener/OpenCLI,https://github.com/jackwener/OpenCLI,Make Any Website into CLI & Use your logged-in browser by AI agent. ,26431,52,2607,3,220,JavaScript,"ai-agent,ai-agents,ai-tools,browser-automation,browser-use,cli,playwright",2026-03-14T22:10:23Z,2026-07-10T22:27:47Z,2026-07-04T17:35:15Z,False
190,charmbracelet/crush,https://github.com/charmbracelet/crush,Glamourous agentic coding for all 💘,26429,105,2095,114,543,Go,"agentic-ai,ai,llms,ravishing",2025-05-21T12:14:57Z,2026-07-10T22:15:34Z,2026-07-10T17:45:09Z,False
191,huggingface/open-r1,https://github.com/huggingface/open-r1,Fully open reproduction of DeepSeek-R1,26399,-2,2447,1,340,Python,,2025-01-24T15:44:11Z,2026-07-10T12:23:27Z,2026-04-02T14:03:15Z,False
192,jarrodwatts/claude-hud,https://github.com/jarrodwatts/claude-hud,"A Claude Code plugin that shows what's happening - context usage, active tools, running agents, and todo progress",26314,21,1209,1,17,JavaScript,"anthropic,claude,claude-code,cli,plugin,statusline,typescript",2026-01-02T01:35:07Z,2026-07-10T22:11:23Z,2026-07-04T21:32:33Z,False
193,oraios/serena,https://github.com/oraios/serena,"A powerful MCP toolkit for coding, providing semantic retrieval and editing capabilities  - the IDE for your agent",26305,38,1750,1,123,Python,"agent,ai,ai-coding,claude,claude-code,codex,ide,jetbrains,language-server,mcp-server,programming,vibe-coding",2025-03-23T22:35:24Z,2026-07-10T22:58:59Z,2026-07-10T20:40:47Z,False
194,PrefectHQ/fastmcp,https://github.com/PrefectHQ/fastmcp,"🚀 The fast, Pythonic way to build MCP servers and clients.",26092,30,2123,3,276,Python,"agents,fastmcp,llms,mcp,mcp-clients,mcp-servers,mcp-tools,model-context-protocol,python",2024-11-30T01:47:40Z,2026-07-10T22:36:28Z,2026-07-09T20:33:36Z,False
195,langchain-ai/deepagents,https://github.com/langchain-ai/deepagents,The batteries-included agent harness.,26062,52,3652,8,189,Python,"ai,deepagents,langchain,langgraph,python,typescript",2025-07-27T23:07:53Z,2026-07-10T22:19:50Z,2026-07-10T23:18:38Z,False
196,mastra-ai/mastra,https://github.com/mastra-ai/mastra,Mastra is the modern TypeScript framework for AI-powered applications and agents.,26027,30,2394,7,425,TypeScript,"agents,ai,chatbots,evals,javascript,llm,mcp,nextjs,nodejs,reactjs,tts,typescript,workflows",2024-08-06T20:44:31Z,2026-07-10T23:09:44Z,2026-07-10T23:08:01Z,False
197,Kilo-Org/kilocode,https://github.com/Kilo-Org/kilocode,"Kilo is the all-in-one agentic engineering platform. Build, ship, and iterate faster with the most popular open source coding agent.",25987,58,2880,6,740,TypeScript,"ai,ai-age,ai-coding,ai-developer-tools,chatgpt,claude,cli,gemini,jetbrains,sonnet,vscode,vscode-extension",2025-03-10T15:34:26Z,2026-07-10T22:59:26Z,2026-07-10T22:44:58Z,False
198,QwenLM/qwen-code,https://github.com/QwenLM/qwen-code,An open-source AI coding agent that lives in your terminal.,25928,26,2636,9,642,TypeScript,,2025-06-26T01:37:46Z,2026-07-10T20:24:11Z,2026-07-10T20:11:52Z,False
