rank,full_name,url,description,stars,star_delta_vs_previous_day,forks,fork_delta_vs_previous_day,open_issues,language,topics,created_at,updated_at,pushed_at,archived
341,fish2018/pansou,https://github.com/fish2018/pansou,PanSou是一款高性能的网盘资源搜索API服务，支持TG频道和插件搜索。系统设计以性能和可扩展性为核心，支持多频道多插件并发搜索、结果智能排序和网盘类型分类。docker集成前后端，一键启动，开箱即用。仅供学习研究，请勿以各种形式用于盈利目的。 ,13471,,3239,,6,Go,,2025-07-10T07:17:46Z,2026-06-14T14:39:21Z,2026-06-14T14:06:26Z,False
342,coleam00/context-engineering-intro,https://github.com/coleam00/context-engineering-intro,"Context engineering is the new vibe coding - it's the way to actually make AI coding assistants work. Claude Code is the best for this so that's what this repo is centered around, but you can apply this strategy with any AI coding assistant!",13461,-1,2710,1,33,Python,,2025-07-02T11:54:47Z,2026-06-14T17:03:54Z,2026-03-16T12:13:59Z,False
343,genlayerlabs/genlayer-project-boilerplate,https://github.com/genlayerlabs/genlayer-project-boilerplate,,13449,7,676,0,28,TypeScript,,2024-06-28T06:59:47Z,2026-06-14T20:16:49Z,2026-06-11T21:44:59Z,False
344,aiming-lab/AutoResearchClaw,https://github.com/aiming-lab/AutoResearchClaw,Fully autonomous & self-evolving research from idea to paper. Chat an Idea. Get a Paper. 🦞,13407,5,1571,0,12,Python,"autonomous-research,citation-verification,llm-agents,metaclaw,multi-agent-debate,openclaw,paper-generation,scientific-discovery,self-evolving",2026-03-15T03:38:49Z,2026-06-14T19:56:50Z,2026-06-03T15:58:09Z,False
345,browserless/browserless,https://github.com/browserless/browserless,Deploy headless browsers in Docker. Run on our cloud or bring your own. Free for non-commercial uses.,13339,4,1015,0,28,TypeScript,"browserless,chrome,docker,firefox,nodejs,playwright,puppeteer,typescript,webkit,websocket",2017-11-17T04:35:31Z,2026-06-14T21:16:30Z,2026-06-12T16:34:58Z,False
346,MetaMask/metamask-extension,https://github.com/MetaMask/metamask-extension,:globe_with_meridians: :electric_plug: The MetaMask browser extension enables browsing Ethereum blockchain enabled websites,13143,2,5546,0,2745,TypeScript,"brave,chrome,dapp,dapp-developers,edge,ethereum,extension,firefox,opera",2015-09-06T16:34:48Z,2026-06-14T21:37:54Z,2026-06-15T00:17:31Z,False
347,plantuml/plantuml,https://github.com/plantuml/plantuml,Generate diagrams from textual description,13089,0,1206,-1,602,Java,"diagram,diagram-as-code,diagrams,diagrams-as-code,java,plantuml,uml,uml-diagram",2010-11-04T15:55:50Z,2026-06-14T21:58:26Z,2026-06-14T22:08:22Z,False
348,ccfos/nightingale,https://github.com/ccfos/nightingale,Nightingale is to monitoring and alerting what Grafana is to visualization.,13079,2,1725,0,218,Go,"alerting,ccf,metrics,monitoring,nightingale,observability,open-falcon,time-series,tsdb",2020-03-03T17:08:26Z,2026-06-14T18:02:39Z,2026-06-14T16:30:45Z,False
349,ixartz/Next-js-Boilerplate,https://github.com/ixartz/Next-js-Boilerplate,"🚀🎉📚 Nextjs Boilerplate and Starter with App Router and Page Router support, Tailwind CSS 4 and TypeScript ⚡️ Made with developer experience first: Next.js 16 + TypeScript + ESLint + Prettier + Drizzle ORM + Husky + Lint-Staged + Vitest + Testing Library + Playwright + Storybook + Commitlint + VSCode + Sentry + PostCSS + Tailwind CSS ✨",12982,1,2394,1,4,TypeScript,"boilerplate,boilerplate-code,jamstack,javascript,js-boilerplate,netlify-template,next-js,next-theme,nextjs,nextjs-starter,nextjs-template,react,react-boilerplate,reactjs,starter-kit,starter-project,starter-template,tailwind-css,tailwindcss,typescript",2020-07-22T19:47:35Z,2026-06-14T17:24:45Z,2026-06-01T22:59:36Z,False
350,EleutherAI/lm-evaluation-harness,https://github.com/EleutherAI/lm-evaluation-harness,A framework for few-shot evaluation of language models.,12954,7,3337,0,857,Python,"evaluation-framework,language-model,transformer",2020-08-28T00:09:15Z,2026-06-15T00:09:16Z,2026-06-02T15:06:38Z,False
351,markmap/markmap,https://github.com/markmap/markmap,Build mindmaps with plain text,12873,0,983,0,61,TypeScript,"markmap,mindmap",2020-01-13T10:23:34Z,2026-06-14T19:50:34Z,2025-06-12T02:21:16Z,False
352,lsdefine/GenericAgent,https://github.com/lsdefine/GenericAgent,"Self-evolving agent: grows skill tree from 3.3K-line seed, achieving full system control with 6x less token consumption",12863,12,1483,1,142,Python,"ai-agent,automation,autonomous-agent,browser-automation,claude,computer-control,desktop-automation,gemini,lightweight,llm-agent,memory-system,python,self-evolving,skill-tree,task-automation",2026-01-16T15:45:24Z,2026-06-14T20:03:46Z,2026-06-14T01:43:07Z,False
353,tiny-craft/tiny-rdm,https://github.com/tiny-craft/tiny-rdm,"Tiny RDM (Tiny Redis Desktop Manager) - A modern, colorful, super lightweight Redis GUI client for Mac, Windows, and Linux. It also provides a web version that can be deployed via Docker.",12859,0,646,1,173,Vue,"go,golang,icon-pack,naive-ui,redis,redis-client,redis-desktop,redis-gui,redis-manager,redis-web,vue,wails,wails-app,web-view",2023-06-27T07:06:25Z,2026-06-14T09:09:49Z,2026-06-11T08:53:51Z,False
354,pipecat-ai/pipecat,https://github.com/pipecat-ai/pipecat,Open Source framework for voice and multimodal conversational AI,12824,9,2190,1,173,Python,"ai,chatbot-framework,chatbots,real-time,voice,voice-assistant",2023-12-27T12:59:00Z,2026-06-14T20:19:35Z,2026-06-15T00:14:33Z,False
355,BasedHardware/omi,https://github.com/BasedHardware/omi,"AI that sees your screen, listens to your conversations and tells you what to do",12786,5,2056,1,525,Dart,"ai,app,bci,c,flutter,friend,mobile,necklace,nextjs,omi,personas,python,smartglasses,summary,transcription,wearable",2024-03-22T18:12:25Z,2026-06-14T21:20:51Z,2026-06-14T17:29:18Z,False
356,YishenTu/claudian,https://github.com/YishenTu/claudian,An Obsidian plugin that embeds Claude Code/Codex as an AI collaborator in your vault,12760,20,795,5,88,TypeScript,"claude-code,codex,ide,obsidian,obsidian-plugin,productivity",2025-12-05T17:58:26Z,2026-06-14T23:46:31Z,2026-06-12T06:18:28Z,False
357,millionco/react-doctor,https://github.com/millionco/react-doctor,Your agent writes bad React. This catches it,12674,6,404,1,24,TypeScript,"agents,code-review,doctor,react,skill",2026-02-13T09:02:13Z,2026-06-14T23:55:11Z,2026-06-14T23:10:30Z,False
358,modelcontextprotocol/typescript-sdk,https://github.com/modelcontextprotocol/typescript-sdk,The official TypeScript SDK for Model Context Protocol servers and clients,12661,3,1927,1,458,TypeScript,,2024-09-24T20:45:31Z,2026-06-14T20:49:04Z,2026-06-14T05:34:20Z,False
359,neuml/txtai,https://github.com/neuml/txtai,"💡 All-in-one AI framework for semantic search, LLM orchestration and language model workflows",12654,2,831,0,8,Python,"agents,ai,ai-agents,embeddings,information-retrieval,language-model,large-language-models,llm,nlp,python,rag,retrieval-augmented-generation,search,search-engine,semantic-search,sentence-embeddings,transformers,txtai,vector-database,vector-search",2020-08-09T19:14:59Z,2026-06-14T21:34:28Z,2026-06-11T16:16:36Z,False
360,MiniMax-AI/skills,https://github.com/MiniMax-AI/skills,,12627,3,1086,3,57,C#,,2026-03-17T07:19:25Z,2026-06-14T17:41:44Z,2026-04-18T09:48:47Z,False
361,pingdotgg/t3code,https://github.com/pingdotgg/t3code,,12613,13,2524,8,781,TypeScript,,2026-02-08T23:46:22Z,2026-06-14T23:48:01Z,2026-06-14T23:55:53Z,False
362,NanmiCoder/cc-haha,https://github.com/NanmiCoder/cc-haha,Claude Code 泄露源码 - 本地可运行版本，新增跨平台桌面端软件补齐Computer Use（附带核心模块解析）,12605,13,8243,2,109,TypeScript,,2026-03-31T17:30:14Z,2026-06-14T21:38:26Z,2026-06-13T04:23:07Z,False
363,dreammis/social-auto-upload,https://github.com/dreammis/social-auto-upload,自动化上传视频到社交媒体：抖音、小红书、视频号、tiktok、youtube、bilibili,12590,10,2199,4,57,Python,"bilibili,douyin,tiktok,xiaohongshu,youtube",2023-12-04T07:49:16Z,2026-06-14T23:46:59Z,2026-06-08T07:04:42Z,False
364,nearai/ironclaw,https://github.com/nearai/ironclaw,"IronClaw is an Agent OS focused on privacy, security and extensibility",12452,2,1455,1,1168,Rust,"codeact,openclaw,rlm,rust,wasm",2026-02-03T06:57:10Z,2026-06-14T23:19:42Z,2026-06-14T23:39:43Z,False
365,can1357/oh-my-pi,https://github.com/can1357/oh-my-pi,"⌥  AI Coding agent for the terminal — hash-anchored edits, optimized tool harness, LSP, Python, browser, subagents, and more",12418,93,1052,10,258,TypeScript,"ai-agent,ai-coding-agent,anthropic,bun,claude,cli,coding-assistant,llm,mcp,multi-provider,openai,rust,terminal,tui,typescript",2025-12-31T14:01:28Z,2026-06-15T00:14:14Z,2026-06-14T23:43:34Z,False
366,The-Pocket/PocketFlow-Tutorial-Codebase-Knowledge,https://github.com/The-Pocket/PocketFlow-Tutorial-Codebase-Knowledge,Pocket Flow: Codebase to Tutorial,12391,-1,1413,0,73,Python,"coding,large-language-model,large-language-models,llm,llm-agent,llm-agents,llm-application,llm-apps,llm-framework,llm-frameworks,llms,pocket-flow,pocketflow",2025-04-02T20:56:33Z,2026-06-14T17:43:23Z,2026-05-31T01:26:41Z,False
367,contains-studio/agents,https://github.com/contains-studio/agents,sharing current agents in use,12386,0,2532,0,11,,,2025-07-28T14:42:35Z,2026-06-14T04:04:48Z,2025-07-28T16:13:43Z,False
368,chenhg5/cc-connect,https://github.com/chenhg5/cc-connect,"Bridge local AI coding agents (Claude Code, Cursor, Gemini CLI, Codex) to messaging platforms (Feishu/Lark, DingTalk, Slack, Telegram, Discord, LINE, WeChat Work). Chat with your AI dev assistant from anywhere — no public IP required for most platforms.",12375,28,1173,2,425,Go,,2026-02-28T02:39:39Z,2026-06-14T23:30:14Z,2026-06-14T23:59:17Z,False
369,infracost/infracost,https://github.com/infracost/infracost,"Cloud cost intelligence for engineers, AI coding agents, and CI/CD 💰📉 Shift FinOps Left!",12365,0,677,0,21,Go,"aws,azure,cdk,cloud,cloud-cost-estimates,cloud-formation,cost-estimation,cost-management,cost-optimization,devops,finops,gcp,google,infrastructure-as-code,monthly-costs,terraform,terraform-cost-estimation",2020-06-24T09:11:56Z,2026-06-13T15:36:39Z,2026-06-03T14:55:27Z,False
370,talkgo/night,https://github.com/talkgo/night,Weekly Go Online Meetup via Bilibili｜Go 夜读｜通过 bilibili 在线直播的方式分享 Go 相关的技术话题，每天大家在微信/telegram/Slack 上及时沟通交流编程技术话题。,12297,0,1162,0,9,Go,"bilibili,bilibili-live,daily,discuss,go,golang,gopher,learning,offline,online,reading,reading-go,share,shenzhen,slack,study,wechat,zoom,zoom-us",2018-03-17T15:28:14Z,2026-06-14T06:03:30Z,2026-06-03T23:40:45Z,False
371,coreui/coreui-free-bootstrap-admin-template,https://github.com/coreui/coreui-free-bootstrap-admin-template,Free Bootstrap Admin & Dashboard Template Built for AI-Assisted Development,12215,-1,3137,0,4,HTML,"admin,admin-dashboard,admin-panel,admin-template,admin-theme,admin-ui,adminlte,bootstrap,bootstrap-admin,bootstrap-admin-dashboard,bootstrap-admin-panel,bootstrap-admin-template,bootstrap-admin-template-free,bootstrap5,bootstrap5-template,css,dashboard,scss,template,theme",2016-08-04T12:30:57Z,2026-06-14T11:15:25Z,2026-05-05T09:19:54Z,False
372,langgptai/LangGPT,https://github.com/langgptai/LangGPT,"LangGPT: Empowering everyone to become a prompt expert! 🚀  📌 结构化提示词（Structured Prompt）提出者 📌 元提示词（Meta-Prompt）发起者   📌 最流行的提示词落地范式 | Language of GPT  The pioneering framework for structured & meta-prompt design 10,000+ ⭐ | Battle-tested by thousands of users worldwide  Created by 云中江树",12210,0,936,0,0,Jupyter Notebook,"chatgpt,claude,deeplearning,doubao,framework,gemini,gpt-4,gpt3-prompts,langgpt,meta-prompting,prompt,prompt-engineering,qwen,structured-prompts",2023-05-06T13:49:43Z,2026-06-14T03:54:33Z,2026-06-09T10:11:57Z,False
373,blackboardsh/electrobun,https://github.com/blackboardsh/electrobun,"Build ultra fast, tiny, and cross-platform desktop apps with Typescript.",12201,4,331,0,235,TypeScript,,2024-02-28T03:18:15Z,2026-06-14T20:16:45Z,2026-06-14T14:18:14Z,False
374,smol-ai/developer,https://github.com/smol-ai/developer,the first library to let you embed a developer agent in your own app!,12188,0,1079,0,87,Python,,2023-05-13T07:19:57Z,2026-06-12T19:23:34Z,2024-04-07T07:11:03Z,False
375,HKUDS/Vibe-Trading,https://github.com/HKUDS/Vibe-Trading,"""Vibe-Trading: Your Personal Trading Agent""",12173,69,2354,18,6,Python,"ai-agent,algorithmic-trading,backtesting,fintech,llm,mcp,multi-agent,python,quantitative-finance,trading",2026-04-01T09:52:20Z,2026-06-14T23:46:17Z,2026-06-14T15:03:32Z,False
376,supertone-inc/supertonic,https://github.com/supertone-inc/supertonic,"Lightning-Fast, On-Device, Multilingual TTS — running natively via ONNX.",12172,194,1246,11,119,Swift,"cpp,csharp,flutter,go,ios,java,lightweight,multilingual,nodejs,on-device,onnx,onnxruntime,python,rust,speech-synthesis,swift,text-to-speech,tts,web,webgpu",2025-11-18T08:23:58Z,2026-06-15T00:17:14Z,2026-05-22T05:05:12Z,False
377,fathah/hermes-desktop,https://github.com/fathah/hermes-desktop,Desktop Companion for Hermes Agent,12162,96,1370,7,293,TypeScript,,2026-04-02T15:26:49Z,2026-06-15T00:13:42Z,2026-06-14T16:47:02Z,False
378,logto-io/logto,https://github.com/logto-io/logto,"🧑‍🚀 Authentication and authorization infrastructure for SaaS and AI apps, built on OIDC and OAuth 2.1 with multi-tenancy, SSO, and RBAC.",12154,2,822,0,181,TypeScript,"authentication,authorization,email,identity,jwt,login,logto,mfa,oauth2,openid-connect,password,passwordless,rbac,saml,signup,sms,social-login,sso,totp,typescript",2021-06-19T03:01:50Z,2026-06-14T23:19:48Z,2026-06-14T15:00:55Z,False
379,Wei-Shaw/claude-relay-service,https://github.com/Wei-Shaw/claude-relay-service,CRS-自建Claude Code镜像，一站式开源中转服务，让 Claude、OpenAI、Gemini、Droid 订阅统一接入，支持拼车共享，更高效分摊成本，原生工具无缝使用。,12087,3,1818,0,345,JavaScript,"claude,claude-api,claude-code,claude-proxy,codex-cli,crs,droid,droid-cli,droid2api,gemini-cli",2025-07-14T10:11:32Z,2026-06-14T18:30:02Z,2026-06-14T13:07:18Z,False
380,datahub-project/datahub,https://github.com/datahub-project/datahub,The Context Platform for your Data and AI Stack,12086,3,3514,0,912,Python,"agent-platform,context-management,data-catalog,data-discovery,data-governance,data-observability,datahub,metadata",2015-11-18T05:47:40Z,2026-06-14T21:43:16Z,2026-06-14T23:12:10Z,False
381,Portkey-AI/gateway,https://github.com/Portkey-AI/gateway,"A blazing fast AI Gateway with integrated guardrails. Route to 1,600+ LLMs, 50+ AI Guardrails with 1 fast & friendly API.",12069,7,1130,1,192,TypeScript,"ai-gateway,gateway,generative-ai,hacktoberfest,langchain,llm,llm-gateway,llmops,llms,mcp,mcp-client,mcp-gateway,mcp-servers,model-router,openai",2023-08-23T11:52:47Z,2026-06-15T00:11:52Z,2026-05-25T13:54:51Z,False
382,wanshuiyin/Auto-claude-code-research-in-sleep,https://github.com/wanshuiyin/Auto-claude-code-research-in-sleep,"ARIS ⚔️ (Auto-Research-In-Sleep) — Lightweight Markdown-only skills for autonomous ML research: cross-model review loops, idea discovery, and experiment automation. No framework, no lock-in — works with Claude Code, Codex, OpenClaw, or any LLM agent.",12061,21,1108,3,52,Python,"ai-research,ai-tools,aris,autonomous-agent,claude,claude-code,claude-code-skills,codex,deep-learning,gpt,idea-generation,llm,machine-learning,mcp,mcp-server,ml-research,openai,paper-review,paper-writing,research-automation",2026-03-10T07:31:45Z,2026-06-15T00:15:52Z,2026-06-14T13:27:49Z,False
383,encoredev/encore,https://github.com/encoredev/encore,Automate infrastructure from local to your cloud,12047,1,589,1,115,Go,"aws,backend,cloud,cloud-native,database,devops,devops-automation,distributed-systems,encore,gcp,go,golang,infrastructure-as-code,infrastructure-automation,microservices,serverless,typescript",2021-02-17T16:33:24Z,2026-06-14T14:13:05Z,2026-06-12T14:21:56Z,False
384,axolotl-ai-cloud/axolotl,https://github.com/axolotl-ai-cloud/axolotl,Go ahead and axolotl questions,12045,0,1368,0,231,Python,"fine-tuning,llm",2023-04-14T04:25:47Z,2026-06-13T19:39:35Z,2026-06-14T17:57:22Z,False
385,simonw/llm,https://github.com/simonw/llm,Access large language models from the command-line,12042,1,887,2,621,Python,"ai,llms,openai",2023-04-01T21:16:57Z,2026-06-14T17:07:49Z,2026-06-11T08:42:28Z,False
386,sanbuphy/learn-coding-agent,https://github.com/sanbuphy/learn-coding-agent,Research on Coding Agents,11995,3,19703,-1,61,,,2026-03-31T09:07:08Z,2026-06-14T22:50:41Z,2026-04-01T10:55:06Z,False
387,kubeshark/kubeshark,https://github.com/kubeshark/kubeshark,"eBPF-powered network observability for Kubernetes. Indexes L4/L7 traffic with full K8s context, decrypts TLS without keys. Queryable by AI agents via MCP and humans via dashboard.",11951,0,539,0,140,Go,"cloud-native,devops,docker,ebpf,golang,grpc,incident-response,kubernetes,mcp,network-analysis,network-engineering,network-observability,network-security,observability,pcap,rest,root-cause-analysis,sniffer,sre,wireshark",2021-04-19T10:29:56Z,2026-06-14T05:43:30Z,2026-06-03T18:01:45Z,False
388,StarTrail-org/LEANN,https://github.com/StarTrail-org/LEANN,"[MLsys2026]: RAG on Everything with LEANN. Enjoy 97% storage savings while running a fast, accurate, and 100% private RAG application on your personal device.",11923,5,1061,0,52,Python,"ai,faiss,gpt-oss,langchain,llama-index,llm,localstorage,offline-first,ollama,privacy,python,rag,retrieval-augmented-generation,vector-database,vector-search,vectors",2025-06-09T06:52:59Z,2026-06-14T22:37:22Z,2026-06-09T03:12:21Z,False
389,hangwin/mcp-chrome,https://github.com/hangwin/mcp-chrome,"Chrome MCP Server is a Chrome extension-based Model Context Protocol (MCP) server that exposes your Chrome browser functionality to AI assistants like Claude, enabling complex browser automation, content analysis, and semantic search.",11921,4,1069,2,214,TypeScript,,2025-06-09T09:07:06Z,2026-06-14T21:45:52Z,2026-01-06T13:05:39Z,False
390,tadata-org/fastapi_mcp,https://github.com/tadata-org/fastapi_mcp,"Expose your FastAPI endpoints as Model Context Protocol (MCP) tools, with Auth!",11916,1,952,1,155,Python,"ai,authentication,authorization,claude,cursor,fastapi,llm,mcp,mcp-server,mcp-servers,modelcontextprotocol,openapi,windsurf",2025-03-08T11:15:43Z,2026-06-14T15:32:26Z,2025-11-24T14:51:54Z,False
391,siteboon/claudecodeui,https://github.com/siteboon/claudecodeui,"Use Claude Code, OpenCode, Cursor CLI, and Codex on mobile and web with CloudCLI (aka Claude Code UI). CloudCLI is a free open source webui/GUI that helps you manage your Claude Code session and projects remotely.",11871,10,1614,4,140,TypeScript,"anthropic,anthropic-ai,anthropic-claude,claude,claude-api,claude-code,claude-code-ui,claudecode,gui,mobile-first,react,ui",2025-06-25T12:51:12Z,2026-06-14T22:14:48Z,2026-06-12T21:25:57Z,False
392,jd-opensource/joyagent-jdgenie,https://github.com/jd-opensource/joyagent-jdgenie,开源的端到端产品级通用智能体,11851,1,1633,0,215,Java,,2025-07-16T02:59:53Z,2026-06-14T22:38:02Z,2026-02-12T06:33:00Z,False
393,zilliztech/claude-context,https://github.com/zilliztech/claude-context,Code search MCP for Claude Code. Make entire codebase the context for any coding agent.,11847,4,872,2,117,TypeScript,"agent,agentic-rag,ai-coding,claude-code,code-generation,code-search,cursor,embedding,gemini-cli,mcp,merkle-tree,nodejs,openai,rag,semantic-search,typescript,vector-database,vibe-coding,voyage-ai,vscode-extension",2025-06-06T02:12:47Z,2026-06-14T23:14:33Z,2026-06-08T08:31:15Z,False
394,superset-sh/superset,https://github.com/superset-sh/superset,"Code Editor for the AI Agents Era - Run an army of Claude Code, Codex, etc. on your machine",11831,23,1003,2,1329,TypeScript,"agentic-ai,ai-agents,claude-code,cli,codex,coding-agents,cursor-agent,desktop-app,developer-tools,electron,git-worktree,llm,mcp,opencode,orchestration,parallel-agents,terminal,tui,vibe-coding,worktrees",2025-10-21T09:16:51Z,2026-06-14T23:29:29Z,2026-06-15T00:10:00Z,False
395,InsForge/InsForge,https://github.com/InsForge/InsForge,"The all-in-one, open-source backend platform for agentic coding. InsForge gives your coding agent database, auth, storage, compute, hosting, and AI gateway to ship full-stack apps end-to-end.",11753,16,1005,1,77,TypeScript,"ai,ai-agents,coding,deno,embeddings,insforge,nextjs,oauth2,pgvector,postgresql,realtime,vectors,websockets",2025-07-29T05:56:00Z,2026-06-15T00:01:49Z,2026-06-14T23:39:15Z,False
396,zaidmukaddam/scira,https://github.com/zaidmukaddam/scira,Scira (Formerly MiniPerplx) is a minimalistic AI-powered search engine that helps you find information on the internet and cites it too. Powered by Vercel AI SDK!,11720,0,1478,1,24,TypeScript,"ai-search-engine,minimalistic-ai-search-engine,scira,scira-ai,search-engine",2024-08-07T13:29:49Z,2026-06-14T17:59:25Z,2026-03-20T15:56:31Z,False
397,langchain-ai/open_deep_research,https://github.com/langchain-ai/open_deep_research,,11699,4,1670,1,62,Python,,2024-11-20T17:37:22Z,2026-06-14T22:40:28Z,2026-06-07T21:35:57Z,False
398,bytedance/trae-agent,https://github.com/bytedance/trae-agent,Trae Agent is an LLM-based agent for general purpose software engineering tasks.,11659,0,1284,0,140,Python,"agent,llm,software-engineering",2025-06-13T12:05:15Z,2026-06-14T18:23:51Z,2026-02-05T11:21:00Z,False
399,BeehiveInnovations/pal-mcp-server,https://github.com/BeehiveInnovations/pal-mcp-server,The power of Claude Code / GeminiCLI / CodexCLI + [Gemini / OpenAI / OpenRouter / Azure / Grok / Ollama / Custom Model / All Of The Above] working as one.,11599,0,1014,1,133,Python,,2025-06-08T15:36:50Z,2026-06-14T22:29:23Z,2025-12-15T17:07:31Z,False
400,opensandbox-group/OpenSandbox,https://github.com/opensandbox-group/OpenSandbox,"Secure, Fast, and Extensible Sandbox runtime for AI agents.",11511,8,949,1,90,Python,"ai,ai-agent,ai-infra,kubernetes,sandbox",2025-12-17T08:41:09Z,2026-06-14T17:52:38Z,2026-06-12T15:35:36Z,False
401,kubescape/kubescape,https://github.com/kubescape/kubescape,"Kubescape is an open-source Kubernetes security platform for your IDE, CI/CD pipelines, and clusters. It includes risk analysis, security, compliance, and misconfiguration scanning, saving Kubernetes users and administrators precious time, effort, and resources.",11480,0,951,0,76,Go,"best-practice,devops,kubernetes,mitre-attack,nsa,security,vulnerability-detection",2021-08-12T10:39:29Z,2026-06-14T19:39:39Z,2026-06-14T19:39:34Z,False
402,nashsu/llm_wiki,https://github.com/nashsu/llm_wiki,"LLM Wiki is a cross-platform desktop application that turns your documents into an organized, interlinked knowledge base — automatically. Instead of traditional RAG (retrieve-and-answer from scratch every time), the LLM incrementally builds and maintains a persistent wiki from your sources。",11451,43,1396,7,145,TypeScript,,2026-04-08T11:24:01Z,2026-06-14T23:36:23Z,2026-06-14T07:47:59Z,False
403,browseros-ai/BrowserOS,https://github.com/browseros-ai/BrowserOS,"🌐 The open-source Agentic browser; alternative to ChatGPT Atlas, Perplexity Comet, Dia.",11381,8,1164,2,130,TypeScript,"agent,browser,browseros,chromium,hacktoberfest,linux,llm,lmstudio,macos,ollama,windows",2025-05-18T16:23:54Z,2026-06-14T22:27:41Z,2026-06-13T01:46:47Z,False
404,EvanLi/Github-Ranking,https://github.com/EvanLi/Github-Ranking,:star:Github Ranking:star: Github stars and forks ranking list. Github Top100 stars list of different languages. Automatically update daily. | Github仓库排名，每日自动更新,11374,8,669,0,32,Python,"forks,github-rank,github-stars,python,ranking,stars",2018-12-16T15:38:31Z,2026-06-14T23:27:13Z,2026-06-14T04:07:09Z,False
405,jlcodes99/cockpit-tools,https://github.com/jlcodes99/cockpit-tools," 🚀 通用 AI IDE 账号管理工具：支持 Antigravity / Codex / GitHub Copilot / Windsurf / Kiro / Cursor / Gemini-cli / CodeBuddy，多账号切换、配额监控、自动唤醒与多开实例管理。 🚀 Universal AI IDE account manager for Antigravity / Codex / GitHub Copilot / Windsurf / Kiro / Cursor / Gemini-cli / CodeBuddy, with multi-account switching, quota monitoring, wake-up automation, and multi-insta",11371,28,1034,4,312,Rust,"account-manager,ai,antigravity,codebuddy,codex,cursor,github-copilot,kiro,windsurf",2026-01-16T07:09:32Z,2026-06-14T20:34:33Z,2026-06-12T01:36:26Z,False
406,microsoft/playwright-cli,https://github.com/microsoft/playwright-cli,"CLI for common Playwright actions. Record and generate Playwright code, inspect selectors and take screenshots.",11324,7,596,0,13,TypeScript,playwright,2020-06-19T18:34:03Z,2026-06-14T23:47:02Z,2026-06-10T00:19:14Z,False
407,Open-LLM-VTuber/Open-LLM-VTuber,https://github.com/Open-LLM-VTuber/Open-LLM-VTuber,"Talk to any LLM with hands-free voice interaction, voice interruption, and Live2D taking face running locally across platforms",11324,33,1303,3,134,Python,"ai,ai-companion,ai-vtuber,ai-waifu,chatbots,live2d,live2d-web,llm,neuro-sama,ollama",2023-11-24T04:55:43Z,2026-06-15T00:13:46Z,2026-05-15T07:18:04Z,False
408,0xJacky/nginx-ui,https://github.com/0xJacky/nginx-ui,Yet another WebUI for Nginx,11211,0,834,0,89,Go,"chatgpt-app,code-completion,copilot,cron,deepseek-r1,docker,go,letsencrypt,linux,macos,mcp,mcp-server,nginx,self-hosted,vue,webui,windows",2021-02-19T10:51:04Z,2026-06-14T05:41:01Z,2026-06-14T20:47:07Z,False
409,tambo-ai/tambo,https://github.com/tambo-ai/tambo,Generative UI SDK for React,11157,0,572,0,29,TypeScript,"agent,agents,ai,assistant,assistant-chat-bots,generative-ui,js,react,reactjs,ui,ui-components",2024-06-15T17:11:37Z,2026-06-14T11:11:24Z,2026-06-13T00:28:39Z,False
