rank,full_name,url,description,stars,star_delta_vs_previous_day,forks,fork_delta_vs_previous_day,open_issues,language,topics,created_at,updated_at,pushed_at,archived
1,public-apis/public-apis,https://github.com/public-apis/public-apis,A collective list of free APIs,450459,380,49533,48,1536,Python,"api,apis,dataset,development,free,list,lists,open-source,public,public-api,public-apis,resources,software",2016-03-20T23:49:42Z,2026-07-15T23:15:14Z,2026-07-13T15:58:22Z,False
2,obra/superpowers,https://github.com/obra/superpowers,An agentic skills framework & software development methodology that works.,255385,711,22831,74,312,Shell,"ai,brainstorming,coding,obra,sdlc,skills,subagent-driven-development,superpowers",2025-10-09T19:45:18Z,2026-07-15T23:13:12Z,2026-07-15T19:15:17Z,False
3,affaan-m/ECC,https://github.com/affaan-m/ECC,"The agent harness performance optimization system. Skills, instincts, memory, security, and research-first development for Claude Code, Codex, Opencode, Cursor and beyond.",230107,396,35220,57,109,JavaScript,"ai-agents,anthropic,claude,claude-code,developer-tools,llm,mcp,productivity",2026-01-18T00:51:51Z,2026-07-15T23:16:39Z,2026-07-14T01:31:12Z,False
4,NousResearch/hermes-agent,https://github.com/NousResearch/hermes-agent,The agent that grows with you,215445,579,40179,202,23061,Python,"ai,ai-agent,ai-agents,anthropic,chatgpt,claude,claude-code,clawdbot,codex,hermes,hermes-agent,llm,moltbot,nous-research,openai,openclaw",2025-07-22T22:22:28Z,2026-07-15T23:17:05Z,2026-07-15T22:52:49Z,False
5,ultraworkers/claw-code,https://github.com/ultraworkers/claw-code,"An agent-managed museum exhibit, built in Rust with Gajae-Code / LazyCodex — developed and maintained with no human intervention.",194772,12,109642,-22,31,Rust,,2026-03-31T08:58:08Z,2026-07-15T23:15:54Z,2026-06-26T16:17:10Z,False
6,multica-ai/andrej-karpathy-skills,https://github.com/multica-ai/andrej-karpathy-skills,"A single CLAUDE.md file to improve Claude Code behavior, derived from Andrej Karpathy's observations on LLM coding pitfalls.",192781,575,19815,79,125,,,2026-01-27T03:53:13Z,2026-07-15T23:18:14Z,2026-04-20T10:05:04Z,False
7,ollama/ollama,https://github.com/ollama/ollama,"Get up and running with Kimi-K2.6, GLM-5.1, MiniMax, DeepSeek, gpt-oss, Qwen, Gemma and other models.",176195,80,16970,6,3451,Go,"deepseek,gemma,gemma3,glm,go,golang,gpt-oss,llama,llama3,llm,llms,minimax,mistral,ollama,qwen",2023-06-26T19:39:32Z,2026-07-15T23:04:40Z,2026-07-15T21:38:55Z,False
8,mattpocock/skills,https://github.com/mattpocock/skills,Skills for Real Engineers. Straight from my .claude directory.,172205,2053,14786,146,168,Shell,,2026-02-03T11:15:53Z,2026-07-15T23:18:17Z,2026-07-14T18:32:39Z,False
9,anthropics/skills,https://github.com/anthropics/skills,Public repository for Agent Skills,161430,292,19075,46,1031,Python,agent-skills,2025-09-22T15:53:31Z,2026-07-15T23:12:34Z,2026-07-13T22:31:37Z,False
10,langflow-ai/langflow,https://github.com/langflow-ai/langflow,Langflow is a powerful tool for building and deploying AI-powered agents and workflows.,151918,40,9678,4,978,Python,"agents,chatgpt,generative-ai,large-language-models,multiagent,react-flow",2023-02-08T22:28:03Z,2026-07-15T23:11:10Z,2026-07-15T23:16:50Z,False
11,firecrawl/firecrawl,https://github.com/firecrawl/firecrawl,"The API to search, scrape, and interact with the web at scale. 🔥",151517,492,8657,31,401,TypeScript,"ai,ai-agents,ai-crawler,ai-scraping,ai-search,crawler,data-extraction,html-to-markdown,llm,markdown,scraper,scraping,web-crawler,web-data,web-data-extraction,web-scraper,web-scraping,web-search,webscraping",2024-04-15T21:02:29Z,2026-07-15T23:16:42Z,2026-07-15T16:53:48Z,False
12,x1xhlol/system-prompts-and-models-of-ai-tools,https://github.com/x1xhlol/system-prompts-and-models-of-ai-tools,"FULL Augment Code, Claude Code, Cluely, CodeBuddy, Comet, Cursor, Devin AI, Junie, Kiro, Leap.new, Lovable, Manus, NotionAI, Orchids.app, Perplexity, Poke, Qoder, Replit, Same.dev, Trae, Traycer AI, VSCode Agent, Warp.dev, Windsurf, Xcode, Z.ai Code, Dia & v0. (And other Open Sourced) System Prompts, Internal Tools & AI Models",141955,34,34800,-4,156,,"ai,bolt,cluely,copilot,cursor,cursorai,devin,github-copilot,lovable,open-source,perplexity,replit,system-prompts,trae,trae-ai,trae-ide,v0,vscode,windsurf,windsurf-ai",2025-03-05T16:38:29Z,2026-07-15T22:49:48Z,2026-07-12T15:42:00Z,False
13,anthropics/claude-code,https://github.com/anthropics/claude-code,"Claude Code is an agentic coding tool that lives in your terminal, understands your codebase, and helps you code faster by executing routine tasks, explaining complex code, and handling git workflows - all through natural language commands.",137982,103,22248,18,11605,Python,,2025-02-22T17:41:21Z,2026-07-15T23:03:40Z,2026-07-15T23:02:35Z,False
14,msitarzewski/agency-agents,https://github.com/msitarzewski/agency-agents,"A complete AI agency at your fingertips - From frontend wizards to Reddit community ninjas, from whimsy injectors to reality checkers. Each agent is a specialized expert with personality, processes, and proven deliverables.",131764,308,21657,73,105,Shell,,2025-10-13T12:12:29Z,2026-07-15T23:13:02Z,2026-07-15T14:55:50Z,False
15,garrytan/gstack,https://github.com/garrytan/gstack,"Use Garry Tan's exact Claude Code setup: 23 opinionated tools that serve as CEO, Designer, Eng Manager, Release Manager, Doc Engineer, and QA",122099,198,18252,31,747,TypeScript,,2026-03-11T21:22:45Z,2026-07-15T23:12:41Z,2026-07-15T01:33:47Z,False
16,github/spec-kit,https://github.com/github/spec-kit,💫 Toolkit to help you get started with Spec-Driven Development,121588,349,10818,40,325,Python,"ai,copilot,development,engineering,prd,spec,spec-driven",2025-08-21T22:54:31Z,2026-07-15T23:13:21Z,2026-07-15T19:55:26Z,False
17,farion1231/cc-switch,https://github.com/farion1231/cc-switch,"A cross-platform desktop All-in-One assistant for Claude Code, Codex, OpenCode, OpenClaw, Gemini CLI & Hermes Agent. Only official website: ccswitch.io",117571,379,7869,27,1915,Rust,"ai-tools,claude-code,codex,desktop-app,hermes,hermes-agent,mcp,minimax,omo,open-source,openclaw,openclaw-ui,opencode,provider-management,rust,skills,skills-management,tauri,typescript,wsl-support",2025-08-04T14:16:16Z,2026-07-15T23:13:52Z,2026-07-15T02:35:22Z,False
18,nextlevelbuilder/ui-ux-pro-max-skill,https://github.com/nextlevelbuilder/ui-ux-pro-max-skill,An AI SKILL that provide design intelligence for building professional UI/UX multiple platforms,106109,517,11256,54,123,Python,"ai-skills,antigravity,claude,claude-code,codex,command-line,copilot,cursor-ai,html5,kiro,landing-page,mobile-ui,qoder,react,tailwindcss,trae,ui-design,uikit,windsurf-ai",2025-11-30T11:36:31Z,2026-07-15T23:17:13Z,2026-07-14T18:32:51Z,False
19,google-gemini/gemini-cli,https://github.com/google-gemini/gemini-cli,An open-source AI agent that brings the power of Gemini directly into your terminal.,106010,23,14269,14,1381,TypeScript,"ai,ai-agents,cli,gemini,gemini-api,mcp-client,mcp-server",2025-04-17T17:04:31Z,2026-07-15T21:28:37Z,2026-07-15T20:12:19Z,False
20,browser-use/browser-use,https://github.com/browser-use/browser-use,🌐 Make websites accessible for AI agents. Automate tasks online with ease.,104910,154,11556,15,323,Python,"ai-agents,ai-tools,browser-automation,browser-use,llm,playwright,python",2024-10-31T16:00:56Z,2026-07-15T23:08:57Z,2026-07-15T00:20:37Z,False
21,harry0703/MoneyPrinterTurbo,https://github.com/harry0703/MoneyPrinterTurbo,利用AI大模型，一键生成高清短视频 Generate short videos with one click using AI LLM.,97658,234,14445,56,2,Python,"ai,automation,chatgpt,moviepy,python,shortvideo,tiktok",2024-03-11T02:57:34Z,2026-07-15T23:16:38Z,2026-07-15T06:16:58Z,False
22,puppeteer/puppeteer,https://github.com/puppeteer/puppeteer,JavaScript API for Chrome and Firefox,95455,17,9648,5,274,TypeScript,"automation,chrome,chromium,developer-tools,firefox,headless-chrome,node-module,testing,web",2017-05-09T22:16:13Z,2026-07-15T22:58:02Z,2026-07-15T22:16:38Z,False
23,TauricResearch/TradingAgents,https://github.com/TauricResearch/TradingAgents,TradingAgents: Multi-Agents LLM Financial Trading Framework,93162,171,17990,24,301,Python,"agent,finance,llm,multiagent,trading",2024-12-28T03:31:08Z,2026-07-15T23:07:22Z,2026-07-05T14:32:24Z,False
24,microsoft/playwright,https://github.com/microsoft/playwright,"Playwright is a framework for Web Testing and Automation. It allows testing Chromium, Firefox and WebKit with a single API. ",92911,68,6099,4,171,TypeScript,"automation,chrome,chromium,e2e-testing,electron,end-to-end-testing,firefox,javascript,playwright,test,test-automation,testing,testing-tools,web,webkit",2019-11-15T18:32:42Z,2026-07-15T23:06:08Z,2026-07-15T23:05:47Z,False
25,JuliusBrussee/caveman,https://github.com/JuliusBrussee/caveman,🪨 why use many token when few token do trick — Claude Code skill that cuts 65% of tokens by talking like caveman,89859,388,5168,30,398,JavaScript,"ai,anthropic,caveman,claude,claude-code,llm,meme,prompt-engineering,skill,tokens",2026-04-04T10:03:00Z,2026-07-15T23:17:15Z,2026-07-03T11:10:42Z,False
26,modelcontextprotocol/servers,https://github.com/modelcontextprotocol/servers,Model Context Protocol Servers,88514,34,11226,8,668,TypeScript,,2024-11-19T01:10:17Z,2026-07-15T21:57:52Z,2026-07-10T03:30:19Z,False
27,ChatGPTNextWeb/NextChat,https://github.com/ChatGPTNextWeb/NextChat,✨ Light and Fast AI Assistant. Support: Web | iOS | MacOS | Android |  Linux | Windows,88465,7,59430,-9,841,TypeScript,"calclaude,chatgpt,claude,cross-platform,desktop,fe,gemini,gemini-pro,gemini-server,gemini-ultra,gpt-4o,groq,nextjs,ollama,react,tauri,tauri-app,vercel,webui",2023-03-10T18:27:54Z,2026-07-15T23:12:15Z,2026-07-06T06:19:02Z,False
28,Graphify-Labs/graphify,https://github.com/Graphify-Labs/graphify,"AI coding assistant skill (Claude Code, Codex, OpenCode, Cursor, Gemini CLI, and more). Turn any folder of code, SQL schemas, R scripts, shell scripts, docs, papers, images, or videos into a queryable knowledge graph. App code + database schema + infrastructure in one graph.",87707,1403,8599,106,511,Python,"antigravity,claude-code,codex,gemini,graphrag,knowledge-graph,leiden,openclaw,rag,skills,tree-sitter",2026-04-03T15:49:07Z,2026-07-15T23:18:25Z,2026-07-15T18:52:02Z,False
29,thedotmack/claude-mem,https://github.com/thedotmack/claude-mem,"Persistent Context Across Sessions for Every Agent –  Captures everything your agent does during sessions, compresses it with AI, and injects relevant context back into future sessions. Works with Claude Code, OpenClaw, Codex, Gemini, Hermes, Copilot, OpenCode + More",87395,141,7571,18,270,JavaScript,"ai,ai-agents,ai-memory,anthropic,artificial-intelligence,chromadb,claude,claude-agent-sdk,claude-agents,claude-code,claude-code-plugin,claude-skills,embeddings,long-term-memory,mem0,memory-engine,openmemory,rag,sqlite,supermemory",2025-08-31T20:50:03Z,2026-07-15T23:17:07Z,2026-07-15T22:16:21Z,False
30,laravel/laravel,https://github.com/laravel/laravel,"Laravel is a web application framework with expressive, elegant syntax. We’ve already laid the foundation for your next big idea — freeing you to create without sweating the small things.",84745,11,24907,4,32,Blade,"framework,laravel,php",2011-06-08T03:06:08Z,2026-07-15T22:41:51Z,2026-06-29T16:18:26Z,False
31,DietrichGebert/ponytail,https://github.com/DietrichGebert/ponytail,Makes your AI agent think like the laziest senior dev in the room. The best code is the code you never wrote.,84007,924,4570,59,70,JavaScript,"agent-skills,ai-agents,claude,claude-code,claude-code-plugin,cursor-rules,developer-tools,llm,prompt-engineering,yagni",2026-06-12T00:52:37Z,2026-07-15T23:17:25Z,2026-07-15T21:32:15Z,False
32,OpenHands/OpenHands,https://github.com/OpenHands/OpenHands,🙌 OpenHands: AI-Driven Development,80899,115,10338,29,372,Python,"agent,artificial-intelligence,chatgpt,claude-ai,cli,developer-tools,gpt,llm,openai",2024-03-13T03:33:31Z,2026-07-15T23:13:10Z,2026-07-15T23:18:13Z,False
33,nexu-io/open-design,https://github.com/nexu-io/open-design,"🎨 The open-source Claude Design alternative. 🖥️ Local-first desktop app. 🖼️ Your coding agent becomes the design engine: prototypes, landing pages, dashboards, slides, images & video — real files, HTML/PDF/PPTX/MP4 export. 🤖 Claude Code / Codex / Cursor / Gemini / OpenCode / Qwen & 20+ CLIs via BYOK.",78600,431,9045,63,644,TypeScript,"agent-skills,ai-agents,ai-design,byok,claude-code-for-design,claude-design,codex-design,coding-agents,cursor-design,design-systems,design-tools,desktop-app,figma-alternative,generative-ai,hermes-agent,local-first,no-code,prototyping,ui-generator,vibe-coding",2026-04-28T04:25:20Z,2026-07-15T23:14:47Z,2026-07-15T21:48:41Z,False
34,addyosmani/agent-skills,https://github.com/addyosmani/agent-skills,Production-grade engineering skills for AI coding agents.,78556,255,8434,28,127,JavaScript,"agent-skills,antigravity,claude-code,codex,cursor,skills",2026-02-15T20:20:26Z,2026-07-15T23:10:20Z,2026-07-12T18:03:54Z,False
35,bytedance/deer-flow,https://github.com/bytedance/deer-flow,"An open-source long-horizon SuperAgent harness that researches, codes, and creates. With the help of sandboxes, memories, tools, skill, subagents and message gateway, it handles different levels of tasks that could take minutes to hours.",77124,82,10483,15,977,Python,"agent,agentic,agentic-framework,agentic-workflow,ai,ai-agents,deep-research,harness,langchain,langgraph,langmanus,llm,multi-agent,nodejs,podcast,python,superagent,typescript",2025-05-07T02:50:19Z,2026-07-15T23:14:44Z,2026-07-15T23:03:08Z,False
36,opendatalab/MinerU,https://github.com/opendatalab/MinerU,Transforms complex documents like PDFs and Office docs into LLM-ready markdown/JSON for your Agentic workflows.,74723,112,6283,13,42,Python,"ai4science,document-analysis,docx,extract-data,layout-analysis,ocr,parser,pdf,pdf-converter,pdf-extractor-llm,pdf-extractor-pretrain,pdf-extractor-rag,pdf-parser,pptx,python,xlsx",2024-02-29T08:52:34Z,2026-07-15T23:17:23Z,2026-07-15T08:38:48Z,False
37,Egonex-AI/Understand-Anything,https://github.com/Egonex-AI/Understand-Anything,"Graphs that teach > graphs that impress. Turn any code into an interactive knowledge graph you can explore, search, and ask questions about. Works with Claude Code, Codex, Cursor, Copilot, Gemini CLI, and more.",74304,272,6188,27,255,TypeScript,"antigravity-skills,business-knowledge,claude-code,claude-skills,codebase-analysis,codex,codex-skills,developer-tools-ai-agent,gemini-cli-skills,karpathy-llm-wiki,knowledge-base,knowledge-graph,memory,opencode-skills,pi-agent,understandcode,vibe-coding",2026-03-15T02:30:51Z,2026-07-15T23:06:07Z,2026-07-15T14:13:54Z,False
38,paperclipai/paperclip,https://github.com/paperclipai/paperclip,The open-source app everyone uses to manage agents at work,73818,154,13736,17,4850,TypeScript,,2026-03-02T15:01:51Z,2026-07-15T23:14:15Z,2026-07-15T23:18:56Z,False
39,abi/screenshot-to-code,https://github.com/abi/screenshot-to-code,Drop in a screenshot and convert it to clean code (HTML/Tailwind/React/Vue),73292,14,9020,2,123,Python,,2023-11-14T17:53:32Z,2026-07-15T21:46:18Z,2026-07-13T17:46:10Z,False
40,Eugeny/tabby,https://github.com/Eugeny/tabby,A terminal for a more modern age,73266,19,4156,3,2780,TypeScript,"serial,ssh-client,telnet-client,terminal,terminal-emulators",2016-12-23T09:06:10Z,2026-07-15T21:58:27Z,2026-07-14T04:03:03Z,False
41,thedaviddias/Front-End-Checklist,https://github.com/thedaviddias/Front-End-Checklist,"🗂 The essential checklist for modern web development, for humans and AI agents",73217,6,6650,-1,3,MDX,"ai-agent,ai-agents,checklist,css,front-end-developer-tool,front-end-development,frontend,guidelines,html,javascript,lists,reference,resources,rules,web-development",2017-10-16T10:12:36Z,2026-07-15T20:20:31Z,2026-06-18T03:46:44Z,False
42,unclecode/crawl4ai,https://github.com/unclecode/crawl4ai,"🚀🤖 Crawl4AI: Open-source LLM Friendly Web Crawler & Scraper. Don't be shy, join here: https://discord.gg/jP8KfhDhyN",72797,164,7466,13,106,Python,,2024-05-09T09:48:50Z,2026-07-15T23:15:43Z,2026-07-15T08:41:10Z,False
43,daytonaio/daytona,https://github.com/daytonaio/daytona,Daytona is a Secure and Elastic Infrastructure for Running AI-Generated Code,72263,39,5661,0,442,,"agentic-workflow,ai,ai-agents,ai-runtime,ai-sandboxes,code-execution,code-interpreter,developer-tools",2024-02-06T08:21:20Z,2026-07-15T22:47:09Z,2026-07-09T18:45:58Z,False
44,OpenCut-app/OpenCut,https://github.com/OpenCut-app/OpenCut,The open-source CapCut alternative,71539,2424,7336,132,347,TypeScript,"editor,oss,videoeditor",2025-06-22T08:02:17Z,2026-07-15T23:17:15Z,2026-07-10T20:26:18Z,False
45,rtk-ai/rtk,https://github.com/rtk-ai/rtk,"CLI proxy that reduces LLM token consumption by 60-90% on common dev commands. Single Rust binary, zero dependencies",71242,217,4429,19,1607,Rust,"agentic-coding,ai-coding,anthropic,claude-code,cli,command-line-tool,cost-reduction,developer-tools,llm,open-source,productivity,rust,token-optimization",2026-01-22T16:54:16Z,2026-07-15T23:12:10Z,2026-07-09T07:49:57Z,False
46,shareAI-lab/learn-claude-code,https://github.com/shareAI-lab/learn-claude-code,"Bash is all you need -  A nano claude code–like 「agent harness」, built from 0 to 1",71125,140,11564,15,65,Python,"agent,agent-development,ai-agent,claude,claude-code,educational,llm,python,teaching,tutorial",2025-06-29T15:34:15Z,2026-07-15T23:02:58Z,2026-06-26T19:36:35Z,False
47,OpenBB-finance/OpenBB,https://github.com/OpenBB-finance/OpenBB,"Open Data Platform for analysts, quants and AI agents.",70624,46,7175,8,78,Python,"ai,crypto,derivatives,economics,equity,finance,fixed-income,machine-learning,openbb,options,python,quantitative-finance,stocks",2020-12-20T10:46:38Z,2026-07-15T23:11:15Z,2026-07-15T18:24:28Z,False
48,D4Vinci/Scrapling,https://github.com/D4Vinci/Scrapling,🕷️ An adaptive Web Scraping framework that handles everything from a single request to a full-scale crawl!,69671,128,6897,15,4,Python,"ai,ai-scraping,automation,crawler,crawling,crawling-python,data,data-extraction,mcp,mcp-server,playwright,python,scraping,selectors,stealth,web-scraper,web-scraping,web-scraping-python,webscraping,xpath",2024-10-13T20:29:53Z,2026-07-15T23:04:04Z,2026-07-15T15:21:20Z,False
49,unslothai/unsloth,https://github.com/unslothai/unsloth,"Unsloth Studio is a web UI for training and running open models like Gemma 4, Qwen3.6, DeepSeek, gpt-oss locally.",68266,46,6142,6,952,Python,"agent,deepseek,fine-tuning,gemma,gemma3,gpt-oss,llama,llama3,llm,llms,mistral,openai,qwen,reinforcement-learning,self-hosted,text-to-speech,tts,ui,unsloth",2023-11-29T16:50:09Z,2026-07-15T22:23:50Z,2026-07-15T19:02:31Z,False
50,xtekky/gpt4free,https://github.com/xtekky/gpt4free,The official gpt4free repository | various collection of powerful language models | opus 4.6 gpt 5.3 kimi 2.5 deepseek v3.2 gemini 3,66465,-6,13534,2,7,Python,"chatbot,chatbots,chatgpt,chatgpt-4,chatgpt-api,chatgpt-free,chatgpt4,deepseek,deepseek-api,deepseek-r1,gpt,gpt-4,gpt-4o,gpt4,gpt4-api,language-model,openai,openai-api,openai-chatgpt,reverse-engineering",2023-03-29T17:00:43Z,2026-07-15T21:57:44Z,2026-07-15T12:13:03Z,False
51,bradtraversy/design-resources-for-developers,https://github.com/bradtraversy/design-resources-for-developers,"Curated list of design and UI resources from stock photos, web templates, CSS frameworks, UI libraries, tools and much more",66421,15,12109,0,53,,,2020-05-06T14:40:35Z,2026-07-15T23:17:00Z,2026-05-24T10:07:48Z,False
52,code-yeongyu/oh-my-openagent,https://github.com/code-yeongyu/oh-my-openagent,"omo/lazycodex: The coding agent for tokenmaxxers;the one and only agent harness for complex codebases. For your Codex, for your OpenCode",65892,90,5375,9,910,TypeScript,"ai,ai-agents,anthropic,chatgpt,claude,claude-skills,codex,cursor,gemini,ide,openai,opencode,orchestration,tui,typescript",2025-12-03T01:40:05Z,2026-07-15T23:10:02Z,2026-07-15T16:19:24Z,False
53,openinterpreter/openinterpreter,https://github.com/openinterpreter/openinterpreter,A coding agent for low-cost models,65441,448,5651,23,274,Rust,"acp,coding-agent,deepseek,kimi,qwen,rust",2023-07-14T07:10:44Z,2026-07-15T23:16:55Z,2026-07-15T19:19:47Z,False
54,cline/cline,https://github.com/cline/cline,"Autonomous coding agent as an SDK, IDE extension, or CLI assistant.",64696,38,6917,4,1257,TypeScript,,2024-07-06T07:28:10Z,2026-07-15T22:35:17Z,2026-07-15T22:35:12Z,False
55,ruvnet/ruflo,https://github.com/ruvnet/ruflo,"🌊 The leading agent meta-harness. Deploy intelligent multi-player swarms, coordinate autonomous workflows, and build conversational AI systems. Features adaptive memory, self-learning intelligence, RAG integration, and native Claude Code / Codex / Hermes and many more Integrated",64547,122,7672,21,793,TypeScript,"agentic-ai,agentic-framework,agentic-workflow,agents,ai-agents,ai-assistant,ai-coding,ai-skills,autonomous-agents,claude-code,codex,harness,mcp-server,multi-agent,multi-agent-systems,npm,skills,swarm,swarm-intelligence,typescript",2025-06-02T21:24:20Z,2026-07-15T23:18:17Z,2026-07-15T22:06:32Z,False
56,Leonxlnx/taste-skill,https://github.com/Leonxlnx/taste-skill,"Taste-Skill - gives your AI good taste. stops the AI from generating boring, generic slop ",63874,402,4514,33,46,JavaScript,"agent,ai,claude,claude-code,codex,coding,design,frontend,lowcode,nocode,skill,skills,vibecoding",2026-02-19T21:44:05Z,2026-07-15T23:18:19Z,2026-07-04T22:02:55Z,False
57,docling-project/docling,https://github.com/docling-project/docling,Get your documents ready for gen AI,63221,70,4461,8,930,Python,"ai,convert,document-parser,document-parsing,documents,docx,html,markdown,pdf,pdf-converter,pdf-to-json,pdf-to-text,pptx,tables,xlsx",2024-07-09T07:50:26Z,2026-07-15T22:42:10Z,2026-07-15T11:56:00Z,False
58,warpdotdev/warp,https://github.com/warpdotdev/warp,"Warp is an agentic development environment, born out of the terminal.",63210,27,5238,15,4625,Rust,"bash,linux,macos,rust,shell,terminal,wasm,zsh",2021-07-08T18:48:08Z,2026-07-15T23:03:26Z,2026-07-15T23:16:45Z,False
59,shanraisshan/claude-code-best-practice,https://github.com/shanraisshan/claude-code-best-practice,from vibe coding to agentic engineering - practice makes claude perfect,62690,84,6264,2,15,HTML,"agentic-ai,agentic-coding,agentic-engineering,agentic-workflow,ai,ai-agents,anthropic,best-practices,boris,claude,claude-ai,claude-code,claude-code-agents,claude-code-best-practices,claude-code-commands,claude-code-skills,context-engineering,pakistan,pakistani-developer,vibe-coding",2025-10-31T14:15:28Z,2026-07-15T23:17:10Z,2026-07-15T06:41:47Z,False
60,koala73/worldmonitor,https://github.com/koala73/worldmonitor,"Real-time global intelligence dashboard. AI-powered news aggregation, geopolitical monitoring, and infrastructure tracking in a unified situational awareness interface",61903,48,9642,10,183,TypeScript,"agent,ai,dashboard,geopolitics,mcp,mcp-server,monitoring,news,opensource,osint,palantir,situation",2026-01-08T17:26:06Z,2026-07-15T23:15:27Z,2026-07-15T19:34:10Z,False
61,Fission-AI/OpenSpec,https://github.com/Fission-AI/OpenSpec,Spec-driven development (SDD) for AI coding assistants.,61057,189,4235,15,476,TypeScript,"ai,context-engineering,engineering,planning,prd,sdd,sdlc,spec,spec-driven-development,specification",2025-08-05T10:37:45Z,2026-07-15T22:56:24Z,2026-07-15T15:35:37Z,False
62,mem0ai/mem0,https://github.com/mem0ai/mem0,Universal memory layer for AI Agents,60920,90,7096,9,608,TypeScript,"agents,ai,ai-agents,application,chatbots,chatgpt,genai,llm,long-term-memory,memory,memory-management,python,rag,state-management",2023-06-20T08:58:36Z,2026-07-15T22:53:28Z,2026-07-15T08:57:12Z,False
63,sansan0/TrendRadar,https://github.com/sansan0/TrendRadar,"⭐AI-driven public opinion & trend monitor with multi-platform aggregation, RSS, and smart alerts.🎯 告别信息过载，你的 AI 舆情监控助手与热点筛选工具！聚合多平台热点 +  RSS 订阅，支持关键词精准筛选。AI 智能筛选新闻 + AI 翻译 +  AI 分析简报直推手机，也支持接入 MCP 架构，赋能 AI 自然语言对话分析、情感洞察与趋势预测等。支持 Docker ，数据本地/云端自持。集成微信/飞书/钉钉/Telegram/邮件/ntfy/bark/slack 等渠道智能推送。",60578,20,24795,1,49,Python,"ai,bark,data-analysis,docker,hot-news,llm,mail,mcp,mcp-server,news,ntfy,python,rss,trending-topics,wechat,wework",2025-04-28T11:42:16Z,2026-07-15T20:19:43Z,2026-07-08T11:47:14Z,False
64,colbymchenry/codegraph,https://github.com/colbymchenry/codegraph,"Pre-indexed code knowledge graph, auto syncs on code changes, for Claude Code, Codex, Gemini, Cursor, OpenCode, AntiGravity, Kiro, and Hermes Agent — fewer tokens, fewer tool calls, 100% local",60188,224,3765,21,324,TypeScript,,2026-01-18T21:45:37Z,2026-07-15T22:39:03Z,2026-07-13T01:09:05Z,False
65,microsoft/autogen,https://github.com/microsoft/autogen,A programming framework for agentic AI,59755,21,8996,5,955,Python,"agentic,agentic-agi,agents,ai,autogen,autogen-ecosystem,chatgpt,framework,llm-agent,llm-framework",2023-08-18T11:43:45Z,2026-07-15T21:57:47Z,2026-04-15T11:59:09Z,False
66,headroomlabs-ai/headroom,https://github.com/headroomlabs-ai/headroom,"Compress tool outputs, logs, files, and RAG chunks before they reach the LLM. 20% fewer tokens for coding agents, 60-95% fewer tokens for JSON, same answers. Library, proxy, MCP server.",59355,191,4406,19,407,Python,"agent,ai,anthropic,claude-code,compression,context-engineering,context-window,cursor,fastapi,langchain,llm,mcp,openai,prompt-engineering,proxy,python,rag,token-optimization,tokens,typescript",2026-01-07T19:58:51Z,2026-07-15T22:49:15Z,2026-07-15T22:28:46Z,False
